twitter_id,date,tweet
1546611438650793985,2022-07-11 21:44:36+00:00,b'Hey!  Stay in your lane! https://t.co/9wPAuWYUNy'
1546608963411759108,2022-07-11 21:34:46+00:00,"b'RT @GailSimone: So, last week, we had the great good fortune to go see @alyankovic and @EmoPhilips live show here in Oregon.\n\nSpoiler: it w\xe2\x80\xa6'"
1543357965222420480,2022-07-02 22:16:27+00:00,"b""I'm in CANADA this week, eh? Vancouver tonight, then Edmonton, Regina, Saskatoon, Winnipeg, and TWO big shows in Calgary! Tickets and info here: https://t.co/ETyiOIWa6h https://t.co/IOSoLAiUm6"""
1542057248846778369,2022-06-29 08:07:52+00:00,b'Thanks to my homie Chris Ballew (@casparbabypants) from @therealpusa for dropping by my show in Seattle tonight! https://t.co/vO9HsnufXC'
1540236465933651969,2022-06-24 07:32:44+00:00,b'Can confirm - Evan Rachel Wood absolutely KILLS it in the biopic. https://t.co/Je7XOuYJxn'
1539357124559441920,2022-06-21 21:18:33+00:00,"b'Well, lookee here... https://t.co/IMzMZdVZs6'"
1539356472093462528,2022-06-21 21:15:57+00:00,"b'And, once again, apologies to the ticket-holders for the 4 shows we\xe2\x80\x99ve had to postpone. We won\xe2\x80\x99t be able to reschedule those dates until after we\xe2\x80\x99ve completed this current leg of the tour\xe2\x80\xa6 but please be patient, and we\xe2\x80\x99ll let you know as soon as we can!'"
1539356186876575744,2022-06-21 21:14:49+00:00,"b'JUST ADDED: Santa Rosa, CA on 9/22! (This is the final one - ALL dates for the 2022 tour have now officially been announced.) Tickets and info for all shows are at https://t.co/dQj6NF6NRj https://t.co/2EHrCDrERZ'"
1538952233487769600,2022-06-20 18:29:39+00:00,"b'Recently a friend of mine was digitizing all the original film footage that we shot for the ""Eat It"" video, and he came across this ""coverage"" take. I\'m pretty sure NOTHING from this take got used in the final video, but I still thought it was stupid/amusing enough to share. https://t.co/Y3zyincMMW'"
1538838738637189120,2022-06-20 10:58:40+00:00,"b'So wonderful to see the great @drdemento, who stopped by my show last night at the @wiltern! https://t.co/IVSgu4kP9C'"
1538316258139045888,2022-06-19 00:22:31+00:00,"b""Hey, last-minute LOS ANGELES ticket-buyers!  We just released a bunch of tickets for tonight and tomorrow's night's show at the Wiltern!  If you want to go, better grab 'em quick!"""
1537318834394107904,2022-06-16 06:19:06+00:00,b'Looks like the mugs finally showed up! https://t.co/r2vRosKOIt'
1535411742037057536,2022-06-11 00:01:00+00:00,"b""JUST ANNOUNCED: I'll be playing Santa Clarita, CA on Sept. 17.  For tickets and info on this or any of my OTHER shows (there's over 100 left!) go to https://t.co/dQj6NF6NRj https://t.co/dY0WkRKdn4"""
1535133988062654465,2022-06-10 05:37:18+00:00,"b'Had a night off here in Las Vegas, so I finally got a chance to catch up with my old \xe2\x80\x9cWhite &amp; Nerdy\xe2\x80\x9d pal \xe2\x81\xa6@donnyosmond\xe2\x81\xa9 and watch him knock \xe2\x80\x98em dead at \xe2\x81\xa6@HarrahsVegas\xe2\x81\xa9 https://t.co/RyQDaN7fBm'"
1534369646308167680,2022-06-08 03:00:05+00:00,"b'I\xe2\x80\x99m in VEGAS, baby!  Doing a 3-night residency at the Venetian this week.  Why would you want to miss THAT??'"
1532240087450324993,2022-06-02 05:57:59+00:00,b'@Drewmanrp Only two of those nights are in a row.'
1530269551367274497,2022-05-27 19:27:46+00:00,b'#Brave #StrangerThings https://t.co/QCZCabaRPm'
1529513076910874624,2022-05-25 17:21:49+00:00,b'RT @Z2comics: A career-spanning visual feast of over 20 classic \xe2\x80\x9cWeird Al\xe2\x80\x9d Yankovic songs interpreted by some of our top illustrators and c\xe2\x80\xa6'
1529166729347321857,2022-05-24 18:25:33+00:00,b'Movie update: PICTURE IS LOCKED.'
1528504037452177408,2022-05-22 22:32:15+00:00,"b'I\xe2\x80\x99m testing negative, back to 100% and ready to rock - so the tour will resume Tuesday in Milwaukee. Thanks so much for all the well-wishes, and sincerely apologies to everybody whose show now needs to be re-scheduled.'"
1526971506139471872,2022-05-18 17:02:31+00:00,"b'So\xe2\x80\xa6 I\xe2\x80\x99ve got COVID. Don\xe2\x80\x99t worry, I\xe2\x80\x99m fine - I\xe2\x80\x99m vaxxed and double-boosted and the symptoms are very mild. But of course this means I unfortunately need to cancel the next couple dates on my tour (Saginaw &amp; Detroit). I\xe2\x80\x99m deeply sorry - we will reschedule those shows ASAP.'"
1525183454949810176,2022-05-13 18:37:26+00:00,"b'I just got the word that my Carnegie Hall show is officially sold out.  Thanks, NYC!'"
1524842143579262978,2022-05-12 20:01:11+00:00,"b""JUST ANNOUNCED: I'll be playing Shreveport, LA on Oct. 7!  For info and tickets to this or ANY OTHER show on my tour, kindly go to https://t.co/dQj6NEPcZL"""
1521536266344534018,2022-05-03 17:04:49+00:00,b'Get psyched. https://t.co/w7oTGVwjFe'
1520187870430040064,2022-04-29 23:46:46+00:00,"b""@EugeneMirman @EmoPhilips I've got some chips and hummus in my dressing room, if you like."""
1519755788897640450,2022-04-28 19:09:50+00:00,b'I love this artwork by the great Mark Fredrickson. (This poster is one of the fabulous perks for our VIP ticket-holders.) https://t.co/PnPbCjlhcT'
1519322845523988480,2022-04-27 14:29:28+00:00,"b'We started our tour in Poughkeepsie, because that\xe2\x80\x99s where ALL the A-list celebrities hang out! https://t.co/eTDHVk8AzL'"
1518981244264009728,2022-04-26 15:52:04+00:00,"b""The tour starts TONIGHT!!! I'll be on the road for the next 6 months. If you don't have your tickets yet, you can get them at https://t.co/ETyiOIVCgJ. (Fair warning, I'm only going to remind you 17 more times!)"""
1516553306717401091,2022-04-19 23:04:19+00:00,"b""If you're attending my upcoming tour and want to avoid the long, crowded lines at the merch table - good news! You can order everything you want in advance online and just pick it up when you get to the venue! Check out our full 2022 tour merch line at https://t.co/K87y3aH51I https://t.co/RmdxisjsuE"""
1514758874384936976,2022-04-15 00:13:53+00:00,"b""Love @aaronpaul_8 - glad he's feeling better! Don't worry, buddy, we'll get you in my NEXT movie (33 years from now, if the cycle continues).  https://t.co/I5z0JXolaw"""
1513994128022904833,2022-04-12 21:35:03+00:00,b'Absolutely gutted to hear about my friend Gilbert. One of the funniest guys ever. An enormous loss to the world of comedy. Much love to his friends and family.'
1511789697302892545,2022-04-06 19:35:26+00:00,b'The Oscar buzz has started already! https://t.co/EnK8AYKkGk'
1511042579579564033,2022-04-04 18:06:39+00:00,"b""New tour date just announced: SARATOGA, CA on September 21!  For tickets and info on ALL the shows - and there's a LOT of them - head on over to https://t.co/5CUkkN5Kd5... won't you?\n\n#TheUnfortunateReturnOfTheRidiculouslySelfIndulgentIllAdvisedVanityTour"""
1508859240441532428,2022-03-29 17:30:50+00:00,b'Napa just announced too! https://t.co/0tJE105taX'
1508851590630838277,2022-03-29 17:00:26+00:00,"b""Okay, here we go... LOS ANGELES tour dates have just been announced! I'll be at the Wiltern Theatre on June 18 and 19. Tickets on sale Friday!  https://t.co/Qe53ehgPuD https://t.co/0helECtZEW"""
1507521090263797761,2022-03-26 00:53:30+00:00,b'Awww!  \xe2\x9d\xa4\xef\xb8\x8f\xf0\x9f\xaa\x97 https://t.co/h6KFt74SNr'
1506180495645634560,2022-03-22 08:06:28+00:00,"b'Hey, would you like me to personally wish Happy Birthday to your friend or loved one? Well, lucky you - my new SmashUp from @amgreetings is available NOW!  @ShareSmashUps \n\nhttps://t.co/OTyHZcLR72'"
1506003119569702912,2022-03-21 20:21:38+00:00,"b""I'd like to thank the producers of @LostCityMovie for inadvertently funding an unofficial press tour for #WEIRDTheAlYankovicStory... and of course the amazing Mr. Radcliffe, who is just the best human. https://t.co/mJR3gERB6B"""
1505975331248693251,2022-03-21 18:31:13+00:00,"b'New tour date just announced: WEBSTER, MA, see you on August 5th!!  For tickets and info on ALL the shows, head on over to https://t.co/5CUkkN5Kd5\n\n#TheUnfortunateReturnOfTheRidiculouslySelfIndulgentIllAdvisedVanityTour'"
1505230579087814657,2022-03-19 17:11:50+00:00,"b'Thanks, @FallonTonight (and Dan)! https://t.co/fxKRCCP0c1'"
1504550383158378505,2022-03-17 20:08:59+00:00,b'\xe2\x99\xa5\xef\xb8\x8f\xe2\x99\xa5\xef\xb8\x8f\xe2\x99\xa5\xef\xb8\x8f https://t.co/yplwU8ebAS'
1504155026083569665,2022-03-16 17:57:58+00:00,"b'RT @screenrant: Daniel Radcliffe tells us his Weird Al biopic was shot in just 18 days!\n\n""It was an unbelievably fast shoot, and I don\'t kn\xe2\x80\xa6'"
1501482164549914624,2022-03-09 08:56:58+00:00,"b'We just finished SHOOT DAY #18, and ladies and gentlemen, that is officially a WRAP on #WEIRDTheAlYankovicStory. Everybody involved with this movie absolutely killed it, and I can\xe2\x80\x99t wait for the world to see this thing. #OscarBait #OscarsSoWEIRD  @TheRokuChannel https://t.co/7kd7VsCJoO'"
1500921291670691840,2022-03-07 19:48:16+00:00,b'Easily one of my top ten favorite interviews that I\xe2\x80\x99ve ever done with an ape.  https://t.co/gFQP4yY9K0'
1500891662737809412,2022-03-07 17:50:32+00:00,"b'New tour date announced: HUNTINGTON, NY, see you on May 13!!  For tickets and info on ALL the shows, head on over to https://t.co/5CUkkN5Kd5\n\n#TheUnfortunateReturnOfTheRidiculouslySelfIndulgentIllAdvisedVanityTour'"
1500873627230605314,2022-03-07 16:38:52+00:00,"b'SHOOT DAY #17: I mean, come on, when have you ever seen cable coiled this well before??  This movie\xe2\x80\x99s gonna be INSANE!  #WEIRDTheAlYankovicStory @TheRokuChannel https://t.co/nrrIvoOmTa'"
1499856717282091012,2022-03-04 21:18:02+00:00,"b'SHOOT DAY #16: Well, we\xe2\x80\x99ve got a couple more days left to go, but ladies and gentlemen\xe2\x80\xa6 that is a WRAP on Mr. Radcliffe! Wait till you see him in this. He\xe2\x80\x99s even more like me than I am. #WEIRDTheAlYankovicStory @TheRokuChannel https://t.co/6a2ZZfvuyE'"
1499466591343296519,2022-03-03 19:27:48+00:00,"b'SHOOT DAY #15: People keep asking me the same question over and over\xe2\x80\xa6 \xe2\x80\x9cHow do you manage to keep a scene from looking too \xe2\x80\x98dark\xe2\x80\x99?\xe2\x80\x9d Well, here\xe2\x80\x99s a little trade secret: We use lights, like this one!  #WEIRDTheAlYankovicStory @TheRokuChannel https://t.co/9SkRQTEANK'"
1499407824970866689,2022-03-03 15:34:17+00:00,"b'Season 2 of #Dicktown (starring those interesting, cool and fun dudes @hodgman and @david_rees) premieres tonight on @FXXNetwork. And I gotta say, their new theme song is a banger! https://t.co/7CqrSWfmmn'"
1499078037161218048,2022-03-02 17:43:50+00:00,"b'It\xe2\x80\x99s SHOOT DAY #14, my friends, and NOW IT CAN BE TOLD: Daniel Radcliffe\xe2\x80\x99s co-stars in #WEIRDTheAlYankovicStory will be Evan Rachel Wood, @rainnwilson, @tobyhuss, and Julianne Nicholson!  @TheRokuChannel https://t.co/rwh1OEIMuD'"
1498718648889794563,2022-03-01 17:55:45+00:00,"b'SHOOT DAY #13: Here\xe2\x80\x99s a special exclusive photo that the paparazzi DIDN\xe2\x80\x99T get\xe2\x80\xa6 the inside of Daniel Radcliffe\xe2\x80\x99s wig! In your face, TMZ!!  #WEIRDTheAlYankovicStory @TheRokuChannel https://t.co/i66xsZe7um'"
1498318218808549380,2022-02-28 15:24:35+00:00,"b'SHOOT DAY #12: Big, big, BIG news from the set - I\xe2\x80\x99m thrilled to announce\xe2\x80\xa6 they\xe2\x80\x99ve got cupcakes at craft services today!!!  #WEIRDTheAlYankovicStory @TheRokuChannel https://t.co/twpEpEiehT'"
1497400686379634691,2022-02-26 02:38:38+00:00,"b'SHOOT DAY #11: We\xe2\x80\x99re doing a night shoot. I\xe2\x80\x99m not allowed to say exactly WHERE we\xe2\x80\x99re shooting, but if you can figure it out based solely on the position of these stars directly overhead, feel free to drop on by. #WEIRDTheAlYankovicStory @TheRokuChannel https://t.co/WmGAzcLh2T'"
1497309023451836420,2022-02-25 20:34:24+00:00,"b'The brand new season of #Reno911 is streaming right now for free on @TheRokuChannel!  (And the Nuge is BACK, baby!!) https://t.co/DJqqdlifst'"
1497082178928218113,2022-02-25 05:33:00+00:00,b'RT @colbertlateshow: .@thomaslennon and @alyankovic are best friends. #LSSC https://t.co/T8k40tPovg'
1496968858464251918,2022-02-24 22:02:42+00:00,"b'SHOOT DAY #10: We\xe2\x80\x99re on location today\xe2\x80\xa6 in a building!  See if you can identify which one, based on an extreme close-up of its drinking fountain.  #WEIRDTheAlYankovicStory @TheRokuChannel https://t.co/eJCFAsEczO'"
1496862795689697280,2022-02-24 15:01:15+00:00,"b'After much careful consideration, I\xe2\x80\x99ve decided that the only thing that can truly heal our society and bring the world together is a WEIRD AL PINBALL MACHINE. https://t.co/qaa3JAm2AC'"
1496524006085648388,2022-02-23 16:35:01+00:00,"b'SHOOT DAY #9: I wish I could say that \xe2\x80\x9call the money is up there on the screen,\xe2\x80\x9d but honestly, half the budget went towards getting these super-cool Hawaiian face masks.   #WEIRDTheAlYankovicStory @TheRokuChannel https://t.co/6rvh6NJ0ic'"
1496215320549150722,2022-02-22 20:08:25+00:00,"b'SHOOT DAY #8: It never fails - we\xe2\x80\x99re trying to shoot a movie here, and this cosplayer weirdo tries to crash our set. Ugh! I mean, I love my fans, but\xe2\x80\xa6 boundaries, people! Don\xe2\x80\x99t worry, we had security throw him out.  \n#WEIRDTheAlYankovicStory @TheRokuChannel https://t.co/XdHZBlrsPM'"
1494766323074621440,2022-02-18 20:10:37+00:00,"b'New tour date announced: LOUISVILLE, KY, see you soon!!  For tickets and info on ALL the shows, head on over to https://t.co/dQj6NF6NRj\n\n#TheUnfortunateReturnOfTheRidiculouslySelfIndulgentIllAdvisedVanityTour'"
1494742376119607297,2022-02-18 18:35:28+00:00,"b'SHOOT DAY #7: Oh man, I am really, REALLY going to get in trouble with @TheRokuChannel over this, but I\xe2\x80\x99m just so proud of this script, and I wanted to leak part of it.  So\xe2\x80\xa6\xf0\x9f\x9a\xa8SPOILER ALERT\xf0\x9f\x9a\xa8\xe2\x80\xa6 This is the ACTUAL ENDING of #WEIRDTheAlYankovicStory https://t.co/VR9CNshKW2'"
1494374812382208000,2022-02-17 18:14:54+00:00,"b'RT @parrygripp: @NerfHerder_band @alyankovic @drdemento Here\'s the ""Born Weird"" video! https://t.co/H7dDdj2K04'"
1494359462512975887,2022-02-17 17:13:54+00:00,"b'RT @NerfHerder_band: Our new single, \xe2\x80\x9cBorn Weird\xe2\x80\x9d is now available on bologna-colored vinyl! The title track features a ripping accordion s\xe2\x80\xa6'"
1494358839763689477,2022-02-17 17:11:25+00:00,"b'SHOOT DAY #6: Okay, people have been complaining that I haven\xe2\x80\x99t been posting pictures of any of the ACTORS in the movie. Fine. Here\xe2\x80\x99s the left nostril of one of our stars - I\xe2\x80\x99m sure I don\xe2\x80\x99t need to tell you who THIS is.  #WEIRDTheAlYankovicStory @TheRokuChannel https://t.co/EIaeZZeL9R'"
1494358154754154524,2022-02-17 17:08:42+00:00,"b'RT @bridger_w: My guest on I Said No Gifts! this week is the spectacular @alyankovic. As you might guess, we got into a screaming match and\xe2\x80\xa6'"
1494011289458204672,2022-02-16 18:10:23+00:00,"b'SHOOT DAY #5: Here\xe2\x80\x99s director @erockappel in action. No time for photos, he\xe2\x80\x99s busy making an awesome movie!!  #WEIRDTheAlYankovicStory @TheRokuChannel https://t.co/MrgNLCFvqE'"
1493613618943909902,2022-02-15 15:50:11+00:00,b'SHOOT DAY #4: Breaking news - @Zendaya is NOT joining the cast of #WEIRDTheAlYankovicStory! We didn\xe2\x80\x99t even ask her! Just figured she\xe2\x80\x99d be too busy. https://t.co/akbjerC7OJ'
1493246600096870400,2022-02-14 15:31:47+00:00,"b'SHOOT DAY #3: Good news - @TheRokuChannel let me know that the NDA doesn\xe2\x80\x99t apply to me, so I can post ANY PICTURES FROM THE SET that I want!!!  So here\xe2\x80\x99s a picture of my favorite apple box. #WEIRDTheAlYankovicStory https://t.co/IP01u77ucH'"
1492157338223972352,2022-02-11 15:23:27+00:00,"b'SHOOT DAY #2: Screw the NDA - you guys demanded to see it, so here it is\xe2\x80\xa6 my parking space at base camp!!  #WEIRDTheAlYankovicStory @TheRokuChannel https://t.co/IXaRFnd33Q'"
1491793805338578952,2022-02-10 15:18:54+00:00,"b'So excited - it\xe2\x80\x99s DAY #1 on the set of #WEIRDTheAlYankovicStory! And I know what everybody\xe2\x80\x99s been absolutely dying to see a picture of, so here it is\xe2\x80\xa6 my chair!! https://t.co/MhKCjmpqaW'"
1491443662567657476,2022-02-09 16:07:33+00:00,"b'Hey, Santa Fe! Tickets for #TheUnfortunateReturnOfTheRidiculouslySelfIndulgentIllAdvisedVanityTour \ngo on sale Friday at 10AM! (And if you don\xe2\x80\x99t happen to live in Santa Fe, tickets to most of the other 132 shows are ALREADY on sale!) https://t.co/dQj6NEPKPj'"
1491114580193722368,2022-02-08 18:19:54+00:00,b'RT @erockappel: Crazy how a year from now my Weird Al biopic is going to be getting nominated for all the oscars.'
1489395442915831812,2022-02-04 00:28:39+00:00,"b'RT @nathanrabin: In a real change of pace, I wrote about @alyankovic for someone other than my website: https://t.co/MiQFLW8o8O'"
1489330910575030274,2022-02-03 20:12:14+00:00,"b'RT @looper: Exclusive Interview: ""Dual"" star Aaron Paul offered advice on how Daniel Radcliffe should best approach the role of Weird Al \xf0\x9f\x99\x8c\xe2\x80\xa6'"
1489110164141600772,2022-02-03 05:35:04+00:00,"b'RT @ConanOBrien: If Weird Al can get a biopic with Daniel Radcliffe, I demand a \xe2\x80\x9cConan"" biopic starring Rupert Grint, and when he says \xe2\x80\x9cno,\xe2\x80\xa6'"
1489106633707851779,2022-02-03 05:21:02+00:00,"b""Um, yeah, let's say that's correct. https://t.co/rRYgnM6KH5"""
1488646955295072259,2022-02-01 22:54:26+00:00,"b'RT @pattonoswalt: I know this whole tour is probably sold out but if there are ANY tickets available, grab them. If you\xe2\x80\x99ve never seen @alya\xe2\x80\xa6'"
1488213385518878723,2022-01-31 18:11:35+00:00,"b'Just added: Akron, OH!  https://t.co/dQj6NF6NRj\n#TheUnfortunateReturnOfTheRidiculouslySelfIndulgentIllAdvisedVanityTour'"
1486459799080366080,2022-01-26 22:03:27+00:00,"b'There are MANY reasons why I wanted to cast Daniel Radcliffe in my movie, but this is what really clinched the deal for me.  (He\xe2\x80\x99s going to absolutely kill this.) https://t.co/TiDNXwQdtR'"
1484723610098954245,2022-01-22 03:04:28+00:00,b'How did they get a hold of our screenplay??? https://t.co/CJzXUk5duy'
1484619756053286915,2022-01-21 20:11:47+00:00,b'Is this why everybody\xe2\x80\x99s been talking about \xe2\x80\x9cWordle\xe2\x80\x9d? https://t.co/kxZjbBN8QL'
1483472330588184576,2022-01-18 16:12:19+00:00,b'See??  I\xe2\x80\x99m not kidding about this!  https://t.co/p1qww3R20v'
1483439049549352962,2022-01-18 14:00:05+00:00,b'So\xe2\x80\xa6 I\xe2\x80\x99m making a movie.'
1479604194285813761,2022-01-08 00:01:44+00:00,"b'RT @ScottAukerman: On SCOTT HASN\xe2\x80\x99T SEEN, it\xe2\x80\x99s DANCE MONTH! \n\nAll of January, Sprague and I will be watching ICONIC dance movies that I have\xe2\x80\xa6'"
1478137058786877441,2022-01-03 22:51:51+00:00,"b'Yeah, no, sorry. Not gonna do ""My Flurona.""'"
1477362535867183104,2022-01-01 19:34:11+00:00,"b'If you thought 2021 sucked, I\xe2\x80\x99m afraid I\xe2\x80\x99ve got some bad news for you\xe2\x80\xa6 https://t.co/BdXZdfZPyi'"
1471576229119623169,2021-12-16 20:21:28+00:00,"b""RT @punchupthejam: The POD is back to PUNCHING. We got to the bottom of what isn't wonderful about Sir Paul's Wonderful Christmastime, with\xe2\x80\xa6"""
1471163204948480002,2021-12-15 17:00:15+00:00,b'FINALLY I get to cross \xe2\x80\x9cbe in a George Harrison music video\xe2\x80\x9d off my bucket list!  https://t.co/5jGscvxed7 https://t.co/eOz5buZYZm'
1469778088858820611,2021-12-11 21:16:18+00:00,"b""FYI, we're a sensitive lot. https://t.co/t6l1T4pj9y"""
1469369599988682753,2021-12-10 18:13:06+00:00,b'Tickets on sale NOW!  \nNOW NOW NOW NOW NOW!!!\nhttps://t.co/dQj6NF6NRj\n#TheUnfortunateReturnOfTheRidiculouslySelfIndulgentIllAdvisedVanityTour https://t.co/5ae61v5luY'
1469027745560547329,2021-12-09 19:34:42+00:00,"b'Okay, this is your LAST WARNING\xe2\x80\xa6 Tickets for my 2022 Ill-Advised Vanity Tour go on sale TOMORROW MORNING at 10AM. Tarry not! (If you\xe2\x80\x99ve already managed to snag pre-sale tickets\xe2\x80\xa6 congrats!)  https://t.co/dQj6NF6NRj https://t.co/kXfr9wHHig'"
1468686007146979329,2021-12-08 20:56:45+00:00,"b'FYI, on this next tour, in cities where I\xe2\x80\x99m doing two nights in a row, I\xe2\x80\x99ll be doing a COMPLETELY different set list the second night, not repeating a single song. Just so ya know.  https://t.co/dQj6NF6NRj'"
1468290629121630208,2021-12-07 18:45:40+00:00,"b""Currently reading book #3 in @thomaslennon's fantastic 75-part #RonanBoyle series. I literally can't put it down (unfortunate Krazy Glue accident)."""
1467962194042056705,2021-12-06 21:00:35+00:00,b'RT @AndyRichter: You NEED to see this. Two of my favorites'
1467904756811141122,2021-12-06 17:12:21+00:00,"b'ICYMI, I\xe2\x80\x99ll be touring all over North America next year with my pal @emophilips - tickets go on sale this Friday at 10AM (your local time). Check https://t.co/dQj6NF6NRj for dates and info. Am I coming anywhere near youuuuu? https://t.co/SEpid3RQ6A'"
1466912484678197252,2021-12-03 23:29:24+00:00,"b'RT @EmoPhilips: I am honored to be touring the U.S. &amp; Canada with \xe2\x80\x9cWeird Al\xe2\x80\x9d; please see which venue is closest to your home, or farthest,\xe2\x80\xa6'"
1466853498125885440,2021-12-03 19:35:01+00:00,"b'133 shows, here we go. Check out all the dates at https://t.co/ETyiOJdd8h https://t.co/26Db4N8PB4'"
1466662883614355456,2021-12-03 06:57:35+00:00,b'RT @RollingStone: \xe2\x80\x98Weird Al\xe2\x80\x99 Yankovic has announced a 133-date \xe2\x80\x98Ill-Advised Vanity Tour\xe2\x80\x99 for 2022 https://t.co/5GVfgDLfc9 https://t.co/WjFM\xe2\x80\xa6'
1466649857507004417,2021-12-03 06:05:49+00:00,"b""@tyranikarp Well, I was told I'd have to practice, practice, practice for it."""
1466635011365347329,2021-12-03 05:06:50+00:00,b'Psssst!  Tour dates are up!\n\nhttps://t.co/r2poJlEIH2'
1466541146771910660,2021-12-02 22:53:51+00:00,b'Foreshadowing...? https://t.co/EgZskJQQf8'
1466476964429148166,2021-12-02 18:38:48+00:00,b'I\xe2\x80\x99ve been hearing a wild rumor that tomorrow I\xe2\x80\x99ll be announcing a major North American tour\xe2\x80\xa6 wonder if it\xe2\x80\x99s true??'
1464247716238745603,2021-11-26 15:00:34+00:00,"b'Sorry, but I\xe2\x80\x99m afraid it\xe2\x80\x99s time for the OBLIGATORY SELF-PROMOTIONAL BLACK FRIDAY ANNOUNCEMENT:\n\nhttps://t.co/yxtCM3ZveX https://t.co/oID6ezb4RD'"
1463896119788908551,2021-11-25 15:43:27+00:00,b'Just catching up on some emails this morning. https://t.co/RPwp3EMmt6'
1462892820302229504,2021-11-22 21:16:42+00:00,"b""To everybody that's congratulating me right now on my new Kid Rock parody video, let me clarify - that's not me. That's actually Kid Rock."""
1460308409534726144,2021-11-15 18:07:10+00:00,b'RT @ScottAukerman: On this week\xe2\x80\x99s @ComedyBangBang \xe2\x80\x9cWeird\xe2\x80\x9d @alyankovic returns! And he has a HUGE announcement!\n\nThen salesperson Maurice Fl\xe2\x80\xa6'
1458484350266195974,2021-11-10 17:19:01+00:00,b'Congratulations to Paul Rudd on being named People Magazine\xe2\x80\x99s Sexiest Man Alive of 2021. https://t.co/DjgqwAPHjc'
1457742075986776067,2021-11-08 16:09:29+00:00,b'RT @jaketapper: Join @alyankovic on Zoom!!!\n\nBid NOW to support injured Veterans through @homesforourtrps during our 5th Annual #VeteransDa\xe2\x80\xa6'
1455588047366492161,2021-11-02 17:30:08+00:00,b'https://t.co/hP4PaP68IM'
1455381113761787905,2021-11-02 03:47:51+00:00,"b'After much careful consideration, I present to you the official winners of Best Halloween Costume of 2021 (all tied for first place). https://t.co/dpRMbYmFGg'"
1455198078714081284,2021-11-01 15:40:32+00:00,"b'Just listened to this. Not a very faithful cover version, if you ask me. https://t.co/jmo4CKgO8s'"
1455006110109212675,2021-11-01 02:57:44+00:00,"b'It\xe2\x80\x99s really a trip to play to 44,000 people in one weekend after not having set foot on a stage in two years. Huge thanks to the fans and all the #nightmarebeforechristmas people for making the whole thing such an absolute joy.'"
1454887298512818183,2021-10-31 19:05:37+00:00,"b'@BenFolds @gmassenburg We shot that on Sunday, July 15, 2001 at the (now defunct) Mad Hatter Studios in L.A.'"
1454495981173559296,2021-10-30 17:10:39+00:00,b'Thinking about taking this supergroup on the road. @peeweeherman @dannyelfman #nightmarebeforechristmas https://t.co/5Wyaq9skLT'
1453044905425526786,2021-10-26 17:04:36+00:00,b'https://t.co/EXxSPaXTa2'
1452446108710580226,2021-10-25 01:25:12+00:00,"b'RT @SummerWoodsSong: Chihuahua Hat, my brand new Weird Al cover album is OUT TODAY! And of course, happy birthday to @alyankovic, whose mus\xe2\x80\xa6'"
1452369162584604681,2021-10-24 20:19:26+00:00,"b'I really enjoyed ALL of Dave Grohl\xe2\x80\x99s new autobiography, but I have to admit, this is my favorite paragraph: https://t.co/LSyrHQxmAP'"
1446281097923346445,2021-10-08 01:07:39+00:00,"b'Sure, I have my share of gold records, but this is the first one I\xe2\x80\x99ve ever gotten from @weezer!  Thanks, guys! https://t.co/mdst2zv1cy'"
1445804923468140550,2021-10-06 17:35:30+00:00,b'RT @2000inch: Episode 127\xe2\x80\x9d is available now!\xe2\x80\x89\n\nDave &amp; Ethan interview \xe2\x80\x9cWEIRD AL\xe2\x80\x9d YANKOVIC in a no-holds-barred conversation covering anythi\xe2\x80\xa6'
1445446457121644555,2021-10-05 17:51:05+00:00,"b'Apologies to my pal @pattonoswalt  - I\xe2\x80\x99m woefully behind on bingeing AP Bio, and I\xe2\x80\x99m only just now seeing this lovely Season 3 shout-out from the great @perlapell. https://t.co/GDUE64Ldiz'"
1445196121383620612,2021-10-05 01:16:20+00:00,b'Uh... thanks?  @Y_FXonHulu https://t.co/9jxWfzkpvv'
1445162091539804162,2021-10-04 23:01:07+00:00,"b'@pattonoswalt Sorry, I refuse to do any songs that have typos in the title.'"
