twitter_id,date,tweet
307273203724726272,2013-02-28 23:36:55+00:00,"b"".@Pontifex Okay, your joke about Quvenzhan\xc3\xa9 Wallis was totally out of line, but you didn't have to go and delete your whole Twitter account!"""
307203327077261312,2013-02-28 18:59:15+00:00,b'\xe2\x80\x9cDude! You\xe2\x80\x99ll never guess who\xe2\x80\x99s on my flight! Hitler!!\xe2\x80\x9d #IfTheyHadCellPhonesInThe30s'
306436780163485698,2013-02-26 16:13:16+00:00,"b'Maybe ""Dare To Be Stupid"" should be our new National Anthem? http://t.co/5p2V9WHW6m'"
306118672538284032,2013-02-25 19:09:13+00:00,b'What\xe2\x80\x99s the politically correct term these days - is it \xe2\x80\x9cEskimo little people\xe2\x80\x9d or \xe2\x80\x9cInuidgets\xe2\x80\x9d?'
305898806594121728,2013-02-25 04:35:33+00:00,"b'BTW, ""Spielberg"" is what I sarcastically call Ang Lee. #StillBatting1000 #Oscars'"
305857411326033920,2013-02-25 01:51:04+00:00,"b'BTW, \xe2\x80\x9cGrumpy Cat\xe2\x80\x9d is my nickname for Christoph Waltz.  Private joke between the two of us. #Oscars'"
305724664326549504,2013-02-24 17:03:34+00:00,"b'I can\xe2\x80\x99t stay up late tonight, so congrats in advance to Argo, Spielberg, Danny Lewis, Jenny Lawrence, Annie Hathaway and Grumpy Cat. #Oscars'"
305357581331869697,2013-02-23 16:44:55+00:00,b'I would NOT have done well in the military. I\xe2\x80\x99d always be saying things like \xe2\x80\x9cSIR LET\xe2\x80\x99S JUST AGREE TO DISAGREE SIR!!!\xe2\x80\x9d'
305047918912602113,2013-02-22 20:14:26+00:00,b'My people! http://t.co/0PhnMSEehf'
305014300655882240,2013-02-22 18:00:50+00:00,"b'Oops, apparently that joke was made on Newreaders, which is a very funny show on Adult Swim that you should be watching.'"
305004089954140161,2013-02-22 17:20:16+00:00,b'\xe2\x80\x9cI\xe2\x80\x99m EXACTLY THE RIGHT AGE for this sh*t!!\xe2\x80\x9d #UnusedActionMovieCatchphrases'
304672709235838977,2013-02-21 19:23:29+00:00,"b'""Pachelbel? More like HACKelbel!"" - Jealous 17th century composers'"
304628989291540480,2013-02-21 16:29:45+00:00,"b'RT @TheOnion: [American Voices] ""Paul McCartney\'s got to be thrilled for the chance to share a stage with Marcus Mumford."" http://t.co/4 ...'"
304266640437157888,2013-02-20 16:29:54+00:00,b'Just started giving my daughter piano lessons.  No pressure. http://t.co/W4eFgIHL'
304140241932009472,2013-02-20 08:07:38+00:00,b'A couple highlights from #BLAM: http://t.co/ujumo7mI http://t.co/QdVRfj1n'
303855350241697792,2013-02-19 13:15:35+00:00,b'RT @Soundcheck: .@alyankovic will help unveil the 2013 #Bonnaroo lineup in a livestream today at 1PM EST: http://t.co/3H07j6J5'
303578389363703809,2013-02-18 18:55:02+00:00,"b""Sorry, but in good conscience I can't celebrate Presidents Day. #BiteMeMillardFillmore #YouKnowWhatYouDid"""
303529241914523648,2013-02-18 15:39:45+00:00,"b'Yo @Pontifex, got your notes on my \xe2\x80\x9cPope House\xe2\x80\x9d reality show treatment. Will lose the hot tub confessional, no prob. Let\xe2\x80\x99s pitch this thing!'"
303196218807439360,2013-02-17 17:36:26+00:00,b'I will not PLAY BY YOUR RULES. http://t.co/zxiFGsZP'
302876463806414849,2013-02-16 20:25:50+00:00,"b'Several years ago I made a dumb joke about Hollywood doing a dark, gritty, big-budget version of \xe2\x80\x9cJack &amp; the Beanstalk\xe2\x80\x9d ha ha ha guess what.'"
302526612258295808,2013-02-15 21:15:39+00:00,b'It\xe2\x80\x99s been several months\xe2\x80\xa6 isn\xe2\x80\x99t it time to reboot the Spider-Man franchise again?'
301754816592482305,2013-02-13 18:08:49+00:00,b'Meet my body double: http://t.co/3pE8Ez67'
301395320988921857,2013-02-12 18:20:18+00:00,"b""RT @Bonnaroo: When\xe2\x80\x99s the #Bonnaroo 2013 lineup announcement?!? What is BLAM? Here's the info straight from @alyankovic's mouth http://t. ..."""
301193012552273920,2013-02-12 04:56:24+00:00,b'RT @setholenick: I finally found a way to get  200 of the best comedians in one place: my photo book. Check it out on Kickstarter now ht ...'
301062453847023617,2013-02-11 20:17:37+00:00,"b"".@Pontifex I've already told you, I am NOT interested in the job.  Please stop DM-ing me."""
301043869963931648,2013-02-11 19:03:46+00:00,"b'Hey @frank_ocean, next time do this one: http://t.co/otLk9s5Q'"
301037392641544193,2013-02-11 18:38:02+00:00,"b'Happy 10th Birthday to my favorite human, @ninayankovic.  #DecaDaughter'"
300650817487257600,2013-02-10 17:01:55+00:00,"b'""Ah! He was probably getting the ball player\'s odd name confused with the commonly-used relative pronoun!"" - Abbott in a reflective moment'"
300274675521572864,2013-02-09 16:07:16+00:00,"b""I know I'm pale, but they ALWAYS over-do it with the makeup at these photo shoots. http://t.co/NnsAYWhi"""
299967526513831936,2013-02-08 19:46:46+00:00,"b""Don't make me angry.  You wouldn't like me when I'm angry.  http://t.co/JZ6rcUBq"""
299263152233791489,2013-02-06 21:07:50+00:00,b'My interview with Dee Snider: http://t.co/I6rZt9Rx'
299037588558315520,2013-02-06 06:11:31+00:00,"b'RT @paulandstorm: The music video for ""Go Viral"" (from the comedy musical web series #LearningTown), feat. @alyankovic: http://t.co/O967qHsl'"
298860797126406144,2013-02-05 18:29:01+00:00,"b'RT @paulandstorm: Episode 4 or #LearningTown is up! Oddly enough, @alyankovic is the most normal thing in this episode. http://t.co/xCmV78Bq'"
298853833382174720,2013-02-05 18:01:20+00:00,"b'If you have a burning hatred of me that engulfs every fiber of your being, we can\xe2\x80\x99t be friends.'"
298240266907832322,2013-02-04 01:23:15+00:00,"b'Nice job, @Beyonce.  Could\xe2\x80\x99ve used more Segways, accordions and singing Amish people, but still.'"
298162122297339905,2013-02-03 20:12:44+00:00,"b'If I were performing at halftime, I would be SO NERVOUS RIGHT NOW instead of eating nachos in my pajamas.'"
298114953464913920,2013-02-03 17:05:18+00:00,b'Just got an inside tip on the half-time show: Beyonce scheduled to lip-sync to @jonathancoulton\xe2\x80\x99s \xe2\x80\x9cBaby Got Back.\xe2\x80\x9d Can\xe2\x80\x99t wait!'
298027011182559232,2013-02-03 11:15:51+00:00,"b""RT @rainnwilson: As you prepare snacks for the Super Bowl, flip to @OWN at 1pm &amp; watch @soulpancake's show on LOVE. It will warm the ..."""
297771811695915008,2013-02-02 18:21:46+00:00,b'Finally got a new headshot! Will need to Photoshop it a bit before I send it out. http://t.co/ZigTBMv4'
297415233075560448,2013-02-01 18:44:51+00:00,b'Who has 3 thumbs and enjoys being genetically mutated?  THIS guy!'
297062173316902912,2013-01-31 19:21:55+00:00,b'This Day In 1986: David Spade officially becomes a solo act after breaking up the comedy team he started with partner Bobby Neutered.'
297058683819548673,2013-01-31 19:08:03+00:00,b'RT @Bonnaroo: A Special Message from Weird Al about the Bonnaroo 2013 Lineup Announcement http://t.co/ji3HlLJ0 #bonnaroo @alyankovic'
296689079427420161,2013-01-30 18:39:23+00:00,b'Everybody put your hands in the air and wave them like you don\xe2\x80\x99t have a particularly strong opinion about anything.'
296315857431322624,2013-01-29 17:56:20+00:00,b'The secret to a good relationship is finding a way to surprise your loved one every day (eg. hiding a live tarantula in your armpit).'
295973111143215104,2013-01-28 19:14:23+00:00,"b'Recently donated a ton of old tour merch, so FYI if you see a bunch of homeless guys in Weird Al T-shirts, they\xe2\x80\x99re not NECESSARILY huge fans'"
295585459839594496,2013-01-27 17:33:59+00:00,b'People who invoke Godwin\xe2\x80\x99s Law are worse than Hitler.'
295261955978055680,2013-01-26 20:08:30+00:00,"b""RT @KenPlume: Inspiration! Longevity! Orchestr-Al! Guam! Jamming! Knott's preservation! Late Shift Johnny! BitOfAChat w/ @AlYankovic htt ..."""
295214140061016066,2013-01-26 16:58:30+00:00,b'I just met a guy that lost both his arms in an industrial accident.  So sad.  Didn\xe2\x80\x99t have a humerus bone in his body.'
295048056301301760,2013-01-26 05:58:33+00:00,"b""You guys have each other's e-mail address, right? RT @neilhimself: @amandapalmer I am coming home to you."""
294850257450332161,2013-01-25 16:52:34+00:00,"b'If you don\xe2\x80\x99t bother to give your pet a stupid middle name, what kind of a monster ARE you?'"
294482242246430720,2013-01-24 16:30:12+00:00,b'I really gotta clean out my car one of these days. http://t.co/zQ5ERspY'
294138911586926593,2013-01-23 17:45:56+00:00,b'So THIS is what Braveheart was going on about? http://t.co/X6OWkslx'
293815302582575104,2013-01-22 20:20:01+00:00,"b'RT @BULLETTMedia: Bark Like a Zebra: ""Weird Al"" Yankovic (@alyankovic) Fills Out Our Patented Questionnaire: http://t.co/XvUZF2mZ'"
293769683516157953,2013-01-22 17:18:45+00:00,b'My Anus True #ElvisCostelloAlbumsAboutAnuses'
293435155505369088,2013-01-21 19:09:27+00:00,"b""Yes, I'm now available for commercial work. http://t.co/umWK9ezc"""
293404170600472577,2013-01-21 17:06:20+00:00,"b'Don\xe2\x80\x99t you hate that one person who just REFUSES to Wang Chung, and ruins it for everybody else?'"
293051326424813569,2013-01-20 17:44:15+00:00,b'The Mosquitoes (on that one episode of \xe2\x80\x9cGilligan\xe2\x80\x99s Island\xe2\x80\x9d) were better than 90% of the bands making music today.'
293047073408970752,2013-01-20 17:27:21+00:00,b'RT @zombiemiki: Hey @alyankovic you are # 1 in this Cracked article http://t.co/zJmRxMa5 Still remember that Japanese show?'
292688175426596865,2013-01-19 17:41:13+00:00,"b""So? How's he doing? Still the same? http://t.co/SqucaodZ"""
292436564485742592,2013-01-19 01:01:24+00:00,"b'RT @ditzkoff: Hey, @alyankovic, this TV game show seems to have heard of you. http://t.co/fDvzo8jV'"
292304427996569600,2013-01-18 16:16:21+00:00,b'My cousin is really into Word With Friends (he shares his copy of Microsoft Word with all his buddies).'
291932695683014658,2013-01-17 15:39:13+00:00,b'Casting News: Andy Serkis has just signed on to play the role of lower-case H in \xe2\x80\x9cCAPTCHA - The Movie\xe2\x80\x9d!'
291600688818040832,2013-01-16 17:39:56+00:00,"b'Who\xe2\x80\x99d You Rather? Teenage me, or teenage @ryanseacrest?  http://t.co/WtJ3zsbs'"
291265358491435008,2013-01-15 19:27:27+00:00,"b'RT @paulandstorm: Here we go...#LearningTown, Episode 1: http://t.co/gx7h5wYL'"
291202213743849474,2013-01-15 15:16:32+00:00,b'Every time I watch \xe2\x80\x9cThe Shining\xe2\x80\x9d I notice something new. http://t.co/jkXiLpgb'
291092740232597504,2013-01-15 08:01:32+00:00,b'RT @plymptoons: Bill Plympton needs your help to Kickstart his 7th Independent Animated Feature Film #CheatinMovie on @Kickstarter! http ...'
290876343934132224,2013-01-14 17:41:39+00:00,"b'When DDL wins the Oscar for Best Actor, I hope for his acceptance speech he just shrugs and goes, \xe2\x80\x9cWell\xe2\x80\xa6 back to cobblin\xe2\x80\x99!\xe2\x80\x9d'"
290732155234029568,2013-01-14 08:08:42+00:00,b'@Sethrogen Will get right to work on that.'
290493885036253184,2013-01-13 16:21:53+00:00,"b'Wow, these guys really mean business. http://t.co/L8t3t0RO'"
290150247961870336,2013-01-12 17:36:24+00:00,"b'\xe2\x80\x9cUp in the sky! It\xe2\x80\x99s a bird! It\xe2\x80\x99s a plane! It\xe2\x80\x99s\xe2\x80\xa6 a bird. Sure looked like a plane for a second, though!\xe2\x80\x9d #BoringComics'"
289789798888120320,2013-01-11 17:44:06+00:00,"b'Whoa, have you guys seen this \xe2\x80\x9cGangnam Style\xe2\x80\x9d thing yet???'"
289373033137856512,2013-01-10 14:08:02+00:00,"b'What? No Supporting Actor nod for his groundbreaking work in \xe2\x80\x9cThat\xe2\x80\x99s My Boy\xe2\x80\x9d?? Great, Academy. Thanks for BREAKING VANILLA ICE\xe2\x80\x99S HEART.'"
289103061429911552,2013-01-09 20:15:15+00:00,"b'Beans, beans, the magic legume - the more you ingest, the more you consume.'"
289074821558587392,2013-01-09 18:23:02+00:00,"b'Ugh, it\xe2\x80\x99s the second week of January and I\xe2\x80\x99m still writing checks.'"
288664519394340864,2013-01-08 15:12:39+00:00,b'No WAY should the government issue a trillion-dollar coin. Think of the hassle just retooling all the vending machines!'
288328274516512769,2013-01-07 16:56:32+00:00,"b'Goodbye, Maui. See ya again soon. http://t.co/xhi5z8SI'"
288016834534457344,2013-01-06 20:18:59+00:00,"b'Thinking of starting a line of Ettgo brand waffles, for the more articulate gourmand: ""I say! Let go of my ETTGO\xe2\x84\xa2!""'"
287653809306603521,2013-01-05 20:16:27+00:00,b'At a contemporary art gallery. This Ed Ruscha piece is my favorite: http://t.co/qKANJutb'
287284046399172608,2013-01-04 19:47:08+00:00,b'Reading a great book about reincarnation.  #YOLO'
286910974219415554,2013-01-03 19:04:41+00:00,"b'Canada didn\'t exactly dominate in the Olympics, but I still give them an ""eh"" for effort. #Leftover2012Tweets'"
286624661876379648,2013-01-03 00:06:59+00:00,"b'Just saw Zero Dark Thirty. I\'m sorry, but that ""Osama Bin Laden"" character was a totally lame rip-off of Abu Nazir. #Homeland'"
286538129328967680,2013-01-02 18:23:08+00:00,"b""That guy from 30 Odd Foot of Grunts must've been so psyched about getting to sing in Les Mis!"""
286356318103670784,2013-01-02 06:20:41+00:00,"b'NOBODY recorded my set with Alice Cooper and Steven Tyler last night? Bummer. Well, it looked kinda like this: http://t.co/RAECbdaf'"
286076461163614208,2013-01-01 11:48:38+00:00,"b'Happy New Year!  (And to all my Chinese friends, Happy Tuesday.)'"
286059363666391040,2013-01-01 10:40:41+00:00,"b""RT @BuzzFeed: Weird Al's High School Yearbook Photo http://t.co/xddZpcDb"""
285787082209767425,2012-12-31 16:38:44+00:00,"b""My New Year's Eve plans? Oh, you know, same old same old. (Singing on stage with Alice Cooper and Steven Tyler!!)"""
285406264580796416,2012-12-30 15:25:30+00:00,"b'In the Breaking Bad finale, Walter White becomes the spokesman for the new anti-drug ad campaign: ""Meth - don\'t meth with it!"" #2013Spoilers'"
285103331066654720,2012-12-29 19:21:45+00:00,b'You know all those songwriters in the 18th century that thought \xe2\x80\x9clove\xe2\x80\x9d rhymed with \xe2\x80\x9cprove\xe2\x80\x9d?  Buncha IDIOTS!  #Topical'
284742612152369153,2012-12-28 19:28:23+00:00,b'#FF @robdelaney\xe2\x80\xa6 even though he DID totally rip off my old avatar photo.  http://t.co/lRhLxInh'
284374778549256192,2012-12-27 19:06:45+00:00,b'Struggling actors: It comes off as kinda desperate when you pad out your resum\xc3\xa9 by including your appearance on Google Maps Street View.'
283985257181638657,2012-12-26 17:18:56+00:00,b'Dear Retailers: Please remember to keep the Box in Boxing Day. #WarOnBoxingDay'
283660339931922432,2012-12-25 19:47:49+00:00,"b'Mele Kalikimaka, y\xe2\x80\x99all. http://t.co/HkAwj2xb'"
283649541473964032,2012-12-25 19:04:55+00:00,"b""RT @Puddinstrip: a brand new holiday Puddin' under your Christmas tree! Feliz Navidad! http://t.co/UE9658E5"""
283292078555922432,2012-12-24 19:24:29+00:00,"b""RT @pattonoswalt: .@Puddinstrip: It's a Wonderful Puddin'. Forgive me, Frank Capra - http://t.co/E4FXHCs7 // @ColinHanks deserves the No ..."""
283278962824732672,2012-12-24 18:32:22+00:00,"b'OK, if NORAD\xe2\x80\x99s Santa-tracking data is identical to last year\xe2\x80\x99s, that will pretty much confirm my suspicion of a GIANT GOVERNMENT CONSPIRACY.'"
282899419450449920,2012-12-23 17:24:12+00:00,b'Nothing says Christmas like... http://t.co/KmsCX4HF'
282659249228763136,2012-12-23 01:29:51+00:00,"b""RT @TheOnion: Peer Group Forces Man To Have Opinion On 'Weird Al' http://t.co/Z69lAkc9 #OnionYIR"""
282511458321965056,2012-12-22 15:42:35+00:00,"b'Well, guess I better start my Christmas shopping.  Stupid non-apocalypse.'"
282149590508130307,2012-12-21 15:44:39+00:00,"b'Hey guys, just got a DM from my Mayan friend. Turns out it\xe2\x80\x99s NOT the end of the world - just time to order a new calendar. Whew!'"
281926704539246593,2012-12-21 00:58:58+00:00,b'Planning to spend my last day on earth just like every other day (i.e. naked and shivering in the closet). #HappyAlpocalypse'
281830235308187649,2012-12-20 18:35:38+00:00,"b'Remember, the world ends tomorrow. Last chance to buy Weird Al: The Book or any of the fine merchandise here: http://t.co/vsVXnLeu'"
281461371873394690,2012-12-19 18:09:55+00:00,"b'How about we keep Social Security, and maybe not spend billions for NORAD to keep tracking Santa every year? #FiscalCliff'"
280817588894846976,2012-12-17 23:31:45+00:00,b'Working on a screenplay - going great so far! http://t.co/SECtzy3f'
279666426665652224,2012-12-14 19:17:26+00:00,b'Today I was one of those idiots who tweets without reading the news first. So sorry. My heart goes out to all those involved in the tragedy.'
279247371274166274,2012-12-13 15:32:16+00:00,b'\xe2\x80\x9cMore like SMELLY Kalikimaka!\xe2\x80\x9d \xe2\x80\x93 flatulent Hawaiian Santa Claus'
278912439624548352,2012-12-12 17:21:22+00:00,"b'I have no idea how TMZ got this picture, but yes, that\xe2\x80\x99s ME with a DEAD HOOKER. http://t.co/Vxe0MTUT'"
278886294724177920,2012-12-12 15:37:28+00:00,b'RT @Ludovicaa: Listen to Alpaca Dinghy: http://t.co/gmVICuER via @Earwolf with @Kulap @HowardKremer and @AlYankovic !!!!'
278543939106136065,2012-12-11 16:57:04+00:00,"b'Remember: You can pick your friends, and you can lead a horse to water, but you can\xe2\x80\x99t keep your eyes open while you\xe2\x80\x99re sneezing.'"
277484174884093954,2012-12-08 18:45:57+00:00,"b'""You\'re an A-Hole, Mr. Grinch"" #FirstDraftChristmasSongs'"
277322415053340672,2012-12-08 08:03:10+00:00,b'RT @donnyosmond: Tonight at the @Pantages was the long awaited #WhiteAndNerdy reunion with me and @AlYankovic.\nGreat to see you again.\n\n ...'
277316137040105472,2012-12-08 07:38:14+00:00,"b""RT @robdelaney: COOL \xe2\x80\xa2 @birbigs' EXCELLENT film about standup, Sleepwalk With Me, is on iTunes: http://t.co/MTNnoH5N"""
277079577543708672,2012-12-07 15:58:13+00:00,"b'I\'m spending WAY too much time online. I was flipping through a magazine just now and thought, ""Man, look how fast these pages are loading!""'"
276718382622064640,2012-12-06 16:02:58+00:00,b'Life of Pi was disappointing - virtually NO discussion of mathematics.'
276009238583705600,2012-12-04 17:05:05+00:00,"b'Every time somebody tweets ""Your an idiot"" an irony angel gets its wings.'"
275810973628116993,2012-12-04 03:57:15+00:00,"b""It's only a matter of time before @pontifex starts following @ashleytisdale. #GotMoneyRidingOnIt"""
275641840777195521,2012-12-03 16:45:10+00:00,"b""Sure, Hulk Hogan was a big WWF champ back in the day, but I bet I'd smear him at Words With Friends NOW!"""
275288422246133761,2012-12-02 17:20:49+00:00,"b""RT if you're breathing right now."""
274930752897048576,2012-12-01 17:39:34+00:00,"b""Fine, next year someone ELSE can decide what the kids do for their school play, but it's my turn THIS year and I say The Book of Mormon."""
274928257260982272,2012-12-01 17:29:39+00:00,"b'RT @paulandstorm: [P] Saturday Morning Obscure Factoid: @KeeganMKey and @JordanPeele are in @alyankovic\'s ""White &amp; Nerdy"" video. htt ...'"
274584423276634113,2012-11-30 18:43:22+00:00,"b'Remember in the days before e-mail, when people would write actual letters that would be delivered by magical owls?'"
274072814611492864,2012-11-29 08:50:25+00:00,"b'RT @ApocalypseHow: YAY! My all-star comedy tribute to FREE TO BE YOU &amp; ME, now on iTunes! $4 - all $ to St. Judes Childrens Hospital ...'"
273489882666631168,2012-11-27 18:14:03+00:00,b'NO.  Taco Thursday can\xe2\x80\x99t be a thing.  It\xe2\x80\x99s either Taco Tuesday or Thaco Thursday.  Choose one and live with it.'
273122984854712321,2012-11-26 17:56:08+00:00,"b""RT @colestratton: It's the 100th episode of @pmcpodcast with super special guest WEIRD AL! (@alyankovic)! http://t.co/EvZa3LJv"""
272787861986762752,2012-11-25 19:44:29+00:00,b'Memo to self: F it. http://t.co/QyPQ1mmj'
272785553349545984,2012-11-25 19:35:18+00:00,"b""RT @NerdistChannel: Catch Face to Face's @alyankovic &amp; other guests on @annoyingorange's Generic Holiday Special tomorrow night at 8 ..."""
272448520076795904,2012-11-24 21:16:03+00:00,b'Free slogan for the National Crudit\xc3\xa9 Advisory Board: \xe2\x80\x9cIt\xe2\x80\x99s Never a Cruddy Day\xe2\x80\xa6 With Crudit\xc3\xa9!\xe2\x80\x9d #YoureWelcome'
272054715150376961,2012-11-23 19:11:13+00:00,"b""If I associate Bob Marley with ANYTHING, it's mocha! http://t.co/Z1xlNMYk"""
271360801598750720,2012-11-21 21:13:51+00:00,"b""RT @MTVGeek: EXCLUSIVE: Season's Greetings from the ANNOYING ORANGE and @alyankovic http://t.co/VFVqj0O9"""
271324789220720640,2012-11-21 18:50:45+00:00,"b'Looking back on it, Hermann Goering was a lot like the Soup Nazi, except for the soup part.'"
270972934020022272,2012-11-20 19:32:36+00:00,"b""What a happy little shoehorn. (PLEASE tell me that's a shoehorn.) http://t.co/xshW8Pmr"""
270971703004377090,2012-11-20 19:27:43+00:00,"b'RT @ApocalypseHow: Lizzy Caplan, @ColinHanks &amp; @eddiepepitone are some of the comic greats on my FREE TO BE YOU &amp; ME parody for  ...'"
270583673542287360,2012-11-19 17:45:49+00:00,"b""See, it's funny because it could also mean something else. http://t.co/UYzx6qcE"""
270242283658563584,2012-11-18 19:09:15+00:00,b'Looks like they misfiled one of my albums again.  (Or DID they??)\n http://t.co/14v5Kc22'
269834524047851520,2012-11-17 16:08:58+00:00,b'The last 5 guys that cheaped my tobacco did a horrible job. Sure hope this place is different. http://t.co/x6unYfNa'
269478965872295936,2012-11-16 16:36:06+00:00,"b'Yo, Ding Dong, man.  Ding Dong.  Ding Dong, yo.  #Hostess #RIP #DayOfMourning'"
269153880921751552,2012-11-15 19:04:20+00:00,b'Ugh.  Needy buildings. http://t.co/H1Gtl7yN'
269093712632627200,2012-11-15 15:05:15+00:00,b'RT @CreativeBloq: Oliver Smith creates these amusing fake film titles to the sound of Weird Al Yankovic. Check out the typography! http: ...'
268802513115967488,2012-11-14 19:48:07+00:00,"b""I really need to upgrade my iPhone one of these days.  I've still got one of those old rotary models."""
268422044763430912,2012-11-13 18:36:17+00:00,"b'""Ask not what your country can do for you... ask what you can do for your country... in bed."" #PoliticalSpeechFortuneCookies'"
268117850038870016,2012-11-12 22:27:31+00:00,b'Happy Veterans Day http://t.co/fj6UIutg'
268038667858231296,2012-11-12 17:12:52+00:00,b'Helpful Hint: Never go on a job interview while wearing your Eye of Mordor contact lenses.'
267681933394321409,2012-11-11 17:35:20+00:00,"b""I'm glad the Spice Girls are still able to get endorsement deals. http://t.co/kHBGYnK9"""
267427517781135360,2012-11-11 00:44:23+00:00,"b""RT @nerdist: IT IS TONIGHT! My 1st stand-up special #Mandroid @ 11p/10c on @ComedyCentral. I'll be live-tweeting from the CC account for ..."""
267307104740724736,2012-11-10 16:45:54+00:00,"b""Going to a screening of Lincoln today. Hope Spielberg didn't gloss over the man's impressive vampire-hunting legacy."""
266932915840090112,2012-11-09 15:59:01+00:00,b'In case you ever needed proof that John Lennon was cool: http://t.co/rYIMYXYR'
266603114474393600,2012-11-08 18:08:30+00:00,"b'""Just you wait, some day I\'ll be a big movie star, and then nobody will ever make fun of my name again!!"" http://t.co/D8uAkkKO'"
265836020967305217,2012-11-06 15:20:21+00:00,"b'Happy Election Day, everybody!  Hope your candidate wins!'"
265607697116835840,2012-11-06 00:13:04+00:00,"b""RT @CHRISDJMOYLES: The Difficult Second Album is out today! On iTunes and in shops that sell cd's too! https://t.co/xsVtJx8F\nThanks and  ..."""
265467293235048448,2012-11-05 14:55:09+00:00,"b'Remember, people, tomorrow we need to vote Nicholas Brody OUT of Congress. The man is a TERRORIST, for crying out loud!'"
264858172920045568,2012-11-03 22:34:43+00:00,"b""I'm thinking of starting a toy store that positively reinforces the use of proper grammar. #ToysAreWe"""
264220957995061249,2012-11-02 04:22:40+00:00,"b'Okay, okay... Part 4: http://t.co/uzNfEJk6'"
264051053060845570,2012-11-01 17:07:31+00:00,b'The Best Halloween Costumes of 2012 - Part 3: http://t.co/AEVX4udM'
264035450111549442,2012-11-01 16:05:31+00:00,b'The Best Halloween Costumes of 2012 - Part 2: http://t.co/mUZdHFYa'
264020550471532544,2012-11-01 15:06:19+00:00,b'And here they are - the Best Halloween Costumes of 2012: http://t.co/qHfNK8Oa'
263759641220116480,2012-10-31 21:49:33+00:00,b'Happy Halloween! http://t.co/gFD86avg'
263690824326459392,2012-10-31 17:16:06+00:00,b'Mummy Dogs http://t.co/cljwQn8z'
263673327934140416,2012-10-31 16:06:34+00:00,"b""Here's the view from my window right now. #TheresAFogUponLA http://t.co/c027jZ1r"""
263487767089143808,2012-10-31 03:49:13+00:00,"b'Got some inside information: Disney purchased LucasFilm primarily so that they could have the rights to the Ewok\'s ""Yub Nub"" song.'"
262928444160110592,2012-10-29 14:46:40+00:00,b'In stores June 25 - get in line now!  http://t.co/GKagN5bE'
262711581903826944,2012-10-29 00:24:56+00:00,b'Here\xe2\x80\x99s @MoRocca\xe2\x80\x99s piece on MAD Magazine from CBS Sunday Morning \xe2\x80\x93 I\xe2\x80\x99m in it for a few seconds\xe2\x80\xa6 http://t.co/uIdzMYmI'
261866485230731264,2012-10-26 16:26:49+00:00,b'In case you ever needed proof that Elvis was cool: http://t.co/87c4KXsy'
261547051895107584,2012-10-25 19:17:31+00:00,b'RT @HeadCountOrg: Do you know what ID you need to #VOTE? Click here to find out: http://t.co/X78ijLtl'
261486404700344322,2012-10-25 15:16:31+00:00,"b'I would love to go on tour with John McCrea\'s band.  Then audiences could have their Cake and ""Eat It"" too.'"
261228088854212608,2012-10-24 22:10:04+00:00,"b""My next children's book won't be out for 8 more months - but I'll be revealing the title and cover art here on Monday!"""
260910684764778498,2012-10-24 01:08:49+00:00,"b'Thanks so much for the birthday wishes, everybody!!  (GROUP HUG)'"
260420118964736001,2012-10-22 16:39:29+00:00,"b""Doing book publicity in NYC today - I've already bumped into Tina Fey and Bob Loblaw. http://t.co/vTgyynME"""
