twitter_id,date,tweet
1535013481732268035,2022-06-09 21:38:27+00:00,b'Throwing it not so far back to my @SparkellaTJones takeover with @BNBuzz\xe2\x80\xa6 https://t.co/H492Ggx3zX https://t.co/nE3TZSEw0t'
1532833071938035712,2022-06-03 21:14:17+00:00,b'RT @SparkellaTJones: Watch at https://t.co/4AIGjmM5A5 at 6pm ET!!'
1531809984283123714,2022-06-01 01:28:54+00:00,"b'Omg I can\xe2\x80\x99t believe it happened once. Now, for a second time, I\xe2\x80\x99m pinching myself and checking my tutu! Thank you from the bottom of glitter poop heart for the opportunity to share @SparkellaTJones with the world again today. #SparkellaMakesAPlan https://t.co/oTYQl3NzCg'"
1531667527226490882,2022-05-31 16:02:50+00:00,b'RT @SparkellaTJones: #Sparkella is SO excited for her first sleepover! A glittery outfit and a collection of games with the awesomest tea p\xe2\x80\xa6'
1526994560903151617,2022-05-18 18:34:08+00:00,"b'And before my next book, #Sparkella Makes a Plan, hits a shelf near you on May 31st, you can grab a copy at https://t.co/JCOZj4J2qr. Let\xe2\x80\x99s GOOOOOOOO! https://t.co/UdQd4VQVDK'"
1526994545153654787,2022-05-18 18:34:04+00:00,"b'PRIME-TIME IS SHINE TIME!!! @SparkellaTJones is coming to life with a live-action movie! It will be adapted by @pamelaribon, who has written some of my favorite animated films. https://t.co/NcU5LnicsH'"
1525129682676600833,2022-05-13 15:03:46+00:00,"b""RT @LostCityMovie: The year's biggest comedy is now on Digital! Bring home #TheLostCity today: https://t.co/Gwv7mHNs4B https://t.co/X0G7zRJ\xe2\x80\xa6"""
1518721844664147968,2022-04-25 22:41:18+00:00,"b""And bonus: if you've already preordered, are planning to preorder, or if you get tickets for one of my events, you can upload your preorder receipt via https://t.co/JCOZj4rr1R to receive a free @SparkellaTJones sticker sheet from\xc2\xa0@MacKidsBooks! https://t.co/uVUGT3P2ni"""
1518721840176267264,2022-04-25 22:41:17+00:00,"b""For anyone who can't make my #Sparkella @BNBuzz signing, I\xe2\x80\x99m also having a virtual launch event hosted by @booksmithtweets on Friday, 6/3 at 6pm ET.\xc2\xa0\n\nGet ticket info &amp; registration details for both events at https://t.co/JCOZj4rr1R. https://t.co/aMJxkT5LeA"""
1518721831837913090,2022-04-25 22:41:15+00:00,"b""It's hard to believe that we're just over a month away from the release of THE ONE AND ONLY SPARKELLA MAKES A PLAN. I'm excited to announce that I'm hosting an in-person launch event at @BNEventsGrove on Weds, 6/1 at 7pm PT! https://t.co/kbtbBX4Ayr"""
1512853818949705731,2022-04-09 18:03:52+00:00,b'Love to everyone. Anyone and everyone. https://t.co/HiRnk1py2S'
1511767183482830850,2022-04-06 18:05:58+00:00,"b'RT @DogTheFilm: No Channing Tatums were harmed in the making of this movie. Those seat cushions though? Different story. #DogMovie, now ava\xe2\x80\xa6'"
1507473630246027267,2022-03-25 21:44:55+00:00,b'https://t.co/Y3LMCIJGCH'
1506782771989127169,2022-03-23 23:59:42+00:00,"b""That's what one does when getting to be in a scene with my sweet lady Sandra\nBullock and the legend himself Bradley Pitt!! You prance with happiness. https://t.co/i1KEYFZDmK"""
1506320320218779648,2022-03-22 17:22:05+00:00,b'https://t.co/rme5sxIITe'
1506292165655371788,2022-03-22 15:30:12+00:00,"b'Honestly, how good do we look here? \xf0\x9f\x98\x81 #TheLostCity https://t.co/kHDifGXAJf'"
1504494391368507394,2022-03-17 16:26:29+00:00,"b""RT @RottenTomatoes: Early reviews from #SXSW are in for #TheLostCity - currently it's #Fresh at 100% on the #Tomatometer, with 10 reviews:\xe2\x80\xa6"""
1503879532096466951,2022-03-15 23:43:15+00:00,b'Dash\xe2\x80\x99s hair is one of the best co-stars I\xe2\x80\x99ve ever worked with. Coming in a close second to Ms. Sandra Bullock. #TheLostCity\xc2\xa0\xf0\x9f\x8e\x9f\xc2\xa0now: https://t.co/gVd0QJNlMS https://t.co/VvB8rYgvhP'
1503160049887334400,2022-03-14 00:04:17+00:00,b'Ayee! It\xe2\x80\x99s crazy to me I\xe2\x80\x99m even in a movie with \xe2\x80\x9cThe Sandra Bullock\xe2\x80\x9d icon https://t.co/BExavxrKtm'
1502396049541025796,2022-03-11 21:28:26+00:00,b'Hahahaha this is so what the movie is. https://t.co/uf6retMhbs'
1500878973349335046,2022-03-07 17:00:06+00:00,b'Sometimes all it takes to survive is acting like you know what you\xe2\x80\x99re doing. \xe2\x9d\xa4\xef\xb8\x8f this tweet to go behind the scenes with the cast of @LostCityMovie before it hits theatres on March 25. https://t.co/NpbIg1kmWw'
1498462241766752258,2022-03-01 00:56:53+00:00,b'I mean the hottest people on the planet \xf0\x9f\x98\x82 https://t.co/XtDFDNSFPC'
1494774010760019968,2022-02-18 20:41:10+00:00,b'RT @DogTheFilm: Check out @ChanningTatum and Reid Carolin speak on their process for #DogMovie on @Nightline. https://t.co/1WUUjIVUw6'
1494109023381110786,2022-02-17 00:38:45+00:00,b'RT @ShaniaTwain: I love dogs. I love Channing Tatum. I can\xe2\x80\x99t wait to see this one and decide which I love more \xf0\x9f\x98\x8d Congrats on your directori\xe2\x80\xa6'
1492674269528084480,2022-02-13 01:37:33+00:00,"b'.@inezandvinoodh I\xe2\x80\x99m beyond words with how much I love this shoot. \n\n@inezandvinoodh and George Cortina are artists of the highest order, and I want to do every single thing possible with them. \xf0\x9f\x99\x8f\xf0\x9f\x8f\xbb @vman @jamie_grooming @thekevinponce @daniacurvy Czar Van Gaal &amp; Greg Krelenstein https://t.co/RpRL84THhD'"
1491490007558856720,2022-02-09 19:11:43+00:00,b'You\xe2\x80\x99re still the one. https://t.co/IHWQFWKMlK'
1491250989470732289,2022-02-09 03:21:56+00:00,b'RT @JimmyKimmelLive: Just sitting here watching this while we wait for @ChanningTatum to arrive\xe2\x80\xa6 \xf0\x9f\x95\xba\xf0\x9f\xa4\xa9 https://t.co/a3KtaiVGPd'
1491140385468747776,2022-02-08 20:02:26+00:00,"b'RT @the_USO: Join the USO and actor/co-director @channingtatum, co-director/writer Reid Carolin &amp; writer/producer Brett Rodriguez for a liv\xe2\x80\xa6'"
1490855939338952707,2022-02-08 01:12:09+00:00,"b'More importantly, @DraftKings is making a $10K matching donation to Tech for Heroes, a program that provides veterans and military spouses free tech skills and training in cybersecurity and web development.'"
1490855936361127937,2022-02-08 01:12:08+00:00,"b""I got word that my @DogTheFilm co-star Lulu needed a workout, so I thought I'd help her out. We played a little game of chase and you get to predict the outcome for a shot at a share of $10K. \n\n#DraftKings eligibility restrictions apply. See https://t.co/ItxbWcNmBd for details. https://t.co/clLV8FhedM"""
1489001405704818692,2022-02-02 22:22:54+00:00,"b'Also got to reminisce about the past few years, my 18-year-old self, and my last road trip with one of my favorite souls in the world. Thanks to @Variety and absolutely everyone for making me feel so very goodie good! https://t.co/EqHp0fjCmy'"
1489001402991099904,2022-02-02 22:22:53+00:00,b'It\xe2\x80\x99s been a minute since I\xe2\x80\x99ve done one of these. Got to shoot with my good friend @brianbowensmith again and @Variety\xe2\x80\x99s  @RaminSetoodeh who interviewed us was so sweet\xe2\x80\xa6 https://t.co/rGlYIEuJgF'
1485046347212505092,2022-01-23 00:26:54+00:00,b'RT @DogTheFilm: Obedience is overrated. Happy #NationalTrainYourDogMonth. Catch #DogMovie only in movie theaters February 18. https://t.co/\xe2\x80\xa6'
1478039636748480515,2022-01-03 16:24:44+00:00,b'Newness \xe2\x99\xa5\xef\xb8\x8f\xe2\x99\xa5\xef\xb8\x8f\xe2\x99\xa5\xef\xb8\x8f\xe2\x99\xa5\xef\xb8\x8f\xe2\x99\xa5\xef\xb8\x8f https://t.co/JNnYPGDLjj'
1474142296954355714,2021-12-23 22:18:06+00:00,b'WHAT\xe2\x80\x99S IN THE BOX???!!\n\n@DogTheFilm https://t.co/aWAipkuyft'
1471480232871972869,2021-12-16 14:00:00+00:00,"b'Those leeches on my butt? They\xe2\x80\x99re real. Others might\xe2\x80\x99ve used fake leeches, but I will always commit to the role. #TheLostCity https://t.co/rOHGTgulBe'"
1471392933635104768,2021-12-16 08:13:07+00:00,"b'#FindingMagicMike is truly a love letter our @magicmikelive show. We hope you check out @MagicMikeonMax, and I want to send a huge thanks to everyone in the #MagicMike universe who worked like crazy to make it all happen!'"
1471392930405527552,2021-12-16 08:13:06+00:00,"b'Look at this motley crew! Some have been with us since @magicmikemovie, some have stayed with us through @magicmikelive, and all of them have now helped us to capture the magic again in our new series @MagicMikeonMax. #FindingMagicMike https://t.co/DGNsbGIjrw'"
1465365017935724553,2021-11-29 17:00:20+00:00,"b'Well world, looks like Mike Lane\xe2\x80\x99s tapping back in. @hbomax https://t.co/V9Ce62n710'"
1462956229098151938,2021-11-23 01:28:40+00:00,b'Ol\xe2\x80\x99charlie boy https://t.co/iEqg5l2E57'
1460971233961410569,2021-11-17 14:01:00+00:00,"b'This process of making @DogTheFilm has been one of the craziest journeys of my life! Also, if you would enjoy watching me get bit by a dog, this will be a very fulfilling and funny movie for you. https://t.co/bCEQY1qqbL'"
1448107241324924936,2021-10-13 02:04:05+00:00,b'W.I.P. https://t.co/TWTRQmDqf7'
1441095553454993420,2021-09-23 17:42:08+00:00,"b""RT @SparkellaTJones: We're back with glitter-tastic new lessons on self-esteem, patience, and ways to get things done when original plans f\xe2\x80\xa6"""
1441094912988966916,2021-09-23 17:39:36+00:00,"b'I can\xe2\x80\x99t really use the quarantine as an excuse this time. I guess, the little girl in me just really likes writing @SparkellaTJones books for my inspiration Evie. I hope you all like this next one too. #SparkellaMakesAPlan https://t.co/hpuM1wj2BU https://t.co/sqBlre6aPy'"
1440319109481132044,2021-09-21 14:16:50+00:00,b'Little Harvest moon witch sighting. \xf0\x9f\xa7\x99\xf0\x9f\x8f\xbd\xe2\x80\x8d\xe2\x99\x80\xef\xb8\x8f https://t.co/Cc3mtnClZg'
1438216796511903753,2021-09-15 19:02:59+00:00,b'Cut boxy like Gianni wore in the 90\xe2\x80\x99s was beyond my wildest dreams. Donatella thank you so much for having and inviting and letting me wear such elegant and magical clothes. it was dream like. You are a legend! and a myth. @Versace https://t.co/ZKif5E5KxP'
1438216790375555081,2021-09-15 19:02:58+00:00,b'So 20 years ago (holy fuk) i was a kid standing in a room of what would be probably 1000\xe2\x80\x99s of guys trying to get picked for the shows in Milan. I never got to walk for @Versace But last night to get to wear this\xe2\x80\xa6\xe2\x80\xa6. other worldly robe\xe2\x80\xa6and to wear the most classic Versace tux\xe2\x80\xa6 https://t.co/eyUwMLYiV6'
1434655017974255620,2021-09-05 23:09:45+00:00,b'Photo credit: Everly Tatum https://t.co/mFOCF7dUAf'
1433917008228270081,2021-09-03 22:17:10+00:00,b'Pro tip: bmx bikes fit into elevators really easy in NY.  Also her name is Khaki. She\xe2\x80\x99s a rider. \xf0\x9f\x9a\xb2 \xf0\x9f\x98\x89 https://t.co/BgtKY1Mj1g'
1431801107697881088,2021-08-29 02:09:20+00:00,b'Life is a blur. https://t.co/LWecA0Pk0F'
1431318802491379715,2021-08-27 18:12:49+00:00,b'\xf0\x9f\x92\x9c\xf0\x9f\x92\x9c\xf0\x9f\x92\x9c\xf0\x9f\x92\x9c\xf0\x9f\x92\x9c https://t.co/V4klb2uL8A'
1427281454833283079,2021-08-16 14:49:51+00:00,b'That\xe2\x80\x99s a wrap on #LostCityOfD. I love this movie so much I don\xe2\x80\x99t have words. I also don\xe2\x80\x99t have words for how special Sandy Bullock is. We definitely were made in the same lab &amp; share a brain at times. I \xe2\x9d\xa4\xef\xb8\x8f U girl. As U can see I\xe2\x80\x99ll ride your coattails anywhere anytime forever. \xf0\x9f\xa4\xa3 https://t.co/yAXAf5D4x6'
1426193930954199040,2021-08-13 14:48:25+00:00,b'I\xe2\x80\x99m so happy and easy right now. Breathing and gonna indulge in this life I\xe2\x80\x99ve been blessed with. Be easy.'
1426193928643125250,2021-08-13 14:48:24+00:00,b'And just like that... our 1st Charlie yells \xe2\x80\x9cand that\xe2\x80\x99s a wrap\xe2\x80\x9d... and i feel myself coming back and the hair starts coming off. And now time... time for all the things. Mine time. Getting back to me before the next creative adventure into someone and somewhere else . https://t.co/Qxe3h0D6R8'
1425508058663464967,2021-08-11 17:23:00+00:00,"b'Peace and rest... soon.  Then... adventure, exploring, laughing, and dancing. https://t.co/UvTf7Qy41M'"
1424830700046495745,2021-08-09 20:31:25+00:00,b'Bored on set. And found this pic. Third most scared I\xe2\x80\x99ve ever been. Maybe forth. \xf0\x9f\x98\x81 https://t.co/CGOSGk1cZU'
1424399800095629318,2021-08-08 15:59:11+00:00,b'Hindsight is 2020 but this moment crystal. \xe2\x99\xa5\xef\xb8\x8f\xf0\x9f\x92\x8e https://t.co/zSa8mqjusE'
1424398521613131780,2021-08-08 15:54:06+00:00,b'Sometimes the road to nowhere is the somewhere i always find myself. https://t.co/vFolkbrwPc'
1415726326196097024,2021-07-15 17:33:53+00:00,b'And what\xe2\x80\x99s mine is mine... and I\xe2\x80\x99m gonna have all of it. And my soul is gonna enjoy every drop. \xf0\x9f\x92\xa7\xf0\x9f\x91\x85 https://t.co/jJ7d1xOT8J'
1408217094337015808,2021-06-25 00:14:53+00:00,b'\xe2\x80\xa6calling out to the mermaids. you said you touched a bald headed mermaid and saw a tail. Haha one day you will read this and i hope laugh. We have fun \xf0\x9f\xa4\xa9 hehehe'
1408217092676067331,2021-06-25 00:14:52+00:00,b'You my littles are everything! You are my world and my heart. You were looking at the full moon in this pic and telling me the prophecy of the full moon mermaid and  then we ran into the water and looked for her and played with glow sticks in the night water\xe2\x80\xa6 https://t.co/ZWI5yTwC14'
1406012525402013697,2021-06-18 22:14:43+00:00,b'What is... I needed to see this today. I love spirals. They means a lot to me. They mean a lot in general. But to me they mean the going in to me deepest self. They remind me that nothing is permanent... nothing. https://t.co/G4C1JHdtT6 https://t.co/8rgydD4MbC'
1405583575529967617,2021-06-17 17:50:13+00:00,b'They have incredible bbq on set. #lostcityofd https://t.co/g25g2obZNB'
1404537255641899008,2021-06-14 20:32:31+00:00,b'This is how #FathersDay prep looks in the Tatum household. It\xe2\x80\x99s hard for my real life #Sparkella to decide which jacket she wants to wear with me. https://t.co/B2NJGxkNhx'
1400505991712677889,2021-06-03 17:33:43+00:00,"b'I promise, this is totally legit and (mostly) historically accurate. #AmericaTheMotionPicture #June30 @Netflix @NetflixFilm https://t.co/FqJ83cA7de'"
1397927694478630925,2021-05-27 14:48:29+00:00,b'This is no fun...no fun at all! #LostCityOfD https://t.co/hIA9ZXZ9ep'
1396607816727764996,2021-05-23 23:23:45+00:00,b'I do it for movies Hahahaha very different motivation. Either way get after it everyone. It\xe2\x80\x99s good to be alive. There are so many people that can\xe2\x80\x99t say that. I\xe2\x80\x99m so blessed. P.s as you can see I\xe2\x80\x99m coming in by myself @ArinBabaian didn\xe2\x80\x99t make it. 2mile ocean swim bruh'
1396607815255531521,2021-05-23 23:23:45+00:00,b'There are moments in both that i am always like i think I might die haha. Yup pretty sure i can\xe2\x80\x99t go on let go would be better than this. Haha \xf0\x9f\x98\x82 and I\xe2\x80\x99m not even i professional athlete. I can\xe2\x80\x99t imagine the depths in which they push themselves. Unreal...'
1396607813158309889,2021-05-23 23:23:45+00:00,b'I have done all kinds of bullshit to get in or stay in shape. Almost everything you can think of. And i have to say nothing yet has been more suffocating and exhausting and effective than freestyle wrestling or open ocean water swimming... https://t.co/RcYI8mmDgT'
1396293895571525639,2021-05-23 02:36:21+00:00,"b'So cool to see the special edition of @SparkellaTJones on the shelves, and in good company \xe2\x80\x94 hey @JimmyFallon! @target https://t.co/suTvzBgAWN'"
1394693920408358914,2021-05-18 16:38:37+00:00,b'Am I method acting right? \xf0\x9f\x98\x9c Actual footage of me getting into character for this audio book reading \xf0\x9f\x91\xa6\xf0\x9f\x8f\xbb #bucketlist @SparkellaTJones @MacKidsBooks https://t.co/pYiUZyH95i'
1392640428701372417,2021-05-13 00:38:46+00:00,b'Say what?!?! #1 on the @NYTimes Bestseller List!! I\xe2\x80\x99m literally speechless right now!!! Ten year old me would never believe this. Evie and I want to thank each and every one of you for all of the #Sparkella love. I couldn\xe2\x80\x99t be more excited right now! THANK YOU!! @SparkellaTJones https://t.co/wK0FDjDlvQ'
1390837023146131457,2021-05-08 01:12:41+00:00,b'Head to my IG story to vote on who wore it better\xe2\x80\xa6 https://t.co/k1VjmsZtnM'
1390837020688277504,2021-05-08 01:12:40+00:00,"b'Magical makeover, from the talented (&amp; blindfolded) Evie. \xf0\x9f\x98\x82 Calling this the #IAmSparkella Challenge. We want to see how you &amp; your kid(s) do! Upload your videos to Instagram using the hashtag! \xf0\x9f\xa6\x84 @SparkellaTJones @arinbabaian https://t.co/iZBFv3V5Fi'"
1390123723500494849,2021-05-06 01:58:17+00:00,b'Did a bit a drawing yesterday. I love egon so i practiced a little with a couple of his drawings.  Create something today. Love. https://t.co/ay7x6tXNDn'
1389717955412377601,2021-05-04 23:05:54+00:00,b'And we\xe2\x80\x99re LIVE with @SparkellaTJones!! https://t.co/K0Azc0Y4ox'
1389612152240095237,2021-05-04 16:05:29+00:00,"b'RT @channingtatum: Today is for you, Evie... the one and only #Sparkella!! Your magic taught me how to SPARKLE. https://t.co/pZtzKBHYBu'"
1389611881493565444,2021-05-04 16:04:24+00:00,"b'RT @SparkellaTJones: I\xe2\x80\x99m headed to a new school, so it\xe2\x80\x99s my time to SHINE! We finally get to share THE ONE AND ONLY #SPARKELLA with all of\xe2\x80\xa6'"
1389611606200496136,2021-05-04 16:03:19+00:00,"b'Today is for you, Evie... the one and only #Sparkella!! Your magic taught me how to SPARKLE. https://t.co/pZtzKBHYBu'"
1389379856278949891,2021-05-04 00:42:25+00:00,"b'I signed a bunch of bookplates for tomorrow\xe2\x80\x99s @SparkellaTJones launch! If you want to get a signed copy, you can click on the link to order from a participating bookstore. Quantities are limited, so make sure you confirm with the stores about availability. https://t.co/QbxlZU2CXl https://t.co/zWso4StVbJ'"
1389008572827283459,2021-05-03 00:07:04+00:00,"b'RT @SparkellaTJones: #Sparkella and all of her friends are SO excited for next week\xe2\x80\x99s launch! \xe2\x9c\xa8\xe2\x9c\xa8Sparkle \xe2\x9c\xa8\xe2\x9c\xa8 with @ChanningTatum, @evachen212\xe2\x80\xa6'"
1384640419028299778,2021-04-20 22:49:35+00:00,"b'Mixing down our movie DOG today. \xf0\x9f\x99\x8f\xf0\x9f\x8f\xbc. My partner Reid Carolin and Leslie Jones, Newton Thomas Sigel and Tom Newman and so many more have worked their asses off and spun magic for this film. I love this movie. @DogTheFilm #dog https://t.co/VR3QFGlXoZ'"
1382405204956438528,2021-04-14 18:47:39+00:00,b'This little story i wrote has really turned out to be something so special to me. So many people helped this come to life and i couldn\xe2\x80\x99t be happier with how it\xe2\x80\x99s come together. We have so much in store for the @SparkellaTJones world. Get your pre-order now https://t.co/m4babsSkca https://t.co/7FMIlJpNTp'
1381227623066562560,2021-04-11 12:48:21+00:00,"b'I have always dreamed of having my own vintage shop or thrift. And now i have one for myself. Thank you, you two. \xf0\x9f\x99\x8f\xf0\x9f\x8f\xbc\xf0\x9f\x99\x8f\xf0\x9f\x8f\xbc\xf0\x9f\x99\x8f\xf0\x9f\x8f\xbc https://t.co/mEtsXq89iW'"
1381224094834831370,2021-04-11 12:34:20+00:00,b'Little grind session! Let\xe2\x80\x99s gooooo 2021! Feeelin goodie good!! https://t.co/Lu9T8CHWj6'
1380549813654147078,2021-04-09 15:54:59+00:00,"b'So excited to announce @BNBuzz\xc2\xa0is hosting my #SPARKELLA launch event on 5/4 at 7pm ET, streaming live to my Facebook! You can get your copy + an exclusive gift here:\xc2\xa0https://t.co/1BwmzVGKbY https://t.co/oS0sHp04kO'"
1376687280115552258,2021-03-30 00:06:39+00:00,"b'My life is so blessed and full and i could not be more grateful. I\xe2\x80\x99m finding so much peace in the small moments and so much wonder, joy, and beauty in the exact same instant. It all becomes one.  @leicammonochrom https://t.co/tSjZqtT7do'"
1376681128187330567,2021-03-29 23:42:13+00:00,b'Getting reacquainted and easing back into riding for an upcoming movie lost city of D. I haven\xe2\x80\x99t ridden in a long time. https://t.co/ChPJPF2aER'
1359209145820405761,2021-02-09 18:34:47+00:00,b'Getting back up to speed after not riding for over a year. Still need to get my knee back over the paint. But damn did i have fun. My yellow dragon was my 1st bike and i love her so. Haha R1 anniversary edition. \xf0\x9f\x96\xa4\xf0\x9f\x92\x9b\xf0\x9f\x96\xa4\xf0\x9f\x92\x9b https://t.co/RRQY6eEP1E'
1357037163456716800,2021-02-03 18:44:06+00:00,b'You will forever live in my mind as the picture of freedom. your spirit is still here lifting and driving for liberation. And i bow and honor you. Also i think the sculptor of this power monument is Mario Chiodo. I could be wrong. But it\xe2\x80\x99s where i found the picture.'
1357037161607012354,2021-02-03 18:44:06+00:00,b'Every single day of the year for all time... there is no way to deny the badass that this legendary woman was. I remember the first time i heard Harriet Tubman\xe2\x80\x99s story. It seemed biblical to me. Superhero is not noble enough of a word... https://t.co/i3WAkR1y4i'
1334003923468816389,2020-12-02 05:18:14+00:00,b'I very rarely share my art. For a lot of reasons i guess. But i came across this image of a series of wet plate images i did. I wanted to share it cause it just seemed tender and caring. I don\xe2\x80\x99t know who needs some of that right now. But... https://t.co/YFXCsEmX6L https://t.co/9Vdo6IkFMI'
1332895849731461121,2020-11-29 03:55:09+00:00,b'Now we just got to get the little monster Rook trained up. Haha \xf0\x9f\xa4\xa6\xf0\x9f\x8f\xbb\xe2\x80\x8d\xe2\x99\x82\xef\xb8\x8f. But Cutie is home and we are in love.'
1332895848708136961,2020-11-29 03:55:08+00:00,b'I will finally feel at ease when my daughter is home and I\xe2\x80\x99m not able to be there. This dog will protect her with her life. I am grateful. Thank you @goldcoastk9 rodney. You really found me a the sweetest tiny flyer cuddle bug that is perfect for our home.'
1332895847764340739,2020-11-29 03:55:08+00:00,b'Haha let\xe2\x80\x99s just say I\xe2\x80\x99m so happy i didn\xe2\x80\x99t run into a yard with this dog on the other side. Eeesh. This is Cutie. She is the sweetest dog I\xe2\x80\x99ve ever owned. But so well trained it\xe2\x80\x99s kinda unbelievable. Also she on the low lethal...'
1332895845704994816,2020-11-29 03:55:08+00:00,"b'I remember as kids we\xe2\x80\x99d accidentally throw the football into neighboring yards with 4-6 foot fences. We have to trick the dogs to 1 side of the yard and then one of us that was kinda fast and kinda dumb. Would jump over, run and get the ball and make it back before getting eaten. https://t.co/sdnIK4hkXX'"
1331083209610829829,2020-11-24 03:52:22+00:00,b'Hahahaha I have so much love in my heart for everyone that was on this journey with me and @DogTheFilm and so much love for the people out there in the world that need love right now. Sending it up for all.....right..... now. #freeandjoyful'
1331083207555637248,2020-11-24 03:52:21+00:00,b'There is nothing and I mean nothing as good as finishing the hardest job of my life. And then shaving my head and letting the character go. It\xe2\x80\x99s a bit of a ritual. A freeing of myself. And being free is always my highest intention. And I\xe2\x80\x99m about to be sooooo freee!!! https://t.co/ybHTHmW3Tx'
1312966483899813890,2020-10-05 04:02:58+00:00,b'This is the newest member of the Tatum tribe. Meet \xe2\x80\x9cRook\xe2\x80\x9d or \xe2\x80\x9cRooklin\xe2\x80\x9d 12 week old Dutch Shepard! He\xe2\x80\x99s gonna be a goon. After i lost my LuLu i didn\xe2\x80\x99t know when or if I\xe2\x80\x99d be open to having another dog... https://t.co/28yNj3pqPC https://t.co/DjyjAJtkcc'
1310585199676272641,2020-09-28 14:20:35+00:00,b'My best homie-My daughter-My life! You are the coolest person on the planet. https://t.co/L8AacM7zuH'
1309337219774271488,2020-09-25 03:41:34+00:00,"b'Been a long road back. Injuries, life shit &amp; insanity in general. Ha daddy\xe2\x80\x99s finally back boooi! Gonna be a fun next 10 year run. To all that have been there for me &amp; held me down. Love you. Gonna make ya proud. Let\xe2\x80\x99s goo. &amp; peep the purell. Keep it clean out there folks. Hahaha https://t.co/5DGoYPPnNN'"
1308122258481836032,2020-09-21 19:13:44+00:00,b'This is from our 1st day of production on the 1st movie my partner Reid &amp; I are directing. This is our story. It\xe2\x80\x99s taken us 2yrs to get it to the starting line. The next 8 weeks will be like riding a bull on sickmode in ludicrous speed. God be with us. In Dog we trust. #DogMovie https://t.co/ABrZSji2DE'
1308122251657703426,2020-09-21 19:13:43+00:00,"b'It\xe2\x80\x99s already been a crazy ride. And we\xe2\x80\x99ve only just begun. And if we survive the rest, it will be one of the most insane stories that I\xe2\x80\x99ve ever been a part of. And I\xe2\x80\x99ve been a part of some pretty crazy ones in this life of mine... #DogMovie @DogTheFilm https://t.co/xnvdYOe3ar'"
1300494588621266946,2020-08-31 18:04:06+00:00,"b'I don\xe2\x80\x99t know about you but things got a little weird for me in quarantine. I locked myself in my daughter\xe2\x80\x99s room &amp; found my inner child. So this is what I created for my little girl. From what is, I guess, the little girl in me. Thx for reading. #Sparkella\xc2\xa0https://t.co/QbxlZU2CXl https://t.co/W0PUb822Q3'"
1274058492505194496,2020-06-19 19:16:30+00:00,"b'RT @Pharrell: .@GovernorKayIvey, please join Virginia and New York and make Juneteenth a paid holiday in Alabama for state employees. Thank\xe2\x80\xa6'"
1267746723310505984,2020-06-02 09:15:47+00:00,b'#blacklivesmatter https://t.co/ZhNtZg5D5p'
1267170805089263617,2020-05-31 19:07:17+00:00,b'https://t.co/RjXeQeHcxu'
