twitter_id,date,tweet
1265805348230717440,2020-05-28 00:41:27+00:00,b'New Mexico\xe2\x80\x99s 3rd congressional district has never been represented by a woman. @TeresaForNM can change that \xe2\x80\x94 she\xe2\x80\x99s on the ballot on June 2nd! \nhttps://t.co/j3CJIG9Wnk'
1265765196494073856,2020-05-27 22:01:54+00:00,"b'If you look away while Andrew Cuomo is talking, you can hear Christopher Walken.'"
1265724970111340545,2020-05-27 19:22:03+00:00,"b'Armed protesters were allowed to storm a govt building to protest stay at home orders without incident, but people protesting the murder of #GeorgeFloyd were tear gassed and pelted with rubber bullets. This is America right now. I won\xe2\x80\x99t accept that. Will you? #BlackLivesMatter https://t.co/dkqoS2aJPs'"
1265373569971662848,2020-05-26 20:05:43+00:00,b'His name was #GeorgeFloyd. This is murder. This is not ok and we must demand justice. #BlackLivesMatter'
1265303407641821190,2020-05-26 15:26:55+00:00,b'Pennsylvania! https://t.co/TALV3jhLbN'
1264686009842728960,2020-05-24 22:33:36+00:00,"b'If people want to do this, they need to do it at Mar-a-Lago. https://t.co/LCHxekf1a8'"
1263945219214422016,2020-05-22 21:29:57+00:00,"b'Looking into eclipses, drinking Clorox, taking hydroxychloroquine\xe2\x80\x94 it bears repeating, do the opposite of whatever Trump is doing. https://t.co/qOnYnOIFF3'"
1263915337180823552,2020-05-22 19:31:13+00:00,b'This is our candidate in Kentucky to get rid of Mitch McConnell. Here are ways to get involved with her campaign. https://t.co/rDurX7MZbH'
1263914923773407232,2020-05-22 19:29:34+00:00,"b'@NYGovCuomo That\xe2\x80\x99s right, baby!'"
1263540268726251520,2020-05-21 18:40:50+00:00,"b'Hold on to your banana bread, I have a real announcement. I will be returning to stand-up with a special on @hbomax! I didn\xe2\x80\x99t want to return to stand-up until I had something important to say. I do now. https://t.co/mYXxwaF6TY'"
1263153589976997889,2020-05-20 17:04:18+00:00,"b'When @VoteJackie4NY wins in November, Congress will have another historic first \xe2\x80\x94 its first Black woman veteran. Join me and @emilyslist to make sure that this incredible leader can cross the finish line. https://t.co/G6cm1sNKEs'"
1263102188139581444,2020-05-20 13:40:03+00:00,b'Let\xe2\x80\x99s get our voting act together. https://t.co/tbid5Q9xtl'
1262848231630757889,2020-05-19 20:50:55+00:00,"b'Been considering doing some gardening\xe2\x80\x94 if you could pick one thing for me to plant, what would it be and why did you choose cannabis?'"
1262747659770556420,2020-05-19 14:11:17+00:00,b'Trump taking hydroxychloroquine when he doesn\xe2\x80\x99t have covid is so stupid. A better idea would be for him to swallow a bottle of the Clorox he recommended. Can we do that???'
1262743006995603457,2020-05-19 13:52:48+00:00,b'RT @PiperPerabo: Right now our senators are debating whether to fund vote-by-mail in the next COVID-19 response package. \n\nNow is the momen\xe2\x80\xa6'
1262740937005912064,2020-05-19 13:44:34+00:00,"b'RT @funder: At least 90,000 Americans have died of coronavirus and we have over 1.5 million known cases. Trump is the biggest fraud and fai\xe2\x80\xa6'"
1262458228304011264,2020-05-18 19:01:11+00:00,"b'LAPD already eats up 53% of LA\xe2\x80\x99s gen fund. @MayorOfLA wants to increase police overtime funds 47%! That\xe2\x80\x99s $200 million, at a time when crime is down 30% &amp; we need funds for services in the midst of #coronavirus crisis. @CD6Nury &amp; City Council we need a #PeoplesBudgetLA! @BLMLA'"
1262038029331345410,2020-05-17 15:11:28+00:00,b'So they found something even more unsanitary\xe2\x80\xa6 https://t.co/oBWsEeLbYf'
1261325842505818113,2020-05-15 16:01:29+00:00,b'Vote vote vote! https://t.co/ZK2dxTKGyC'
1261113501017227264,2020-05-15 01:57:43+00:00,"b'RT @SEIU: Tell Congress to #ProtectAllWorkers, not just give blank checks to CEOs: https://t.co/mfoczwirds\n\nTHANK YOU @wkamaubell, @Alyssa_\xe2\x80\xa6'"
1260637715302772736,2020-05-13 18:27:07+00:00,"b'Even during a pandemic, elections are still happening \xe2\x80\x94 and women need support during their campaigns. I\xe2\x80\x99m so excited to see my friends at @emilyslist providing such incredible resources for candidates running for office across the country. Check it out\nhttps://t.co/uZVjAL9ntW'"
1260334613278253056,2020-05-12 22:22:42+00:00,"b'490 women are running for congressional seats this year. A recccors high! I love women, and I love record highs. https://t.co/uKpFzvCVre'"
1260314056952446976,2020-05-12 21:01:01+00:00,"b""RT @TheCivicsDean: Special Election in California 25th TODAY to fill Katie Hill's seat. Republican Mike Garcia is poised to flip the distri\xe2\x80\xa6"""
1260302870211031040,2020-05-12 20:16:34+00:00,"b'Thank you to all responders who have been risking their lives. 100% of the net proceeds of this Super Nurse tee will provide meals to medical professionals, first responders and those in need through @WCKitchen. Join me and support https://t.co/GQN6AiTdq1 #InternationalNursesDay https://t.co/panprlEiGk'"
1259973595784077313,2020-05-11 22:28:09+00:00,b'I\xe2\x80\x99ve teamed up with @PeacockTV for a great cause. More info coming soon! #PeacockVarietyShow https://t.co/shBwLDTgxr'
1259938853223149568,2020-05-11 20:10:05+00:00,b'The #ClassOf2020 may not get to march for graduation this spring. But we can help them march to the polls in November. @HeadCountOrg is helping schools run virtual voter registration drives for their students. Visit https://t.co/nQyI4yCug0  for more info #Vote2020'
1259835013538869249,2020-05-11 13:17:28+00:00,b'RT @HeartLADems: Join #TeamChristy for the final push to GOTV for @ChristyforCA25 for the May 12th CA25 Special Election! 48 hours to go -\xe2\x80\xa6'
1259513039268659208,2020-05-10 15:58:03+00:00,"b'To all fathers on Mother\xe2\x80\x99s Day. Please cook something, clean something, and go to bed tonight without trying to get sex from your wife. It\xe2\x80\x99s Mother\xe2\x80\x99s Day, and we\xe2\x80\x99re in a  pandemic. No one\xe2\x80\x99s horny.'"
1259264028318171137,2020-05-09 23:28:35+00:00,b'This is not what the CDC is talking about when they say wear a mask.  https://t.co/yrinn73C1H'
1258883563161698304,2020-05-08 22:16:45+00:00,b'Stephen Miller has a wife?'
1258773890446159878,2020-05-08 15:00:57+00:00,"b'The more racist the right becomes, the more radical we become. The more intolerant the right becomes, the more intolerant we become of you. The more you claim religion, the more you make a fool of religion. If you think hate wins, and murder is reasonable, vote Republican.'"
1258756439624970240,2020-05-08 13:51:36+00:00,"b'California, we have an election coming up in may 12th. @ChristyforCA25 is our girl! https://t.co/6VxGX9Z4nO'"
1258519291269283842,2020-05-07 22:09:15+00:00,b'Just because you are home doesn\xe2\x80\x99t mean you need to grow a beard. You can still shave.'
1258480315145707521,2020-05-07 19:34:23+00:00,"b'1/3 women will experience gender-based violence. #COVID19\xe2\x80\x8b is exacerbating this. I stand #TogetherForHer\xe2\x80\x8b with \xe2\x80\x8b@CharlizeAfrica\xe2\x80\x8b, \xe2\x80\x8b@CTAOP\xe2\x80\x8b, @CARE\xe2\x80\x8b &amp; \xe2\x80\x8b@EIFoundation\xe2\x80\x8b in spotlighting &amp; funding interventions to keep women &amp; girls safe from abuse. Join us: https://t.co/1XPoIOzka3 https://t.co/99YclTkSfz'"
1258386536569028608,2020-05-07 13:21:44+00:00,b'How can anyone in power sit around while this happens and claim the United States is the greatest country in the world? This is despicable. This country has been and continues to be deeply fraught with injustice for anyone who isn\xe2\x80\x99t white. #JusticeForAhmaudArbery https://t.co/qu4vM1CTRi'
1258195828880994305,2020-05-07 00:43:56+00:00,"b'To all our past, present, and future nurses: thank you for all you are doing. Thank you for caring for us when we are sick. Thank you for asking questions and taking time to help us. And thank you for looking at parts of our body no human should have to see. #NationalNursesDay'"
1258047033601998848,2020-05-06 14:52:40+00:00,"b'Big corps are scared about \xe2\x80\x9cfrivolous\xe2\x80\x9d lawsuits from their workers, so while people are dying and covid is on the rise in many parts of the country, McConnell is trying to protect major corporations so their employees can\xe2\x80\x99t sue them frivolously. This is the a Republican Party'"
1257823808477487104,2020-05-06 00:05:39+00:00,"b'Happy Cinco De Mayo, everyone. This holiday always makes me think of my nugget, Chuy. He didn\xe2\x80\x99t drink, but he put up with me when I did. I\xe2\x80\x99m thankful his little nugget hands always had my back. #CincoAtHome https://t.co/gQwEWokUgz'"
1257701940911149056,2020-05-05 16:01:24+00:00,b'Hey Mitch McConnell. Go duck yourself. https://t.co/0VEoZC6Lm7'
1257680145579511808,2020-05-05 14:34:47+00:00,"b'Trump is traveling to Arizona today to tour a mask facility. Why? He refuses to wear masks, and doesn\xe2\x80\x99t believe in them.'"
1257668538283683840,2020-05-05 13:48:40+00:00,b'Dress for the job you want\xe2\x80\xa6 in Trump\xe2\x80\x99s White House. https://t.co/Iicqrb7gzj'
1257509419232792577,2020-05-05 03:16:23+00:00,b'This is what real leadership looks like! https://t.co/JLps60pfxi'
1257439962359894022,2020-05-04 22:40:23+00:00,"b""And it's all done through volunteers in close to 110 communities around the world. Find out more in the link #pandemicoflove #makeamericakindagain\xc2\xa0@ShellyTygielski https://t.co/7QRAO1ihjf"""
1257439959671242761,2020-05-04 22:40:23+00:00,"b""This is an incredible organization my friend Shelly started called the Pandemic of Love. So far she's matched over 51,934 families in need with people who want to help and have 'adopted them.' She's raised over $7.01 M so far. https://t.co/0Pgya44xyU"""
1257394101487624195,2020-05-04 19:38:09+00:00,b'In the fog of conflicting information the reality is that we are numbing people to basically accept that 3000 people will die every day from June onwards? How is this even fathomable? Republicans.  https://t.co/ZBU5jPmgX7'
1257092785523453952,2020-05-03 23:40:50+00:00,"b'Ah yes, the day white people fought for their right to get people sick so they could get a haircut. https://t.co/sQdZPkLdUT'"
1256999458522292224,2020-05-03 17:29:59+00:00,"b'So, a city in Oklahoma had to walk back their mandatory mask wearing ordinance because people wearing masks were being harassed and threatened physically. So,  the Republican party supports people that physically threaten another person\xe2\x80\x99s safety\xe2\x80\x94for trying to protect others.'"
1256719883749830656,2020-05-02 22:59:03+00:00,b'It\xe2\x80\x99s great to see nature healing\xe2\x80\xa6 And the drugs in Florida returning to their original habitat. https://t.co/6pS6zTmXbs'
1256372329552044032,2020-05-01 23:58:00+00:00,"b'Congrats on your first lie, girl! It gets easier. https://t.co/4sNrQSx85T'"
1256302581845917696,2020-05-01 19:20:51+00:00,"b'All proceeds go toward @Americares lifesaving work in the US and around the world, already delivering over 34 tons of supplies to 40 states. Let\xe2\x80\x99s help them do even more.\nTune-in tonight at 8 pm EDT. Visit https://t.co/2Pp0HzMSSw for details. See you there!'"
1256302578389803008,2020-05-01 19:20:50+00:00,"b'Health workers are heroes working on the front lines to save lives. They deserve our support and protection, including masks, gowns and gloves. That\xe2\x80\x99s why I\xe2\x80\x99m supporting COVID #ItsNoJoke: a night of levity, laughter and community to raise funds to support frontline health workers https://t.co/DYZFn3ufWw'"
1256223006344589315,2020-05-01 14:04:38+00:00,"b'Our Federal gov\xe2\x80\x99t. ordered 100,000 body bags this month, and our president is telling people to go back to work. If you do not have to go back to work, do not go.'"
1255941615215972352,2020-04-30 19:26:29+00:00,b'Congrats to Karen Pence on becoming the ultimate Karen. https://t.co/y1QW3IlbSA'
1255682119516385280,2020-04-30 02:15:21+00:00,"b'Now that Trump can see that strong men wear PPE, I wonder if he will let Mike Pence start to wear protection. https://t.co/FcR0FBcXtO'"
1255667417847443456,2020-04-30 01:16:56+00:00,b'The governor of Iowa should have to step down tomorrow. Ordering people to go to work when they are in danger and threatening their livelihood? This is your Republican Party hard at work to make sure everyone knows that economies are more important than lives.'
1255613219097333761,2020-04-29 21:41:34+00:00,"b'A success would be avoiding the virus altogether after being warned 12 times. A success would have been having enough PPE equipment to protect our medical and frontline workers. A success would mean not one person died, because we did everything we could. Trump did nothing. https://t.co/HDUCzjhJcd'"
1255539606348414977,2020-04-29 16:49:03+00:00,"b""Mike Pence doesn't need a mask if he's in a room with a virus, but he needs his wife is he's in a room with a woman. Watching these Republican muppets is giving me a lot of confidence in telling anyone who supports this party they are a moron. https://t.co/qVN8ibKwee"""
1255525946385457153,2020-04-29 15:54:46+00:00,b'Here\xe2\x80\x99s the person to replace this horrible representative that is telling Democratic states they don\xe2\x80\x99t deserve aid. Get to know @AmyMcGrathKY https://t.co/5cZdXi5wEW'
1255253040749326336,2020-04-28 21:50:21+00:00,"b""Waiting for Postmates to arrive with the Jack in the Box I don't need. https://t.co/Nhnn2JFh9t"""
1255166853179076608,2020-04-28 16:07:52+00:00,b'It would be great to have a leader right now. A plan for moving forward that was mindful and kept our vulnerable people safe. Any plans would be great. Any leader with any plan. Anyone?  Only 300 million people looking for someone to lead...I\xe2\x80\x99ll take almost anyone at this point.'
1254898259039973377,2020-04-27 22:20:34+00:00,b'@coconuttyc For realz'
1254879377952661504,2020-04-27 21:05:32+00:00,b'Uh.... https://t.co/piyQjeJOp4'
1254879208066572288,2020-04-27 21:04:52+00:00,b'I\xe2\x80\x99d like proof that this man has ever missed a meal. https://t.co/w1UTVbYflG'
1254773786575921155,2020-04-27 14:05:57+00:00,b'@realityofreal @AmyMcGrathKY Awesome'
1254602313060085761,2020-04-27 02:44:35+00:00,b'This is a reminder of the candidate @AmyMcGrathKY who is running against Mitch McConnell\xe2\x80\x94who thinks states should claim bankruptcy because of a pandemic. Let\xe2\x80\x99s continue replacing the worst of these men with more capable women. https://t.co/rVlOMGvRw4'
1253864966785908736,2020-04-25 01:54:38+00:00,"b'My evening cocktail. Ice, vodka, and a lot of Lysol. https://t.co/3DcEpIgTWe'"
1253691530214170624,2020-04-24 14:25:27+00:00,b'I have a fun idea: why don\xe2\x80\x99t we have Trumps personal doctor/ carny inject Trump with the coronavirus and then we can test out all his ideas on him and his family? There will be light everywhere. The best lights. Inside and out.'
1253689479174303746,2020-04-24 14:17:18+00:00,"b'RT @NYGovCuomo: Let\xe2\x80\x99s talk about fairness, Mitch.\n\nNYS puts $116 billion more into the federal pot than we take out.\n\nKentucky TAKES $148 b\xe2\x80\xa6'"
1253409227218944005,2020-04-23 19:43:41+00:00,b'Thanks @USATODAY for chatting with me about #GetLitWithChelsea and happy #WorldBookDay everybody! https://t.co/ml68VFiA5l'
1253156762699497472,2020-04-23 03:00:29+00:00,"b'Happy earth day everyone, from my globes to yours. Mother Earth told us to get inside and stop abusing our planet. We didn\xe2\x80\x99t listen, so she had to scream louder. Let\xe2\x80\x99s listen, and do better when we get back out there. I know I have to do way better than I did before. https://t.co/NC77ffo1uT'"
1253046473698103296,2020-04-22 19:42:14+00:00,b'Health care workers are fighting for us. We must fight for them. Tell Trump and Pence to get them the protective equipment they need: https://t.co/0H7ZoEAXNy\xc2\xa0\xc2\xa0#Coronavirus #GetUsPPE #COVID19 @MoveOn https://t.co/bflrTg7siv'
1253003208546373639,2020-04-22 16:50:19+00:00,"b'My home state of New Jersey has been hit hard by the pandemic. Please join me, and a few other people you may know, in a benefit for the New Jersey Pandemic Relief Fund tonight at 7pm EST. Click https://t.co/vNYL0LPUtm for more info on how to tune in. @NJ_PRF https://t.co/fkBQkjBIrB'"
1252980004645818368,2020-04-22 15:18:07+00:00,b'RT @thehill: Banks earned more than $10 billion in fees processing small business loans: report https://t.co/38XMsA5lKL https://t.co/N7mNSn\xe2\x80\xa6'
1252955893022392323,2020-04-22 13:42:18+00:00,b'Watch me on #EarthDayLive at 10:10am EST / 7:10am PST. Tune in here: https://t.co/qaFeaIlmHj #EarthDay #StrikeWithUs #ClimateStrike @FutureCoalition'
1252759253904846848,2020-04-22 00:40:55+00:00,"b'The shelter I adopted Bert and Bernice from @CARL_dogs has lost its funding and needs support funding their kennel and rescue efforts. If you are able to help, please join me in supporting them. Visit this link to donate https://t.co/vCOJpIdX69 https://t.co/Pa2DCY7U8S'"
1252732859514679296,2020-04-21 22:56:03+00:00,b'The GOP went from pro-life to sacrifice-your-life real quick. https://t.co/VBvckuaDhb'
1252662566678978560,2020-04-21 18:16:43+00:00,"b'This #EarthDay, I\xe2\x80\x99m joining people all over the U.S. and the world in calling for a society rooted in sustainability and justice. RSVP and watch me April 22-24 on #EarthDayLive: https://t.co/qaFeaIlmHj https://t.co/Ktj3vJGdnb @FutureCoalition'"
1252662247677022211,2020-04-21 18:15:27+00:00,"b'RT @FrntWellNetwork: While\xc2\xa0many people have been released from #LA jails, thousands remain in dangerous and inadequate conditions where the\xe2\x80\xa6'"
1252616326167707651,2020-04-21 15:12:59+00:00,"b'Today, I am thinking of all the families who have lost someone during this terrible time. Each family, friend, sister, brother,  mother who is broken-hearted, and haven\xe2\x80\x99t yet had proper funerals. We are thinking of you, and you are not alone.'"
1252349416226222081,2020-04-20 21:32:23+00:00,"b'Happy #420FromHome. Cannabis has taught me how to slow down and shut up. I\xe2\x80\x99ve become more patient and kind and probably a lot more bearable to be around. Happy 4/20, everyone. https://t.co/zDOmPgS3vT'"
1252250671866195969,2020-04-20 15:00:00+00:00,b'California- let\xe2\x80\x99s spread the word. https://t.co/rFKzbM0Bis'
1251935096371732480,2020-04-19 18:06:01+00:00,b'Im starting to get used to the taste of Clorox with my takeout food. It\xe2\x80\x99s turned into a nice accent.'
1251636304455983104,2020-04-18 22:18:43+00:00,b'After taking an edible and staring out my window topless for an hour. https://t.co/F7Mz8Xv33X'
1251633984401887232,2020-04-18 22:09:30+00:00,"b'RT @JoeNBC: This is the most devastating political ad I\xe2\x80\x99ve seen in years. It reveals the truth about Trump and China, and that truth is ugl\xe2\x80\xa6'"
1251551668484730880,2020-04-18 16:42:25+00:00,"b'With film &amp; TV productions currently halted or suspended, hundreds of thousands of people who work behind the camera have been hit hard. Please join me in supporting this fund benefitting crews and their families @MPTF @TheActorsFund https://t.co/WwkXONVHra https://t.co/On2TkTUsw2'"
1251273589036158978,2020-04-17 22:17:25+00:00,b'Hello? https://t.co/wzgl5wnUzX'
1251212030427594752,2020-04-17 18:12:49+00:00,"b'Love @NYGovCuomo going off on Trump this away, is just what I\xe2\x80\x99ve been waiting for, and I\xe2\x80\x99m going to go into the weekend with hope and optimism for more governors to stand up for their states this way. Thank you @GavinNewsom for what you\xe2\x80\x99ve done here in California to protect us.'"
1251201541488422919,2020-04-17 17:31:08+00:00,b'I caught up with @jimmyfallon on @FallonTonight last night about my supervised quarantine and my love for @NYGovCuomo. Check it out here https://t.co/Dbm18t2oLI'
1250969032859152387,2020-04-17 02:07:13+00:00,"b'Trump supporters: today your president eased mercury restrictions, so that the industries that benefit from fewer regulations can make more money.'"
1250948418794516483,2020-04-17 00:45:19+00:00,"b'RT @FallonTonight: Tonight on #FallonAtHome: @chelseahandler, @kellyclarkson, @DudePerfect, &amp; a performance from Michael McDonald! Plus Jim\xe2\x80\xa6'"
1250810793374830592,2020-04-16 15:38:26+00:00,b'I did my boyfriend @realjeffreyross podcast. Listen up! https://t.co/SvAB1ueevh'
1250535873541574656,2020-04-15 21:26:00+00:00,"b'Last month was the first March without a school shooting in the United States since 2002. It took all schools to be closed and everyone forced to be inside because of a pandemic, but we finally did it.'"
1250416146588659712,2020-04-15 13:30:15+00:00,"b'So, to clarify\xe2\x80\x94Donald Trump takes no responsibility for all the states in the country he was elected to represent, yet the World Health Org is to blame. So, don\xe2\x80\x99t look to your president. Blame a global organization that is crucial to preventing the spread of covid-19.'"
1250219097331126272,2020-04-15 00:27:15+00:00,"b'In Florida, Pro Wrestling Deemed Essential Business - News &amp; Guts Media https://t.co/nnx5i8Eeuf'"
1250188272686383104,2020-04-14 22:24:46+00:00,b'Trump to the World Health Organization: \xe2\x80\x9ctelling the truth would have been so easy.\xe2\x80\x9d'
1250152920588271616,2020-04-14 20:04:17+00:00,b'Surviving one virus only to be exposed to another. https://t.co/TS5KykCg9b'
1250089657917792256,2020-04-14 15:52:54+00:00,"b'Cuomo is on giving a constitutional for dummies lesson for our dotard president who thinks he has the authority to reopen the country, which he does not. As usual, trump has no idea what he is talking about, and Cuomo does. Thank god for some stability in this insanity.'"
1249841832717979648,2020-04-13 23:28:08+00:00,"b'No, booty calls are not covid approved. For this and more, listen to my talk with @natashaleggero and @moshekasher on The Endless Honeymoon podcast https://t.co/cTKOQJLCPa https://t.co/b9Hl9joA4A'"
1249794158069334016,2020-04-13 20:18:41+00:00,"b'Judging by the amount of food I\xe2\x80\x99ve eaten while alone, I think it\xe2\x80\x99s important we skip over summer entirely.'"
1249518051113840640,2020-04-13 02:01:32+00:00,"b'@Amplitude_7 We had plenty of warning about the virus. Long before our first patient. Your president knew and decided because of his experience with medicine, it wasn\xe2\x80\x99t serious. He knew before we had one case and did nothing.'"
1249517636913774592,2020-04-13 01:59:54+00:00,b'@williemgreen I love you too'
1249516837072584704,2020-04-13 01:56:43+00:00,b'On this Easter I have read and heard too many examples of anti Asian sentiment due to covid-19. What on earth is wrong with people to blame an entire race for a disease? Trump supporters: races don\xe2\x80\x99t cause disease. Your president does.'
1248965916924116992,2020-04-11 13:27:33+00:00,b'@JoyAnnReid Yes. And point to where chad is located on a map.'
1248964117215338497,2020-04-11 13:20:24+00:00,b'Last night I took a sleeping pill so I could stop eating.'
1248723818618617856,2020-04-10 21:25:33+00:00,b'Happy #NationalSiblingDay to these assholes. https://t.co/kKO05KByNf'
1248632013931700229,2020-04-10 15:20:45+00:00,b'2020 feels like that time in 2016 when we were all being terrorized by clowns but it won\xe2\x80\x99t stop.'
1248401186689966082,2020-04-10 00:03:31+00:00,"b""If I want a margarita for breakfast, I\xe2\x80\x99m going to have it. And who\xe2\x80\x99s going to stop me? Seriously, there's nobody here. https://t.co/uRRoi09mG5"""
1248356934979186688,2020-04-09 21:07:41+00:00,b'@ChrisTight Thank you for calling me by my professional name'
1248356852506562560,2020-04-09 21:07:21+00:00,b'@elle_3113_elle I\xe2\x80\x99m so sorry for your loss.'
1248354686211506176,2020-04-09 20:58:45+00:00,"b'To all the people who have lost a loved one and couldn\xe2\x80\x99t be by their side, I hope you know how many of us are feeling your hurt, your rage, and your loss. We are with you, and we know what you are going through is hell. We love you and we are here for you.'"
1248293430528053248,2020-04-09 16:55:20+00:00,"b'When we elect our next president, we can be assured that in 3 years of fires and hurricanes, he will have in fact, checked the national stockpile. Stockpiles are for refilling, just like bowls and bongs, but stockpiles save lives and any president would know that. 2020'"
1248282600667353088,2020-04-09 16:12:18+00:00,b'News organizations- why do you keep cutting Cuomo\xe2\x80\x99s updates short? It\xe2\x80\x99s the most sane we advice we get all day. Please let our real leaders talk and skip Trump\xe2\x80\x99s update every afternoon. He has proven himself untrustworthy is this crisis.'
1248036351439564807,2020-04-08 23:53:48+00:00,"b'Trump said African Americans are being hit hard by the coronavirus and he \xe2\x80\x9cwants to find the reason for it.\xe2\x80\x9d Here\xe2\x80\x99s the reason: poverty, access to healthcare, medical neglect because of bias, residential segregation. Because of racism reinforced by old white men like you.'"
1247942277260931072,2020-04-08 17:39:59+00:00,b'Enough of this pandemic-opportunitism abortion bans bullshit. Abortion is an essential service. Art from @emilyslist https://t.co/MQCXZG3Cyr'
1247646946681995264,2020-04-07 22:06:26+00:00,b'Republicans can\xe2\x80\x99t decide what they want the American people to have less\xe2\x80\x94 health care or fair elections. https://t.co/yKpGo6ArPy'
1247269066072440832,2020-04-06 21:04:53+00:00,b'RT @funder: BREAKING: Ohio lawmaker @RepGalonski says she is making a criminal referral today to the International Criminal Court for Trump\xe2\x80\xa6'
