twitter_id,date,tweet
1292134980819324930,2020-08-08 16:26:00+00:00,b'Question for the man with the medically grafted penis growing out of his arm: Are you getting more--or fewer--rides when you hitchhike?'
1291814873496682500,2020-08-07 19:14:01+00:00,b'Today Dr. Fauci announced he\xe2\x80\x99s hopeful by year\xe2\x80\x99s end we\xe2\x80\x99ll have a release date for TENET.'
1291481676678344706,2020-08-06 21:10:00+00:00,"b'People are calling for the presidential debates to be canceled, but if that happens, how will I decide who to vote for?'"
1291436880853184512,2020-08-06 18:12:00+00:00,"b'I let a jellyfish sting me today, just for the physical contact.'"
1291106401331359745,2020-08-05 20:18:48+00:00,b'I am still available if Joe Biden changes his mind and decides to go with a white woman.'
1290725975207051269,2020-08-04 19:07:07+00:00,"b'If Trump bans TikTok, what will I threaten to join when my kids don\xe2\x80\x99t do their homework?'"
1290256296600416256,2020-08-03 12:00:47+00:00,"b'I\xe2\x80\x99ve got a new side hustle, and it\xe2\x80\x99s getting the hilarious @wkamaubell to be my friend. Check out my season opener and hear why he is definitely not interested. https://t.co/pfOk23nSHZ https://t.co/VF101nFdCc'"
1289958638782525441,2020-08-02 16:18:00+00:00,b'I can only imagine how slow Netflix streaming must have been while quarantining for the 1918 pandemic.'
1289598266531885058,2020-08-01 16:26:00+00:00,"b'When I cook, I only use the freshest herbs and vegetables to f*** up the recipe.'"
1289278159293054976,2020-07-31 19:14:01+00:00,"b'Well, looks like the wife and I are gearing up for another Date Month.'"
1288944961367531523,2020-07-30 21:10:00+00:00,b'Have we settled on a term for all our new mask-related acne yet? Maskne? Macne? Covimples?'
1288521924226809858,2020-07-29 17:09:00+00:00,"b'Ladies, I\xe2\x80\x99m a 2-ply, washable cloth mask in the streets and a surgical n95 respirator in the sheets.'"
1288208357636145154,2020-07-28 20:23:00+00:00,"b'I\'m starting to resent the way my Postmate always says, ""Another 3-pizza Tuesday, Mr. O\'Brien?\xe2\x80\x9d'"
1287843707245547522,2020-07-27 20:14:01+00:00,b'Idea: we hire Jeff Goldblum to calmly talk this virus into chilling out.'
1287475574412386306,2020-07-26 19:51:11+00:00,"b""True Crime Podcast Idea: 'The Husband Didn't Do It'. It will be 2 episodes."""
1287061553297215489,2020-07-25 16:26:01+00:00,"b'Our father, who art in heaven-- what the hell, man?'"
1286741440467480576,2020-07-24 19:14:00+00:00,"b'Wanted to watch the Chernobyl miniseries but thanks to Alexa I am deeply engrossed in ""Cher: No Bull."" What a life she\'s had!'"
1286408247868522497,2020-07-23 21:10:01+00:00,"b'Canadian border agents say ""No thanks, you diseased ingrate"" in the most polite way.'"
1286029823421190144,2020-07-22 20:06:17+00:00,b'Crammed a mattress into the Largo dressing room. I\xe2\x80\x99ve never felt like a bigger star. https://t.co/tlKLFyDujm'
1285985213894602752,2020-07-22 17:09:02+00:00,b'Genuinely jealous of people who live in haunted mansions right now and get to have company over.'
1285671641079570432,2020-07-21 20:23:00+00:00,b'Disney World is running a special where your ticket automatically gets you a Fast Pass to COVID.'
1285276289264431110,2020-07-20 18:12:01+00:00,"b'""Let\'s meet for coffee""- New Zealanders right now, rubbing our noses in it.'"
1284909435559845888,2020-07-19 17:54:16+00:00,b'We are living in a time when going to a museum belongs in a museum.'
1284524836170207235,2020-07-18 16:26:00+00:00,b'Fun fact: Nudity is typically blurred out on TV because no one can get their genitals to sign a release form.'
1284204726700118018,2020-07-17 19:14:00+00:00,"b'If you\xe2\x80\x99re wondering how much weight I\xe2\x80\x99ve gained during quarantine, I just googled \xe2\x80\x9cmale caftan.\xe2\x80\x9d'"
1283871529617457153,2020-07-16 21:10:00+00:00,"b""Bad news: I've been googling symptoms on the internet and it sounds like I have hypochondria."""
1283507269854826496,2020-07-15 21:02:34+00:00,b'My hair has gotten so long but it still has its magical powers. https://t.co/zdGXIU7Qd4'
1283448493194072064,2020-07-15 17:09:00+00:00,"b'Instead of \xe2\x80\x9cBuyer beware,\xe2\x80\x9d how about \xe2\x80\x9cSeller don\xe2\x80\x99t be a dick\xe2\x80\x9d?'"
1283134929111527425,2020-07-14 20:23:01+00:00,b'\xe2\x80\x9cWhat\xe2\x80\x99s with all the statues?\xe2\x80\x9d\n--Future scuba divers'
1282772392054423553,2020-07-13 20:22:25+00:00,b'My POV from @LargoLosAngeles. Watch an all-new week of shows starting tonight @ 11/10c on @TBSNetwork. https://t.co/RZwTQGc3di'
1282739574024867847,2020-07-13 18:12:01+00:00,b'Turns out the people who predicted the world ending in 2012 were optimists.'
1282348495685509121,2020-07-12 16:18:00+00:00,"b'And to think that this whole time, I respected Donald Trump because of his SAT scores. Strike one, Mr. President.'"
1281988121723273223,2020-07-11 16:26:01+00:00,b'How much wood would a woodchuck chuck if a woodchuck did CrossFit? My guess is more.'
1281649455654035456,2020-07-10 18:00:16+00:00,"b'I really enjoyed @JimCarrey\'s ""memoir."" Like Jim, the book is wildly comic, inventive, subversive, and made primarily of compressed paper pulp. https://t.co/P7nnIixLzb https://t.co/tr1F0HKFoc'"
1281304051963981824,2020-07-09 19:07:46+00:00,"b'RT @TeamCoco: ""I\'m an impossible square."" - @ConanOBrien shocks @RobLowe on a new episode of ""Literally!"" Watch part of their conversation\xe2\x80\xa6'"
1281249312995979264,2020-07-09 15:30:15+00:00,b'My first electric guitar! #TBT https://t.co/mG0j5HfKiL'
1280911779376365569,2020-07-08 17:09:01+00:00,"b'Just went to the doctor, my BMI is 40% ice cream.'"
1280471706163953665,2020-07-07 12:00:19+00:00,"b'Hear @tomhanks and I discuss his new movie @GreyhoundMovie, SNL memories, and our squeaky voices @ https://t.co/pfOk236hQr https://t.co/terxMZBSDH'"
1280317117238140930,2020-07-07 01:46:02+00:00,b'I did it. I left my house. My first show from @LargoLosAngeles premieres tonight with guest Will Ferrell. https://t.co/CVJpPtmgnF #SaveOurStages'
1280202858646904837,2020-07-06 18:12:01+00:00,b'Looks like I trained for the 2020 running of the bulls for nothing.'
1279811779003142144,2020-07-05 16:18:00+00:00,b'With churches still closed I\xe2\x80\x99m forced to sneak glances at my watch at home.'
1279451407217758208,2020-07-04 16:26:01+00:00,b'Just now remembering I left a tuna fish sandwich on my desk back in March.'
1279191696090247169,2020-07-03 23:14:01+00:00,b'Not sure I like the revised MLB rules for this shortened season: first bunt wins? Odd.'
1279101100528930816,2020-07-03 17:14:01+00:00,"b""I'm going to be checking out @TheOutpostMovie today \xe2\x80\x94 very true and harrowing story of an intense battle in the Afghanistan War. I also plan to floss, but no one cares about that."""
1278835670203592704,2020-07-02 23:39:18+00:00,"b""I am thrilled I'm moving my show to @LargoLosAngeles next week. My family is more thrilled. https://t.co/4bAK5y3fwo"""
1278798101806022660,2020-07-02 21:10:01+00:00,b'This new book about Trump is sure to be his downfall.'
1278409858052734976,2020-07-01 19:27:16+00:00,b'We gave Canadians a little something special for this year\xe2\x80\x99s Canada Day\xe2\x80\x94no Americans!'
1277989457396809728,2020-06-30 15:36:45+00:00,b'https://t.co/LeQJAcpf7M'
1277656537175953408,2020-06-29 17:33:50+00:00,"b""This year marks the 100th anniversary of the Negro Leagues. In honor of this milestone, I'm tipping my cap to honor those who played and helped build the foundation for the civil rights movement. #TipYourCap2020 https://t.co/64JgI2zHmt"""
1277275067513278464,2020-06-28 16:18:01+00:00,b'When I was younger I used to learn a new word and then find ways to awkwardly shoehorn it into conversation. Talk about a classic bildungsroman.'
1276914689583316992,2020-06-27 16:26:00+00:00,b'They say muscle weighs more than fat. During the pandemic I\xe2\x80\x99ve gained 9 biceps.'
1276623776877293568,2020-06-26 21:10:01+00:00,b'Billboard just announced the song of the summer. It\xe2\x80\x99s the sound of your spouse chewing.'
1276274044149604354,2020-06-25 22:00:18+00:00,"b""Consider donating to @ChildrensLA's COVID-19 Emergency Response Fund to help meet the needs of patients, families, and caregivers during this unprecedented time. https://t.co/1CuMh6Pruu"""
1275838347160633344,2020-06-24 17:09:00+00:00,"b""If you're missing the sensation of shaking a good friend's hand, I've found that a 4-day-old mango has a pretty similar feel."""
1275475807088136194,2020-06-23 17:08:24+00:00,b'The upside of hiking in a face mask in 80 degree weather is I inadvertently created my own mushroom grow-house.'
1274748615127228417,2020-06-21 16:58:48+00:00,b'RT @RealRonHoward: Check it out this weekend &amp; let us know what you think. \xe2\x81\xa6\xe2\x81\xa9 \xe2\x81\xa6\xe2\x81\xa6@RealImagine\xe2\x81\xa9 \xe2\x81\xa6 https://t.co/naeSWCFk8V'
1274398488160329737,2020-06-20 17:47:31+00:00,"b'As FDR once said, ""These three months or so will live in infamy, to varying degrees, depending on which state you live in, and also how local officials handled this situation.""'"
1274108803412156416,2020-06-19 22:36:25+00:00,"b'RT @MichelleObama: This #Juneteenth, let\xe2\x80\x99s all pledge to keep using our voices\xe2\x80\x94and our votes\xe2\x80\x94to keep marching toward freedom.\n\nhttps://t.co\xe2\x80\xa6'"
1272520286315790336,2020-06-15 13:24:13+00:00,b'Spend the next few weeks with me and the people I pay to be my friends: @sonamov and @MattGourley. Listen to the first episode of our limited podcast series @ https://t.co/pfOk23nSHZ https://t.co/5XiBgYM2zv'
1271225071407755264,2020-06-11 23:37:29+00:00,"b'I loved speaking with my friend @nicolebyer today about the power of comedy, the importance of supporting Black-owned businesses, and her new book #VERYFAT #VERYBRAVE. https://t.co/7aZ3yZOkbW'"
1270826206020038656,2020-06-10 21:12:32+00:00,"b'Watch part of my moving conversation with @SenBooker about empathy, human dignity, and moral leadership. https://t.co/Sa18dvSCS7'"
1270504700601790464,2020-06-09 23:55:00+00:00,b'.@RonFunches shared his experiences with racism and typecasting. Give it a watch. https://t.co/Y9sMID6kCk'
1270137105558036481,2020-06-08 23:34:18+00:00,b'I had a hopeful conversation with @MayorCarter about investing in communities and betting on the human spirit. https://t.co/nrHYhnMvuK'
1270058390283116546,2020-06-08 18:21:31+00:00,b'Michelle Alexander wrote this very thought-provoking piece in @nytimes. Check it out. https://t.co/08CcOEgZLx'
1269988911251460097,2020-06-08 13:45:26+00:00,b'I recorded the season finale of my podcast with @amyschumer a few weeks ago. I hope it makes you laugh. https://t.co/pfOk23nSHZ https://t.co/DMmkT9Xy92'
1268982379713986560,2020-06-05 19:05:50+00:00,"b""RT @kateschatz: Ok @ConanOBrien &amp; @TeamCoco! Here's your Whiteness Assignment for today: #BreonnaTaylor should be turning 27 today. NO CHAR\xe2\x80\xa6"""
1268710070813986816,2020-06-05 01:03:47+00:00,b'Today I talked to my good friend @SamRichardson about his experience as a Black man in America. https://t.co/qEYfu5HwlY'
1268382122345029632,2020-06-04 03:20:38+00:00,"b""@kateschatz @wkamaubell \xf0\x9f\x91\x8b Kate! Thanks for sharing that article with me, I'm ready to get to work and dress the part \xe2\x80\x93 sizing may be an issue because my body is downright weird, but we'll make it work."""
1268321920010731520,2020-06-03 23:21:24+00:00,b'I had a great conversation with @wkamaubell about showing your work. https://t.co/EQtYs4gh9U'
1267659705192640515,2020-06-02 03:30:00+00:00,b'Visit this link for a list of actions you can take: https://t.co/tjNjsYlTft #BlackLivesMatter #TheShowMustBePaused #BlackoutTuesday https://t.co/iKvf84Ioav'
1267646026690605056,2020-06-02 02:35:39+00:00,b'https://t.co/ceDoxWaz4g'
1267620620453306368,2020-06-02 00:54:41+00:00,b'https://t.co/aUWUXp91rT'
1266447722820878339,2020-05-29 19:14:01+00:00,"b'God is looking down on humans right now thinking, \xe2\x80\x9cDamn. Maybe I should try dinosaurs again?\xe2\x80\x9d'"
1266160660284465153,2020-05-29 00:13:20+00:00,"b""This is my Commencement Speech to the Harvard Class of 2020. Unlike college, it's short and free. https://t.co/JrRyFX0mkG"""
1266114539319369730,2020-05-28 21:10:04+00:00,"b'Cats can\xe2\x80\x99t spread COVID but trust me, those assholes will figure out a way.'"
1265710642524192771,2020-05-27 18:25:07+00:00,b'President Trump just demanded to see Twitter\xe2\x80\x99s birth certificate.'
1265377920639475718,2020-05-26 20:23:00+00:00,"b'My kids have started saying ""Leave Meeting"" when they want me to stop talking.'"
1264889008447946752,2020-05-25 12:00:14+00:00,"b'Hear Russell Brand (@rustyrockets) and I argue about whether ""clear broth"" or ""synthetic saliva"" is the best metaphor for fame. https://t.co/pfOk236hQr https://t.co/fQhQyvtXb1'"
1264608055154499584,2020-05-24 17:23:50+00:00,"b'.@roryscovel is one of my favorite comics, and his hilarious new show ""Robbie"" is worth checking out between naps. https://t.co/AmxpaWq5dL'"
1264591488379506688,2020-05-24 16:18:00+00:00,"b""So, that\xe2\x80\x99s what it\xe2\x80\x99s like to wax the mold off an old potato. What'd everyone else get up to today?"""
1264231114048143360,2020-05-23 16:26:00+00:00,"b'Today, I overslept and completely missed my 2nd nap.'"
1263911007468040193,2020-05-22 19:14:01+00:00,"b'If there is a scandal involving Christina Applegate, what would they call it?'"
1263500229527011330,2020-05-21 16:01:44+00:00,"b""@hbomax @elmo This town only has room for one charming, red-headed talk show host. And it's you."""
1263161842551140353,2020-05-20 17:37:06+00:00,b'I do believe that President Trump has been taking hydroxychloroquine. Since childhood.'
1262841209158074368,2020-05-19 20:23:01+00:00,b'Troubling thought: What if these are the good old days?'
1262352490168823814,2020-05-18 12:01:01+00:00,b'I booked @jjabrams on my podcast to ask him why he\xe2\x80\x99s never cast me in any of his movies. Hear his chilling answer! https://t.co/pfOk236hQr https://t.co/kwPecDr05F'
1262054777799704578,2020-05-17 16:18:01+00:00,"b'What I Googled in January: ""Who directed \'Ford v Ferrari?\'""\nWhat I Googled in May: ""Can Murder Wasps get Coronavirus?""'"
1261694399441928195,2020-05-16 16:26:00+00:00,"b'Every meditation app should be called, Hey Brain, STFU'"
1261374289103785984,2020-05-15 19:14:00+00:00,"b""Every day I count the trees in my yard and the number is never the same. Anyway I'm fine."""
1261041094407729152,2020-05-14 21:10:00+00:00,b'\xe2\x80\x9cNormal People\xe2\x80\x9d is about 2 horny Irish teens who choose to have sex instead of unnaturally suppressing those urges so they can go into comedy.'
1260683840689000448,2020-05-13 21:30:24+00:00,"b'If Trump wins in November, will he blame everything on the first Trump administration?'"
1260304493968789507,2020-05-12 20:23:01+00:00,"b'Just went down a 4-hour YouTube rabbit hole, so ""tip of the hat"" to the Father of American Beekeeping: Lorenzo Langstroth.'"
1260043275261685760,2020-05-12 03:05:01+00:00,"b'Tonight I described a Freudian nightmare in which my dad knocks a hotdog out of my hand after a dropped fly-ball at Fenway Park. Never happened, but I\xe2\x80\x99ll lie about my Dad any day to get a cool t-shirt from @SullysBrand. https://t.co/OzOE68vF9D https://t.co/gZK5AUSzDU'"
1259815525175250949,2020-05-11 12:00:02+00:00,"b'I had an absolute blast speaking with Mike Myers about Canada, comedy, Liverpool, anxiety, and the threatening note I put in his office at SNL. https://t.co/pfOk236hQr https://t.co/FTMGAZQFqF'"
1259518058206580740,2020-05-10 16:18:00+00:00,"b""Today is Mother's Day. I celebrated by taking my wife to her favorite room in the house and leaving her alone."""
1259157683934019584,2020-05-09 16:26:00+00:00,"b""I just think Adam Driver is getting all the roles I'd be getting if I had his talent."""
1258837578276646914,2020-05-08 19:14:01+00:00,"b'Cool quarantine fact: 99% of the time, the answer to ""More spaghetti?"" is yes.'"
1258504381424640003,2020-05-07 21:10:01+00:00,b'Someone should do a podcast about true crime.'
1258081342530748417,2020-05-06 17:09:00+00:00,"b""TIME Magazine just announced its Person of the Year: it's sourdough bread."""
1257767778712461313,2020-05-05 20:23:01+00:00,b'L.A. wildlife really is getting brazen during the lockdown--just today I found three Hollywood Boulevard Spidermen wandering in my yard.'
1257278846828777472,2020-05-04 12:00:10+00:00,"b'When I recorded this interview with @TedDanson, his webcam was smudged with almond butter. Either that, or I have late-stage glaucoma. Hear our conversation @ https://t.co/pfOk236hQr https://t.co/8E3x4050xy'"
1256981343826780160,2020-05-03 16:18:00+00:00,b'I just adopted 890 barrels of oil.'
1256628521394454529,2020-05-02 16:56:01+00:00,"b'My first thought after seeing some recent footage of UFOs in our airspace was, \xe2\x80\x9cGuys, could you come back at a better time?\xe2\x80\x9d'"
1256287851039215616,2020-05-01 18:22:19+00:00,"b""It was an honor to celebrate #CollegeSigningDay with @MichelleObama last year and I want to offer the best of luck to this year's graduating seniors. https://t.co/XCCo4nqewn"""
1255902794286075906,2020-04-30 16:52:14+00:00,b'Where In Her House Is Carmen Sandiego?'
1255565904345288704,2020-04-29 18:33:33+00:00,b'Just found out the stimulus package is giving every American a podcast and an Etsy store.'
1255163454559838209,2020-04-28 15:54:22+00:00,b'Sometimes at night I look up at the stars and think... I should really get a roof for this house.'
1254774539256381472,2020-04-27 14:08:57+00:00,b'Check out my first socially distant podcast interview with the hilarious @nickkroll. Listen as I fail to work the equipment properly! https://t.co/pfOk23nSHZ https://t.co/UCh5ZZFHO0'
1254446642536812546,2020-04-26 16:26:00+00:00,b'Netflix just added a new category to their menu: \xe2\x80\x9cStuff You Forgot You Already Watched at the Beginning of This Pandemic.\xe2\x80\x9d'
1254082243053699079,2020-04-25 16:18:01+00:00,b'I am packing on weight for a movie role I don\xe2\x80\x99t have.'
1253764146186924032,2020-04-24 19:14:00+00:00,"b'Looking forward to getting back to normal, and once again experiencing the simple pleasure of having a stranger sneeze into my open mouth.'"
1253430956804825092,2020-04-23 21:10:02+00:00,b'Let\xe2\x80\x99s play a game of \xe2\x80\x9cWho Can Cry First\xe2\x80\x9d I win.'
1253007912525594627,2020-04-22 17:09:00+00:00,b'I just spent 40 minutes opening and closing my blinds to the tune of Camptown Races.'
1252694348594110465,2020-04-21 20:23:01+00:00,b'Hey things might be bad right now but at least they\xe2\x80\x99ll still be this way for a while.'
1252205415909203973,2020-04-20 12:00:10+00:00,"b'Before the world shut down, I flew to London and sat down for a conversation with @rickygervais about comedy, meeting your heroes, and death. https://t.co/pfOk236hQr https://t.co/xGFb2Frbxm'"
1251907914228477953,2020-04-19 16:18:00+00:00,"b""I'm starting to miss things I hated."""
1251547538072768512,2020-04-18 16:26:00+00:00,"b'I\xe2\x80\x99m a little nervous because Senator Kelly Loeffler just bought 600,000 shares in a company that makes gigantic fly swatters.'"
1250954323191832577,2020-04-17 01:08:46+00:00,"b'In retrospect, the Hunger Games had a lower child death rate than what Dr. Oz is suggesting.'"
1250894236117086208,2020-04-16 21:10:01+00:00,b'I\xe2\x80\x99m on day 27 of being useless in a pandemic.'
1250566708999274496,2020-04-15 23:28:32+00:00,b'Damn store would only let me have 600 of these. https://t.co/85mNQcyEnc'
1250471197730537478,2020-04-15 17:09:00+00:00,b'At least we flattened the curve on \xe2\x80\x9cMy Sharona\xe2\x80\x9d parodies.'
1250157633719369728,2020-04-14 20:23:01+00:00,b'Remember how toilet wine used to be just for prison inmates?'
1249668790373285889,2020-04-13 12:00:32+00:00,"b"".@kevin_nealon stopped by my podcast to interrupt me, constantly change the subject, and waste everyone's time. https://t.co/pfOk236hQr https://t.co/2Ncro0BQCR"""
1249371198405967876,2020-04-12 16:18:00+00:00,b'Trump says Jesus could have avoided crucifixion by taking hydroxychloroquine.'
1249006803985326080,2020-04-11 16:10:02+00:00,b'Can we all agree to temporarily raise the bar for what\xe2\x80\x99s considered an \xe2\x80\x9calcoholic?\xe2\x80\x9d'
1248659258477965312,2020-04-10 17:09:00+00:00,"b'Alright fine, I\xe2\x80\x99ll bite: who is TikTok?'"
1248314228898803715,2020-04-09 18:17:59+00:00,b'#IStayHomeFor my parents. Share who you stay home for with #IStayHomeFor and tag 6 friends to do the same. @AndyRichter @sonamov @jordanschlansky @MeganMullally @Nick_Offerman @peeweeherman https://t.co/51MdoWzAIF'
1247950843581804555,2020-04-08 18:14:01+00:00,"b'The Trump sons must be asking themselves, \xe2\x80\x9cWhat does Jared not have that I also don\xe2\x80\x99t have?\xe2\x80\x9d'"
1247582789156745216,2020-04-07 17:51:30+00:00,b'Being trapped with your spouse driving you crazy? Submit a video outlining your marriage woes and I might help resolve your issues on the air. https://t.co/WubwSJnVS6'
1247314735181074435,2020-04-07 00:06:21+00:00,"b""It's hard to do an animal expert segment while isolated at home \xe2\x80\x93 but not impossible. https://t.co/rZayWz9v0V #ConanAtHome"""
1247131971769249795,2020-04-06 12:00:07+00:00,"b'It was a pleasure chatting with you, @DarcyCarden. Thank you for saying that I have a muscular neck. https://t.co/pfOk236hQr https://t.co/cZj4xBcpkZ'"
1246879062712127488,2020-04-05 19:15:09+00:00,b'Bought this gator three months ago \xe2\x80\x94 never thought it would become my everyday-wear. https://t.co/xBGipRz0E1'
1246834483803893760,2020-04-05 16:18:00+00:00,"b""Staying in every night and watching sitcom reruns, it's like every night is Prom Night."""
1246474109510393859,2020-04-04 16:26:00+00:00,"b'Well gang, I did it. I reached the end of Netflix. Gotta say, Lilyhammer holds up.'"
1246154003521474561,2020-04-03 19:14:01+00:00,b'Does anyone need the recipe for my new toothpaste stir-fry?'
1245813377160458241,2020-04-02 20:40:29+00:00,"b'I can\'t think of a better song for these times than ""Better Things"" as performed by the late Adam Schlesinger and his beloved band Fountains of Wayne. https://t.co/rhhflTMoCZ'"
1245397765628268549,2020-04-01 17:09:00+00:00,b'Oh so NOW my accountant says I can buy stock in PornHub.'
1245084201763975174,2020-03-31 20:23:00+00:00,b'My boredom has reached \xe2\x80\x9cMemorize the Vice Presidents\xe2\x80\x9d level.'
1244778076958908417,2020-03-31 00:06:35+00:00,"b'My first #ConanAtHome show premieres tonight @ 11/10c on @TBSNetwork with guest @AdamSandler. You won\xe2\x80\x99t learn anything, but I can promise you silliness, good cheer, and bad lighting. https://t.co/NG0a1YBCTI'"
1244595345817993216,2020-03-30 12:00:28+00:00,"b'Steve Coogan and I both come from large Irish families, are middle children, and play talk show hosts on TV. https://t.co/pfOk236hQr https://t.co/qeHh6LgvGY'"
1244297771651411969,2020-03-29 16:18:01+00:00,b'I ordered Postmates while Ubering and started a car chase across five states. Pretty expensive.'
1243952494088269824,2020-03-28 17:26:00+00:00,"b""Let's hope the people in charge of jury duty don't find out about Zoom."""
1243571989039722497,2020-03-27 16:14:01+00:00,"b'\xe2\x80\x9cAlexa, play something upbeat.\xe2\x80\x9d\n\xe2\x80\x9c....No.\xe2\x80\x9d'"
1243307273461456898,2020-03-26 22:42:08+00:00,b'Join me in helping Angelenos in need by texting LALOVE to 21000 or by visiting https://t.co/AWLWPQuiE1 to donate. We\xe2\x80\x99re all in this together. #LALove https://t.co/iBnnFFdLs4'
1242885443168813056,2020-03-25 18:45:56+00:00,"b""Since we're all stuck at home, I thought I'd show you how to make simple repairs around the house. https://t.co/DWRwGdZs9V"""
1242571729408409601,2020-03-24 21:59:20+00:00,b'Preparations for my return to @TBSNetwork on 3/30 are going really well. https://t.co/LFLbOx2gAV'
1242547488168566784,2020-03-24 20:23:01+00:00,"b'Fun fact: Twitter is a Belgian word that means, \xe2\x80\x9cNo *you* shut up.\xe2\x80\x9d'"
1242146248460627968,2020-03-23 17:48:38+00:00,"b'This is Conan O\xe2\x80\x99Brien, reporting from an empty street. https://t.co/fMU8MWOcjX'"
1242058558545563654,2020-03-23 12:00:11+00:00,b'.@WhitneyCummings and I were both very serious kids who became very beautiful women. Hear our conversation @ https://t.co/pfOk236hQr https://t.co/CantOT2xFh'
1241761054490845184,2020-03-22 16:18:00+00:00,"b'""Someone needs to grab this virus by the ears, give it a little shake and say, \'Mister, you\'re not gonna steal my root beer!"" - Joe Biden, probably'"
1241400679115247617,2020-03-21 16:26:00+00:00,"b""I asked my doctor if I need to cancel my birthday party, but she said that's only for events over 10 people."""
1241080573004779523,2020-03-20 19:14:01+00:00,b'38 seconds: That\xe2\x80\x99s my current record for not touching my own face.'
1241065810170220547,2020-03-20 18:15:21+00:00,b'Let me show you how to make hand sanitizer at home! Warning: It will not work. https://t.co/r5pj68dokK'
1240790160549318657,2020-03-20 00:00:01+00:00,b'We all could use a dose of joy about now. @musiciansoncall is delivering the healing power of music to patients in hospitals with their #MOCHeals playlist. Check it out and share it with anyone who might need a pick me up. https://t.co/pKZF8hPSex'
1240747374793850882,2020-03-19 21:10:00+00:00,"b'In hindsight, it was probably not a great idea to invest $20 million in lickable wallpaper.'"
1240718266420486144,2020-03-19 19:14:20+00:00,"b'Fans are constantly hounding me for selfies, which can be an issue these days. https://t.co/CElCgvXZfL'"
