twitter_id,date,tweet
1069662633341710336,2018-12-03 18:40:19+00:00,"b'If I could only listen to one album for the rest of my life, I would probably wonder what kind of fascist regime I was living under.'"
1069577259961462784,2018-12-03 13:01:05+00:00,"b'.@billburr and I talk about conspiracy theories, Burt Reynolds, and growing up with red hair @ https://t.co/9Po0LyTBd1 https://t.co/i3s8f5W3oJ'"
1069350682887626753,2018-12-02 22:00:45+00:00,"b'I wonder if Crackle and Pop ever say, \xe2\x80\x9cOh, Snap.\xe2\x80\x9d'"
1068949129534017536,2018-12-01 19:25:07+00:00,"b'Ah yes, time for the annual debate between people who insist \xe2\x80\x9cDie Hard\xe2\x80\x9d is a Christmas movie and people who don\xe2\x80\x99t give a shit.'"
1068897785414471680,2018-12-01 16:01:05+00:00,b'Spent a day with President George H.W. Bush at Dartmouth College in 2010. He could not have been kinder and he was absolutely lovely to my parents. It was an honor I\xe2\x80\x99ll always remember.'
1068665763823706112,2018-12-01 00:39:07+00:00,b'I\xe2\x80\x99m starting a new meme. #dotheteddy #getcelebstodotheteddy #noonewilldotheteddy #conanandfriends https://t.co/X0q0XIsaII'
1068627026049974278,2018-11-30 22:05:11+00:00,"b'Should have just said, \xe2\x80\x9cWho wants a cocktail?\xe2\x80\x9d instead of \xe2\x80\x9cWho will join me in briefly drowning out the shriek of The Abyss?\xe2\x80\x9d'"
1068399145436803072,2018-11-30 06:59:40+00:00,"b'We can\xe2\x80\x99t sleep, and now you can\xe2\x80\x99t either. #ConanAndFriends https://t.co/OISq6VUqcY'"
1068290637030719488,2018-11-29 23:48:30+00:00,b'@jdmcphersonjr @FirstAvenue @TeamCoco I would love to sit in with you tonight but my show doesn\xe2\x80\x99t end until 10:30pm. How late are you guys going to be there? And do you have a tuba?'
1068269821291307008,2018-11-29 22:25:47+00:00,b'I\xe2\x80\x99ll be sending this out as my holiday card this year. Apologies to my family. #ConanAndFriends https://t.co/Z0USWJLW6x'
1068234468966711297,2018-11-29 20:05:18+00:00,"b""Simple way to get my kids to brush their teeth and do their homework: if they don't, they have to be a guest on my podcast."""
1067944263269273601,2018-11-29 00:52:08+00:00,"b'I rented a new family while I was in Japan. Yes, you can do that there. Check it out and then tune in to #ConanJapan tonight @ 10pm on @TBSNetwork. https://t.co/80USl3Umnx'"
1067849408337899521,2018-11-28 18:35:13+00:00,"b""It evens out, because most climate scientists can't believe Trump is president."""
1067527296049922048,2018-11-27 21:15:15+00:00,"b""More like Paul Manafucked, am I right? (CONAN EXTENDS HIGH 5 HAND, WALKS THE EARTH IN SEARCH OF CONTACT, RECEIVES NO HIGH 5's, THEN QUIETLY EXPIRES.)"""
1067146757371441152,2018-11-26 20:03:08+00:00,b'Someone visiting Ireland sent me this photo of an ancient bog person.  It looks just like me when I forget to moisturize. https://t.co/jPvQH0VLYl'
1067089000609939456,2018-11-26 16:13:37+00:00,b'RT @ConanOBrien: .@IMKristenBell gave me some great advice about friendship and face lift tape. https://t.co/9Po0LyTBd1'
1067040405466828801,2018-11-26 13:00:31+00:00,b'.@IMKristenBell gave me some great advice about friendship and face lift tape. https://t.co/9Po0LyTBd1'
1066778580720525313,2018-11-25 19:40:08+00:00,"b'Product idea: honey, packaged inside a little human, but with a bear chasing it.'"
1066397319510310912,2018-11-24 18:25:08+00:00,"b'Every time I see a giant pink bouncy castle going up in my neighbor\xe2\x80\x99s back yard, I\xe2\x80\x99m reminded that he still has my giant pink bouncy castle.'"
1066081591011803137,2018-11-23 21:30:32+00:00,"b'I don\xe2\x80\x99t need to buy anything on Black Friday, I just want to get in a fistfight at Bed Bath and Beyond to feel alive.'"
1065757783704793088,2018-11-23 00:03:51+00:00,b'RT @ConanOBrien: Will Ferrell sat down for the premiere episode of my new podcast. If you like Will Ferrell and Conan O\xe2\x80\x99Brien but hate our\xe2\x80\xa6'
1065732932642500608,2018-11-22 22:25:06+00:00,b'Having an authentic Thanksgiving celebration this year. I\xe2\x80\x99m giving my family smallpox.'
1065668802644533249,2018-11-22 18:10:16+00:00,b'Do you think Abe Lincoln would have declared Thanksgiving a national holiday if he knew it would mean the Lions play every year?'
1065324012681732098,2018-11-21 19:20:12+00:00,b'Fun fact: the guy who had the idea for turducken was watching porn at the time.'
1064972980852264960,2018-11-20 20:05:19+00:00,"b""I bet a part of Mueller is also hoping this thing wraps up soon so he doesn't miss the next season of Game of Thrones."""
1064661550122917888,2018-11-19 23:27:48+00:00,"b'Please, show some respect and use its full name: ""Fantastic Beasts: The Crimes of Grindelwald: The Plight of Scamander: The Ritings of Rowling: The Windfall of Redmayne: The Disregard of Depp-cusations: The Disbelief You Read This Far: MagicTimes FunWithWands ZipZap.\xe2\x80\x9d'"
1064591690311376898,2018-11-19 18:50:12+00:00,"b""In my experience, an apple a day keeps Hugh Jackman away, but, no, I can't confirm that they're connected."""
1064503674758750208,2018-11-19 13:00:28+00:00,"b'Will Ferrell sat down for the premiere episode of my new podcast. If you like Will Ferrell and Conan O\xe2\x80\x99Brien but hate our faces, check it out! https://t.co/9Po0LyTBd1 https://t.co/HokO42e1Cs'"
1064258232473055233,2018-11-18 20:45:10+00:00,"b'This is my favorite time of year: every Sunday, the boys come over, we order hot wings and watch ""Love Actually.""'"
1064255812669972481,2018-11-18 20:35:33+00:00,b'I was just adopted by this bachelorette party in Austin. #girlsweekend https://t.co/EvSxGc54D5'
1063997536854249472,2018-11-18 03:29:15+00:00,"b'In Texas, this is a light breakfast. #ConanAndFriends https://t.co/ThjsHBZh8H'"
1063925254366666753,2018-11-17 22:42:02+00:00,b'This is the 47th wedding I\xe2\x80\x99ve ruined. When I hit 50 I can retire. #ConanAndFriends https://t.co/RroiPVFp1m'
1063917230633742337,2018-11-17 22:10:09+00:00,b'Studies show young people are having less sex than previous generations. I knew I was ahead of my time.'
1063671125908045824,2018-11-17 05:52:13+00:00,"b'On my tour, I\xe2\x80\x99m selling these limited edition posters by @kiiarens. Ah, I was such a sweet young girl. #ConanAndFriends https://t.co/hC9acnqlk7'"
1063551879009886208,2018-11-16 21:58:22+00:00,"b'When Lou Dobbs said illegals were coming into our country to vote, maybe he was thinking of this comedy bit we shot: https://t.co/FNJnY7YqDV'"
1063532200547758082,2018-11-16 20:40:10+00:00,"b'Either the barista got my name *really* wrong, or I just drank Erica\xe2\x80\x99s mochaccino.'"
1063495497325793280,2018-11-16 18:14:20+00:00,"b'RT @BillSimmons: New BS Podcast: a long, overdue hang w/ @ConanOBrien on SNL, The Simpsons, funniest people, Ted Williams, Greg Daniels, th\xe2\x80\xa6'"
1063130862554890241,2018-11-15 18:05:24+00:00,b'Just had my first non-Tootsie Roll breakfast since Halloween.'
1062820099495739392,2018-11-14 21:30:32+00:00,"b'Terrible office scheduling here. Somehow, Bring Your Dog to Work Day is on the same day as Wear Steak Pants to Work Day.'"
1062527000865267713,2018-11-14 02:05:52+00:00,"b'Visit https://t.co/nsCTOuZpDq to bid on four VIP tickets to my show in Burbank. All proceeds go to @HomesForOurTrps, who are building homes for our most severely wounded post-9/11 veterans.'"
1062464050532114432,2018-11-13 21:55:43+00:00,"b'Unfortunately, this morning I said, \xe2\x80\x9cKids, let\xe2\x80\x99s gather \xe2\x80\x98round my iPhone and see why Jill Scott is trending!\xe2\x80\x9d'"
1062419904782131214,2018-11-13 19:00:18+00:00,"b'Like Trump, I also try to avoid the rain due to my hair, but only because mine grows 5 times its normal size and begins to attract lightning.'"
1062159830440280064,2018-11-13 01:46:52+00:00,"b'Back in 1995, I had the pleasure of talking to Stan Lee about his 50 years in comic books. Rest in peace, Stan. https://t.co/zPbwAhZJVg'"
1062082036578414601,2018-11-12 20:37:44+00:00,"b'""Conan O\'Brien Needs A Friend"" combines my two passions: making friends and selling mattresses. Listen to a preview with guests Will Ferrell, @iamwandasykes, @billburr, @IMKristenBell, and more at https://t.co/9Po0LyBZOr https://t.co/9XjzHtIVU0'"
1061686273755234306,2018-11-11 18:25:07+00:00,b'Nope. That wasn\xe2\x80\x99t me at CVS loudly humming along to that \xe2\x80\x9cSmooth\xe2\x80\x9d Santana/Rob Thomas song.'
1061379244532600837,2018-11-10 22:05:06+00:00,b'New drinking game: drink every time you feel anxious and sad.'
1060990715428188160,2018-11-09 20:21:13+00:00,"b'Visit https://t.co/QeFv9XuPOE to bid on a meet and greet with my friend @jaketapper. All proceeds go to @HomesForOurTrps, who are building homes for our most severely wounded post-9/11 veterans.'"
1060234269359030272,2018-11-07 18:15:22+00:00,b'My apologies to LA Zoo officials. I thought giraffes could handle Chipotle.'
1059976269864017927,2018-11-07 01:10:10+00:00,"b'If you\xe2\x80\x99re near a losing candidate\xe2\x80\x99s headquarters this evening, stop by for a good deal on balloons and room temperature hors d\xe2\x80\x99oeuvres.'"
1059929699999191047,2018-11-06 22:05:07+00:00,"b'At the end of the day, this election comes down to one question: do you like stickers? #vote #stickers'"
1059899556714946560,2018-11-06 20:05:20+00:00,"b'Just walked into an Arby\xe2\x80\x99s and asked, \xe2\x80\x9cWhat\xe2\x80\x99s fresh today?\xe2\x80\x9d The cashier pointed to her cold sore.'"
1059553500596748290,2018-11-05 21:10:14+00:00,b'This is an unbelievable statistic: 18% of all statistics are falsely inflated 106% of the time.'
1059168444631994368,2018-11-04 19:40:10+00:00,"b'Call me old fashioned, but I find beautiful women incredibly attractive.'"
1059128280559816705,2018-11-04 17:00:34+00:00,"b""Just read my old pal Mike Reiss' book on writing for The Simpsons and it's great. Put down that classic Russian novel and read this instead. https://t.co/fiw99s8VDJ https://t.co/24Dm73YJPu"""
1058795745619382272,2018-11-03 18:59:11+00:00,b'Thank you D.C. for an incredible first show. See you soon Atlantic City. #ConanAndFriends https://t.co/GOechbuRbM'
1058774612199256065,2018-11-03 17:35:13+00:00,b'My personal style can best be described as \xe2\x80\x9cTrader Joe\xe2\x80\x99s cashier.\xe2\x80\x9d'
1058434921847574529,2018-11-02 19:05:24+00:00,"b'Jared Kushner could sell ice to a polar bear (in 2040, when there is no ice left).'"
1058097656885583872,2018-11-01 20:45:14+00:00,"b""The barista said she liked my Dia de los Muertos skeleton costume. I'm not wearing a costume."""
1057788099546230784,2018-11-01 00:15:10+00:00,b'Dear trick-or-treaters: Would it kill you to say \xe2\x80\x9cthank you\xe2\x80\x9d when I hand you a freshly made egg salad sandwich?'
1057743173517103104,2018-10-31 21:16:39+00:00,"b'Hey Boston, a few more tickets have just been released for my 10pm show at @The_Wilbur on 11/6. Get them while you can @ https://t.co/ikq4lZK5OJ https://t.co/9dZ3LVo7Ny'"
1057367828318314496,2018-10-30 20:25:09+00:00,"b'Red Dead Redemption 2 is incredibly realistic, except for the turn signals on the horses.'"
1056984220294352896,2018-10-29 19:00:50+00:00,"b'\xe2\x80\x9cI\xe2\x80\x99ve never owned a van,\xe2\x80\x9d is fast becoming one of my best qualities.'"
1055893133190488064,2018-10-26 18:45:15+00:00,b'I stayed in tonight and watched the Fall Classic. (\xe2\x80\x9cAutumn in New York\xe2\x80\x9d with Richard Gere and Winona Ryder)'
1055509354781270017,2018-10-25 17:20:15+00:00,b'The National Weather Service is letting me name the next hurricane. Watch out for Tropical Storm Dr. Sanjay Gupta.'
1055139406317842432,2018-10-24 16:50:12+00:00,b'Is it weird that my ballot was in Russian?'
1054929235922575360,2018-10-24 02:55:04+00:00,"b'I didn\xe2\x80\x99t win the lottery, but I\xe2\x80\x99m still planning on dying alone.'"
1054880026968121344,2018-10-23 23:39:31+00:00,"b'I was up all night, worried about this caravan of people who are willing to do the jobs that most Americans won\xe2\x80\x99t.'"
1054831117193371648,2018-10-23 20:25:10+00:00,"b'Last year, my family started a tradition of putting up a \xe2\x80\x9cChristmas skeleton\xe2\x80\x9d because it works so well with our other tradition, \xe2\x80\x9cnot putting away the Halloween decorations.\xe2\x80\x9d'"
1054441058187309056,2018-10-22 18:35:13+00:00,b'Heads up! Greek Yogurt is just regular yogurt with an irresistible cologne.'
1054101296817553408,2018-10-21 20:05:08+00:00,"b""HEY SHARK TANK! Pumpkin Spice Lotto. You're welcome."""
1053727599246143489,2018-10-20 19:20:11+00:00,b'The original Big Bird has retired from Sesame Street. I\xe2\x80\x99m told he was delicious.'
1053343820585295874,2018-10-19 17:55:11+00:00,"b""Trump's reaction to the story about Khashoggi in the Saudi consulate reminds me of when we agreed to let Dahmer investigate whether or not Dahmer did it."""
1053030484358426624,2018-10-18 21:10:06+00:00,"b'Now that Canada has legalized marijuana, maybe Canadians will finally mellow out.'"
1052669391840657411,2018-10-17 21:15:15+00:00,"b'For Halloween, I\xe2\x80\x99m going as a newspaper.'"
1052278076955070471,2018-10-16 19:20:18+00:00,"b'I was just the victim of identity theft, but when the thief realized who it was, said, \xe2\x80\x9cActually I\xe2\x80\x99m good.\xe2\x80\x9d'"
1051888113931485184,2018-10-15 17:30:44+00:00,b'Hard to believe it\xe2\x80\x99s been almost three days without the announcement of a new Star Wars movie.'
1051541927714279424,2018-10-14 18:35:06+00:00,b'Social media use among the young is getting worse. Latest research: 1 out of 3 teenagers today IS a phone.'
1051156901180911620,2018-10-13 17:05:09+00:00,b'It\xe2\x80\x99s a bad sign that in order to vote in Georgia you have to prove you subscribe to The Golf Channel.'
1050873397968801792,2018-10-12 22:18:37+00:00,b'Kanye is in my office and he won\xe2\x80\x99t leave.'
1050849892246147072,2018-10-12 20:45:12+00:00,b'We apparently have just over 10 years to reverse the catastrophic effects of climate change. But first - we dance!'
1050447253226315776,2018-10-11 18:05:16+00:00,"b""When I eat raisins, I feel like I'm chomping up some grape's grandmother."""
1050107495501451264,2018-10-10 19:35:11+00:00,"b'May start a talent agency. First client - that dog in ""A Star is Born.""'"
1049705305565790213,2018-10-09 16:57:02+00:00,b'It\xe2\x80\x99s weird that both the Earth and I have about 30 years left.'
1049353808395034624,2018-10-08 17:40:18+00:00,b'FUN FACT: no facts are actually fun!'
1049030405641437184,2018-10-07 20:15:13+00:00,b'I want to open a Buddhist bakery that specializes in nothing bagels.'
1048642832276365319,2018-10-06 18:35:08+00:00,"b'I read that shaving your legs helps you swim faster, so now, I just have to go back in time and convince the guys who hazed me in high school that I was a swimmer.'"
1048287233332207616,2018-10-05 19:02:07+00:00,b'67 million Americans don\xe2\x80\x99t speak English at home. This includes my family because we don\xe2\x80\x99t say a word to each other.'
1047942375589306368,2018-10-04 20:11:46+00:00,b'a triple thread.'
1047942374746247168,2018-10-04 20:11:46+00:00,b'I\xe2\x80\x99m known as'
1047942373748105217,2018-10-04 20:11:46+00:00,"b'In the business,'"
1047932244914892800,2018-10-04 19:31:31+00:00,"b'Get ready for the podcast NPR called, ""not for us."" Check out the teaser for ""Conan O\'Brien Needs a Friend."" Premieres next month, but subscribe now \xe2\x80\x94 I\'m really having fun making these. https://t.co/9Po0LyBZOr https://t.co/5OwLXkBWmy'"
1047541859130777611,2018-10-03 17:40:16+00:00,"b""This is the THIRD time I've found Jeff Goldblum in a box of Kellogg's Raisin Bran."""
1047185774859505665,2018-10-02 18:05:19+00:00,b'Neil Da Grass Try Some is my favorite weed strain that makes you good at astrophysics.'
1046846003448614912,2018-10-01 19:35:11+00:00,b'Evergreen tweet: I love a blue spruce.'
1046457181250486273,2018-09-30 17:50:08+00:00,b'My wife hasn\xe2\x80\x99t touched me since the election. She took Gore\xe2\x80\x99s loss pretty hard.'
1046098572280832001,2018-09-29 18:05:09+00:00,"b""We're getting to a place where the Supreme Court seems less respectable than the Taco Bell Crunchwrap Supreme."""
1045798966871433217,2018-09-28 22:14:38+00:00,b'I\xe2\x80\x99m going to delay my Kavanaugh tweet for a week.'
1045720336648437760,2018-09-28 17:02:11+00:00,b'Tickets for my 18-city stand-up tour are on sale now @ https://t.co/JERw0JAX9l #ConanAndFriends https://t.co/5BJGGQYGem'
1045419102012100609,2018-09-27 21:05:11+00:00,"b'My doctor says I should eat more red meat and drink more alcohol. BTW, I consider all waiters doctors.'"
1045016451818704896,2018-09-26 18:25:12+00:00,b'I hit a deer with my car. Pretty impressive considering the deer was in the zoo.'
1044934956303020032,2018-09-26 13:01:22+00:00,"b""I'm hitting the road for an 18-city tour and bringing my funniest friends with me. Tickets go on sale Friday @ 10am. For more info visit https://t.co/JERw0JAX9l #ConanAndFriends https://t.co/PLUxlchUnR"""
1044688043519758337,2018-09-25 20:40:13+00:00,b'You gotta hand it to ticket takers. I\xe2\x80\x99m sorry.'
1044589630027268096,2018-09-25 14:09:09+00:00,b'It\xe2\x80\x99s time to register to vote for the 2018 midterms. Text \xe2\x80\x9cVOTER\xe2\x80\x9d to 40649 or visit @HeadCountOrg @  https://t.co/DvyBg0U9OX. #TheFutureIsVoting #NationalVoterRegistrationDay https://t.co/zpL3MSpvfS'
1044272820136693760,2018-09-24 17:10:16+00:00,"b""This country has become so divided, it might as well be an amoeba. Netflix, where's my comedy special?"""
1043946879560691712,2018-09-23 19:35:06+00:00,"b'Since the new ""Captain Marvel"" trailer came out, at least 7 people have hit me in the face then said, ""Now THAT\'S how you punch an old lady.""'"
1043570669294899202,2018-09-22 18:40:10+00:00,"b'Historical fact: The city of Buffalo, New York was founded by Dutch trader Anton van Wild Wings.'"
1043246037111136256,2018-09-21 21:10:12+00:00,"b'One huge perk about being famous is, you can walk into any Olive Garden restaurant and get free unlimited breadsticks.'"
1042516231448932362,2018-09-19 20:50:13+00:00,"b'I\xe2\x80\x99ve left instructions that after I die, I\xe2\x80\x99m to be cremated and sold as a detergent additive.'"
1042143356162211841,2018-09-18 20:08:32+00:00,"b""Hey, Los Angeles, I'll be stopping by tonight's @upandup with @MosesStorm. Get tickets here https://t.co/whhzVdkOCb"""
1042097255405285379,2018-09-18 17:05:21+00:00,b'It\xe2\x80\x99s officially 22 shopping days until Mario Lopez\xe2\x80\x99s birthday.'
1041760028380856320,2018-09-17 18:45:20+00:00,b'Spent the weekend binge-watching every Verizon commercial.'
1041407643678646279,2018-09-16 19:25:05+00:00,"b'The new iPhone Xs will let you have two different phone #s on one phone. Congratulations, adulterers!'"
1041054114736746496,2018-09-15 20:00:17+00:00,"b'Thanks to Paul McCartney, now when people ask about my 25 year relationship with Andy Richter, I can say, \xe2\x80\x9cwe\xe2\x80\x99re friends but we\xe2\x80\x99re not \xe2\x80\x98masturbate-together\xe2\x80\x99 friends.\xe2\x80\x9d'"
1040723168154071041,2018-09-14 22:05:13+00:00,"b'Whenever I see a newborn baby, I realize they have absolutely no clue how many binge-worthy shows they now have to catch up on.'"
1040253140530909184,2018-09-13 14:57:30+00:00,"b'25 years ago today, ""Late Night with Conan O\'Brien"" premiered. Here\'s the first episode, on loan from the Smithsonian. https://t.co/cbBAyFfqX5'"
1039973212115873792,2018-09-12 20:25:10+00:00,"b'Do I believe in climate change? Well, I just saw a mosquito steal a bike.'"
1039591988583178240,2018-09-11 19:10:19+00:00,"b'I got one of those robotic dogs. Calm down, it\xe2\x80\x99s a rescue.'"
1039556054042857472,2018-09-11 16:47:31+00:00,b'.@Daniel_Sloss just released two hilarious stand-up specials. You have my permission to watch them at work. https://t.co/2Pz3TTqfna'
1039204613826781185,2018-09-10 17:31:02+00:00,"b'\xe2\x80\x9cPlum\xe2\x80\x9d is, by far, the dirtiest sounding fruit.'"
1038497853880946688,2018-09-08 18:42:37+00:00,b'That\xe2\x80\x99s a wrap on #ConanJapan. Sayonara. \xf0\x9f\x87\xaf\xf0\x9f\x87\xb5 https://t.co/HaoWuAAcuD'
1038426528441229313,2018-09-08 13:59:12+00:00,"b'A year ago this couple, Michael and Kayo invited me to their wedding. I couldn\xe2\x80\x99t make it so instead I flew to Japan and took this selfie. #ConanJapan https://t.co/JmYmufaRr2'"
1038327247252250624,2018-09-08 07:24:41+00:00,b'Last night I brought karaoke to Japan. (At least I\xe2\x80\x99m assuming it\xe2\x80\x99s not a big thing here). #ConanJapan https://t.co/Ftj5TQvJ0U'
1038250201553592321,2018-09-08 02:18:32+00:00,b'Shot something super secret with #HideoKojima. Coming soon. #ConanJapan https://t.co/J44hzEGQEn'
1038018572990074880,2018-09-07 10:58:07+00:00,"b'After 5 days, I now read and speak fluent Japanese. #ConanJapan https://t.co/4rnnCT5qsA'"
1037917748796379136,2018-09-07 04:17:29+00:00,b'RIP Burt Reynolds. He was like no other. https://t.co/hLQgctLVzp'
1037881342912909314,2018-09-07 01:52:49+00:00,b'#ConanJapan https://t.co/5dXoIhwxlx'
1037736119293497345,2018-09-06 16:15:45+00:00,b'I was asked to join a totally impromptu parasol dance in my honor by the Governor. I think im losing my mind. #ConanJapan https://t.co/v1yyJDLDvH'
1037603360868720641,2018-09-06 07:28:13+00:00,"b'I finally made it to Conan Town.\nThe mayor gave me an honorary sash, and I gave him one. #ConanJapan https://t.co/iWzncNvyad'"
1037538222874607616,2018-09-06 03:09:23+00:00,"b'People of Conan Town, we landed at the wrong airport. My apologies. We\xe2\x80\x99re on our way. See you soon. https://t.co/mIMCpRNByz'"
1037525904002449408,2018-09-06 02:20:26+00:00,b'On my way to Conan Town. It\xe2\x80\x99s time to settle this. #ConanJapan #ConanTown https://t.co/kQhtHwzrBW'
1037360889601511426,2018-09-05 15:24:43+00:00,"b'In Japan, you can rent a family. I rented one for the day and I\xe2\x80\x99ve never been happier. #ConanJapan https://t.co/ss8fVb9Taq'"
1037267047158149120,2018-09-05 09:11:50+00:00,b'For all our disagreements Jordan does know his food. #Tonkatsu #ConanJapan https://t.co/1QQv7ZQZZh'
1036938035210858496,2018-09-04 11:24:27+00:00,b'Looking forward to a great and/or horrible meal. #ConanJapan https://t.co/l7xWSSK51B'
1036835197461749760,2018-09-04 04:35:49+00:00,b'Japanese lunch for two. #ConanJapan https://t.co/7rsFXD5V4F'
1036792592476725248,2018-09-04 01:46:31+00:00,b'Hoping everyone in Japan stays safe during Typhoon Jebi. #ConanJapan https://t.co/FKY1HqivUZ'
1036570328644837379,2018-09-03 11:03:19+00:00,"b'Just before I left, my daughter said \xe2\x80\x9cDad, don\xe2\x80\x99t embarrass me in Japan.\xe2\x80\x9d\n#ConanJapan https://t.co/YhZhy5jgV5'"
1036520719230726144,2018-09-03 07:46:11+00:00,b'Our album drops never. #conanjapan https://t.co/vmJEBtUPCB'
1036475647265128449,2018-09-03 04:47:05+00:00,b'Konnichiwa! I\xe2\x80\x99ve arrived in #Japan to film a new episode of #ConanWithoutBorders. Already making new friends. #ConanJapan https://t.co/1y3CGQDyFm'
1035964288207388674,2018-09-01 18:55:08+00:00,"b'SPOILER ALERT: In the final episode of The Big Bang Theory, we learn \xe2\x80\x9cBazinga\xe2\x80\x9d was the name of young Sheldon\xe2\x80\x99s sled.'"
1035634641510785026,2018-08-31 21:05:14+00:00,"b'I just tried out a new flight simulator that\xe2\x80\x99s so realistic, I spent the whole 2 hours grounded at JFK.'"
1035249587550932992,2018-08-30 19:35:10+00:00,"b'I ordered the Olive Garden \xe2\x80\x9cBottomless Salad Bowl,\xe2\x80\x9d and it led me to Narnia.'"
1034894776917745666,2018-08-29 20:05:16+00:00,"b""Ever since I scooped my eyes out with a melon baller, the news hasn't bothered me so much."""
1034490857074962432,2018-08-28 17:20:14+00:00,"b'Ugh, my dog\'s giving me those ""Jeff Sessions checking to see if Trump is still mad at him"" eyes again.'"
1034193875999621120,2018-08-27 21:40:09+00:00,"b'President Trump is sounding more and more like a mob boss. At a press pool this morning, he referred to America as \xe2\x80\x9cthis thing of ours.\xe2\x80\x9d'"
1033786348572835841,2018-08-26 18:40:46+00:00,"b""Today everyone is rightly praising the courage and wisdom of John McCain. To truly honor the man, let's all try and follow his lead. https://t.co/6ET1EOfSlc"""
1033401156515647488,2018-08-25 17:10:10+00:00,"b'I hope when I die, Madonna says nice things about herself.'"
1033063955273531392,2018-08-24 18:50:14+00:00,"b'This is the 3rd time I\'ve tried hitchhiking to work and it\'s the 3rd time I\'ve been picked up by @JoeManganiello who was again ""just in the neighborhood.""'"
1032706627277922306,2018-08-23 19:10:21+00:00,"b'The following random syllables are hereby offered as names for your new app: Buzu, Spotchi Jimsin, Plantic, Tanco and Spoob.'"
1032317774490755072,2018-08-22 17:25:11+00:00,"b""On my recent trip to wherever, I couldn't believe how great that thing was."""
1031986945734402048,2018-08-21 19:30:35+00:00,"b'Besides biting into it, what\xe2\x80\x99s the best way to find out if a loose battery is good?'"
1031647660220923904,2018-08-20 21:02:23+00:00,"b""My writers are performing at Flappers tonight. I thought I'd stop by and say hi. See you there. https://t.co/BgTnBJxG1g"""
1031613162309775361,2018-08-20 18:45:18+00:00,"b'Just got asked to autograph a breast. My wife was nearby, so I told him \xe2\x80\x9cno.\xe2\x80\x9d'"
1031228108492419072,2018-08-19 17:15:15+00:00,"b'Just learned that when *I\xe2\x80\x99m* one of the options, instead of \xe2\x80\x9cMarry, F*ck, Kill\xe2\x80\x9d people play, \xe2\x80\x9cPretend You\xe2\x80\x99re On a Call, Play Dead, Actually Die.\xe2\x80\x9d'"
1030894653355253762,2018-08-18 19:10:13+00:00,"b'Someone is suing Canada Dry Ginger Ale because it contains no ginger, so I\xe2\x80\x99d like to formally announce my lawsuit against Panda Express.'"
