twitter_id,date,tweet
1203151340702195713,2019-12-07 03:16:47+00:00,"b'GRACIAS, infinitas GRACIAS, Cali. \nEl Teatro Jorge Isaacs a reventar con este p\xc3\xbablico generoso de pie aplaudiendo lo que hago con amor, es mi felicidad. https://t.co/TklIVIVJeP'"
1201360652050354177,2019-12-02 04:41:14+00:00,"b'Profunda gratitud con el p\xc3\xbablico de Bogot\xc3\xa1. Cerr\xc3\xa9 hoy en el Teatro Bellas Artes con todas las funciones repletas. El honor m\xc3\xa1s grande, haber visto a los mil espectadores aplaudiendo de pie. Esta es mi felicidad. https://t.co/4ZxMOTzJpg'"
1201158015359078401,2019-12-01 15:16:01+00:00,b'El cerebro funciona desde que naces y hasta que te enamoras.'
1201002498338754560,2019-12-01 04:58:03+00:00,"b'Doble funci\xc3\xb3n hoy, dos mil espectadores y cierre con un aplauso que llena el coraz\xc3\xb3n. \xc2\xa1GRACIAS Bogot\xc3\xa1! Ma\xc3\xb1ana domingo \xc3\xbaltima presentaci\xc3\xb3n a las 3pm. Info: https://t.co/atnzsDgKrP https://t.co/PHLhxSSmqe'"
1200780379789103106,2019-11-30 14:15:26+00:00,"b'S\xc3\xad creo en el amor eterno a primera vista, la prueba es mi mam\xc3\xa1.'"
1200632066313986048,2019-11-30 04:26:05+00:00,"b'Infinitas GRACIASSSSS, Bogot\xc3\xa1. \xc2\xa1Funci\xc3\xb3n a reventar! Mi coraz\xc3\xb3n qued\xc3\xb3 lleno de felicidad por su cari\xc3\xb1o y apoyo. \xc3\x9altimas presentaciones este fin de semana. Info: https://t.co/atnzsDgKrP https://t.co/GyU4NNlvag'"
1200494588865261583,2019-11-29 19:19:48+00:00,b'Admiro a la gente que sabe bailar merengue sin fisurarse el coxis.'
1200404592602824704,2019-11-29 13:22:11+00:00,b'\xc2\xbfCu\xc3\xa1ndo van a marchar pac\xc3\xadficamente pero a trabajar?'
1200043734102106112,2019-11-28 13:28:16+00:00,"b'Influenciadora, mi abuela.'"
1199883874886733824,2019-11-28 02:53:03+00:00,b'\xc2\xbfQue el tiempo pasa volando? Me cuentan cuando se encuentren al ex en un ascensor.'
1199766614687854592,2019-11-27 19:07:06+00:00,"b'Fui elegida como imagen de @iShopCol y #Apple \nYa tengo el IPhone 11 Pro, as\xc3\xad que voy a regalarle a alguno de uds mi cel  anterior, un IPhoneX en excelente estado. Si quieren gan\xc3\xa1rselo, vayan a mi cuenta de Instagram @laazcarateoficial y sigan un par de pasos sencillos.'"
1199532954487263233,2019-11-27 03:38:37+00:00,b'Seguiremos sangrando de muchos colores.  https://t.co/TS6YG6qVz4'
1199449348918132737,2019-11-26 22:06:24+00:00,"b'Ingratitud, eso que casi siempre se recibe cuando se ha dado todo.'"
1199282431037202432,2019-11-26 11:03:07+00:00,b'En este pa\xc3\xads el peligro de un acto vand\xc3\xa1lico se mide en cent\xc3\xadmetros.'
1199175497709694976,2019-11-26 03:58:12+00:00,"b'Ellos creen que por no escucharnos, nosotras vamos a dejar de hablarles.'"
1198774876187873285,2019-11-25 01:26:17+00:00,"b'Si quieres saber lo que piensan de ti, m\xc3\xadralos, no los oigas.'"
1198264963175010304,2019-11-23 15:40:04+00:00,b'No difundo el video de \xe2\x80\x9cEpa\xe2\x80\x9d porque no le cabe el Colombia. La fiscal\xc3\xada debe tomar acci\xc3\xb3n frente a esa v\xc3\xa1ndala. \xc2\xbfEse es el ejemplo de un figur\xc3\xadn digital? Que esto nos sirva para replantear el concepto de lo que es un influenciador.'
1197406870044106752,2019-11-21 06:50:19+00:00,b'A uno solo le parece intenso el que no le gusta.'
1197028929724391427,2019-11-20 05:48:31+00:00,"b'Cuando una mujer expone su edad con aparente orgullo y alegr\xc3\xada, en el fondo existe una profunda inseguridad. Cuando no la revela, un hondo temor a ser evaluada. La verdadera tranquilidad la tienen quienes no viven pendientes de eso y por ende son atemporales.'"
1196639047512477698,2019-11-19 03:59:16+00:00,"b'Ropa, pinta, vestuario, ajuar, indumentaria, atuendo, percha, ropaje, atav\xc3\xado, prenda, conjunto. \xc2\xbfPor qu\xc3\xa9 \xe2\x80\x9caufi\xe2\x80\x9d? \xc2\xbfPor qu\xc3\xa9?'"
1196578035429978113,2019-11-18 23:56:49+00:00,b'La perversidad es f\xc3\xa1cilmente detectable en la extrema amabilidad.'
1196262316553244672,2019-11-18 03:02:16+00:00,b'Todos nuestros padres pensaron que \xc3\xa9ramos los m\xc3\xa1s inteligentes hasta que crecimos para demostrarles lo contrario.'
1195821634155925506,2019-11-16 21:51:09+00:00,"b'\xe2\x80\x9cEn mi humilde opini\xc3\xb3n le digo que...\xe2\x80\x9d\nNo es humilde, es la suya, dele valor.'"
1195383283070070784,2019-11-15 16:49:18+00:00,"b'Latin Grammy en Las Vegas, la noche m\xc3\xa1s esperada por los artistas musicales y los nuestros, los colombianos, mandando la parada.\nGRACIAS a la prensa internacional por los generosos comentarios sobre mi vestido de Andr\xc3\xa9s Paj\xc3\xb3n, orgullosamente talento paisa.\n@Bulova https://t.co/mnheLlje6Z'"
1194782659953577984,2019-11-14 01:02:38+00:00,b'Sigue busc\xc3\xa1ndome los defectos para que me reduzcas ese esfuerzo.'
1194555469332828160,2019-11-13 09:59:52+00:00,b'Empezando con total \xc3\xa9xito esta experiencia en los Latin Grammy. En cuatro segundos perd\xc3\xad un d\xc3\xb3lar en Las Vegas. \n@Bulova #Itsbulovatime https://t.co/Q1FHp1FgWy'
1194058743333281792,2019-11-12 01:06:03+00:00,"b'Gracias por tu comentario, me encantar\xc3\xada poder agradarte pero no quiero.'"
1193960047157616640,2019-11-11 18:33:52+00:00,"b'Boston, la ciudad que ocupa una buena parte del ba\xc3\xbal de mis recuerdos. Me voy con funci\xc3\xb3n agotada y p\xc3\xbablico de pie. Un feliz regreso al que fue mi barrio en la \xc3\xa9poca universitaria. https://t.co/9SXLov2XIq'"
1193655459099611137,2019-11-10 22:23:33+00:00,"b'Hasta pronto, Nueva York. La gran manzana que me hace sentir enana. Esta noche, funci\xc3\xb3n agotada en Boston. https://t.co/76E9WFWG3z'"
1193311406755635200,2019-11-09 23:36:24+00:00,b'GRACIAS a todo el p\xc3\xbablico de NYork por haberme regalado una gran noche. Teatro reventado y p\xc3\xbablico de pie aplaudiendo. \xc2\xa1La felicidad absoluta! https://t.co/4lk9WGKSD8'
1192645728553885696,2019-11-08 03:31:14+00:00,b'La vida cambia en un minuto y se va en un segundo. @Bulova #Itsbulovatime https://t.co/LtGqekQVNk'
1191952098323247104,2019-11-06 05:35:00+00:00,b'Menos mal en esta relaci\xc3\xb3n se nos sali\xc3\xb3 todo de las manos y no algo puntual porque eso s\xc3\xad ser\xc3\xada grave.'
1191759802935992322,2019-11-05 16:50:53+00:00,b'Los buenos hijos damos amor pero no devolvemos el tiempo. \nMam\xc3\xa1s: \xc2\xa1Vivan!'
1191553477849292802,2019-11-05 03:11:01+00:00,"b'Les comparto mi experiencia en la Comuna 13 de Medell\xc3\xadn. Un lugar que gracias a su transformaci\xc3\xb3n, hoy es ejemplo y despierta la esperanza.  https://t.co/5SHYbi2sfv'"
1191434008074313729,2019-11-04 19:16:17+00:00,b'He perdido amigos por haberles dicho duro la verdad. Lo duro para ellos ha sido haber perdido una amiga de verdad.'
1190840318792544256,2019-11-03 03:57:11+00:00,"b'Caras vemos, secretos no sabemos.'"
1189984804940525570,2019-10-31 19:17:41+00:00,b'Felicidades y un gran abrazo a quienes hoy celebran el d\xc3\xada internacional del puti disfraz.'
1189290581094256641,2019-10-29 21:19:05+00:00,"b'NADIE, absolutamente NADIE debe avergonzarse por besar a quien ama.'"
1189217337028861953,2019-10-29 16:28:02+00:00,b'En el c\xc3\xb3digo de la traici\xc3\xb3n lo que cuenta es la causa.'
1188997006754271232,2019-10-29 01:52:31+00:00,b'No es a qui\xc3\xa9n le has entregado tus a\xc3\xb1os sino con qui\xc3\xa9n los has disfrutado.'
1188611376543096832,2019-10-28 00:20:10+00:00,"b'Cuando nada es seguro, todo es posible porque depende del tiempo. @Bulova #Itsbulovatime https://t.co/ggURDfR0xY'"
1188548982622113793,2019-10-27 20:12:14+00:00,"b'Yo no boto mi opini\xc3\xb3n, por eso voto.'"
1188215536867512321,2019-10-26 22:07:14+00:00,"b'Si no me aportas, no me importas.'"
1187753646605455361,2019-10-25 15:31:51+00:00,"b'Tienes mucha moral, poca voluntad y cero memoria.'"
1187177629323010048,2019-10-24 01:22:58+00:00,b'Les comparto un peque\xc3\xb1o adelanto de este proyecto que saldr\xc3\xa1 del horno el prox 13 de Nov a las 10pm en Discovery Home and Health en se\xc3\xb1al para toda Latinoam\xc3\xa9rica. https://t.co/TBIA4zCYVq'
1187073480224858115,2019-10-23 18:29:07+00:00,b'Hay respuestas que siempre hacen llorar.'
1186434980064452608,2019-10-22 00:11:56+00:00,b'Los que tanto esculcan las vidas ajenas tienen muchos guardados.'
1186101028753723392,2019-10-21 02:04:56+00:00,b'La buena fiesta deja malas consecuencias.'
1185231379338088448,2019-10-18 16:29:16+00:00,"b'El celular se nos volvi\xc3\xb3 el tercer brazo, por eso #MiMejorRegalo es el Iphone11 que ya est\xc3\xa1 en Ishop. Lo estoy esperando con mo\xc3\xb1o...'"
1184616426008649728,2019-10-16 23:45:39+00:00,b'Todo el mundo quiere que te vaya bien pero no mejor que a ellos.'
1184159236122656768,2019-10-15 17:28:57+00:00,b'Los espero en Ciudad de M\xc3\xa9xico. https://t.co/9OAoWNSZH0'
1184106513587007490,2019-10-15 13:59:27+00:00,b'Somos un c\xc3\xbamulo de recuerdos intentando vivir el presente.'
1183883786842525696,2019-10-14 23:14:24+00:00,"b'El Eje Cafetero, una de las regiones m\xc3\xa1s hermosas de nuestro pa\xc3\xads. \nEste espacio se llama \xe2\x80\x9cParan\xc3\xa1 Hotel Boutique\xe2\x80\x9d es una casona t\xc3\xadpica con un paisaje estupendo, ideal para descansar y disfrutar la belleza de Colombia. Info: Lina Cardona (312) 432-2820 https://t.co/wTGlVaBu2s'"
1183736478666543104,2019-10-14 13:29:03+00:00,b'Vivo tambaleando en el hasta hoy y desde hoy.'
1183375605502566400,2019-10-13 13:35:05+00:00,"b'Nada sucede sin una finalidad precisa. El simple hecho de que algo ocurra, tiene de por s\xc3\xad un prop\xc3\xb3sito.'"
1182614592821837824,2019-10-11 11:11:05+00:00,b'Se nos va la vida deseando otra.'
1182083867395678210,2019-10-10 00:02:10+00:00,"b'G\xc3\xb6reme, Capadocia. (Turqu\xc3\xada) https://t.co/oYSVty34U5'"
1181839628791365632,2019-10-09 07:51:39+00:00,"b'Hay errores caros, baratos y otros que se pagan en m\xc3\xb3dicas cuotas el resto de la vida.'"
1180991246204059648,2019-10-06 23:40:29+00:00,b'Todos estamos esperando a ver qu\xc3\xa9 con esa situaci\xc3\xb3n que hemos sido incapaces de resolver.'
1180588534589034497,2019-10-05 21:00:15+00:00,"b'El B\xc3\xb3sforo, estrecho que conecta el Mar Negro con el de M\xc3\xa1rmara. Turqu\xc3\xada fascinante. https://t.co/G1BZ1qDMqi'"
1180119355369099264,2019-10-04 13:55:54+00:00,b'La br\xc3\xbajula de la intuici\xc3\xb3n jam\xc3\xa1s pierde el norte.'
1179328775852642305,2019-10-02 09:34:25+00:00,b'Estambul \xf0\x9f\x87\xb9\xf0\x9f\x87\xb7 https://t.co/irTALuwGGC'
1178809593255911424,2019-09-30 23:11:22+00:00,b'En la categor\xc3\xada de placeres perversos est\xc3\xa1 el saber que te hago falta.'
1178402991252094976,2019-09-29 20:15:41+00:00,"b'Adivinanza: Si uno permite que alguien se la quite, se jode. \nLos leo desde Madrid \xe2\x9d\xa4\xef\xb8\x8f... https://t.co/GvdKvS81g6'"
1178091299221725184,2019-09-28 23:37:08+00:00,"b'Madrid, mi ciudad favorita. Vacaciones sin restricciones. https://t.co/lrn77kGeg0'"
1177544673688268801,2019-09-27 11:25:02+00:00,b'Las deudas con uno mismo no se pagan a cuotas.'
1177204910087184385,2019-09-26 12:54:56+00:00,b'Mi mente me sac\xc3\xb3 el cuerpo.'
1176613584022974464,2019-09-24 21:45:13+00:00,"b'El nunca no existe y el siempre, menos.'"
1176206555102027778,2019-09-23 18:47:50+00:00,b'Las metidas de pata enderezan nuestros pasos.'
1175275652674674689,2019-09-21 05:08:45+00:00,b'Un pol\xc3\xadgrafo es una mujer con cables.'
1174746825145888772,2019-09-19 18:07:23+00:00,b'Las mejores historias son las que no se pueden contar.'
1174538682092675074,2019-09-19 04:20:18+00:00,"b'Los que se autodenominan como \xe2\x80\x9cgente bien\xe2\x80\x9d, rara vez son gente de bien.'"
1174317217707646976,2019-09-18 13:40:17+00:00,b'Un personaje nace de las letras. Se fue Betty pero jam\xc3\xa1s Gait\xc3\xa1n.'
1174034798593159169,2019-09-17 18:58:03+00:00,b'Eres mi mejor error y yo tu peor acierto.'
1173404006804316161,2019-09-16 01:11:30+00:00,b'Amor es saber que estoy haciendo algo por tu bien aunque me cueste l\xc3\xa1grimas.'
1172821144124059648,2019-09-14 10:35:25+00:00,b'Quise ofrecerte un mejor futuro sin entender que te satisfac\xc3\xada tu presente.'
1172726982582448128,2019-09-14 04:21:15+00:00,b'Los problemas son pasajeros as\xc3\xad uno sienta que llevan el tim\xc3\xb3n.'
1172365236289953792,2019-09-13 04:23:48+00:00,b'Estamos cortados por la misma tijera oxidada.'
1171722709396545536,2019-09-11 09:50:38+00:00,"b'Los espejos de los ascensores fueron creados por un psic\xc3\xb3logo, uno se mira y necesita terapia.'"
1171630970635767809,2019-09-11 03:46:05+00:00,b'Somos tan tibios que la alegr\xc3\xada ante la merecida desgracia ajena la llamamos \xe2\x80\x9cfresquito\xe2\x80\x9d.'
1171441674058268672,2019-09-10 15:13:54+00:00,b'La curiosidad es f\xc3\xa9rtil pero la b\xc3\xbasqueda es est\xc3\xa9ril.'
1171197218226868224,2019-09-09 23:02:31+00:00,b'Nuestra historia tiene luz sin una sola letra.'
1170782521296064514,2019-09-08 19:34:39+00:00,"b'Cuando a uno le dicen: \xe2\x80\x9cEl problema no es con usted\xe2\x80\x9d, s\xc3\xad es con usted.'"
1170484356516913158,2019-09-07 23:49:51+00:00,b'Dando una vuelta por mi s\xc3\xb3tano a ver si encuentro el \xc3\xa1nimo.'
1170205797852286978,2019-09-07 05:22:58+00:00,b'Se necesita mucha agua para tomar decisiones.'
1169746149445656582,2019-09-05 22:56:29+00:00,b'Todos tenemos un muerto en el ba\xc3\xbal.'
1169439123557560320,2019-09-05 02:36:28+00:00,b'No puedo con el granito de arena.'
1168854335192743936,2019-09-03 11:52:44+00:00,b'Te felicito. fue un \xc3\xa9xito tu cirug\xc3\xada de escr\xc3\xbapulos.'
1167308143488991232,2019-08-30 05:28:43+00:00,b'Me estoy equivocando con tanta frecuencia que estoy por creer que voy bien.'
1166468579883192321,2019-08-27 21:52:36+00:00,"b'El domingo 8 de Sept necesitamos que nos ayuden a ayudar. 20 comediantes en el Movistar Arena apoyando a los ni\xc3\xb1os de la Guajira y Bol\xc3\xadvar, entradas en https://t.co/u3wi0SfAOv \n#are\xc3\xadrconcausa Tenemos que vender siete mil entradas para lograr la meta. @AlejandroRia'"
1164357871150227465,2019-08-22 02:05:23+00:00,"b'Aunque en la vida uno se muere muchas veces, solo lo entierran una.'"
1164038886600974336,2019-08-21 04:57:52+00:00,b'Uno besa primero con los ojos.'
1163888466540847108,2019-08-20 19:00:09+00:00,"b'Alejandro Ria\xc3\xb1o y su hermana Mar\xc3\xada dise\xc3\xb1aron este proyecto y ya es una realidad. Veinte comediantes en un mismo escenario, unidos para apoyar a los ni\xc3\xb1os m\xc3\xa1s necesitados de la Guajira y Cartagena. Funci\xc3\xb3n en el Movistar Arena este 8 de Sept, entradas en wwwtuboleta https://t.co/DmbaNqrmsL'"
1163855613966856192,2019-08-20 16:49:36+00:00,"b'Yo no te pago con la misma moneda devaluada, la vida suele cobrarte a un mejor precio.'"
1162845549160280064,2019-08-17 21:55:58+00:00,"b'Entre m\xc3\xa1s tiempo llevo siendo su esposa, m\xc3\xa1s disfruto sinti\xc3\xa9ndome su novia.'"
1162592890637488129,2019-08-17 05:11:59+00:00,"b'Como en el amor, a todos los chicles se les va el sabor.'"
1162418370018516993,2019-08-16 17:38:30+00:00,"b'Mi abogado @DELAESPRIELLAE tom\xc3\xb3 las acciones pertinentes y ahora esto est\xc3\xa1 en sus manos @FiscaliaCol @DIJINPolicia Hecha la denuncia por estafa en masa y suplantaci\xc3\xb3n en sitios web. De uds depende frenar a AUVELA, esta red de fraude internacional que vende cremas faciales falsas'"
1161785993768439811,2019-08-14 23:45:40+00:00,b'Yo no prometo nada porque me comprometo a todo.'
1161406055684935682,2019-08-13 22:35:56+00:00,b'Hay ca\xc3\xaddas que tumban y otras que impulsan.'
1160644591755902976,2019-08-11 20:10:09+00:00,"b'En tiempos de falta de certezas y significados destrozados, no hay otro camino que el de las convicciones.'"
1159891488970596355,2019-08-09 18:17:35+00:00,"b'Uno es lo que hace, no lo que dice.'"
1158806590327283712,2019-08-06 18:26:35+00:00,"b'Con titulares amarillistas, fotos intervenidas y noticias falsas, la marca \xe2\x80\x9cAUVELA\xe2\x80\x9d est\xc3\xa1 usando mi nombre para vender cremas faciales. \xc2\xa1Ojo! Les debitan hasta 4 veces el valor establecido, no reciben nada a cambio y les clonan las tarjetas. ES UNA RED INTERNACIONAL DE ESTAFA.'"
1158551120089931776,2019-08-06 01:31:26+00:00,"b'Si me caes mal, ojal\xc3\xa1 se me note.'"
1158199048307978241,2019-08-05 02:12:26+00:00,b'Siempre ser\xc3\xa1s mi de pronto.'
1158042972501479425,2019-08-04 15:52:14+00:00,b'No hay nada repartido de modo m\xc3\xa1s equitativo que nuestra capacidad para juzgar a los dem\xc3\xa1s.'
1157539290026586112,2019-08-03 06:30:47+00:00,b'La gente siempre sale feliz de mi mon\xc3\xb3logo. \nFunci\xc3\xb3n repleta esta noche en el gran teatro Morelos de Morelia (M\xc3\xa9xico). https://t.co/WomvuSVR6g'
1157072410434244609,2019-08-01 23:35:34+00:00,"b'Si as\xc3\xad soy rayada, no s\xc3\xa9 licuada.'"
1156566745085333505,2019-07-31 14:06:14+00:00,b'Busco gente seria para poder re\xc3\xadrme.'
1156051220890562560,2019-07-30 03:57:44+00:00,b'- \xc2\xbfQu\xc3\xa9 es lo primero que le miras a un hombre? \n- La pareja.'
1155145229734961152,2019-07-27 15:57:38+00:00,b'La juventud es un estado de \xc3\xa1nimo.'
1154915298925043713,2019-07-27 00:43:59+00:00,b'Darse gusto es regalarse vida.'
1154769629547507712,2019-07-26 15:05:08+00:00,b'Me encanta tenerme en tan mal concepto.'
1154461163540926465,2019-07-25 18:39:24+00:00,b'Qu\xc3\xa9 rico es encontrarse a alguien y no tener que saludarlo.'
1153529583582552065,2019-07-23 04:57:38+00:00,b'Miro de lado para irme de frente.'
1152811843263639552,2019-07-21 05:25:36+00:00,"b'Si te sueno a canci\xc3\xb3n, estoy en tu coraz\xc3\xb3n.'"
1151877563758911489,2019-07-18 15:33:06+00:00,"b'El rotundo \xc3\xa9xito de \xe2\x80\x9cBetty la fea\xe2\x80\x9d comprueba que la calidad es atemporal. Sin narcos, balas, prepagos, vulgaridad ni ordinarieces, esta historia es y seguir\xc3\xa1 siendo la reina indestronable de las novelas colombianas. Un verdadero escritor jam\xc3\xa1s muere. #PorsiempreGait\xc3\xa1n'"
1151680414211346437,2019-07-18 02:29:42+00:00,b'B\xc3\xbascame cuando me necesites pero no me jodas.'
1150950456744730626,2019-07-16 02:09:07+00:00,"b'- \xc2\xbfQu\xc3\xa9 ganas con ayudar a los dem\xc3\xa1s? \n- Mucho, soy feliz.'"
1150570153815490560,2019-07-15 00:57:55+00:00,"b'Estoy empezando a identificarme con la m\xc3\xbasica electr\xc3\xb3nica, creo que me qued\xc3\xa9 sin letra.'"
1150491390582951936,2019-07-14 19:44:57+00:00,b'Lo que una mujer le critica a otra es el resultado de su auto an\xc3\xa1lisis.'
1150095393767792647,2019-07-13 17:31:24+00:00,b'Quien ataca por la espalda sabe que de frente no es capaz.'
1149066990193008640,2019-07-10 21:24:53+00:00,b'Ojal\xc3\xa1 uno tuviera la percepci\xc3\xb3n de dignidad de un deudor. Se le cobra y se ofende.'
1148788693748125696,2019-07-10 02:59:02+00:00,"b'El perd\xc3\xb3n conlleva la esperanza de un cambio, por ende hay resistencia y memoria. La aceptaci\xc3\xb3n es libertad y deriva en tranquilidad. Es ah\xc3\xad cuando se vuelve posible la pasada de cualquier p\xc3\xa1gina. https://t.co/HcyYZPHsw9'"
1148231259942019072,2019-07-08 14:04:00+00:00,"b'Si no hablas conmigo, no hables de m\xc3\xad.'"
1147889697034838016,2019-07-07 15:26:45+00:00,b'No me vuelvo a tomar ni la molestia.'
1146637253872979969,2019-07-04 04:29:59+00:00,"b'El tiempo no cura, ubica. https://t.co/iszl6hzfTo'"
1146262834541670406,2019-07-03 03:42:10+00:00,b'La dificultad es el \xc3\xbanico terreno que nos pertenece a todos.'
1146096997709074435,2019-07-02 16:43:12+00:00,"b'Coquetear es un intento, evidenciarlo es un fracaso.'"
1145868922874408960,2019-07-02 01:36:55+00:00,b'- \xc2\xbfY qu\xc3\xa9 tal el tipo? \n- Es financieramente fr\xc3\xa1gil.'
1145020647623593986,2019-06-29 17:26:10+00:00,b'Los golpes de pecho hay que d\xc3\xa1rnoslos primero en la cabeza.'
1144661259184422912,2019-06-28 17:38:05+00:00,"b'Me llevo la luz de Guadalajara en una funci\xc3\xb3n a reventar. S\xc3\xa1bado 29, Monterrey en el Auditorio R\xc3\xado. \nInfo: Arema Ticket https://t.co/DwhcymnhBD'"
1144356065770975246,2019-06-27 21:25:21+00:00,b'Si vives pendiente de lo que hago es porque t\xc3\xba no has podido o ya quisieras.'
1143368392658817029,2019-06-25 04:00:42+00:00,"b'En un noviazgo, el puente es un amague de convivencia.'"
1142816035772555264,2019-06-23 15:25:50+00:00,"b'Enamorarse, como todo suceso inesperado, surge cuando corresponde.'"
1142231193523560448,2019-06-22 00:41:52+00:00,"b'Nada mejor un viernes cultural, que encontrar con quien perder los modales.'"
1141816721067655176,2019-06-20 21:14:54+00:00,"b'Cuando se sienten pasos de animal grande, no hay que buscar otro culpable al tener la pata encima.'"
1141153305466421248,2019-06-19 01:18:44+00:00,b'Cansa defender lo que cuesta conservar.'
1141020993793773574,2019-06-18 16:32:58+00:00,b'La imaginaci\xc3\xb3n provoca el acontecimiento.'
1140834884983951361,2019-06-18 04:13:26+00:00,"b'Funciones Junio: \n-Bquilla. Jueves 20, Teatro Jos\xc3\xa9 Consuegra. Tuboleta \n3219116534\n-Medell\xc3\xadn. S\xc3\xa1bado 22, Teatro U de Medell\xc3\xadn. Tuboleta \n3219116534\n-Guadalajara. Jueves 27, Teatro Galer\xc3\xadas. Ticketmaster \n-Monterrey. S\xc3\xa1bado 29, Auditorio R\xc3\xado. Arema ticket https://t.co/rGAdmEaEhC'"
1140689361870163968,2019-06-17 18:35:11+00:00,b'Soy paciente. Frase que suelo decirme mientras miro hacia arriba y aprieto los dientes.'
1140373531487801344,2019-06-16 21:40:11+00:00,"b'Para que nada nos separe, que el amor no nos una.'"
1139987308801863681,2019-06-15 20:05:29+00:00,"b'No lo dejes pasar, que te va a pesar.'"
1139922691216072704,2019-06-15 15:48:42+00:00,"b'Todos tenemos la libertad de expresarnos pero cuando emitimos una opini\xc3\xb3n no pedida, caemos en la intromisi\xc3\xb3n innecesaria.'"
1139541851646697474,2019-06-14 14:35:23+00:00,b'\xe2\x80\x9cLa verdad duele\xe2\x80\x9d. Qu\xc3\xa9 premisa tan equivocada la que nos ense\xc3\xb1aron. Lo que deber\xc3\xada doler es la mentira.'
1138861848684564481,2019-06-12 17:33:18+00:00,"b'Hay que ser optimista, siempre vendr\xc3\xa1n cosas peores.'"
1138593859007651845,2019-06-11 23:48:24+00:00,"b'En Facebook te siguen por chismosear, en Instagram por c\xc3\xb3mo te ves y en Twitter por lo que piensas. \xc2\xbfD\xc3\xb3nde tienes m\xc3\xa1s seguidores?'"
1138315672725929984,2019-06-11 05:22:59+00:00,b'Las dificultades son del tama\xc3\xb1o que uno elija verlas.'
1138168733053198336,2019-06-10 19:39:06+00:00,b'T\xc3\xba + yo = X'
1138098971472289792,2019-06-10 15:01:54+00:00,"b'RT @WRadioColombia: Alejandra Azc\xc3\xa1rate (@LAAZCARATE), todera en la industria del entretenimiento, es #UnaMujerW | Por @ma_camiladiaz | Link\xe2\x80\xa6'"
1137922436933050370,2019-06-10 03:20:25+00:00,"b'La creatividad nace de la curiosidad, por eso los chismosos son tan efectivos.'"
1137557346677329920,2019-06-09 03:09:40+00:00,"b'Si no te llama cuando est\xc3\xa1 borracho, fracasaste como ex.'"
1137363169578536962,2019-06-08 14:18:05+00:00,b'La risa nos llev\xc3\xb3 a la cama.'
1136462830968999938,2019-06-06 02:40:28+00:00,"b'Por su propio bien, lo \xc3\xbanico que uno debe tomar son decisiones.'"
1135695180462526471,2019-06-03 23:50:05+00:00,"b'Lleg\xc3\xb3 el verano a este lado del mundo y con \xc3\xa9l, la alegr\xc3\xada a mi coraz\xc3\xb3n al haber cerrado esta gira de funciones por Europa con todos los aforos en Par\xc3\xads, Madrid, Londres y Barcelona, agotados. \nGratitud absoluta. https://t.co/VLuVV8DoG0'"
1135014075233198080,2019-06-02 02:43:37+00:00,b'Le colgu\xc3\xa9 al miedo y me est\xc3\xa1 llamando la felicidad. \nFunci\xc3\xb3n AGOTADA en \xe2\x80\x9cThe Auditorium\xe2\x80\x9d de Londres. https://t.co/le6hvsdgCb'
1134632588293935104,2019-06-01 01:27:44+00:00,b'Otra estaci\xc3\xb3n en mi camino con un sue\xc3\xb1o m\xc3\xa1s cumplido. Funci\xc3\xb3n AGOTADA esta noche en el gran teatro Infanta Isabel de Madrid. https://t.co/V9ZAGyUhxH'
1134274468589838345,2019-05-31 01:44:41+00:00,"b'Cuando un anhelo lejano se convierte en realidad, uno entiende que ma\xc3\xb1ana es hoy. El presente es lo \xc3\xbanico que hay. \nFunci\xc3\xb3n AGOTADA en el Teatro Palais des Glaces en Par\xc3\xads. https://t.co/Hv1P1bBUYD'"
1133771035025772552,2019-05-29 16:24:13+00:00,"b'Desde que haya locura, todo est\xc3\xa1 sano.'"
1133163033893711872,2019-05-28 00:08:15+00:00,"b'Nuestra vida tiene su propia banda sonora. Prep\xc3\xa1rense para recordar en el festival \xe2\x80\x9cCassette\xe2\x80\x9d el 24 de Agosto. Flans,Miguel Mateos, Ilegales, Proyecto1, Poligamia,Moenia y m\xc3\xa1sss \nEntradas en Tuboleta, descuento de 20% con Bancos Aval https://t.co/oCodgqRpce'"
1132511899483103233,2019-05-26 05:00:52+00:00,"b'El amor, esa enfermedad incurable que lo cura todo.'"
1132030491668963328,2019-05-24 21:07:55+00:00,"b'Uno solo descubre qu\xc3\xa9 tan vulnerable es, hasta que ve sufrir a quien m\xc3\xa1s ama.'"
1131043325182644230,2019-05-22 03:45:17+00:00,"b'Cuando uno entiende que la vida es un segundo, aprende a valorar su tiempo.'"
1130923446056169473,2019-05-21 19:48:55+00:00,b'Los espero en el Teatro Jorge Isaacs de Cali este s\xc3\xa1bado 25 de Mayo. \xe2\x80\x9cDesc\xc3\xa1rate con la Azc\xc3\xa1rate\xe2\x80\x9d \nInfo: 3158809027 y 6611111 https://t.co/i2EdKUprPn'
1130514531552309249,2019-05-20 16:44:02+00:00,b'La disculpa es el disfraz de la culpa.'
1129750772248399872,2019-05-18 14:09:08+00:00,"b'\xe2\x80\x9cDesc\xc3\xa1rate con la Azc\xc3\xa1rate en Europa\xe2\x80\x9d \nPar\xc3\xads: Mayo30, Teatro Palais des Glaces. Inf 0142022717\nMadrid: Mayo 31, Teatro Infanta Isabel. Inf 915210212\nLondres: Junio 1, Teatro The Auditorium. Inf 07873435444\nBarcelona: Junio 2, Auditorio Up&amp;Down +34 672 34 06 36 https://t.co/fqVFII0P4N'"
1129366527961178112,2019-05-17 12:42:17+00:00,b'Hoy es viernes de: \xe2\x80\x9cPerd\xc3\xad la depilada\xe2\x80\x9d.'
1129243595423326208,2019-05-17 04:33:48+00:00,"b'Cuando uno es bueno en su trabajo no se cansa. Cuando es mediocre, vive cansado.'"
