twitter_id,date,tweet
701206890181738496,2016-02-21 00:48:45+00:00,"b'Atardecer celebrando. Funci\xc3\xb3n agotada esta noche en el Centro de Convenciones. Mil, mil y mil GRACIAS Cartagena! https://t.co/eoJqzu2QSx'"
700553082279690240,2016-02-19 05:30:45+00:00,b'Me encanta la madurez de nuestra relaci\xc3\xb3n infantil.'
700531300160159744,2016-02-19 04:04:11+00:00,b'El ego trastea del curubito al sepulcro'
700491134414487552,2016-02-19 01:24:35+00:00,b'Naturaleza femenina https://t.co/cdkXDzOB8N'
700374731485265920,2016-02-18 17:42:02+00:00,b'Mi \xc3\xbanico proyecto de vida es vivirla.'
700324613918744577,2016-02-18 14:22:54+00:00,"b'Duele ver que en nuestro pa\xc3\xads, lo privado se vuelve p\xc3\xbablico y lo p\xc3\xbablico se esconde en privado'"
700128257912545280,2016-02-18 01:22:39+00:00,b'Much\xc3\xadsimas GRACIAS a todas las personas generosas y desparchadas que votaron por m\xc3\xad en los #ChoiceAwardsColombia \xf0\x9f\x98\x89 https://t.co/tfpKY5eixl'
700052240023887873,2016-02-17 20:20:35+00:00,b'De nada sirven los planes ante los encuentros inesperados.'
700012040837009409,2016-02-17 17:40:50+00:00,b'Puesto vacante en el vice ministerio de los interiores'
699976831580180480,2016-02-17 15:20:56+00:00,b'Mal d\xc3\xada para proponer matrimonio. Al que le encuentren el anillo se le va hondo.'
699724150613680129,2016-02-16 22:36:52+00:00,"b'Desde que cumplan con su labor, que hagan lo que quieran con su bolillo'"
699623684529614848,2016-02-16 15:57:39+00:00,"b'Ya casi, qu\xc3\xa9 emoci\xc3\xb3n! ""Desc\xc3\xa1rate con la Azc\xc3\xa1rate"" en M\xc3\xa9xico. MONTERREY Jueves 3 de Marzo 8pm en\xe2\x80\xa6 https://t.co/07ZAEsxs6U'"
699296105167765509,2016-02-15 18:15:58+00:00,"b'En el momento preciso aparecer, en el indicado desaparecer y lograr siempre estar.'"
699230409633169408,2016-02-15 13:54:55+00:00,b'Exprimiendo cada segundo con la certeza de que nunca me va a volver a pasar.'
698984325530914816,2016-02-14 21:37:04+00:00,b'Amor. https://t.co/h1JIJxoVKe'
698944938738896896,2016-02-14 19:00:33+00:00,b'Entenderme no es problema m\xc3\xado.'
698857352649424896,2016-02-14 13:12:31+00:00,b'Le pone emoci\xc3\xb3n a la vida saber que alguien se muere por ti.'
698580370724356096,2016-02-13 18:51:54+00:00,b'Somos lo peor y cada vez la pasamos mejor.'
698416713751228416,2016-02-13 08:01:35+00:00,b'S\xc3\xb3lo el verdadero amor logra que despu\xc3\xa9s de darlo todo uno se sienta lleno.'
698176539712733185,2016-02-12 16:07:13+00:00,b'Con una enorme felicidad recibo mi nominaci\xc3\xb3n como mejor actriz antag\xc3\xb3nica en los premios India\xe2\x80\xa6 https://t.co/jdfqK49agk'
698149757458452480,2016-02-12 14:20:47+00:00,b'No quiero cucarachas en mi cabeza sino mariposas en mi panza.'
697977397887504384,2016-02-12 02:55:54+00:00,"b'Por favor si alguien lo ha visto o sabe algo, comun\xc3\xadquense urgente al cel que aparece en la foto https://t.co/U2Jw4zcwYo'"
697840596682219520,2016-02-11 17:52:18+00:00,"b'Si funciona entre el carro, va sobre ruedas.'"
697483581380284417,2016-02-10 18:13:39+00:00,b'Aqu\xc3\xad voy un poco despelucada https://t.co/K86RPtpJNh'
696734349283217409,2016-02-08 16:36:28+00:00,b'Tan simple y dif\xc3\xadcil que es entender lo que el otro necesita.'
696593241878220800,2016-02-08 07:15:45+00:00,"b'El insomnio es contagioso, telep\xc3\xa1tico y comunicativo.'"
696403583911206912,2016-02-07 18:42:07+00:00,b'Domingo. https://t.co/CjcHjXL0w8'
696226229154934784,2016-02-07 06:57:22+00:00,b'Me genera inestabilidad lo que se empieza a volver estable.'
696029037202948098,2016-02-06 17:53:48+00:00,"b'Desde chiquita me ha pasado algo muy especial. Cuando llegu\xc3\xa9 a la adolescencia, de forma\xe2\x80\xa6 https://t.co/XwGPVyJoZi'"
695978789667540993,2016-02-06 14:34:08+00:00,b'Como detractor eres un tierno seguidor. Sigue al fondo a la derecha'
695848816835239936,2016-02-06 05:57:40+00:00,"b'Si de d\xc3\xada tengo malas ideas, de noche son p\xc3\xa9simas.'"
695793196962594821,2016-02-06 02:16:40+00:00,"b'Hoy es viernes de : ""Qu\xc3\xa9date fresco que no me voy a mover de mi casa"".'"
695716080921268225,2016-02-05 21:10:14+00:00,b'Linda iron\xc3\xada cuando alguien con la intenci\xc3\xb3n de generar un da\xc3\xb1o termina haciendo un favor'
695639212805201922,2016-02-05 16:04:47+00:00,"b'Sin importar cu\xc3\xa1l sea su oficio, uno debe estar con el que sienta que es el mejor en lo que hace.'"
695387727479504896,2016-02-04 23:25:28+00:00,"b'Los rega\xc3\xb1os, como las buenas oportunidades, lo cogen a uno sentado'"
695335352081321984,2016-02-04 19:57:21+00:00,"b'""Desc\xc3\xa1rate con la Azc\xc3\xa1rate"" en M\xc3\xa9xico! DF S\xc3\xa1b 5 Marzo,teatro Voil\xc3\xa1 Antara Fashion Hall Polanco.Boletas en https://t.co/4DrYEAPzTU 5561437864'"
695302709197553664,2016-02-04 17:47:38+00:00,"b""El bot\xc3\xb3n para bloquear es la escoba de los 80's"""
694842227755974664,2016-02-03 11:17:51+00:00,b'Estamos de paseo entre la vida y la muerte.'
694696316220395521,2016-02-03 01:38:03+00:00,b'No hay nada m\xc3\xa1s cruel con uno mismo que intentar ser lo que los dem\xc3\xa1s quieren'
694524245506969601,2016-02-02 14:14:18+00:00,"b'La seducci\xc3\xb3n es el arte de las transparentes, la coqueter\xc3\xada el de las estrategas y la vulgaridad el de las evidentes'"
694295773299740672,2016-02-01 23:06:26+00:00,b'Despu\xc3\xa9s de amar con locura hay que olvidar con cordura.'
694244659539869697,2016-02-01 19:43:19+00:00,b'Dame la importancia que no merezco y yo te lo agradezco'
694202689673117696,2016-02-01 16:56:33+00:00,"b'El 100% de las ventas de ""El pa\xc3\xads q se hizo posible""Libro de Julio S\xc3\xa1nchez Cristo es para apoyar a mujeres con c\xc3\xa1ncer.Ya tengo el m\xc3\xado y t\xc3\xba?'"
693922808489984000,2016-01-31 22:24:24+00:00,"b'El domingo es un d\xc3\xada selectivo. A diferencia de los otros, no con cualquiera se comparte'"
693471414775615488,2016-01-30 16:30:44+00:00,"b'Hoy ""Desc\xc3\xa1rate con la Azc\xc3\xa1rate"" funci\xc3\xb3n AGOTADA en Bogot\xc3\xa1. Siguientes fechas: Cartagena 20 de\xe2\x80\xa6 https://t.co/KIXDr6rx2b'"
693430937997201411,2016-01-30 13:49:53+00:00,"b'Las ex, como las alergias, se dejan ver siempre en los momentos menos esperados'"
693279405465014272,2016-01-30 03:47:45+00:00,b'Nada de lo que uno tiene repetido es igual.'
693241391951011840,2016-01-30 01:16:42+00:00,b'Exito total el gran lanzamiento de GEF MEN en Medell\xc3\xadn! Nos toc\xc3\xb3 cerrar las puertas porque no\xe2\x80\xa6 https://t.co/AGDHtThsLp'
692904108722769920,2016-01-29 02:56:27+00:00,b'Mariposa y La Do\xc3\xb1a. https://t.co/bVFxNguakP'
692711190473117696,2016-01-28 14:09:52+00:00,b'https://t.co/xaMzv3LF7p https://t.co/DlFkBmFMH7'
692668657336487937,2016-01-28 11:20:51+00:00,b'En minutos estar\xc3\xa9 con Julio S\xc3\xa1nchez Cristo hablando en @WRadioColombia'
692451008212004865,2016-01-27 20:56:00+00:00,b'https://t.co/FvuS3ZoctC'
692409421775896577,2016-01-27 18:10:45+00:00,b'Colombiatex cada a\xc3\xb1o eleva su nivel. Mejor escenario imposible para el gran lanzamiento de GEF MEN hoy en Medell\xc3\xadn. #hablemosdeellos'
692396290249003012,2016-01-27 17:18:34+00:00,"b'Siempre hay un buen motivo para regresar a Medell\xc3\xadn. Hoy, gran lanzamiento de GEF MEN. Piso esta ciudad y hasta el aire es amable'"
692381526462435328,2016-01-27 16:19:54+00:00,b'Lo mejor de no tomarse la vida en serio es re\xc3\xadrse de quienes s\xc3\xad lo hacen'
692372145628942336,2016-01-27 15:42:37+00:00,"b'Yo pues, acosada, acosada, lo q se dice acosada, no la veo. -Ohhh! Astrid Helena. -Ohhh! Jorge Armando. Continuar\xc3\xa1. https://t.co/bTnzLcLNlU'"
692154288248901634,2016-01-27 01:16:56+00:00,b'Entiende mi desorden y volvamos al orden.'
692121611227525120,2016-01-26 23:07:05+00:00,b'Malos? Buenos ? O m\xc3\xa1s o menos? @johana_bahamon danielsampero https://t.co/yjz3MJT0pV'
692120812124508162,2016-01-26 23:03:55+00:00,b'Al cuento del defensor le falta un pedazo. Abuso? Novela? Celos? Venganza? Chats er\xc3\xb3ticos y drama? Cierto o falso?'
692010102941941760,2016-01-26 15:44:00+00:00,b'Tuvimos la qu\xc3\xadmica y nos inventamos la f\xc3\xb3rmula.'
691778066171977731,2016-01-26 00:21:58+00:00,"b'Viendo como te dejaron tus ex, no tengo buena mano sino poder de sanaci\xc3\xb3n.'"
691635319066738690,2016-01-25 14:54:44+00:00,b'Lo que uno no puede decir es en lo \xc3\xbanico que logra pensar.'
691302474414739456,2016-01-24 16:52:08+00:00,b'La cercan\xc3\xada poco tiene que ver con la distancia.'
690980727106752512,2016-01-23 19:33:37+00:00,b'Hay fotos que uno se las quisiera comer a mordiscos.'
690720445130235904,2016-01-23 02:19:21+00:00,b'Enredo cuadrado y chequeo cruzado.'
690340862769917954,2016-01-22 01:11:02+00:00,b'Somos la pareja ideal para no vivir juntos.'
689945957467840512,2016-01-20 23:01:49+00:00,b'El reclamo es un signo de amor femenino.'
689810630824595456,2016-01-20 14:04:05+00:00,b'Tengo una cita para hacer todo lo peor posible.'
689143924737335296,2016-01-18 17:54:49+00:00,b'Par\xc3\xads. https://t.co/zq26RYmLYH'
689112894911475714,2016-01-18 15:51:31+00:00,b'No hay freno para ese arranque incontenible de besar a alguien que nos hace temblar.'
689079519530078209,2016-01-18 13:38:54+00:00,"b'RT @alejovillalobos: Hola.  Feliz lunes.   Hoy regreso 10 am al aire en LA FM 94.9 Bog , audio disponible en https://t.co/yhSUz2XG4x y en a\xe2\x80\xa6'"
688873634639785984,2016-01-18 00:00:47+00:00,b'Bruja en Brujas https://t.co/S6OARmQx9h'
688836203047743488,2016-01-17 21:32:03+00:00,b'Si entiendes mi silencio no hacen falta mis palabras.'
688432475387875328,2016-01-16 18:47:47+00:00,"b'La persona en la mesa que entra en modo h\xc3\xa1mster, guardando la bola de comida en el cachete mientras habla, qu\xc3\xa9? Mastica y ret\xc3\xa9n tu idea'"
687979136216907776,2016-01-15 12:46:22+00:00,b'Las mayores ganancias provienen de los mejores errores.'
687765043103023104,2016-01-14 22:35:38+00:00,b'Prefiero ser pasada que quedada'
687047470749204480,2016-01-12 23:04:16+00:00,b'Yo tengo lo que necesitas y t\xc3\xba sabes lo que no conozco.'
686987944041787392,2016-01-12 19:07:44+00:00,"b'Chamonix, Alpes Suizos. https://t.co/uzq3BVVTev'"
686589428358365184,2016-01-11 16:44:10+00:00,b'Q dicha haberle expresado mi amor y total admiraci\xc3\xb3n a Carlos Mu\xc3\xb1oz en la entrevista que le hice. Hoy siento su ida y acompa\xc3\xb1o a su familia'
686237993150054401,2016-01-10 17:27:41+00:00,b'Domingo en el Monte Pilatus. Uno de los puntos m\xc3\xa1s altos de Europa en los Alpes Suizos. https://t.co/sELWmhOph8'
685884515978493952,2016-01-09 18:03:06+00:00,b'Lucerna. https://t.co/FstQgG1cug'
685541825193635840,2016-01-08 19:21:22+00:00,b'Hay cosas que su tama\xc3\xb1o las convierte en irremplazables.'
684780073774362624,2016-01-06 16:54:26+00:00,b'Dos cabezas y un mismo pensamiento en Berna. Pd:La piel de mi chaqueta no es de animal para que no especulen. https://t.co/Q3cv1urqSd'
684611529841459200,2016-01-06 05:44:42+00:00,b'La luz del amanecer ilumina escenas que parecen de cuento.'
684451610962083840,2016-01-05 19:09:15+00:00,"b'Cuando el silencio se vuelve inc\xc3\xb3modo,  la grieta de lo que se dijo fue muy grande'"
684276646019489792,2016-01-05 07:34:00+00:00,"b'Afortunadamente, las malas costumbres nunca se pierden'"
684091406474964992,2016-01-04 19:17:55+00:00,"b'Hoy, s\xc3\xa1nduche de queso derretido en Estrasburgo. https://t.co/mmBkbPTqLj'"
684083714125643777,2016-01-04 18:47:21+00:00,b'Todo iba bien hasta que se present\xc3\xb3 con su hombre y apellido'
683576571681226752,2016-01-03 09:12:09+00:00,b'En Mumbai y aqu\xc3\xad. https://t.co/9WnUJjkgCw'
683534303981105152,2016-01-03 06:24:12+00:00,b'Primera semana de Enero y ya te me instalaste.'
683023609636323328,2016-01-01 20:34:53+00:00,b'Cuando uno siente que est\xc3\xa1 llegando a su l\xc3\xadmite es porque hace rato lo pas\xc3\xb3'
682678586600366081,2015-12-31 21:43:53+00:00,"b'A las 12, al cerrar los ojos, donde estemos, estamos. Desde Mumbai, feliz a\xc3\xb1o! . https://t.co/uY8EaWS72H'"
682386366852771841,2015-12-31 02:22:42+00:00,b'Con la cabeza ah\xc3\xad y el coraz\xc3\xb3n aqu\xc3\xad.'
682030031095218178,2015-12-30 02:46:45+00:00,b'...........................................................'
681500630750367745,2015-12-28 15:43:06+00:00,"b'Taj Mahal, el monumento al amor. Cuando ella se fue, el dolor de \xc3\xa9l se transform\xc3\xb3 en arte. https://t.co/RBFluFnUce'"
681328564583698433,2015-12-28 04:19:22+00:00,b'Queremos vivirlo sin tener que definirlo.'
680507428375375872,2015-12-25 21:56:28+00:00,b'Ambos estamos tan perdidos que siempre logramos encontrarnos.'
680203083415031810,2015-12-25 01:47:07+00:00,"b'Noche para agradecerlo TODO. Desde India, Feliz Navidad! \xe2\x9d\xa4\xef\xb8\x8f. https://t.co/nlScsfpmzW'"
680165666565955584,2015-12-24 23:18:26+00:00,"b'En alpargatas, tenis o tacones, quiero seguir caminando contigo.'"
679792975056994304,2015-12-23 22:37:29+00:00,b'Nuestra risa nace de la nada y lo transforma todo.'
679282567594573824,2015-12-22 12:49:19+00:00,"b""Je t'aime. https://t.co/Rgvyv6fZYU"""
679081361324572672,2015-12-21 23:29:47+00:00,b'En el archivo secreto siempre se conserva lo imborrable.'
678969932214874115,2015-12-21 16:07:01+00:00,"b'Como en los negocios, por el bien de ambos la demencia se divide en un 50-50.'"
678810911914762240,2015-12-21 05:35:07+00:00,"b'Siempre existen dos opciones : Mortificarse ante la humillaci\xc3\xb3n, o ver c\xc3\xb3mo usufructuarla. Si le\xe2\x80\xa6 https://t.co/6g7lRuLgsd'"
678774369888378880,2015-12-21 03:09:55+00:00,b'Eso sucede por poner de presentador a Oscar de Le\xc3\xb3n'
678587763478945792,2015-12-20 14:48:25+00:00,"b'Ni m\xc3\xa1s, ni menos. https://t.co/hfAzAJBUXO'"
678189763514494976,2015-12-19 12:26:54+00:00,b'Ella so\xc3\xb1aba con bailar y \xc3\xa9l nunca lo entendi\xc3\xb3. Fin del cuento.'
677876178770722818,2015-12-18 15:40:50+00:00,"b'A falta de pollo, toca el polluelo.'"
677526031734054912,2015-12-17 16:29:28+00:00,b'Estoy muy orgullosa de mi decadencia. Cada vez soy m\xc3\xa1s cursi.'
677085698713874433,2015-12-16 11:19:44+00:00,b'Es satisfactorio saber que se puede construir una relaci\xc3\xb3n tan inmadura.'
676870636996808705,2015-12-15 21:05:10+00:00,"b'Hay olores con nombre propio. Si uno logra hacer la asociaci\xc3\xb3n, ya est\xc3\xa1 tragado hasta las \xc3\xb1atas.'"
676757869597978624,2015-12-15 13:37:04+00:00,"b'Cuando uno por temor, pierde la posibilidad de elegir, le toca conformarse con lo que le sali\xc3\xb3 en la tapa'"
676691941355069440,2015-12-15 09:15:05+00:00,b'La mejor sorpresa es encontrar a ese alguien que se sale de los planes.'
676617760756129792,2015-12-15 04:20:19+00:00,b'En cortas conversaciones se hacen importantes confesiones.'
676597304686682112,2015-12-15 02:59:02+00:00,"b'El que se invent\xc3\xb3 la tina, supo sintetizar el placer.'"
676525860061626368,2015-12-14 22:15:08+00:00,b'Me haces pensar que todo es posible.'
676494689999167490,2015-12-14 20:11:17+00:00,b'Rechazar lo que no quiero es aceptar lo que intento ser'
676468682458034176,2015-12-14 18:27:56+00:00,b'El agrado se gana al dar un s\xc3\xad y el respeto al decir no'
676223453389828096,2015-12-14 02:13:29+00:00,b'Disfruto la presencia permanente de mi compa\xc3\xb1ero imaginario.'
675786624303779840,2015-12-12 21:17:41+00:00,"b'Sin sal, con poca az\xc3\xbacar y lejos del horno, estamos en nuestro punto.'"
675441037880397824,2015-12-11 22:24:27+00:00,b'Viernes. https://t.co/1qkzcwhKS8'
675320380165382144,2015-12-11 14:25:00+00:00,b'Qu\xc3\xa9 lindo cuando le mandas a ella una foto y en la imagen te das cuenta que fue tomada por otra.'
675038581656854528,2015-12-10 19:45:14+00:00,b'Nunca pens\xc3\xa9 que no pudiera dejar de pensarte.'
674802757874925568,2015-12-10 04:08:09+00:00,b'La m\xc3\xa1s completa y desequilibrada felicidad est\xc3\xa1 en disfrutar lo real y lo irreal.'
674776625494556672,2015-12-10 02:24:18+00:00,b'Es cierto que los sue\xc3\xb1os se cumplen. Es cierto que la disciplina da sus frutos. Es cierto  que la\xe2\x80\xa6 https://t.co/R3tmPuM38z'
673931529089888256,2015-12-07 18:26:12+00:00,"b'Hay que meterle cabeza a las miradas,  porque hay miradas que nunca se salen de la cabeza.'"
673686664833843200,2015-12-07 02:13:12+00:00,b'La vida est\xc3\xa1 llena de momentos especiales y hoy fue uno de los m\xc3\xa1s grandes. Cerr\xc3\xa9 40 funciones\xe2\x80\xa6 https://t.co/T3Bi3K2PbM'
673517937928597505,2015-12-06 15:02:44+00:00,b'Llenando el espantoso vac\xc3\xado con divinos recuerdos.'
673295632900034560,2015-12-06 00:19:22+00:00,b'Lista para abrir la puerta de un nuevo espacio en Bt\xc3\xa1. Sala de 948 personas con funci\xc3\xb3n agotada!!! https://t.co/6Vz4e0Ns62'
673279811981320193,2015-12-05 23:16:30+00:00,b'El amor imposible es el perfecto para uno.'
672965245384695808,2015-12-05 02:26:32+00:00,b'Las manos retienen los olores que por alguna raz\xc3\xb3n uno no quiere olvidar.'
672933415226908675,2015-12-05 00:20:03+00:00,b'Divinas noches mexicanas. https://t.co/SKfniq55NC'
672209065221611520,2015-12-03 00:21:44+00:00,"b'Uno no puede decir no a nada, ni s\xc3\xad a todo.'"
670991027839332352,2015-11-29 15:41:42+00:00,"b'El perro le dijo al amo: ""Cuidado con esa perra"". El amo le contest\xc3\xb3: ""Fresco que el perro soy yo"". Moraleja: Perra que no ladra s\xc3\xad muerde.'"
670716336377581568,2015-11-28 21:30:10+00:00,"b'Hoy cuando le coment\xc3\xa9 a un par de amigos que ven\xc3\xada para Florencia (Caquet\xc3\xa1), ambos me dijeron : ""\xe2\x80\xa6 https://t.co/t6nbfnazkp'"
670417897043423233,2015-11-28 01:44:17+00:00,b'C\xc3\xbarate en salud y enf\xc3\xa9rmate por m\xc3\xad.'
670062488411619329,2015-11-27 02:12:01+00:00,b'Llena todo esa dulce alegr\xc3\xada silenciosa que produce el querer tanto a alguien.'
670033564793225216,2015-11-27 00:17:05+00:00,b'No corras el riesgo de volverte real.'
670004454398251008,2015-11-26 22:21:24+00:00,"b'Lista en Cali para presentar el gran evento anual de Incauca. Siendo azucareros, agradezco ser su postre agridulce https://t.co/e1sleA32HS'"
669914274408566785,2015-11-26 16:23:04+00:00,b'Estoy preocupada porque tengo la consciencia tranquila.'
669670595928432640,2015-11-26 00:14:46+00:00,b'Uno debe elegir al mejor para hacer lo peor.'
669654673499009024,2015-11-25 23:11:30+00:00,b'Todos aprendemos a leer y pocos a com-pren-der'
669500703610675200,2015-11-25 12:59:41+00:00,b'Nos entendemos sin ninguna explicaci\xc3\xb3n.'
669179210406240257,2015-11-24 15:42:11+00:00,b'Ojal\xc3\xa1 se dijera la verdad con la misma seguridad que se cuenta un chisme'
668979524969852929,2015-11-24 02:28:42+00:00,b'Yo ya le dije SI a la #fundacionEudes #cadasicuenta #carreradelsi10k https://t.co/FvXNTnZnjJ y los reto a todos para que den su SI'
668885519795953664,2015-11-23 20:15:09+00:00,b'Si no han visto el \xc3\xbaltimo corto de #JohnnieWalker se los recomiendo https://t.co/m4fHc9iulQ. Perfecto para echarle ojo en un rato libre'
668805589426946048,2015-11-23 14:57:32+00:00,"b'Ya somos un ""Nosotros"".'"
668595232787865600,2015-11-23 01:01:40+00:00,"b'Con nostalgia, tristeza y ojo aguado, @HoracioSerpa cumpli\xc3\xb3! @RositadeSerpa ya est\xc3\xa1 con otro hombre \xf0\x9f\x98\x89 https://t.co/NutL7XHnZs'"
668106341517496320,2015-11-21 16:38:59+00:00,b'Listas en Oca\xc3\xb1a para despegar. Nuestro destino de hoy : Sincelejo. Funci\xc3\xb3n 8pm en el teatro Municipal https://t.co/yFJlhVXvRG'
668072483405320192,2015-11-21 14:24:26+00:00,b'Las grandes historias de amor tienen su alta dosis de enredo.'
667866796809146368,2015-11-21 00:47:07+00:00,b'La mejor ganancia es perder el miedo.'
667723516456919040,2015-11-20 15:17:46+00:00,b'No s\xc3\xa9 qu\xc3\xa9 hacer sin ti y menos qu\xc3\xa9 hacer contigo.'
667116875646689281,2015-11-18 23:07:12+00:00,b'Esta es la evidencia del \xc3\xbaltimo puchero de @HoracioSerpa antes de entrarle con guada\xc3\xb1a a su bigote https://t.co/FQx5jee7it'
666828563254009856,2015-11-18 04:01:33+00:00,b'No me preguntes mi opini\xc3\xb3n si quieres que te conteste con la tuya'
666604188865032192,2015-11-17 13:09:58+00:00,b'Cuando uno est\xc3\xa1 dispuesto a o\xc3\xadr es porque ya tiene la decisi\xc3\xb3n tomada'
666462653817233408,2015-11-17 03:47:33+00:00,b'Por fin alguna candidata contest\xc3\xb3 mencionando al infaltable granito de arena. Puedo dormir en paz. Hasta ma\xc3\xb1ana'
666415591931138048,2015-11-17 00:40:33+00:00,b'Te hiciste el de las gafas hasta que me viste por dentro.'
666405149968080896,2015-11-16 23:59:03+00:00,"b'No tengo Facebook, ning\xc3\xban art\xc3\xadculo subido en esas falsas cuentas es m\xc3\xado y no escribo el verbo ""haber"" sin h. Gracias queridos usurpadores'"
666353611723644928,2015-11-16 20:34:15+00:00,b'No aclares que oscureces'
666296170273218561,2015-11-16 16:46:00+00:00,b'Quiero ser la pr\xc3\xb3xima Zhao Wei en el  corto de #JohnnieWalker y darle a Jude Law the #joyofgiving https://t.co/m4fHc9iulQ'
665940528819752960,2015-11-15 17:12:49+00:00,b'Si la foto no tiene significado pasa a ser una imagen m\xc3\xa1s.'
665664408799047682,2015-11-14 22:55:37+00:00,b'Antes eras como cre\xc3\xadas y ahora eres como quieres.'
665549877909262336,2015-11-14 15:20:30+00:00,b'Lo sucedido en Par\xc3\xads es una tragedia que ha conmovido al mundo entero. Veo en redes que la gente est\xc3\xa1\xe2\x80\xa6 https://t.co/Q4fzIEB9Vn'
665232465414529026,2015-11-13 18:19:13+00:00,b'Todo es relativo hasta que uno tiene la certeza de estar enamorado.'
665152392174960641,2015-11-13 13:01:02+00:00,"b'Esposo con actitud d novio,bueno. Novio con actitud d esposo,malo. Esposo con actitud d amante,bueno. Amante con actitud d esposo,p\xc3\xa9simo.'"
664470046077542401,2015-11-11 15:49:38+00:00,"b'Mi renuncia al programa ""Desc\xc3\xa1rate sin Evadir"". https://t.co/65xVXsex5N'"
664226152186269696,2015-11-10 23:40:30+00:00,b'Por andar como la Bella Durmiente uno termina con Pinocho.'
664160987096948736,2015-11-10 19:21:33+00:00,b'BCBG es lo m\xc3\xado. Cuarto piso CCAndino 6914826-3108004623 https://t.co/dMhTgPyPwb'
664093469275758596,2015-11-10 14:53:15+00:00,"b'Ma\xc3\xb1ana 11 de Nov, \xc3\xbanica funci\xc3\xb3n ""Desc\xc3\xa1rate con la Azc\xc3\xa1rate"" en Monter\xc3\xada 7:30pm. Info: 7822222- 3168314539'"
663945387665920000,2015-11-10 05:04:50+00:00,"b'El amor como la alergia, uno lo detecta de repente.'"
663697263357788160,2015-11-09 12:38:53+00:00,b'Una cosa es ser paciente y otra muy distinta estar resignado'
663577585088118784,2015-11-09 04:43:19+00:00,b'A Alejandra Borrero la vi por primera vez en persona haciendo casting para un personaje en la novela\xe2\x80\xa6 https://t.co/0yCFQCtgab'
663559723120254976,2015-11-09 03:32:20+00:00,b'Gracias x todos sus generosos comentarios sobre el programa.Para m\xc3\xad lo m\xc3\xa1s maravilloso es saber q  hemos abierto un espacio libre de juicios'
663521660079878144,2015-11-09 01:01:06+00:00,"b'Hoy,en #Desc\xc3\xa1rateSinEvadir tendremos a la gran @alejaoficial Valiente y atrevida como pocas. Aut\xc3\xa9ntica y brillante! https://t.co/BCF8vLol3b'"
663215895301484544,2015-11-08 04:46:06+00:00,"b'Ver el letrero ""Sold Out"" en el gran teatro Casa de la M\xc3\xbasica de Quito, en el que s\xc3\xb3lo se presenta la sinf\xc3\xb3nica nacional,es indescriptible!'"
663095579271110656,2015-11-07 20:48:00+00:00,b'Llegando a Quito me auto encontr\xc3\xa9 buseteando. Estoy adorando Ecuador. Qu\xc3\xa9 emoci\xc3\xb3n ver c\xc3\xb3mo me han\xe2\x80\xa6 https://t.co/hrRTIX9KvQ'
663022920000806913,2015-11-07 15:59:17+00:00,"b'En la historia de mi vida irreal, t\xc3\xba eres el protagonista.'"
662856520502272000,2015-11-07 04:58:04+00:00,b'Much\xc3\xadsimas gracias Guayaquil. Lleno y publicazo! Espero regresar pronto. Ma\xc3\xb1ana funci\xc3\xb3n en Quito. Info en tiquetshow'
662651254489915393,2015-11-06 15:22:25+00:00,"b'Si te preguntas d\xc3\xb3nde estoy, es porque ah\xc3\xad me tienes.'"
662433709929418752,2015-11-06 00:57:58+00:00,b'Los regalos sencillos suelen tener profundos significados.'
662327624623083520,2015-11-05 17:56:25+00:00,b'Por qu\xc3\xa9 ser\xc3\xa1 que nunca veo hombres como Jude Law en Bogot\xc3\xa1? Gracias #JohnnieWalker por ponerlo en su ultimo corto https://t.co/m4fHc9iulQ'
662261775736401920,2015-11-05 13:34:46+00:00,"b'No hablo de roles familiares,ejemplos a seguir,valores subjetivos,ni modelos sociales adecuados. Esta es mi opini\xc3\xb3n: https://t.co/5XpvWmMCWR'"
662032688342302720,2015-11-04 22:24:27+00:00,"b'Gracias al p\xc3\xbablico,regreso x 3a vez a Ecuador.Estar\xc3\xa9 en Guayaquil y Quito 6y7 de Nov. Info y entradas en tiquetshow https://t.co/Nb8SbiKMs4'"
661726712808538112,2015-11-04 02:08:37+00:00,"b'Exprim\xc3\xad tanto la situaci\xc3\xb3n, que de m\xc3\xad no qued\xc3\xb3 ni el zumo.'"
661375758292643840,2015-11-03 02:54:03+00:00,"b'Ver a @PrimoRojas en teatro es una experiencia \xc3\xbanica.LLorar de la risa ante la crueldad de la brillante s\xc3\xa1tira,es algo q s\xc3\xb3lo logra un genio'"
661200887856111616,2015-11-02 15:19:10+00:00,b'La felicidad es tan simple que puede ser hasta risible.'
660956653332922368,2015-11-01 23:08:40+00:00,"b'Hoy, despu\xc3\xa9s de Noticias RCN a las 8pm, nos vemos en #Desc\xc3\xa1ratesinEvadir con @OrlandoLinan y el maestro Carlos Mu\xc3\xb1oz https://t.co/DAoRk4RrUq'"
660806191967313920,2015-11-01 13:10:48+00:00,"b'Transcurrir es eso especial que pasa y se desarrolla en el tiempo, disfrutando el durante, sin importar el hasta cu\xc3\xa1ndo.'"
660522839662051328,2015-10-31 18:24:51+00:00,b'Feliz Halloween! https://t.co/JBIG1yUxIx'
660436890294878208,2015-10-31 12:43:19+00:00,"b'Mis queridas bendecidas, afortunadas, enaltecidas, prosperadas en victoria, guerreras de la luz : Se jodieron! Agotados los puti disfraces'"
660336568054497280,2015-10-31 06:04:40+00:00,b'Es m\xc3\xa1gica la transmisi\xc3\xb3n de pensamientos por parte de dos personas distantes entre s\xc3\xad y porque s\xc3\xad.'
