twitter_id,date,tweet
874743796931731459,2017-06-13 21:42:27+00:00,b'Si algo agradezco es que me digan que nunca tengo la raz\xc3\xb3n'
874652455883214849,2017-06-13 15:39:30+00:00,"b'Piedad C\xc3\xb3rdoba dice que ser\xc3\xa1 presidente en 2018. Perd\xc3\xb3n, me retiro de inmediato a colgarme de un turbante'"
874622962330193921,2017-06-13 13:42:18+00:00,"b'Si le preguntan cu\xc3\xa1l ha sido el d\xc3\xada m\xc3\xa1s feliz de su vida y sabe responder, ha tenido entonces una muy aburrida'"
874425551905316865,2017-06-13 00:37:52+00:00,b'Cuando encuentro la tranquilidad es porque perd\xc3\xad el inter\xc3\xa9s'
874264944790966273,2017-06-12 13:59:40+00:00,"b'Que uno no soporte que alguna mujer se le acerque, lo mire, lo salude, le sonr\xc3\xada, lo toque o le hable, cuenta como celos?'"
873681612202004481,2017-06-10 23:21:43+00:00,b'No necesitamos estar juntos para permanecer unidos.'
873329758033108992,2017-06-10 00:03:34+00:00,b'No hemos necesitado promesas para tener la absoluta certeza.'
873270731030835200,2017-06-09 20:09:01+00:00,b'Hay momentos en los que uno mismo se tira piedras y otros en los que le toca aprender a recogerlas'
872913230821294080,2017-06-08 20:28:26+00:00,b'Ya va siendo hora de que nos llegue nuestro momento.'
872625046854017024,2017-06-08 01:23:18+00:00,b'Tu madura ternura es tu mayor atractivo infantil.'
872560643546787840,2017-06-07 21:07:23+00:00,"b'Me parece como maluco que Shakira llegue esta noche a la casa cantando: ""Toy loca con mi tigreeee, loca, loca, loca ""'"
872513380636033024,2017-06-07 17:59:35+00:00,"b'Si conoces mi ansiedad, estamos bajo control.'"
872312569708646404,2017-06-07 04:41:38+00:00,b'Las palabras sangran.'
872164819977330688,2017-06-06 18:54:31+00:00,"b'Quienes juzgan el exagerado amor por las mascotas, son unos verdaderos animales'"
872144092339347457,2017-06-06 17:32:09+00:00,b'Caminando en tacones sobre la cuerda floja.'
871932703423311872,2017-06-06 03:32:10+00:00,"b'Para todos los que me han preguntado, aqu\xc3\xad les comparto el link del episodio de @LaTele_Letal al que fui invitada https://t.co/LKowtYaHPq'"
871900594839146497,2017-06-06 01:24:35+00:00,b'Hoy 9pm x ClaroTv 107/1005HD estar\xc3\xa9 en @LaTele_Letal con @MdeFrancisco12 y @MoureSantiago Un cap\xc3\xadtulo vergonzoso que esperamos no se pierdan'
871793683569487872,2017-06-05 18:19:45+00:00,"b'Hoy, a las 9pm x ClaroTV estar\xc3\xa9 junto a @MdeFrancisco12 y @MoureSantiago en @LaTele_Letal .Un episodio no apto para susceptibles'"
871210602290655232,2017-06-04 03:42:48+00:00,b'Qu\xc3\xa9 maravilla de seguridad la que nos genera el no tener ni la menor certeza.'
871003340917833728,2017-06-03 13:59:13+00:00,b'Se me enred\xc3\xb3 tu foto en mis pesta\xc3\xb1as.'
870597137528238081,2017-06-02 11:05:07+00:00,b'Me hiciste perder el sentido y encontrar los otros cinco.'
870410101525540864,2017-06-01 22:41:54+00:00,b'La felicidad viene en sobre.'
870049595153371144,2017-05-31 22:49:22+00:00,b'Todas somos la ex de un error'
870031434098118657,2017-05-31 21:37:12+00:00,b'El papel aguanta todo.Paz firmada y no implementada.Seguimos en poder de estos delincuentes que contin\xc3\xbaan amenazando y abusando de nosotros'
869785518363561985,2017-05-31 05:20:02+00:00,"b'Si devolviera el tiempo volver\xc3\xada a caer con el mismo, entonces mejor que siga.'"
869745242672640002,2017-05-31 02:39:59+00:00,"b'Cuando me dices que me amas, lo grave es que te creo.'"
869679729049206784,2017-05-30 22:19:39+00:00,b'No nos preocupemos por nosotros que ese no es problema nuestro.'
869565689933201409,2017-05-30 14:46:30+00:00,"b'Si uno se refiere a su pareja como ""mi norte"" , est\xc3\xa1 perdido'"
869245511286575104,2017-05-29 17:34:14+00:00,b'No esperaba nada pero lo quer\xc3\xada todo.'
869061858401157120,2017-05-29 05:24:28+00:00,b'Duermes all\xc3\xa1 y sue\xc3\xb1as ac\xc3\xa1.'
869030873085214720,2017-05-29 03:21:20+00:00,b'Ahora salen de rumba para enterarse al d\xc3\xada siguiente en redes c\xc3\xb3mo pasaron'
868878350151974917,2017-05-28 17:15:16+00:00,b'Tenemos que vivir separados para poder seguir juntos.'
868608604139659265,2017-05-27 23:23:23+00:00,"b'Yo? Bien, aqu\xc3\xad, masticando lentamente tu foto.'"
868499721060528128,2017-05-27 16:10:44+00:00,b'Me toc\xc3\xb3 dedicarme a mirar para el techo a ver si enfoco.'
867921348600844288,2017-05-26 01:52:29+00:00,"b'Presentando la ceremonia del Premio Obras Cemex 2017, el m\xc3\xa1s importante del gremio de la construcci\xc3\xb3n y la arquitectura en Col. #POC2017COL https://t.co/1Uw5r4tWkG'"
867816903649218560,2017-05-25 18:57:27+00:00,b'Le tengo miedo a la venganza de mi cuerpo'
867803844440457216,2017-05-25 18:05:34+00:00,"b'Si est\xc3\xa1n en Miami, por favor no se pierdan a @PrimoRojas en el Teatro Trail. Es el MEJOR actor de comedia negra que he visto en la vida'"
867497753538154496,2017-05-24 21:49:16+00:00,b'Los celos son una vuelta a la manzana infernal que sale a dar la imaginaci\xc3\xb3n.'
867252980747075584,2017-05-24 05:36:38+00:00,b'Estamos cada vez m\xc3\xa1s cerca de que nunca nos alejemos.'
866802897572384769,2017-05-22 23:48:09+00:00,b'Estoy incapacitada sentimentalmente.'
866668172635713537,2017-05-22 14:52:48+00:00,b'M\xc3\xadrame.'
866516992597131266,2017-05-22 04:52:04+00:00,"b'Cierro la gira con funci\xc3\xb3n agotada en Toronto.Gracias a los empresarios,a mi equipo de trabajo y sobre todo al p\xc3\xbablico.Hasta pronto Canad\xc3\xa1!'"
866425506769633282,2017-05-21 22:48:32+00:00,b'Te prob\xc3\xa9 de entrada y eres un plato fuerte.'
866407754063327232,2017-05-21 21:38:00+00:00,"b'Si quer\xc3\xadas llamarme la atenci\xc3\xb3n, ya te colgu\xc3\xa9'"
866303911132573697,2017-05-21 14:45:22+00:00,b'Jugando a inventarme la vida sin saber de ti.'
866148243062882304,2017-05-21 04:26:48+00:00,"b'Llorar sobre un escenario con todo el p\xc3\xbablico de pie aplaudiendo, es muy emocionante. Pero estando en Canad\xc3\xa1? Sin palabras. GRACIAS Montr\xc3\xa9al'"
866112982278742017,2017-05-21 02:06:41+00:00,"b'En Colombia, las mujeres hacen cosas maravillosas. https://t.co/YmWWdOs4XN'"
866106856338542592,2017-05-21 01:42:20+00:00,b'Gracias a la comunidad latina de Montr\xc3\xa9al y en especial a los colombianos. AGOTADA mi funci\xc3\xb3n esta noche. Ma\xc3\xb1ana cierre de gira en Toronto'
866008205033394178,2017-05-20 19:10:20+00:00,b'Qu\xc3\xa9 bonita iniciativa! #LocutoresDeCalle Aprendan a hablar en p\xc3\xbablico y chequeen el programa de becas en\n\xe2\x9e\x9c https://t.co/5UrBNXAQNo'
865779743085481984,2017-05-20 04:02:30+00:00,b'En las cataratas del Ni\xc3\xa1gara. Es viernes y hasta la naturaleza lo sabe. Este s\xc3\xad es un buen chorro. https://t.co/jFiTHPFVDC'
865764466562129920,2017-05-20 03:01:48+00:00,b'Estamos peor que siempre y mejor que nunca.'
865638141373239297,2017-05-19 18:39:50+00:00,b'Me sabes rico en mis recuerdos.'
865238152767619072,2017-05-18 16:10:25+00:00,b'Pasaste de la casilla de novedad a la de prioridad.'
864895927886028800,2017-05-17 17:30:32+00:00,b'Olv\xc3\xaddame des-pa-ci-to.'
864674096113623040,2017-05-17 02:49:04+00:00,b'YO. https://t.co/mrlwN4JaMv'
864566264005509120,2017-05-16 19:40:34+00:00,b'Entre cuatro paredes creamos un mundo.'
864317850726522881,2017-05-16 03:13:28+00:00,b'Necesito mi mu\xc3\xb1eco para disfrutar esta jugueter\xc3\xada.'
864270975239462912,2017-05-16 00:07:12+00:00,b'Somos como el clima; a veces s\xc3\xad y de pronto tambi\xc3\xa9n.'
864185194655367168,2017-05-15 18:26:20+00:00,b'Escogiendo en mis archivos mentales las mejores im\xc3\xa1genes para nuestro \xc3\xa1lbum.'
863943143300841472,2017-05-15 02:24:31+00:00,b'No pens\xc3\xa9 que fuera posible extra\xc3\xb1ar tanto una plancha.'
863828609475125248,2017-05-14 18:49:24+00:00,b'T\xc3\xba eres su \xc3\xbanica vez y yo soy tu primera vez.'
863625067481014272,2017-05-14 05:20:36+00:00,b'Aforo anoche Vancouver 88% y hoy en Calgary agotado. Gracias a los organizadores x pasarme a la sala m\xc3\xa1s grande. Sigo feliz de gira x Canad\xc3\xa1'
863573247354216448,2017-05-14 01:54:41+00:00,b'Intentando encontrar una escalera para bajarme de la nube en la que me dejaste.'
863453371390279680,2017-05-13 17:58:20+00:00,b'Quedamos enmarcados en una ventana.'
863304477377417216,2017-05-13 08:06:41+00:00,"b'Si supieras la falta que me haces, por mi bien no te me volver\xc3\xadas a acercar.'"
863115663388270592,2017-05-12 19:36:24+00:00,"b'Despu\xc3\xa9s de satisfacer, es hora de desaparecer.'"
862825173774249985,2017-05-12 00:22:06+00:00,b'En el Museo Dolores Olmedo de Xochimilco ( M\xc3\xa9xico ) aprendiendo a posar bajo las instrucciones\xe2\x80\xa6 https://t.co/BxDBTsTiLV'
862662601704169473,2017-05-11 13:36:06+00:00,"b'Cuando todo parece tan perfecto, de repente se vuelve real.'"
862484647153893377,2017-05-11 01:48:58+00:00,b'AGOTADA mi funci\xc3\xb3n esta noche en Ciudad de M\xc3\xa9xico. Que dicha tan grande! Tomar\xc3\xa9 margaritas hasta que me salgan p\xc3\xa9talos.'
862326812361322496,2017-05-10 15:21:47+00:00,"b'Las condiciones dignas de trabajo no deber\xc3\xadan pedirse xq son obligatorias,sin embargo hoy se debatir\xc3\xa1 si las merecemos.Apoyo #laleydelactor'"
862076792370192384,2017-05-09 22:48:18+00:00,b'En Ciudad de M\xc3\xa9xico alistando motores para la funci\xc3\xb3n de ma\xc3\xb1ana. Teatro Voil\xc3\xa1 en Antara a las\xe2\x80\xa6 https://t.co/3BzaiNcJfS'
861775883715084290,2017-05-09 02:52:36+00:00,"b'La gente est\xc3\xa1 muy loca, todav\xc3\xada van al supermercado? \n@MARREMUSIC \n#mercaconazc\xc3\xa1rate https://t.co/iEne79E9u8'"
861686761654808576,2017-05-08 20:58:28+00:00,"b'El respeto, ese valioso concepto que todos desconocemos'"
861594598182965248,2017-05-08 14:52:14+00:00,b'Esperando que el congreso hunda el referendo de Vivianne Morales y C.A Lucio.Cualquier tipo de discriminaci\xc3\xb3n en nombre de Dios es un pecado'
861588621853212672,2017-05-08 14:28:29+00:00,"b'Estuve anoche viendo ""Annie"" en el teatro Colsubsidio, le ped\xc3\xad a mi mam\xc3\xa1 que me acompa\xc3\xb1ara como\xe2\x80\xa6 https://t.co/ogI9VNPp0w'"
861258044587606017,2017-05-07 16:34:53+00:00,b'Eres el error que todas quisi\xc3\xa9ramos cometer.'
861023420120780800,2017-05-07 01:02:35+00:00,b'Antes me mirabas y ahora me ves.'
860945788612096000,2017-05-06 19:54:06+00:00,b'Infinitas GRACIAS Cali por tanto \xe2\x9d\xa4\xef\xb8\x8f! Funci\xc3\xb3n AGOTADA esta noche.Desde el mi\xc3\xa9rcoles se acabaron las 1400 boletas as\xc3\xad que en Diciembre volver\xc3\xa9'
860632195551170560,2017-05-05 23:07:59+00:00,"b'No te preocupes por conseguir lo m\xc3\xado, oc\xc3\xbapate de lograr lo tuyo'"
860575855394869250,2017-05-05 19:24:07+00:00,b'Gracias a la marca colombiana de ropa exterior m\xc3\xa1s reconocida de Latinoam\xc3\xa9rica x elegirme a partir de hoy como su nueva cara. Soy Studio F'
860555961265672193,2017-05-05 18:05:04+00:00,"b'Ya saben quienes me siguen que me encanta la moda. Lejos de ser un tema superficial y fr\xc3\xadvolo,\xe2\x80\xa6 https://t.co/WmCwB2cqxS'"
860006106785087488,2017-05-04 05:40:08+00:00,"b'Aunque nos damos energ\xc3\xada, qu\xc3\xa9 bueno no tenerte de planta.'"
859931414300696580,2017-05-04 00:43:20+00:00,b'A mi mesa le hace falta un puesto.'
859860712742629379,2017-05-03 20:02:24+00:00,b'@MauricioLizcano ud y su familia se divierten viendo tv? Nosotros queremos disfrutar trabajando en ella con condiciones justas #leydelactor'
859837840783548419,2017-05-03 18:31:30+00:00,"b'Ojal\xc3\xa1 todas las leyes de este pa\xc3\xads fueran tan debatidas. Los que trabajamos por y para el p\xc3\xbablico, merecemos hoy la nuestra @actoresACA'"
859754041416536064,2017-05-03 12:58:31+00:00,b'De vez en cuando es suficiente.'
859645670977929216,2017-05-03 05:47:54+00:00,b'Jugando al beso robado con mi novio imaginario.'
859407096844079108,2017-05-02 13:59:53+00:00,b'De lejos aguanto.'
859200007160950788,2017-05-02 00:16:59+00:00,b'Me preguntaste el primer d\xc3\xada qu\xc3\xa9 quer\xc3\xada contigo y te respond\xc3\xad que no saber cu\xc3\xa1ndo ser\xc3\xada el \xc3\xbaltimo.'
859034415418265601,2017-05-01 13:18:59+00:00,b'Nos ha costado mucho no tener nada.'
858915561874628608,2017-05-01 05:26:42+00:00,"b'De sue\xc3\xb1o hecho realidad, a realidad hecha sue\xc3\xb1o.'"
858482434647760896,2017-04-30 00:45:36+00:00,b'AGOTADA funci\xc3\xb3n esta noche en el Teatro@elaguiladescalz en Medell\xc3\xadn. 3080 personas en 2 fines de semana y un mill\xc3\xb3n de latidos con gratitud'
858332993680797697,2017-04-29 14:51:47+00:00,"b'Vuelvo a temblar al ver la foto. AGOTADO anoche el teatro m\xc3\xa1s grande de Colombia x octava vez. Hoy, funci\xc3\xb3n a las 5pm. Info: 2844211 https://t.co/NlY7Fnt8tc'"
858186148929302528,2017-04-29 05:08:16+00:00,"b'Haber agotado por octava vez el teatro m\xc3\xa1s grande de Colombia, el de la U de Medell\xc3\xadn con 1700 sillas, es un triunfo que me llena el alma\xe2\x9d\xa4\xef\xb8\x8f'"
857635918789922818,2017-04-27 16:41:51+00:00,b'El coraz\xc3\xb3n me qued\xc3\xb3 latiendo en los ojos.'
857445567177388032,2017-04-27 04:05:28+00:00,"b'Muchas GRACIAS Bucaramanga! Funci\xc3\xb3n agotada esta noche en el Teatro Corfescu. Ma\xc3\xb1ana, privada en el Club Campestre'"
857330101922533376,2017-04-26 20:26:39+00:00,b'Lo que uno m\xc3\xa1s disfruta es hecho en mala compa\xc3\xb1\xc3\xada.'
857068251150524417,2017-04-26 03:06:09+00:00,b'Supimos escogernos.'
856736156800692224,2017-04-25 05:06:31+00:00,b'Funci\xc3\xb3n colectiva AGOTADA hoy en La Castellana.11 artistas en escena nos unimos gracias a @AlejandroRia y recaudamos 49 millones para Mocoa'
856525361278013440,2017-04-24 15:08:54+00:00,"b'Sali\xc3\xb3 de la agenda de discusi\xc3\xb3n nuestro proyecto. Hoy esperamos q se defina fecha para debate de la ley del actor. No es favor, es justicia'"
856314090263896064,2017-04-24 01:09:23+00:00,b'Veo que ya somos TRES MILLONES DOSCIENTOS MIL aqu\xc3\xad. Sigo sin entender qu\xc3\xa9 es lo que les gusta o les interesa pero agradezco su desocupe \xf0\x9f\x92\x9c'
856175434672857088,2017-04-23 15:58:25+00:00,b'Tenemos una mirada pendiente sobre la misma almohada.'
855980680928514048,2017-04-23 03:04:32+00:00,"b'Gracias a Carlos Mario y Cristina,el d\xc3\xbao de @elaguiladescalz x abrirme de nuevo las puertas de su teatro en Medell\xc3\xadn. Hoy, funci\xc3\xb3n llena!'"
855882151597944833,2017-04-22 20:33:01+00:00,b'Tenemos la suficiente madurez para regresar juntos a la adolescencia.'
855851129581817858,2017-04-22 18:29:44+00:00,b'Conf\xc3\xado en que el concejo de Bogot\xc3\xa1 apruebe la creaci\xc3\xb3n del instituto de protecci\xc3\xb3n animal. Es una absoluta necesidad'
855768152751394817,2017-04-22 13:00:01+00:00,b'Sintiendo esa extra\xc3\xb1a tranquilidad que nos producimos al regresar a lo inestable.'
855519995677343744,2017-04-21 20:33:56+00:00,b'Al cu\xc3\xa1nto tiempo se celebran las bodas de mierda?'
855507922977030144,2017-04-21 19:45:58+00:00,b'Aqu\xc3\xad les comparto la informaci\xc3\xb3n sobre mis pr\xc3\xb3ximas funciones para que se programen y me\xe2\x80\xa6 https://t.co/NUL5RPdcWI'
855228124719489024,2017-04-21 01:14:08+00:00,b'ESTA VEZ NO SAL\xc3\x8d A DARLO SINO QUE VINIERON A PEDIRMELO.\n@aviatur\n#nosfuimos https://t.co/7XoIWhyyvA'
854884282308870144,2017-04-20 02:27:50+00:00,b'La experiencia en Toscana me ha dejado grandes momentos que a partir de ma\xc3\xb1ana se convertir\xc3\xa1n en\xe2\x80\xa6 https://t.co/j1fYdpTdVN'
854446498469171200,2017-04-18 21:28:14+00:00,b'Siena es una extra\xc3\xb1a ciudad ubicada sobre las colinas de La Toscana. Digo que es extra\xc3\xb1a porque\xe2\x80\xa6 https://t.co/dkqpCNuUY2'
854328647905234945,2017-04-18 13:39:56+00:00,"b'LA VIDA ES UN VIAJE. \nLa Toscana (Italia) \n@aviatur \nHotel lecalvane \n@samybessudo\nConsuelito,\xe2\x80\xa6 https://t.co/hhyioPmomt'"
854045895230242816,2017-04-17 18:56:23+00:00,"b'Junto al mar Tirreno, en la costa oeste de Italia, se encuentra La Toscana. Esta regi\xc3\xb3n es\xe2\x80\xa6 https://t.co/cWnaQEVrnw'"
853616276102455296,2017-04-16 14:29:14+00:00,b'La regi\xc3\xb3n de La Toscana no ha basado su belleza simplemente en la fachada. Como las mujeres de\xe2\x80\xa6 https://t.co/cjrbCPwUNV'
853398593163583488,2017-04-16 00:04:14+00:00,"b'Si uno quiere darse un buen regalo en la vida, debe venir a La Toscana. Es un sitio ideal para\xe2\x80\xa6 https://t.co/go0Qo1kucC'"
853164643216269312,2017-04-15 08:34:36+00:00,"b'Hoy el turno fue para Pietrasanta, la capital hist\xc3\xb3rica de Versilia, ubicada en la costa norte\xe2\x80\xa6 https://t.co/liXS11M6S6'"
853164583879491584,2017-04-15 08:34:22+00:00,b'Sorprenderse es una de las cosas m\xc3\xa1s maravillosas que ofrece un buen viaje. Entrar en los\xe2\x80\xa6 https://t.co/JYe4fbuFFE'
852639830324396032,2017-04-13 21:49:11+00:00,b'Volterra es un municipio italiano que pertenece a la Provincia de Pisa y a la vez forma parte\xe2\x80\xa6 https://t.co/2Hx8mejPsx'
852241324405174272,2017-04-12 19:25:40+00:00,"b'Aunque la belleza es un concepto relativo, Florencia es una ciudad que con mucha dificultad\xe2\x80\xa6 https://t.co/7Isc8roY8l'"
851858165532471297,2017-04-11 18:03:08+00:00,"b'Italia es un pa\xc3\xads que enamora. El idioma es dulce, la comida exquisita, los paisajes\xe2\x80\xa6 https://t.co/w7i1UaVHGY'"
851477242546880517,2017-04-10 16:49:28+00:00,b'Con la libreta rayada.'
850929077280284672,2017-04-09 04:31:16+00:00,b'Muchas GRACIAS Armenia! Agotada mi funci\xc3\xb3n esta noche en el Centro de Convenciones. 1250 boletas vendidas con sabor a caf\xc3\xa9 del bueno'
850493330333028352,2017-04-07 23:39:46+00:00,"b'No hay nada tan claro como un ""no s\xc3\xa9"" mutuo.'"
850128963523444737,2017-04-06 23:31:54+00:00,b'Ella meti\xc3\xb3 el coraz\xc3\xb3n hasta el fondo y la cabeza se le qued\xc3\xb3 por fuera.'
849841492369842176,2017-04-06 04:29:35+00:00,b'A la menos indicada le cay\xc3\xb3 en reversa haberte visto mal parqueado y yo qued\xc3\xa9 en primera con el freno de mano.'
849819677878624256,2017-04-06 03:02:54+00:00,b'Me cae muy bien saber que te portas tan mal.'
849521831103135744,2017-04-05 07:19:22+00:00,b'Si el miedo al cambio me quita el sue\xc3\xb1o es porque en efecto estaba dormida'
848905585340952576,2017-04-03 14:30:38+00:00,b'Somos una gran coincidencia hecha a prop\xc3\xb3sito.'
848238150422061056,2017-04-01 18:18:29+00:00,b'La dieta de la vida es sencilla: Coma mierda o tome decisiones'
848234594914545664,2017-04-01 18:04:21+00:00,"b'As\xc3\xad nos vemos las perras en tierra caliente. Esta noche, funci\xc3\xb3n en Cartagena en el Centro de\xe2\x80\xa6 https://t.co/GhfAHHSjcf'"
848185119269683200,2017-04-01 14:47:45+00:00,"b'No dejen para ma\xc3\xb1ana lo que pueden viajar hoy. Outlet Aviatur con los mejores descuentos en tiquetes,hoteles y planes en el Parque de la 93'"
848055752862445568,2017-04-01 06:13:42+00:00,b'El valor del trabajo nace del respeto que se le d\xc3\xa9 al mismo'
847933661404155908,2017-03-31 22:08:33+00:00,b'Esa extra\xc3\xb1a tranquilidad que produce el hacer lo incorrecto.'
847767022222159872,2017-03-31 11:06:23+00:00,"b'Quieren viajar? Desde hoy y hasta el domingo,el Outlet Aviatur abre sus puertas en el Parque de la 93.Aprovechen los descuentos y empaquen!'"
847673832231981056,2017-03-31 04:56:05+00:00,"b'Muchas, muchas GRACIAS Barranquilla! Hoy celebro 30 funciones agotadas en el Teatro Jos\xc3\xa9 Consuegra Higgins. Me voy m\xc3\xa1s que feliz!'"
847562829456650241,2017-03-30 21:35:00+00:00,"b'Celebrando la firma de nuestro nuevo proyecto! Pronto @cuervocarolina @Veronica_Orozco y yo,estaremos muy, muy cerca de uds. Bomba femenina\xf0\x9f\x92\xa3 https://t.co/c9S8LRGsGt'"
847438613973487616,2017-03-30 13:21:24+00:00,b'Es tanto el amor que lo haces con rabia.'
847113752071823360,2017-03-29 15:50:31+00:00,b'No estar\xc3\xa9 viva para ver cumplir a Rafael Uribe Noguera su condena de 51 a\xc3\xb1os pero s\xc3\xad lo estoy hoy para decir que 60 de hecho eran pocos'
847108999929585668,2017-03-29 15:31:38+00:00,"b'Si el crimen de Rafael Uribe Noguera no amerita pena m\xc3\xa1xima de sesenta a\xc3\xb1os, me hacen el favor y me explican qu\xc3\xa9 detalle le falt\xc3\xb3 ?'"
846338480087097344,2017-03-27 12:29:52+00:00,"b'Despu\xc3\xa9s de haberme presentado a finales del a\xc3\xb1o pasado en Miami, Tampa, West Palm Beach,\xe2\x80\xa6 https://t.co/Ao64gu7Jmk'"
845933858302287873,2017-03-26 09:42:03+00:00,b'Amanec\xc3\xad con un nombre.'
845850497231831040,2017-03-26 04:10:48+00:00,"b'Gracias Jacksonville por tanta felicidad! Funci\xc3\xb3n agotada esta noche con p\xc3\xbablico de pie. Ma\xc3\xb1ana, cierre de gira en Charlotte ya ""Sold Out""'"
845629822785261568,2017-03-25 13:33:55+00:00,"b'Imaginarte en tu espacio, llena el m\xc3\xado.'"
845518146077380608,2017-03-25 06:10:09+00:00,b'Gracias Chicago! La ciudad de los vientos me dej\xc3\xb3 una funci\xc3\xb3n llena de un divino aire. Ma\xc3\xb1ana Jacksonville y domingo Charlotte. 7862188783'
845503335004200960,2017-03-25 05:11:18+00:00,b'Gran autogol el q se meti\xc3\xb3 Armero en el arco de @AndreaGuerreroQ quien con sensatez y valent\xc3\xada supo poner el pecho.Hoy felicito a su esposo'
845283954076864512,2017-03-24 14:39:33+00:00,"b'Llegando a Chicago,la ciudad de los vientos.Funci\xc3\xb3n aqu\xc3\xad hoy, ma\xc3\xb1ana Jacksonville y domingo Charlotte. 7862188783 y https://t.co/7TFgbxBvHg'"
844747046104043520,2017-03-23 03:06:05+00:00,b'Ni\xc3\xb1a consentida pierde el sentido.'
844535194522595328,2017-03-22 13:04:15+00:00,b'Este es el \xc3\xbanico hombre que me ha contratado sin haberme visto. Me oy\xc3\xb3 al aire en El Ma\xc3\xb1anero de\xe2\x80\xa6 https://t.co/wBBla89lr4'
843671566005231616,2017-03-20 03:52:30+00:00,b'Dejaste de ser una inquietud para convertirte en una certeza.'
843616224068083712,2017-03-20 00:12:36+00:00,"b'Haber regresado a trabajar donde antes estudi\xc3\xa9 ha sido muy emocionante,pero cerrar funci\xc3\xb3n con p\xc3\xbablico de pie,mil veces m\xc3\xa1s.GRACIAS Boston!'"
843506757284519936,2017-03-19 16:57:37+00:00,b'The Hamptons es una zona muy exclusiva y elegante de Long Island que pertenece al estado de\xe2\x80\xa6 https://t.co/ml2Lv1TGH0'
843468506574311426,2017-03-19 14:25:37+00:00,"b'Verte, altera respiro, genera suspiro, desvirola ojo, colorea cachete y afloja rodilla.'"
843296284937261056,2017-03-19 03:01:16+00:00,b'Avram Theater lleno esta noche en The Hamptons y todo el p\xc3\xbablico aplaudiendo de pie al final. Tengo helado el cuerpo y caliente el coraz\xc3\xb3n.'
843227368240168960,2017-03-18 22:27:25+00:00,b'El placer m\xc3\xa1s evolucionado consiste en comportarse como un primate.'
842960265964638208,2017-03-18 04:46:03+00:00,"b'De haber sabido que lo hac\xc3\xadas tan bien, mucho antes te habr\xc3\xada hecho el mal.'"
842868746691760128,2017-03-17 22:42:23+00:00,b'Suerte a mi amigo @AlejandroRia que esta noche se presenta en Miami. No se lo pierdan! Info: 3054431009'
842806861208469504,2017-03-17 18:36:28+00:00,b'Funci\xc3\xb3n AGOTADA esta noche en Orlando! Ma\xc3\xb1ana estar\xc3\xa9 en The Hamptons en el Avram Theater. Info:6312559774 y https://t.co/DYxizUI31Z'
842587419836743681,2017-03-17 04:04:30+00:00,b'GRACIAS a toda la comunidad latina y en especial a los colombianos x darme la dicha de haber agotado el gran teatro Manuel Artime en Miami'
842465263593353217,2017-03-16 19:59:05+00:00,b'Me qued\xc3\xb3 andando tu caminado.'
842380799144001537,2017-03-16 14:23:27+00:00,b'GRACIAS Jaime Bayly x dedicarme tu programa entero en vivo y presentarme como la creadora del mon\xc3\xb3logo femenino + exitoso de Latinoam\xc3\xa9rica'
842379571232043008,2017-03-16 14:18:35+00:00,"b'Lo conoc\xc3\xad aqu\xc3\xad en Miami pocos minutos antes de salir al aire, me sinti\xc3\xb3 nerviosa, lo cual era\xe2\x80\xa6 https://t.co/IcZSX1vsAV'"
842134039779786752,2017-03-15 22:02:55+00:00,"b'Saber c\xc3\xb3mo era \xc3\xa9l con ella, me canta c\xc3\xb3mo debo ser yo con \xc3\xa9l.'"
841991416813371394,2017-03-15 12:36:11+00:00,b'Me tienes a la neurona rasc\xc3\xa1ndose la cabeza.'
841958611714748417,2017-03-15 10:25:50+00:00,"b'En un pa\xc3\xads sin memoria, @DanielSamperO en ""Mi puta obra"" se encarga de despertarla con un texto cargado de s\xc3\xa1tira en el teatro Fanny Mickey'"
841808992905138176,2017-03-15 00:31:18+00:00,"b'Contin\xc3\xbao mi gira por Estados Unidos. De antemano, gracias por tanto apoyo porque uds me han permitido que esto sea realidad. Los espero! https://t.co/Kqvzjsbtvi'"
841755305662939141,2017-03-14 20:57:58+00:00,b'Los pol\xc3\xadticos para qu\xc3\xa9 van a hacer las cosas de frente si de espaldas les va tan bien'
841733166641512450,2017-03-14 19:30:00+00:00,"b'Despu\xc3\xa9s de mil doscientas noventa funciones hasta el d\xc3\xada de hoy, de haber recorrido Colombia de\xe2\x80\xa6 https://t.co/35HVvlc3FM'"
841495298279133184,2017-03-14 03:44:47+00:00,b'Somos tan buena pareja que tenemos el tiempo contado.'
841377751512842241,2017-03-13 19:57:42+00:00,"b'Si no se sabe la soluci\xc3\xb3n, intentar invent\xc3\xa1rsela es el problema.'"
841330456910036993,2017-03-13 16:49:46+00:00,"b'El caso de Odebretch, que deber\xc3\xada ser considerado como un grave caos del estado, aqu\xc3\xad lo volvimos una trenza de chismes y en eso quedar\xc3\xa1'"
841287669447557121,2017-03-13 13:59:45+00:00,b'Me siento muy preparada para seguir metiendo la pata.'
841019840567611392,2017-03-12 20:15:30+00:00,b'Muchas gracias a @jgiraldoreporta y a todo el combo demente de @LaRedCaracol x elegirme como la mejor vestida de los premios India Catalina'
840942341070422017,2017-03-12 15:07:32+00:00,b'Somos un coqueteo inconcluso.'
840718895216488448,2017-03-12 00:19:39+00:00,"b'Contra todo pron\xc3\xb3stico, tenemos futuro.'"
840583621136244736,2017-03-11 15:22:07+00:00,b'Celebrando un gran fin de semana gracias a uds.Anoche funci\xc3\xb3n agotada en el teatro de la Unab de Bmanga y hoy en el teatro Zulima de C\xc3\xbacuta'
