twitter_id,date,tweet
1545768039978770436,2022-07-09 13:53:14+00:00,"b'Do the Math:\n\n1962\nGas: 30-cents/gal\nMed. household income  $6,000\nMileage: 14 mpg\nDist. per 1/1,000 of income: 280 mi\n\n2022\nGas: $5.00/gal\nMed. household income  $75,000\nMileage: 25 mpg\nDist. per 1/1,000 of income: 375 mi\n\nWe travel father today on earned money than 60 yrs ago. https://t.co/Au9iYz3GUj'"
1545163471251275776,2022-07-07 21:50:53+00:00,"b'There I was, all these years, thinking conservative Republicans were all about minimizing how much the Government should meddle in our private lives.'"
1544123898064769024,2022-07-05 01:00:00+00:00,"b'Watching colorful Fireworks tonight?\n\nThank a Chemist. As well as Aluminum, Barium, Calcium, Chlorine, Copper, Nitrogen, Oxygen, Sodium, &amp; Strontium. https://t.co/wGOsxflEW3'"
1544008388048207872,2022-07-04 17:21:00+00:00,"b'US Independence Day\n\nCelebrating the badass moment when the American Colonists declared their independence from the King of England, five years before that independence was actually won.\n\n[USS Intrepid aircraft carrier, now Sea, Air &amp; Space Museum, NYC, -- July 4, 2012] https://t.co/e6mucMVxOR'"
1543998990655651842,2022-07-04 16:43:40+00:00,"b'July 4, 2022\n\nHappy Aphelion to Planet Earth. In our oval orbit, it\xe2\x80\x99s when Earth is farthest from the Sun \xe2\x80\x94 3% more distant than six months from now.\n\nAstrophysicists worldwide, but especially in the USA, might be seen today celebrating with fireworks. https://t.co/OWhx4coOcp'"
1539253247990452228,2022-06-21 14:25:46+00:00,b'No 8 was not a test. It was just a plain old \xe2\x80\x9cwordo\xe2\x80\x9d \xe2\x80\x94 the word equivalent of a \xe2\x80\x9ctypo\xe2\x80\x9d. Should have said \xe2\x80\x9cSouthern Hemisphere days begin to lengthen\xe2\x80\x9d. Thanks to all those who caught it.'
1539166230720008198,2022-06-21 08:40:00+00:00,"b'and\xe2\x80\xa6\n\nAlong the equator, sitting exactly between two hemispheres that always trend in opposite ways, the duration of sunlight &amp; darkness remains unchanged throughout the year.  There are no astronomical seasons, and their twilight is always the shortest -- less than 30 mins.'"
1539163666918121473,2022-06-21 08:29:49+00:00,"b'June 21, 2022\nWelcome to the Solstice. On this day\xe2\x80\xa6\n\n7.  the Northern Hemisphere days begin to shorten\n\n8.  the Northern Hemisphere days being to lengthen\n\n...'"
1539161309912219648,2022-06-21 08:20:27+00:00,"b'June 21, 2022\nWelcome to the Solstice.  On this day\xe2\x80\xa6\n\n4. the Northern Hemisphere sees max sunlight - first day of Summer\n\n5. the Southern Hemisphere sees min sunlight - first day of Winter\n\n6. the World experiences the longest twilight of the year\n\n...'"
1539160857078382592,2022-06-21 08:18:39+00:00,"b'June 21, 2022\nWelcome to the Solstice.  On this day...\n\n1. the North Pole tips directly to the Sun - 23.5 degrees\n\n2. the entire Arctic circle never sees sunset\n\n3. the entire Antarctic circle never sees daylight\n\n...'"
1535688970545373184,2022-06-11 18:22:36+00:00,"b'Speaking of children\'s books, I once daydreamed that @levarburton read ""Goodnight Moon"" to me.\n\nhttps://t.co/rsfzs9XJYg'"
1535051566025424896,2022-06-10 00:09:47+00:00,"b'Banned in Pennsylvania\n\nA biography called StarStruck portrays an actual (non-violent) Police encounter in my teens. From my apartment building\xe2\x80\x99s roof, they thought my telescope was a weapon.\n\nApparently they don\xe2\x80\x99t want you to see what can happen between Police &amp; people of color. https://t.co/mysDB3VZNI'"
1534738911733465088,2022-06-09 03:27:25+00:00,b'Do you want to live forever?\n\n[Video: 9 min]\nhttps://t.co/5JybiQNzxP'
1531044826925486082,2022-05-29 22:48:26+00:00,"b'8:12 pm, NYC Time\nSunday, May 29, 2022\nMonday, May 30, 2022\n\nCrowds gather. Traffic halts. Cross streets glisten with fiery orange light, rendering otherwise-shadowed urban canyons aglow. Behold sunset on the Manhattan grid. Behold #Manhattanhenge. https://t.co/l0tus96gqp'"
1530671626894774272,2022-05-28 22:05:29+00:00,"b'Hockey great Mark Messier, upon learning as a @NYRanger that the @StanleyCup double\xe2\x80\x99s off-season as the @NASAHubble Space Telescope. https://t.co/DdMhld3Eft'"
1530664159792312320,2022-05-28 21:35:48+00:00,"b'@mechjacktv @NYRangers @TheGarden @StanleyCup Sounds like you already know the answer.  All scientific discoveies build on previous work.\n\nHenrietta Leavitt in 1908, eighteen years earlier.\n\nHubble\xe2\x80\x99s discovery was enabled by his monster 100-inch telescope on Mt. Wilson, California.'"
1530656427047587843,2022-05-28 21:05:05+00:00,b'@Rizeberg No.  Your lungs already mixed your bood with oxygen.'
1530655940676132866,2022-05-28 21:03:09+00:00,"b'The @NYRangers were founded in 1926, as center ice at @TheGarden reminds us.\n\nThe same year astrophysicist Edwin Hubble discovered that our galaxy \xe2\x80\x94 the Milky Way \xe2\x80\x94 is a small part of a vastly larger universe that also contains the @StanleyCup. https://t.co/FXkLJRjljI'"
1526629951880822786,2022-05-17 18:25:18+00:00,"b'Cute cat videos go viral instantly.\n\nNearly seven billion smart phones in the world.  Imagine video of an extraterrestrial ship landing, with aliens disembarking. I\xe2\x80\x99m thinking that would go viral too.'"
1526516497715286016,2022-05-17 10:54:29+00:00,"b'I\xe2\x80\x99m thinking that if Space Aliens were actively visiting Earth from across the galaxy, we would not need Congressional Hearings to establish this fact.  Just sayin\xe2\x80\x99. https://t.co/6log7RToMV'"
1526041155837825024,2022-05-16 03:25:38+00:00,"b'Lunar eclipses occur on average every two or three years and are visible to all the billions of people who can see the Moon when it happens. \n \nSo, contrary to what you may have been told, lunar eclipses are not rare.'"
1526034149546639361,2022-05-16 02:57:48+00:00,b'Lunar eclipses are so un-spectacular that if nobody told you what was happening to the Moon you\xe2\x80\x99d probably not notice at all.\n\nJust sayin\xe2\x80\x99.'
1526033392936132608,2022-05-16 02:54:47+00:00,"b'Unlike solar eclipses, which are location-dependent, everyone on the side of Earth facing the full Moon (i.e. the Sun has set for you) can witness a lunar eclipse.'"
1526031413337903104,2022-05-16 02:46:55+00:00,"b'Decades ago, when there was more air pollution, sunsets were often beet-red. That color would refract into Earth\xe2\x80\x99s shadow in space tinting the fully eclipsed Moon. \n\nHaven\xe2\x80\x99t seen that effect in years. The Moon more commonly goes dark, leaving nothing \xe2\x80\x9cbloody\xe2\x80\x9d about the Blood Moon'"
1526029500269711361,2022-05-16 02:39:19+00:00,"b'Dear Earthlings currently in darkness:\n\nRight about now, the full Moon is passing into Earth\xe2\x80\x99s conical shadow in space. The event is long and boring, lasting 3.5 hours.  For the middle 84 minutes, the Moon is all but fully darkened as it enters the deepest part of Earth\xe2\x80\x99s shadow.'"
1525230770448637954,2022-05-13 21:45:27+00:00,"b'@GuestSt18702890 @NASA @elonmusk @SpaceForceCSO @SpaceForceDoD @ScienceNews Lunar phases are just the Sun illuminaing the Moon in different amounts during the Moon\xe2\x80\x99s moonthly orbit around Earth.  Has nothing to do with Earth\xe2\x80\x99s shadow. Occasionally, the Moon\xe2\x80\x99s path enters Earth\xe2\x80\x99s shadow. That can happen only during Full Moon.  Behold, a Lunar eclipse.'"
1525228178725380097,2022-05-13 21:35:09+00:00,b'@bd_zero_g @StarTalkRadio It doesn\xe2\x80\x99t. That\xe2\x80\x99s part of what defines our cosmic horizon.'
1525150630628798465,2022-05-13 16:27:00+00:00,b'@INSIGHS No. You saw four dimensions projected onto three dimensions filmed in two dimensions.'
1525147310916780033,2022-05-13 16:13:49+00:00,"b""Just created my own Tesseract portal.  But don't tell anybody. https://t.co/vpSC6QtiXz"""
1522283656013885442,2022-05-05 18:34:40+00:00,b'If interested\xe2\x80\xa6\n\nSome thoughts on Abortion\n[600 words]\n\nhttps://t.co/oLxH7DR2bH https://t.co/fOyh6KSWZA'
1521883616623611904,2022-05-04 16:05:04+00:00,b'May the 4th be with you.'
1520629890537730049,2022-05-01 05:03:12+00:00,"b'If a human bites a Vampire then shouldn\xe2\x80\x99t the Vampire turn back into a human?\n\nAnd while we\xe2\x80\x99re at it, if a human bites a Zombie shouldn\xe2\x80\x99t it cure the Zombie too?'"
1518436512144236545,2022-04-25 03:47:30+00:00,"b""I don't know anyone who drinks liquids from cups with holes in their bottoms.  So you are describing a different world. https://t.co/2IkNZQmgEF"""
1518435591947489286,2022-04-25 03:43:50+00:00,"b""@cubosh If the arrow of time reversed, then so would the vocabulary describing the events.  So I think we're good here."""
1518434939326406656,2022-04-25 03:41:15+00:00,b'If you watched the glass long enough (over days) you will see the level slowly drop as the water evaporates from its surface.\n\nThat counts as half-empty. https://t.co/z5anbj3jbn'
1518434055662014464,2022-04-25 03:37:44+00:00,"b""@sum_prodigalson I would instead say, please continue pouring, it's only half-full."""
1518433534075097093,2022-04-25 03:35:40+00:00,"b'If you are filling a glass and reach the halfway point, it\xe2\x80\x99s half-full. If you are emptying a glass and reach the halfway point, it\xe2\x80\x99s half-empty.\n\n No need to invoke your emotional state.'"
1517562686703292425,2022-04-22 17:55:14+00:00,b'If every day were #EarthDay we wouldn\xe2\x80\x99t be in the mess we\xe2\x80\x99re in.'
1516779181870354432,2022-04-20 14:01:52+00:00,b'@DisgVet If it was not otherwise clear: The link to the podcast episode in the tweet will take you there.'
1516778499801026567,2022-04-20 13:59:09+00:00,b'@RichardDuton everybody knows\xe2\x80\xa6 \n\n1 Guffaw = 10 Chortles'
1516583818421014537,2022-04-20 01:05:33+00:00,"b""We talked about science in bad movies. Was a guffaw a minute.\n\nHow I'll always remember him:  Smart. Funny. Curious. With a childlike amusement of all that makes you laugh.\n\nGilbert Gottfried, RIH (rest in humor) Feb 1955 - April 2022.\n\n[Audio: 1h 37m]\nhttps://t.co/9RhTtVZvC8 https://t.co/SNShL6mQkL"""
1515474727032209410,2022-04-16 23:38:25+00:00,"b'With a telescope, the Moon is best viewed during other phases, especially half-moon, in which the craters and mountains cast their longest shadows.\n\nCool Lamp. https://t.co/JnS4oBtsFS'"
1515470948249579524,2022-04-16 23:23:24+00:00,"b'Saturday, April 16, 2022\n\nFull Moon today \xe2\x80\x94 the first one after the March Equinox. The Sunday following that Full Moon is, by definition, Easter.\n\nThis rule precludes solar eclipses from ever taking place on Easter Sunday. https://t.co/Vimo9ICIpO'"
1511373963007508481,2022-04-05 16:03:27+00:00,b'@beatmurda The previews have me greatly worried.  But It\xe2\x80\x99s nonetheless on my list.\n\nStay tuned.'
1511364412283789317,2022-04-05 15:25:30+00:00,b'Hard time comprehending the universe? Just remember that it\xe2\x80\x99s actually above everyone\xe2\x80\x99s head. https://t.co/QsWRhHAIZ7'
1511058900879040517,2022-04-04 19:11:30+00:00,b'Looks like some parts of the World need more Sunflowers \xe2\x80\x94 again.\n\xe2\xa0\x80\xe2\xa0\x80\xe2\xa0\x80\xe2\xa0\x80\n[Vincent van Gogh styled image of a Sunflower field. Mixed Media by David Pyatt]\n\nhttps://t.co/3p8xL8altv https://t.co/xfx7c2mmfP'
1511052837303824387,2022-04-04 18:47:25+00:00,"b'RT @MikeyMarie3: @neiltyson @NCAA Maybe it\'s to reduce Canadian confusion. ""N-C-A, eh?"" ...""Eh!!"" \xf0\x9f\x98\x86'"
1510988890810818566,2022-04-04 14:33:19+00:00,"b'Not that anybody inquired, but to say the individual letters \xe2\x80\x9cN-C-A-A\xe2\x80\x9d (as in @NCAA) uses fewer syllables than to say \xe2\x80\x9cN-C-double-A\xe2\x80\x9d. So to utter \xe2\x80\x9cdouble-A\xe2\x80\x9d does not save you time.'"
1509572257487724560,2022-03-31 16:44:07+00:00,"b'@SupernovaStuff @MoonfallFilm The Sun is off to the right.  Illiuminaing the right-facinig crescent of the Moon, the right-facing crescent of Earth, and the right-facing parts of the Space Station.\n\nAll is well in the world of optics.'"
1508475622426910722,2022-03-28 16:06:29+00:00,"b'A reminder\xe2\x80\xa6\n\nEighty years ago the city of Leningrad was under siege for 900 days. The Nazis severed all supply chains into the city and pummeled the infrastructure, ultimately leaving a million Russian civilians dead.\n\nMeanwhile\xe2\x80\xa6\nhttps://t.co/uNtf5trk7W https://t.co/RSmQ54AZqJ'"
1507514587041746944,2022-03-26 00:27:40+00:00,"b'Last I checked, the rest of the Universe was in good shape. It\xe2\x80\x99s Earth that\xe2\x80\x99s got all the problems.'"
1504534281879646212,2022-03-17 19:05:00+00:00,"b'The exact Rainbow any of us sees is entirely our own \xe2\x80\x94 a personal, yet communal gift from the laws of optics.\n\nThat\xe2\x80\x99s why Rainbows are **always** face-on. You\xe2\x80\x99ve never seen one at an angle, which forever protects the Pot of Gold hidden at it base. https://t.co/I8jBXIopVf'"
1504529249109164034,2022-03-17 18:45:00+00:00,"b'""It Ain\'t Easy Being Green\xe2\x80\x9d\n-Kermit the Frog\n\nhttps://t.co/z3ukZdEUpP'"
1504522956889747463,2022-03-17 18:20:00+00:00,"b'By the 1920s the mysterious, Green-emitting space element ""nebulium was ID\'ed as oxygen, but behaving oddly in the rarefied conditions of space.'"
1504520440617873410,2022-03-17 18:10:00+00:00,"b'Mid-19th century, a mysterious element was discovered in space nebulae. It emits deep Green, and was dubbed \xe2\x80\x9cnebulium."" https://t.co/sVPHe1sQez'"
1504515658712850439,2022-03-17 17:51:00+00:00,"b'Rarefied gas just might be Irish: The element oxygen, in Aurora and in the near-vacuum conditions of space, radiates pure Green. https://t.co/Pc8zXMy4JH'"
1504513142021247001,2022-03-17 17:41:00+00:00,"b'Stars are not Irish: The laws of radiative physics conspire in such a way that there are no Green stars in the Universe. They come in three basic colors: Reddish, White, &amp; Blueish.'"
1504509618956906497,2022-03-17 17:27:00+00:00,"b'We think of US paper money as                                                                                                            being Green. But face-side ink is primarily black. So instead of ""Greenbacks"" it could legitimately be called ""Blackfronts"" https://t.co/7XUqODregB'"
1504506095880048642,2022-03-17 17:13:00+00:00,"b""Curiously, light-loving Green plants reject the Sun's Green light, reflecting it back at you, which is why they look Green. https://t.co/7iUrQHTRno"""
1504498546111832065,2022-03-17 16:43:00+00:00,"b'The ""Green\xe2\x80\x9d movement might be misnamed. Experiments show that increased CO2 promotes photosynthesis, making plants grow faster.'"
1504494770978181120,2022-03-17 16:28:00+00:00,b'Odd that drivers of fuel efficient cars often get more Green-praise than people who chose to live where they can walk to work.'
1504491500759138307,2022-03-17 16:15:00+00:00,"b""From a rainbow, Green is Roy G. Biv's middle name. Red Orange Yellow GREEN Blue Indigo Violet. https://t.co/Nvoluc9ptV"""
1504487221163966465,2022-03-17 15:58:00+00:00,"b'From the Archives:  Between scenes, in socks on the slippery smooth Green-Screen that would become the Cosmic Calendar. \xe2\x80\x9cCosmos A Spacetime Odyssey\xe2\x80\x9d (2014).\n\n[Video: 10 sec] https://t.co/KSM8eQhLd4'"
1504484201696935941,2022-03-17 15:46:00+00:00,"b'From the Archives:  Receiving Green Screen Instructions from Bill Pope, the Director of Photography for \xe2\x80\x9cCosmos: A Spacetime Odyssey\xe2\x80\x9d (2014). https://t.co/StOkvFAVWX'"
1504479100542468106,2022-03-17 15:25:44+00:00,"b'I hear that the Credible Hulk, also Green, was instead exposed to rays of Objective Truths. https://t.co/djkwL8Bfk9'"
1504476400002248704,2022-03-17 15:15:00+00:00,"b'The Hulk is Green from a potent, accidental dose of Gamma Rays. Actually, Bruce Banner would have died within days from organ failure. https://t.co/BeOzo5VNmz'"
1504473129007017996,2022-03-17 15:02:00+00:00,"b'A reminder that Kryptonite, the only substance in the universe that can injure or kill Superman, is Green. https://t.co/20l6op0lhN'"
1504468850762387465,2022-03-17 14:45:00+00:00,"b'If human blood used Copper instead of Iron, turning it Green, I wonder what color we would have made stop lights &amp; stop signs. https://t.co/hH5c86MNG2'"
1504465077713264644,2022-03-17 14:30:00+00:00,b'Lobsters (and Vulcans) use copper instead of iron in their blood. Oxidized copper confers a Green tinge. https://t.co/lEuczvnluw'
1504461300700631040,2022-03-17 14:15:00+00:00,"b'Our eyes are about 10x more sensitive to Green light than Red. So watt-for-watt, Green lasers look much brighter than Red ones.'"
1504458280994701317,2022-03-17 14:03:00+00:00,"b'The peak sensitivity of the Human Retina is Green, evolved to match the peak spectral output of the Sun.'"
1504453075368652806,2022-03-17 13:42:19+00:00,b'The Sun emits more Green light than any other band of light in the rainbow.'
1504447941498609669,2022-03-17 13:21:55+00:00,b'A cosmic romance on the color GREEN follows shortly\xe2\x80\xa6'
1504222822473814016,2022-03-16 22:27:22+00:00,"b'Some educators who are quick to say, ""These students just don\'t want to learn"" should instead say to themselves, ""Maybe I suck at my job.""'"
1503403432597757968,2022-03-14 16:11:24+00:00,b'FYI: That was all the Pi that Twitter could handle.'
1503401371474739212,2022-03-14 16:03:13+00:00,b'3.14159265358979323846264338327950288419716939937510582097494459230781640628620899862803482534211706798214808651328230664709384460955058223172535940812848111745028410270193852110555964462294895493038196442881097566593344612847564823378678316527120190914564856692346034861045432664'
1501049570314252289,2022-03-08 04:18:00+00:00,b'What scientists know about the world is mind-blowing.  What the public thinks scientists don\xe2\x80\x99t know about the world is alarming.'
1498203381386686467,2022-02-28 07:48:16+00:00,"b'@buitengebieden_ That\xe2\x80\x99s missing an \xe2\x80\x9cs\xe2\x80\x9d.  The actual sentence, which still applies to the video, is:\n\n \xe2\x80\x9cThe quick sly fox jumped over the brown lazy dog.""'"
1496536404406542341,2022-02-23 17:24:17+00:00,"b'@michaelianblack I\xe2\x80\x99m a caboose man, myself.\n\nNot only is the word delightful, but chillin\xe2\x80\x99 in the (red) last train car, staring out the window at the passing scenery, sounds good to me.'"
1493421944418582529,2022-02-15 03:08:32+00:00,b'https://t.co/GoghXoTC7S https://t.co/Dx5CkSULjT'
1492983478085984259,2022-02-13 22:06:14+00:00,b'Okay. Okay. Next time (and every time) I\xe2\x80\x99ll give fair warning that a Dad-joke is imminent.'
1492699575068594181,2022-02-13 03:18:06+00:00,"b'Can\xe2\x80\x99t help thinking the @NFL, at season\xe2\x80\x99s end, should round up all the best Vegetarian football players and have them play in an annual \xe2\x80\x9cSalad Bowl\xe2\x80\x9d.'"
1487843519897161729,2022-01-30 17:41:52+00:00,"b'FYI:  When the wayward SpaceX rocket hits the Moon on March 4, there\xe2\x80\x99s no need to worry for the Moon itself.  Impact craters are its thing.\n\nMust-see NASA Video [2m 40s]:\nhttps://t.co/sATmyPTGBy'"
1487839140360208388,2022-01-30 17:24:28+00:00,"b'Friday on @AndersonCooper I vastly underestimated the wayward SpaceX rocket\xe2\x80\x99s impact energy with the Moon. Using corrected numbers, the March 4th explosion will rival 20,000 sticks of dynamite.  Easily visible to Aliens, or anyone else in space who can see the Moon\xe2\x80\x99s far side.'"
1484942687451029509,2022-01-22 17:35:00+00:00,"b'Always wondered, if a toddler ghost trips and scrapes its knee, is the bruise a Boo Boo?'"
1484940986052755458,2022-01-22 17:28:14+00:00,b'Dad Joke alert\xe2\x80\xa6'
1483993178164412418,2022-01-20 02:41:59+00:00,b'The mathematical value of Pi does not change when you cross international borders.'
1483099663658012690,2022-01-17 15:31:29+00:00,"b'""Nothing in the world is more dangerous than sincere ignorance and conscientious stupidity.\xe2\x80\x9d\n\n- Martin Luther King Jr. 1963 https://t.co/B9Z62cu97i'"
1482844726038564871,2022-01-16 22:38:27+00:00,"b'@Jen_Jen_RN Bacteria within will not stop munching away.  And if the bodies are nearby a source of high-energy photons -- a blue star, for example \xe2\x80\x94without an ozone layer to shield them, the bodies molecules would systematically decompose from the outside.'"
1482797010017300487,2022-01-16 19:28:50+00:00,b'I have on good authority \xe2\x80\x94 Philly native and my @StarTalkRadio cohost @ChuckNiceComic \xe2\x80\x94 that the @Eagles are saving their best stuff against @TomBrady and the @Buccaneers for the second half of the game they are currently losing 17-0.'
1480312679076093957,2022-01-09 22:57:00+00:00,"b'At night, I occasionally dream of briefly unplugging light-ridden cities such as New York, enticing all to look up &amp; embrace the splendor of a Starry Sky. https://t.co/uXiRrGY79r'"
1478386905641373697,2022-01-04 15:24:40+00:00,"b'@JoinTeamB @Sqweesh_Kapeesh FYI:  \xe2\x80\x9cThey"" is not my pronoun.'"
1478378912128319488,2022-01-04 14:52:54+00:00,"b'Solar flux scales as the square of the distance.\n\nIf you do the math, Earth today receives about 6% more solar energy than in July.\n\nBut we\xe2\x80\x99re also moving faster in our orbit. Which largely cancels out the net gain.\n\nThat\xe2\x80\x99s why Winter is only 89 days long. Summer: 94 days https://t.co/ha4oBScC4j'"
1478375588364754953,2022-01-04 14:39:41+00:00,"b'Merry Perihelion to planet Earth.\n\n147,105,050 kilometers from the Sun\n\nIn our annual oval orbit, today we are closer to the Sun than at any other time of the year.\n\nBut not by much -- about 3% closer than at Aphelion, our farthest distance from the Sun six months from now. https://t.co/rEyoT622uA'"
1476677492849225731,2021-12-30 22:12:04+00:00,"b'It\xe2\x80\x99s almost that time of year\xe2\x80\xa6 \n\nMERRY PERIHELION\n(Janaury 4, 2022)\n\nConceived &amp; designed by fans. Approved by me. After fees to the artist, proceeds go to educational organizations.\n\nApparel\nhttps://t.co/MsUGiBVdpl\n\nPop Socket\nhttps://t.co/jXgGI57NVt https://t.co/WCLaZd8oEE'"
1476294547122671618,2021-12-29 20:50:22+00:00,b'@ihc0613 @netflix The Marvel Universe does that all the time. So I\xe2\x80\x99m well-trained to wait for the end-of-credits.'
1476293956153581578,2021-12-29 20:48:02+00:00,"b'Finally saw the @Netflix film \xe2\x80\x9cDon\xe2\x80\x99t Look Up,\xe2\x80\x9d a fictional tale of a Nation distracted by pop-culture and divided on whether to heed dire warnings of scientists.\n\nEverything I know about news-cycles, talk shows, social media, &amp; politics tells me the film was instead a documentary https://t.co/tvDuEUXWCW'"
1475870474248900624,2021-12-28 16:45:16+00:00,b'@SpaceRyunosuke It kinda does. A little bit.'
1475869076954222593,2021-12-28 16:39:42+00:00,b'Where in the universe is the James Webb Space Telescope?\n\nInquiring minds want to know.\n\nhttps://t.co/40BvXfDdGe'
1474828542709960704,2021-12-25 19:45:00+00:00,"b'(2/2) Psychedelic cosmic collage, continued\n\n \xe2\x80\xa6dog &amp; human robots, an armillary sphere (Google it), a phrenology head, Leo the Lion, a fashion model looking through three telescopes, a 1970s era boom box, and of course, on the far left, a jeweled six-foot electric guitar. https://t.co/yxjUqwqXva'"
1474827284502573056,2021-12-25 19:40:00+00:00,"b'(1/2) Sciencey 12-ft Christmas windows along 5th Ave @Bergdorfs Goodman, NYC\n\nPsychedelic cosmic collage\n\nIt\xe2\x80\x99s all there, and then some.  Star charts, crescent moon, Galileo, a rocket, late 1950s Cadillac Eldorado fins, disco-balls, an hourglass, a wall-mounted dial telephone\xe2\x80\xa6 https://t.co/uLZvVvredS'"
1474819734667509764,2021-12-25 19:10:00+00:00,"b'Sciencey 12-ft Christmas windows along 5th Ave @Bergdorfs Goodman, NYC\n\nPsychedelic Tree of Life\n\nMostly birds, including a peacock, owl, parrot, and toucan. Also insects, including bees, butterflies, beetles, and a dragonfly. And of course a fashion model with a wasp in her hair https://t.co/AKu8XrJpLf'"
1474813443261665284,2021-12-25 18:45:00+00:00,"b'Sciencey 12-ft Christmas windows along 5th Ave @Bergdorfs Goodman, NYC\n\nA psychedelic Marine scene\n\nNot a fish expert, but I see multiple swordfish, an electric eel, an octopus, a hammerhead shark, a barracuda, a purple goldfish, a scaly mermaid with legs. And of course a Harley. https://t.co/Wb8cYOE4sq'"
1474810171800965121,2021-12-25 18:32:00+00:00,"b'Three sciencey Christmas windows along 5th Avenue at @Bergdorfs Goodman, New York City.  Cool.\n\n1) A psychedelic marine scene\n\n2) A psychedelic tree of life\n\n3) A psychedelic cosmic collage.\n\nAnalysis to come\xe2\x80\xa6 https://t.co/FQY9cIkCkG'"
1474767330811039748,2021-12-25 15:41:46+00:00,"b'Godspeed James Web Space Telescope. Launched 7:20 am ET, December 25, 2021\n\nHeaded for Earth-Sun Lagrangian Point \xe2\x80\x9cL2\xe2\x80\x9d a million miles away.  \n\nCongratulations to @NASA, thousands of engineers &amp; my fellow scientists. \n\nEvidence that exploration remains alive in the human spirit. https://t.co/bEJzzzng6t'"
1474737190865416198,2021-12-25 13:42:00+00:00,"b'To all Christians of the world: \n\n""Merry Christmas.\xe2\x80\x9d\n\nTo Jews, Muslims, &amp; anybody else not expecting Santa:\n\n""Happy Saturday.\xe2\x80\x9d https://t.co/jDNXd12JH3'"
1474541148928716805,2021-12-25 00:43:00+00:00,"b'Santa doesn\xe2\x80\x99t know Zoology:\n\nBoth male &amp; female Reindeer grow antlers. But all male Reindeer lose their antlers in the late fall, well-before Christmas.\n\nSo Santa\xe2\x80\x99s reindeer, which all sport antlers, are therefore all female, which means Rudolf has been misgendered. https://t.co/03skVxyYRE'"
