twitter_id,date,tweet
633277960401891328,2015-08-17 14:03:26+00:00,"b'RT @a_rfef: Ser tu hermano es un orgullo. Ser tu representante, una responsabilidad. \xc2\xa1Enhorabuena por continuar tu sue\xc3\xb1o!#2020SR4 http://t.\xe2\x80\xa6'"
633251455525351424,2015-08-17 12:18:06+00:00,"b'.@realmadrid is my home. A dream of 10 years that is not over yet. Then, now and always: HALA MADRID #2020SR4 https://t.co/xEWzftwpK0'"
633251286813704192,2015-08-17 12:17:26+00:00,"b'El @realmadrid es mi casa, un sue\xc3\xb1o de 10 a\xc3\xb1os que no ha terminado. Entonces, ahora y siempre HALA MADRID #2020SR4  https://t.co/xEWzftwpK0'"
633004072916926464,2015-08-16 19:55:06+00:00,"b'A unique weekend with an incredible travel companion @PilarRubio_ Love you, sweetie... \xf0\x9f\x92\x9c\xe2\x9d\xa4\xf0\x9f\x92\x9c\xe2\x9d\xa4... http://t.co/5lJ6NdHm0W'"
633001691613429764,2015-08-16 19:45:38+00:00,b'Un fin de semana \xc3\xbanico con una maravillosa compa\xc3\xb1era de viaje @pilarrubio_. Tqm mi vida...\xf0\x9f\x92\x9c\xe2\x9d\xa4\xef\xb8\x8f\xf0\x9f\x92\x9c\xe2\x9d\xa4\xef\xb8\x8f... http://t.co/Jl9hgxHhJ0'
631814488199725056,2015-08-13 13:08:07+00:00,"b""RT @PilarRubio_: Don't know what to wear today? Customize a t-shirt so it looks completely different! http://t.co/vC1N44E6Pi http://t.co/KK\xe2\x80\xa6"""
631814446118252544,2015-08-13 13:07:57+00:00,b'RT @PilarRubio_: \xc2\xbfNo sab\xc3\xa9is qu\xc3\xa9 poneros hoy? \xc2\xa1Os ense\xc3\xb1o c\xc3\xb3mo customizar una camiseta para que parezca otra! http://t.co/vC1N44mvXK http://t\xe2\x80\xa6'
631071351588155392,2015-08-11 11:55:09+00:00,b'Back with the team and victory during the training match! Come on!!! http://t.co/7tFYe5g4Om'
631071163851108352,2015-08-11 11:54:24+00:00,b'Entrenamiento de nuevo con el equipo y victoria en el partidillo. \xc2\xa1\xc2\xa1Vamossss!! http://t.co/GSeWHO0kS5'
630728858430513153,2015-08-10 13:14:12+00:00,"b""Ma\xc3\xb1ana de trabajo. \xc2\xa1\xc2\xa1Buen d\xc3\xada a tod@s!! // This morning's work. Good day everyone!! http://t.co/sA2Vw3Jpjb"""
628892926664409088,2015-08-05 11:38:52+00:00,b'Buen partido ayer. Hoy toca dar el m\xc3\xa1ximo contra el Bayern/Great game yesterday. Must give our all today Vs. Bayern. http://t.co/yx2d96ZoVZ'
628283841111814144,2015-08-03 19:18:35+00:00,"b""Ya en M\xc3\xbanich, preparados para el partido de ma\xc3\xb1ana. /Just arrived in Munich, ready for tomorrow's game. http://t.co/XZFGSiwq9C"""
627099163730268160,2015-07-31 12:51:06+00:00,"b""Back home. I've come across this guy wearing a t-shirt customised by his mum. I love you both so much @PilarRubio_ \xf0\x9f\x92\x9c\xe2\x9d\xa4 http://t.co/Imi5kSUsmh"""
627098557212946433,2015-07-31 12:48:41+00:00,b'De vuelta en casa mirad a quien me he encontrado con camiseta personalizada por @PilarRubio_   . Os quiero mucho\xe2\x9d\xa4\xef\xb8\x8f\xf0\x9f\x92\x9c http://t.co/4NKUpOaYmp'
625914677504143361,2015-07-28 06:24:22+00:00,"b'After the training session, hanging out with @isco_alarcon and @nachofi1990 . Hello everyone! http://t.co/4jOmJOFlB8'"
625909157095436288,2015-07-28 06:02:26+00:00,"b'Despu\xc3\xa9s de la sesi\xc3\xb3n de trabajo, un poquito de relax con @isco_alarcon y @nachofi1990 \xc2\xa1Saludos a todos! http://t.co/Sw3uwnFEjZ'"
625577151824326656,2015-07-27 08:03:10+00:00,"b'Thanks, China, for your warm welcome! Training at 100% as usual. First match here today. http://t.co/K8gK8CDDD5'"
625577022975266816,2015-07-27 08:02:39+00:00,"b'\xc2\xa1Gracias, China, por el recibimiento! Seguimos entrenando al 100%. Hoy toca primer partido aqu\xc3\xad. http://t.co/2adzKlAbJG'"
623871545379844098,2015-07-22 15:05:42+00:00,"b'Thanks so much for the song, @PilarRubio_ I miss you all! See you real soon. I love you. \xf0\x9f\x92\x81\xf0\x9f\x99\x87 http://t.co/odskBVgVwy'"
623870044976582656,2015-07-22 14:59:44+00:00,b'Muchas gracias por la canci\xc3\xb3n cari\xc3\xb1o @PilarRubio_  \xc2\xa1Os echo de menos!Ya queda nada para veros de nuevo.Os quiero. \xf0\x9f\x92\x81\xf0\x9f\x99\x87 http://t.co/jHFyyLRIO6'
623517436915122176,2015-07-21 15:38:36+00:00,"b""Goodnight everyone! Here's a playlist that I like, hope you enjoy it as much as I do. Greetings from Australia! https://t.co/iwKDPGV1vD"""
623517329608048640,2015-07-21 15:38:10+00:00,b'De buenas noches os dejo una lista con canciones que espero os gusten tanto como a m\xc3\xad. \xc2\xa1Saludos desde Australia!\nhttps://t.co/iwKDPGV1vD'
623430668861743104,2015-07-21 09:53:48+00:00,b'Sesi\xc3\xb3n muy divertida con invitados especiales / A very funny session with special guests at the AAMI Park http://t.co/Fk9iGM3iST'
623030734601756676,2015-07-20 07:24:37+00:00,b'An amazing performance and great victory. CHAMPIONS!! Congratulations @sefutbol!! #U19EURO http://t.co/NObbTiHFMh'
623030434973249536,2015-07-20 07:23:25+00:00,"b'Juego espectacular y gran victoria. \xc2\xa1\xc2\xa1CAMPEONES!! \xc2\xa1\xc2\xa1Enhorabuena, @sefutbol!! https://t.co/m9QvvYcWQZ'"
622718651846799360,2015-07-19 10:44:30+00:00,b'First match of the pre-season and boat trip in Melbourne. Greetings from Australia! http://t.co/QKdfwlCcwk'
622718366713819136,2015-07-19 10:43:22+00:00,b'Primer partido de la pretemporada y paseo en barco por Melbourne. \xc2\xa1Saludos desde Australia! http://t.co/Ouf5tTwemG'
622020195733913600,2015-07-17 12:29:05+00:00,b'Great reception in Australia. Pre-season going well and ready for first match tomorrow Vs Roma. http://t.co/Dzo4087oTb'
622019801834242048,2015-07-17 12:27:31+00:00,b'Gran recibimiento en Australia. A tope con la pretemporada y preparado para el primer partido ma\xc3\xb1ana contra la Roma. http://t.co/oA74cuAIP9'
621941923666894848,2015-07-17 07:18:04+00:00,"b'Well done, boys. Great performance. Now for the final! #EuropeoSub19 @SeFutbol http://t.co/GnuJho0qkM'"
621941778573299712,2015-07-17 07:17:29+00:00,"b'Enhorabuena, compa\xc3\xb1eros. Sois muy grandes. \xc2\xa1Ahora, a por la final! #EuropeoSub19 @SeFutbol http://t.co/FqFgAqWyWp'"
620976658879803392,2015-07-14 15:22:27+00:00,b'Enjoying a contrast bath after a double training session. Greetings everyone! Good night http://t.co/w8pwQfmZjn'
620976321259274240,2015-07-14 15:21:06+00:00,"b'Despu\xc3\xa9s de una doble sesi\xc3\xb3n de trabajo, contrastes de agua fr\xc3\xada y caliente. \xc2\xa1Saludos a tod@s! Buenas noches http://t.co/RMPPvt3aHp'"
620175480562520064,2015-07-12 10:18:51+00:00,"b'10 years together and many, many shared moments. A great Captain, thank you, @CasillasWorld #GraciasIker https://t.co/5xRIlOaS8J'"
620175385829986304,2015-07-12 10:18:28+00:00,"b'10 a\xc3\xb1os juntos y muchos, muchos momentos. Grande Capit\xc3\xa1n, Gracias @CasillasWorld #GraciasIker https://t.co/5xRIlOaS8J'"
620164571437879296,2015-07-12 09:35:30+00:00,"b'RT @PilarRubio_: Fin de las vacaciones, una maravilla poder disfrutar del Gran Ca\xc3\xb1\xc3\xb3n con mi amor @SergioRamos \xe2\x9d\xa4\xef\xb8\x8f\xf0\x9f\x91\xa8\xe2\x80\x8d\xf0\x9f\x91\xa9\xe2\x80\x8d\xf0\x9f\x91\xa6\xe2\x80\x8d\xf0\x9f\x91\xa6\xe2\x9d\xa4\xef\xb8\x8f http://t.co/ZDgQC\xe2\x80\xa6'"
614460857221836800,2015-06-26 15:50:59+00:00,"b'Havana, June 2015. Unforgettable experience with @UNICEF. All about it in this video. #ConUnicefenCuba https://t.co/895Zr5yzfk'"
614460062120189952,2015-06-26 15:47:49+00:00,"b'La Habana, junio de 2015. Experiencia inolvidable con @unicef_es .Te lo cuento todo en este v\xc3\xaddeo. #ConUnicefenCuba https://t.co/yzLHhzlSqE'"
614000483850690560,2015-06-25 09:21:37+00:00,b'4/4. Unprecedented achievement. Proud of you and of the junior teams. Absolute basketball champions! #HalaMadrid'
614000316510511104,2015-06-25 09:20:57+00:00,b'4 de 4. \xc3\x89xito hist\xc3\xb3rico. Orgullosos de vosotros... y de todas las categor\xc3\xadas inferiores. \xc2\xa1Campeones de todo en baloncesto! #HalaMadrid'
611607331248451584,2015-06-18 18:52:05+00:00,"b'There are no words to explain my trip but there are some pictures. Thank you CUBA, thank you @UNICEF! https://t.co/25tkkPkiJZ'"
611606568954630144,2015-06-18 18:49:03+00:00,"b'No hay palabras para contar el viaje pero s\xc3\xad algunas im\xc3\xa1genes. \xc2\xa1Gracias CUBA, gracias @unicef_es ! #ConUNICEFenCUBA https://t.co/25tkkPkiJZ'"
611181057409425408,2015-06-17 14:38:13+00:00,b'A special game with the kids from Old Havana. Sport brings people together #ConUNICEFenCUBA http://t.co/SdwnFPAssb'
611180701489229825,2015-06-17 14:36:49+00:00,b'Un partido especial con los chicos de Habana Vieja. El deporte une. #ConUNICEFenCUBA http://t.co/87bMAbx8fu'
610923285644189696,2015-06-16 21:33:56+00:00,b'Football crosses borders and gives away smiles. #ConUNICEFenCUBA @UNICEF http://t.co/9WBlKDkjkh'
610922946534731777,2015-06-16 21:32:35+00:00,b'El f\xc3\xbatbol traspasa fronteras y regala sonrisas. #ConUNICEFenCUBA http://t.co/lKsZSZWh0o'
610824947871690752,2015-06-16 15:03:10+00:00,b'Children\xe2\x80\x99s development in their early years is key. That\xe2\x80\x99s why @UNICEF is involved with pre-schools in Cuba. http://t.co/DUO9Or6MJn'
610824613879246848,2015-06-16 15:01:51+00:00,b'El desarrollo de los ni\xc3\xb1os en sus primeros a\xc3\xb1os es clave. @unicef_es colabora en Cuba con los c\xc3\xadrculos infantiles. http://t.co/psrqlCF0sO'
610810230109306881,2015-06-16 14:04:41+00:00,"b'In 2014 more than 70,000 children were vaccinated in Cuba thanks to @UNICEF  #ConUNICEFenCUBA http://t.co/zjyTasWhrV'"
610809902538321921,2015-06-16 14:03:23+00:00,b'En 2014 m\xc3\xa1s de 70 mil ni\xc3\xb1os se vacunaron en Cuba gracias a UNICEF. Conociendo el trabajo de cerca. #ConUNICEFenCUBA http://t.co/ge5esvSP8o'
610779716577046528,2015-06-16 12:03:26+00:00,b'Very touched by the reception. An education in values and integration. Very charming! #ConUNICEFenCUBA @UNICEF http://t.co/qfw1spzzSJ'
610779213034074112,2015-06-16 12:01:26+00:00,b'Emocionado con el recibimiento. Educaci\xc3\xb3n en valores e integraci\xc3\xb3n \xc2\xa1\xc2\xa1con mucho arte!! #ConUNICEFenCUBA http://t.co/JPQuzxW9GU'
610422699547082752,2015-06-15 12:24:47+00:00,b'3 vital points for qualification. Now it\xe2\x80\x99s time to think about those most in need. The journey begins. #ConUNICEFenCUBA @UNICEF'
610422232209358849,2015-06-15 12:22:55+00:00,b'3 puntos clave para la clasificaci\xc3\xb3n. Ahora toca pensar en los que m\xc3\xa1s lo necesitan. Empieza el viaje. #ConUNICEFenCUBA @unicef_es'
608358053059133440,2015-06-09 19:40:37+00:00,"b""Good luck, teammates! The day has come. Tonight we'll be all with you girls. #So\xc3\xb1arEnGrande http://t.co/mWDwQom4Ol"""
608357708446744576,2015-06-09 19:39:15+00:00,"b'\xc2\xa1Mucha suerte compa\xc3\xb1eras! Lleg\xc3\xb3 el d\xc3\xada. Esta noche, todos con vosotras. #So\xc3\xb1arEnGrande http://t.co/v10nhdU0bF'"
606086861019316224,2015-06-03 13:15:42+00:00,b'Quarterfinals with Spanish flavour. @DavidFerrer87 and @RafaelNadal Good luck! Go get them!!! #APorLasSemis'
606084793730744320,2015-06-03 13:07:29+00:00,b'Cuartos de final incre\xc3\xadbles con mucho sabor nuestro. @DavidFerrer87  y @RafaelNadal  \xc2\xa1Mucha suerte! \xc2\xa1\xc2\xa1\xc2\xa1Vamos!!!! #APorLasSemis'
605313744202305537,2015-06-01 10:03:37+00:00,b'\xc2\xa1Felicidades Campe\xc3\xb3n!  https://t.co/ssk8F9FzDS'
604634437670846465,2015-05-30 13:04:18+00:00,"b""Getting ready for @SeFutbol next week. Let's keep working! Come on!!! \xf0\x9f\x92\xaa\xf0\x9f\x92\xaa\xf0\x9f\x92\xaa\xf0\x9f\x92\xaa http://t.co/p56APGNbPV"""
604634225619398656,2015-05-30 13:03:27+00:00,b'Puesta a punto para encarar la pr\xc3\xb3xima semana con @SeFutbol .Toca seguir trabajando.\xc2\xa1\xc2\xa1Vamossss!! \xf0\x9f\x92\xaa\xf0\x9f\x92\xaa\xf0\x9f\x92\xaa\xf0\x9f\x92\xaa http://t.co/Qtf7pkh78H'
603672526775001090,2015-05-27 21:22:00+00:00,"b'Congratulations, four times already!! @sevillaFC is in the Champions League!'"
603670501010108416,2015-05-27 21:13:57+00:00,"b'\xc2\xa1Felicidades por la cuarta campeones! @sevillaFC equipo de Champions.\xc2\xa1\xc2\xa1Vamos mi Sevilla, vamos campe\xc3\xb3n!!'"
603628753751781378,2015-05-27 18:28:04+00:00,"b'Double training session again, and now ready to watch my beloved @SevillaFC  play another final!! #AporlaCuarta http://t.co/n2AvzhlOuP'"
603628212539805697,2015-05-27 18:25:55+00:00,b'De nuevo doble sesi\xc3\xb3n de trabajo y listo para ver a mi @SevillaFC disputar otra final!! #AporlaCuarta http://t.co/LNzYTsBaeV'
603292013916749824,2015-05-26 20:09:59+00:00,b'Double training session and starting to run. Thank you so much for your support. #HalaMadrid http://t.co/JKmWOTP4jp'
603291685964140547,2015-05-26 20:08:41+00:00,b'Doble sesi\xc3\xb3n de entrenamiento y ya empezando a correr. Muchas gracias por  vuestros mensajes de apoyo. #HalaMadrid http://t.co/B3zRTC5U77'
603165757682393088,2015-05-26 11:48:17+00:00,"b""One of the best coaches I've ever had. @MrAncelotti thanks so much. A great professional leaves, a friend stays http://t.co/DUqN0fLJl2"""
603165512516894720,2015-05-26 11:47:19+00:00,"b'De los mejores entrenadores que he tenido, @MrAncelotti gracias por todo. Se va un grande, me quedo un amigo. http://t.co/ohsseisfX4'"
601390380823793664,2015-05-21 14:13:34+00:00,"b""Good luck, pal! We'll miss you. Pure football wherever you play. #GraciasXavi http://t.co/RZf1bsiIj1"""
601389987519692800,2015-05-21 14:12:00+00:00,"b'Mucha suerte, compa\xc3\xb1ero! Te echaremos de menos. F\xc3\xbatbol en estado puro est\xc3\xa9s donde est\xc3\xa9s #GraciasXavi http://t.co/AD8C7Ir1mU'"
601129662157303808,2015-05-20 20:57:34+00:00,"b""Today I'd like to wish a happy birthday to @CasillasWorld .Congratulations, captain. Congratulations, my friend."""
601129336339574785,2015-05-20 20:56:16+00:00,"b'No quiero que acabe el d\xc3\xada sin felicitar a @CasillasWorld .Felicidades, capit\xc3\xa1n. Felicidades, amigo.'"
600687893221367810,2015-05-19 15:42:08+00:00,"b'Nos deja uno de los grandes, Manuel Molina. Siempre nos quedar\xc3\xa1 su arte. DEP https://t.co/b2fvstgOm2'"
600054069424726016,2015-05-17 21:43:33+00:00,"b""A team with talent and passion who deserved to win the Euroleague. Congratulations @RMBaloncesto, 'La Novena' is home. #HalaMadrid"""
600052323298213888,2015-05-17 21:36:36+00:00,"b'Un equipo con coraz\xc3\xb3n, talento y pasi\xc3\xb3n que merec\xc3\xada ser Campe\xc3\xb3n de Europa.Felicidades @RMBaloncesto, la novena ya en casa. #HalaMadrid'"
599931317631987712,2015-05-17 13:35:46+00:00,"b""Enjoying a 'madridista' afternoon. Let's all support @realmadrid and @RMbaloncesto. #APorLaNovena #HalaMadrid http://t.co/tzazzVK6Jb"""
599931094633455617,2015-05-17 13:34:53+00:00,b'Tarde madridista. Empujamos todos a @realmadrid y @RMbaloncesto. #APorLaNovena #HalaMadrid http://t.co/1eveEp5LZO'
599209891652313088,2015-05-15 13:49:05+00:00,"b""Thank you all for your love and support.Finally it's a grade 1 muscle injury. I'll be back soon!#HalaMadrid http://t.co/hej295SdOY"""
599209744696479744,2015-05-15 13:48:30+00:00,b'Gracias por vuestras muestras de cari\xc3\xb1o y apoyo. Finalmente la lesi\xc3\xb3n es de grado 1.\xc2\xa1Volver\xc3\xa9 pronto! #HalaMadrid http://t.co/D5oMg1lswy'
599199367497719809,2015-05-15 13:07:16+00:00,b'RT @EPinternacional: .@unicef_es conf\xc3\xada en liberar a 5.000 ni\xc3\xb1os soldado en #Rep\xc3\xbablicaCentroafricana en 2015 http://t.co/JU1Y5IuSN7 http://\xe2\x80\xa6'
598178368077565952,2015-05-12 17:30:11+00:00,b'Blowing out the candles today.Fighting for the present tomorrow.Happy Birthday @MarceloM12  #JuntosAPorLaUndecima http://t.co/q2la8SWv7z'
598171827165405184,2015-05-12 17:04:11+00:00,"b'Hoy soplamos las velas, amigo. Ma\xc3\xb1ana peleamos el regalo. Feliz cumplea\xc3\xb1os @MarceloM12 ! #JuntosAPorLaUndecima http://t.co/p8T0mLJGZc'"
597747709571952640,2015-05-11 12:58:54+00:00,"b""Di St\xc3\xa9fano said, 'No player is as good as all players together'. You are player no. 12. #JuntosAPorLaUnd\xc3\xa9cima"""
597747541153820672,2015-05-11 12:58:14+00:00,"b'Di St\xc3\xa9fano dijo: ""Ning\xc3\xban jugador es tan bueno como todos juntos"". Vosotros sois el jugador n\xc2\xba 12 . #JuntosAPorLaUnd\xc3\xa9cima'"
596369409012281344,2015-05-07 17:42:01+00:00,b'#RealDecretoConAFE http://t.co/mEETLrX0uq'
596266448831537152,2015-05-07 10:52:54+00:00,b'The children in #Nepal still need our help. Make a donation at http://t.co/DIkRtfU20W and get involved. Every contribution counts!@unicef_es'
596263899235778560,2015-05-07 10:42:46+00:00,b'Los ni\xc3\xb1os en #Nepal siguen necesitando la ayuda de todos. Dona en http://t.co/DIkRtfU20W y colabora. \xc2\xa1Toda ayuda suma! @unicef_es'
595923184110669824,2015-05-06 12:08:53+00:00,b'#HalaMadrid #JuntosAPorLaUndecima http://t.co/JkKLPhWJa1'
595922982343733248,2015-05-06 12:08:05+00:00,b'#HalaMadrid #JuntosAPorLaUndecima http://t.co/SB83OTdL7D'
595545421986009089,2015-05-05 11:07:47+00:00,"b'Prepared for the first ""final"" of the season.Now comes the good part!Let\'s go!! #HalaMadrid #JuntosAPorLaUndecima http://t.co/VDukrTqUHE'"
595544844480708608,2015-05-05 11:05:30+00:00,"b""A tope para la primera 'final' de la temporada.\xc2\xa1Empieza lo bueno! \xc2\xa1\xc2\xa1Vamos!! #HalaMadrid #JuntosAPorLaUndecima http://t.co/TxKvDIIBIo"""
595204255956541440,2015-05-04 12:32:07+00:00,b'We want to share an important news with you cc @PilarRubio_ https://t.co/9opGkXWtBe'
595204090734448640,2015-05-04 12:31:28+00:00,b'Queremos compartir con vosotros una noticia importante cc @PilarRubio_ https://t.co/9opGkXWtBe'
594612480527175680,2015-05-02 21:20:37+00:00,b'Very difficult win to keep fighting. Time to recover and focus on @ChampionsLeague #HalaMadrid http://t.co/m0gDWqRlKT'
594612081393008640,2015-05-02 21:19:02+00:00,b'Victoria dif\xc3\xadcil para seguir en la lucha. Ahora a recuperarse y pensar en la @ChampionsLeague #HalaMadrid http://t.co/lRU5bXsgPW'
594186122047139840,2015-05-01 17:06:25+00:00,"b""Ready for tomorrow's match. Difficult, very important and always special against @SevillaFC http://t.co/MVdt5tQmza"""
594185944426754048,2015-05-01 17:05:43+00:00,"b'Listos para el partido de ma\xc3\xb1ana. Dif\xc3\xadcil, muy importante y siempre especial contra @SevillaFC http://t.co/UPJGncoynI'"
591025828491829248,2015-04-22 23:48:32+00:00,b'Hala Madrid..!!! http://t.co/GCCa9xkOm7'
591025757918523394,2015-04-22 23:48:16+00:00,b'Proud of my team in a fantastic night at the Bernabeu stadium. Once again in the semifinals of the Champions League.'
591025564733046784,2015-04-22 23:47:30+00:00,b'Orgulloso del car\xc3\xa1cter de mi equipo en una noche fant\xc3\xa1stica en el Bernabeu. Otro a\xc3\xb1o m\xc3\xa1s en semifinales de la Champions.'
582680389040386048,2015-03-30 23:06:45+00:00,b'RT @CH14_: Felicidades churuuuuuu @SergioRamos que la pases muy bien!!! \xf0\x9f\x91\x8f\xf0\x9f\x91\x8f #top http://t.co/ulhTMRk38V'
582645780181291008,2015-03-30 20:49:13+00:00,"b'RT @PilarRubio_: Feliz cumplea\xc3\xb1os mi amor @SergioRamos, cada a\xc3\xb1o m\xc3\xa1s y mejor!!! \xf0\x9f\x98\x98\xe2\x9d\xa4\xef\xb8\x8f\xf0\x9f\x8e\x82 TQ!'"
582630826141204480,2015-03-30 19:49:48+00:00,b'RT @IllarraOfficial: De vuelta a los entrenamientos para preparar nuestro pr\xc3\xb3ximo partido ante el @GranadaCdeF/\xc2\xa1felicidades @SergioRamos!\xf0\x9f\x8e\x82 \xe2\x80\xa6'
582630698722443264,2015-03-30 19:49:17+00:00,b'RT @16LucasSilva: Muchas felicidades @SergioRamos Felices 29! \xc3\x89 um grande prazer jogar ao teu lado no @realmadrid \xf0\x9f\x8e\x89\xf0\x9f\x91\x8f\xe2\x9a\xbd\xef\xb8\x8f http://t.co/3lHohaGO\xe2\x80\xa6'
582629933459091456,2015-03-30 19:46:15+00:00,b'RT @Benzema: Feliz cumplea\xc3\xb1os mi amigo ;-) @SergioRamos !!!\nHappy Birthday my friend !!! #HalaMadridYNadaMas http://t.co/dwyM7za6Zc'
582629428934668289,2015-03-30 19:44:15+00:00,b'RT @GarethBale11: Feliz cumplea\xc3\xb1os @SergioRamos .. Espero que tengas un muy buen d\xc3\xada. Buena suerte ma\xc3\xb1ana!!'
582561289077129216,2015-03-30 15:13:29+00:00,b'Very grateful for your birthday wishes. Its a pleasure to have birthdays like these. Thanks to everyone for their constant love and support!'
582561159372521472,2015-03-30 15:12:58+00:00,b'Muy agradecido por vuestros mensajes de felicitaci\xc3\xb3n. As\xc3\xad da gusto cumplir a\xc3\xb1os. Muchas gracias a tod@s por el cari\xc3\xb1o y apoyo constante..!!'
581602241066483712,2015-03-27 23:42:34+00:00,"b'Important victory on a special night, at home and with my people. 125 games. Closer to the Eurocup \xf0\x9f\x87\xaa\xf0\x9f\x87\xb8\xf0\x9f\x87\xaa\xf0\x9f\x87\xb8\xf0\x9f\x87\xaa\xf0\x9f\x87\xb8.. http://t.co/ITS5FKNUXk'"
581601919287853056,2015-03-27 23:41:17+00:00,b'Triunfo importante en una noche especial en mi casa y con mi gente. 125 partidos. M\xc3\xa1s cerca de la Eurocopa.\xf0\x9f\x87\xaa\xf0\x9f\x87\xb8\xf0\x9f\x87\xaa\xf0\x9f\x87\xb8\xf0\x9f\x87\xaa\xf0\x9f\x87\xb8\xf0\x9f\x87\xaa\xf0\x9f\x87\xb8.. http://t.co/7uW7ld7e2L'
581088154893082627,2015-03-26 13:39:46+00:00,"b""It's always a pleasure and satisfaction to be in my city and, most of all, to play with our National Team \xf0\x9f\x87\xaa\xf0\x9f\x87\xb8\xf0\x9f\x87\xaa\xf0\x9f\x87\xb8\xf0\x9f\x87\xaa\xf0\x9f\x87\xb8 http://t.co/ptaa3h7qU2"""
581088112354435073,2015-03-26 13:39:36+00:00,b'Siempre es un placer y una alegr\xc3\xada tremenda estar en mi ciudad y m\xc3\xa1s para jugar con la Selecci\xc3\xb3n. Vamos Espa\xc3\xb1a \xf0\x9f\x87\xaa\xf0\x9f\x87\xb8\xf0\x9f\x87\xaa\xf0\x9f\x87\xb8\xf0\x9f\x87\xaa\xf0\x9f\x87\xb8 http://t.co/gARYwPETt3'
580360969181917184,2015-03-24 13:30:12+00:00,b'Toda mi fuerza y \xc3\xa1nimo para los familiares de las v\xc3\xadctimas del accidente de avi\xc3\xb3n. DEP.'
578236433749663745,2015-03-18 16:48:03+00:00,b'Toda la suerte del mundo en este nuevo trabajo a mi gran amigo @canelitareal. Saltar\xc3\xa9 http://t.co/Q46c4KfpMN'
577965051790946304,2015-03-17 22:49:41+00:00,"b'Happy birthday and many more to come, my love!! You deserve everything. I love you @PilarRubio_! http://t.co/TwCwHYvovl'"
577964895980896257,2015-03-17 22:49:03+00:00,"b'Much\xc3\xadsimas felicidades y que cumplas muchos m\xc3\xa1s, mi vida!! Te lo mereces todo. Te quiero @PilarRubio_! http://t.co/ukVAafb3VS'"
577252493903687680,2015-03-15 23:38:14+00:00,b'Happy to be able to play again and for an important victory. We are a united team with hunger for titles #HalaMadrid http://t.co/gAu1FcQ2EV'
577252441718190080,2015-03-15 23:38:01+00:00,b'Feliz por volver a jugar y por un triunfo importante. Somos un equipo unido y con hambre de t\xc3\xadtulos. #HalaMadrid http://t.co/EKwxPth3FB'
571771847513128960,2015-02-28 20:40:06+00:00,"b'Desconectando con la mejor compa\xc3\xb1\xc3\xada en una ciudad m\xc3\xa1gica, Florencia @PilarRubio_. http://t.co/X26T664SFA'"
571286884921552897,2015-02-27 12:33:02+00:00,"b""After 3 weeks of hard work it's time for a two relaxing days off. The count down is on! Hala Madrid..!! http://t.co/jVJKaJ59Si"""
571286633619836928,2015-02-27 12:32:02+00:00,b'Despu\xc3\xa9s de 3 semanas duras de trabajo hoy y ma\xc3\xb1ana un poquito de relax. Ya queda menos. Hala Madrid..!! \xf0\x9f\x92\xaa\xf0\x9f\x8c\x9f\xf0\x9f\x92\xaa... http://t.co/OB0BZ6fCYO'
566616516167467009,2015-02-14 15:14:39+00:00,"b""RT @PilarRubio_: Feliz d\xc3\xada de los enamorados! Happy Valentine's Day! @SergioRamos Te amo con locura. \xe2\x9d\xa4\xef\xb8\x8f\xe2\x9d\xa4\xef\xb8\x8f\xe2\x9d\xa4\xef\xb8\x8f http://t.co/SV16jqLnBS"""
561671491205758976,2015-01-31 23:44:53+00:00,b'RT @PilarRubio_: He might be a dentist in the future... Creo q nuestro baby va para dentista...\xf0\x9f\x98\x8d\xf0\x9f\x98\x8d\xf0\x9f\x98\x8d\xf0\x9f\x98\x8d http://t.co/ixvVhprquB'
558749036308865024,2015-01-23 22:12:05+00:00,b'Thanks to all the Real Madrid supporters for the welcoming and care in C\xc3\xb3rdoba. http://t.co/HqcPSOfRlf'
558743264950763520,2015-01-23 21:49:09+00:00,b'Gracias a los aficionados madridistas por el recibimiento y el cari\xc3\xb1o en C\xc3\xb3rdoba. #HalaMadrid..!! http://t.co/jGfqMZqz49'
558604516204224512,2015-01-23 12:37:49+00:00,b'Visit @PilarRubio_ new blog! http://t.co/1n6IzbN3Ag'
558386880782548993,2015-01-22 22:13:01+00:00,b'Visitad el nuevo blog de @PilarRubio_! TQ..!! http://t.co/1n6IzbN3Ag http://t.co/B8g8UdgMLx'
556810913731596288,2015-01-18 13:50:41+00:00,b'Important victory to finish as leaders in the first round. United group with hunger for titles. #HalaMadrid..!! http://t.co/ow2uYfauQ9'
556810897889693696,2015-01-18 13:50:37+00:00,b'Victoria importante para terminar como l\xc3\xadderes la primera vuelta.  Grupo unido con hambre de t\xc3\xadtulos. #HalaMadrid..!! http://t.co/evg5JNiJT0'
554820279550373888,2015-01-13 02:00:37+00:00,"b'RT @a_rfef: Orgulloso una vez m\xc3\xa1s de lo grande que eres por conseguir t\xc3\xba quinto #OnceIdealFIFA ,Te Quiero Brother!! Te lo mereces http://t.\xe2\x80\xa6'"
554813051401420800,2015-01-13 01:31:54+00:00,"b'RT @PilarRubio_: Felicidades mi amor @SergioRamos, por quinta vez en el once ideal! Un ejemplo de esfuerzo y un gran talento. TQM \xe2\x9d\xa4\xef\xb8\x8f http:/\xe2\x80\xa6'"
554751019192950784,2015-01-12 21:25:24+00:00,b'Enhorabuena un a\xc3\xb1o m\xc3\xa1s a mi gran amigo @cristiano. Estaba claro..!! Merecido...Disfr\xc3\xbatalo. http://t.co/7UAI3dhKy0'
554684830332772352,2015-01-12 17:02:23+00:00,b'Proud of being for the fith time in the best 11th of the #FIFA. Thanks to the best Club in the world. http://t.co/3OXB3Htrfq'
554684598714900481,2015-01-12 17:01:28+00:00,"b'Orgulloso de estar por 5 vez en el once de #FIFA. Gracias a mis compa\xc3\xb1eros, cuerpo t\xc3\xa9cnico y al mejor club del mundo. http://t.co/2S3sz3wLUR'"
552483555948134401,2015-01-06 15:15:19+00:00,b'Os dejo esta canci\xc3\xb3n de mi gran amiga @La_Pastori que viene muy bien en este d\xc3\xada. \xe2\x9d\xa4\xef\xb8\x8f\xf0\x9f\x92\x9c\xf0\x9f\x92\x9c\xe2\x9d\xa4\xef\xb8\x8f... http://t.co/T2wLAGfCAe'
