twitter_id,date,tweet
717522633508712448,2016-04-06 01:21:41+00:00,b'It was fun catching up with some old friends and telling stories. And sitting next to my man MO.'
717522496321417216,2016-04-06 01:21:08+00:00,b'Unreal food. @JordanSpieth did an amazing job.'
716643531050377216,2016-04-03 15:08:27+00:00,"b""It's what golf and family are all about."""
716643378608357377,2016-04-03 15:07:50+00:00,"b""I don't watch a lot of golf on tv, but my kids and me are glued to @drivechipputt. Amazing to see them so focused and having so much fun."""
716053811157213184,2016-04-02 00:05:06+00:00,"b'I\xe2\x80\x99ve been dedicated to my rehab and improving daily, but I\xe2\x80\x99m not physically ready to compete in the Masters. https://t.co/vbrv5xXISu'"
714895487749472261,2016-03-29 19:22:21+00:00,b'Coming back to my roots. So Cal!! https://t.co/p1qehnervU'
708374983660048386,2016-03-11 19:32:11+00:00,b'Just posted a new blog. https://t.co/osnZheyKqg'
707642404619341831,2016-03-09 19:01:11+00:00,b'Great day with #Rolex. Fantastic watches. Only watch for me #Deepsea. https://t.co/Cikz0niKAT'
706922500081512449,2016-03-07 19:20:32+00:00,b'Also my Raiders have a better chance of finishing higher than 4th in the division now.'
706922314114461696,2016-03-07 19:19:48+00:00,"b'Now we can play more golf in the future, but this time I need shots.'"
706922219197300737,2016-03-07 19:19:25+00:00,b'It was an honor to watch #18 for all these years. He revolutionized the position.'
705214299967516673,2016-03-03 02:12:46+00:00,b'First hole at The Playgrounds @BluejackNation and this happened https://t.co/ChD312oPEJ'
705052126200913923,2016-03-02 15:28:20+00:00,b'On the way to @BluejackNation working on getting more fit every day. https://t.co/FcAjMUxjhA'
702492113188032512,2016-02-24 13:55:46+00:00,b'Progressing nicely. https://t.co/HKnnluR1OW'
697511898636533761,2016-02-10 20:06:10+00:00,"b'That day president @billclinton helped launch my learning center. 10 yrs &amp; 150k kids later, I\xe2\x80\x99m so proud. #TWF20 https://t.co/o3tTfS8ukl'"
696429966309879808,2016-02-07 20:26:57+00:00,b'Peyton and the Broncos all day! #SB50'
690254632996728832,2016-01-21 19:28:23+00:00,"b'Happy Birthday Jack, 76 years young and could probably shoot your age anytime you wanted to.'"
686658807250989056,2016-01-11 21:19:51+00:00,b'Had fun teaming up with @themichellewie today for @TWFoundation. Thanks for the assist. #GoStanford https://t.co/n6vp6ZLskP'
685506281201872896,2016-01-08 17:00:08+00:00,"b'Big day @BluejackNation, front nine fully open with two more holes ready for member play:  https://t.co/sQ4i8tpPmy https://t.co/3ldjKS1dNF'"
685185548135317509,2016-01-07 19:45:39+00:00,b'Just saw a screening for @13hours. Very powerful and important film. Really well done. https://t.co/dpINxZ10zC'
682582349503152128,2015-12-31 15:21:28+00:00,b'Thanks everyone for the wonderful birthday wishes. 40 is cool.'
682582151552970752,2015-12-31 15:20:41+00:00,b'Had a great time celebrating my 40th with family &amp; friends at The Woods Jupiter last night. Thanks @dariusrucker for a fun show.'
680050197695614976,2015-12-24 15:39:36+00:00,b'https://t.co/7I6XS16B9d'
680050150589337600,2015-12-24 15:39:25+00:00,b'https://t.co/S9k6V4gT3t'
680050069375070208,2015-12-24 15:39:05+00:00,"b'We would like to welcome a new member to our family/pack:), Bugs!!!! https://t.co/MjtiZudTL2'"
679388903875342337,2015-12-22 19:51:51+00:00,"b'My final column of the year, happy holidays to all of you and to a great 2016! https://t.co/iGYhFEaNwU'"
678983282722127872,2015-12-21 17:00:04+00:00,"b'As a designer, there is nothing more rewarding than seeing @BluejackNation members enjoying my first US golf course: https://t.co/mVc4YQQqUO'"
677268224791199744,2015-12-16 23:25:02+00:00,b'Thanks for inspiring us all @AbbyWambach https://t.co/00EDlXr3Q7'
676855018608336896,2015-12-15 20:03:06+00:00,b'Tonight two great men are linked. Congrats Jack on winning the Muhammad Ali Legacy Award. https://t.co/y3poTtOpB9'
673632440263516160,2015-12-06 22:37:43+00:00,b'First #HeroWorldChallenge at Albany was a huge success. Thanks to Hero and the players &amp; a big congrats to Bubba! https://t.co/L9u2Jnyrn1'
673615284171898880,2015-12-06 21:29:33+00:00,b'Congrats to @Cheyenne_Woods for getting her LPGA tour card today. Birdied 5 of last 6 holes to make it.'
670348170954715136,2015-11-27 21:07:13+00:00,"b""I've watched a lot of football this year, and @CMccaffrey5 is the most exciting player out there. He deserves a trip to NYC. #WildCaff"""
667742906556538880,2015-11-20 16:34:49+00:00,b'Photo previews of Hole Nos. 4 &amp; 5 at my first U.S. design to open for play @BluejackNation  https://t.co/GzdZKqFg7I'
667088379868246016,2015-11-18 21:13:58+00:00,"b'Excited to join @Love3D, the other VCs &amp; @RyderCupUSA as a Vice Captain, and help #TeamUSA  get a victory in 2016: https://t.co/p5wzvoyOYI'"
664456033956470784,2015-11-11 14:53:58+00:00,b'(2/2) We thank you for your selfless dedication and service to this great country. https://t.co/6H921dYuyQ'
664455815751929856,2015-11-11 14:53:06+00:00,b'(1/2) To Pops and all the veterans who have gone down range or are currently down range...'
660209283179651072,2015-10-30 21:38:53+00:00,b'Had a follow-up procedure on my back as the next step in my recovery. Staying strong &amp; patient. https://t.co/ZAlbOEYGVE'
658682165123784705,2015-10-26 16:30:40+00:00,"b""Here's a pic with Sam. https://t.co/IyIB16drqN"""
658681995724242944,2015-10-26 16:30:00+00:00,b'Thx to @CarliLloyd &amp; @AbbyWambach for taking time to meet my daughter and her soccer team yesterday. And beating Brazil 3-1 to top it off!'
658329793973366787,2015-10-25 17:10:28+00:00,b'Thanks to @007 for the private screening with family and friends. #Spectre was incredible. https://t.co/LJyyTccSii'
651426400797368320,2015-10-06 15:58:51+00:00,b'Link to more details. http://t.co/YaaE4rmYsn'
651426245821992960,2015-10-06 15:58:14+00:00,"b""I won't be able to compete, but I'll still travel to Mexico City Oct. 20-21 to support Bridgestone America\xe2\x80\x99s Golf Cup presented by Value."""
645001861704065024,2015-09-18 22:30:02+00:00,b'Just had successful back surgery. I\xe2\x80\x99ve come back from injuries before and I will again. http://t.co/jZeL6By5EY'
642102361096343552,2015-09-10 22:28:27+00:00,b'Best birthday wishes to Arnold Palmer today. Happy to call him a friend.'
641009788965490688,2015-09-07 22:06:57+00:00,b'Started #DeutscheBankChampionship week off by taking a selfie with @RickieFowler. The price of selfies just went up. Congrats on the W.'
639225289642479616,2015-09-02 23:55:59+00:00,"b'In town for @DBChampionship. Caught up with @RickieFowler tonight, good luck to all players this week! http://t.co/d2yPOdBTwl'"
639177227054284801,2015-09-02 20:45:00+00:00,b'Always love coming to nb3foundation event. Great people and raising awareness for Native American\xe2\x80\xa6 https://t.co/xo88RmXI3H'
635591835575058432,2015-08-23 23:17:56+00:00,"b'People were so nice this entire week, tons of respect for Greensboro.  Very cool to see @Love3d get another win here.'"
634077676815450112,2015-08-19 19:01:13+00:00,b'Had a really fun trash talking round of golf with my friend Chris Paul @CP3 @WyndhamChamp http://t.co/C6MvJhakMc'
633053229765537794,2015-08-16 23:10:26+00:00,b'Cool to watch him win from The Woods Jupiter. http://t.co/pig9sUrQ0O'
633051320019222529,2015-08-16 23:02:50+00:00,"b'Game over, very happy for Jason. Great dude and well deserved. Hats off to Jordan, incredible season. Calling it early.'"
629387665993936896,2015-08-06 20:24:47+00:00,b'A little sneak preview of The Woods Jupiter. http://t.co/2jgxmI7mRR'
628756025068404744,2015-08-05 02:34:52+00:00,"b""Almost here, The Woods Jupiter Opens Aug 10. Can't wait! http://t.co/wOVvCTcPua"""
627976005425213441,2015-08-02 22:55:21+00:00,"b'Huge thanks to everyone who makes the #QLNational so fantastic: staff, volunteers and especially the fans. http://t.co/aZWLHxI9QG'"
627975223317524480,2015-08-02 22:52:15+00:00,b'Congrats to #QLNational Champion @TROYMERRITT_PGA! Great way to finish on 18 for your first win.'
624282460243763200,2015-07-23 18:18:31+00:00,b'Heading to #QLNational next week. Check out this #TBT  https://t.co/B3tgIjSdGm'
621366342009008132,2015-07-15 17:10:55+00:00,"b'Two other legends from my Rolex visit earlier today, Mr. Palmer and Rod Laver. http://t.co/fvQIYmHAGK'"
621358275087327232,2015-07-15 16:38:51+00:00,b'It was an honor to play at the home of golf with 3 great friends and legends. http://t.co/3ZGMCu04Kl'
617858889959256064,2015-07-06 00:53:33+00:00,b'Love watching history being made. There is nothing like it. Go USA!'
617846603349626880,2015-07-06 00:04:43+00:00,"b""@CarliLloyd, this is incredible! Second half let's do this. #USWNT"""
617287951819624448,2015-07-04 11:04:51+00:00,b'Happy birthday to our great country the United States of America. And thanks to all of those who defend it here and abroad.'
615567308958924800,2015-06-29 17:07:37+00:00,b'Our design team is making the turn @BluejackNation and the course looks amazing.  Take a look: http://t.co/IOLaWYwzXu.'
612947410130747392,2015-06-22 11:37:05+00:00,b'A rough year is about to get better. Taking my boy of 9 years to get double ACL reconstruction on both hind legs. http://t.co/qIwG5nYKBj'
612606072067596288,2015-06-21 13:00:43+00:00,"b""Happy Father's Day to all the Dad's out there. https://t.co/qWPd2pYEER http://t.co/B4mbkAVR5v"""
610212823319228416,2015-06-14 22:30:48+00:00,"b""Early Father's Day gift from Sam and Charlie, they'll be with me all week. http://t.co/YhWh9gVUKo"""
608665365154033664,2015-06-10 16:01:46+00:00,b'Getting my explosiveness back. https://t.co/BVSmnFUu25'
603717468016762881,2015-05-28 00:20:35+00:00,"b""And all on my Mom's birthday too, special day. Happy birthday Mom, I love you."""
603717091653513217,2015-05-28 00:19:05+00:00,"b""Congrats to the Stanford women's golf team, an amazing comeback win in extra holes! #NERDNATION  https://t.co/9LRVYsOEok"""
602869131713638400,2015-05-25 16:09:36+00:00,"b'My deepest gratitude to the men &amp; women who gave so much, and the families that remember them every day.'"
600762681180590080,2015-05-19 20:39:19+00:00,b'Had a great shoot with @MusclePharm today. I look forward to a long partnership @bradpyatt @musclepharmpres http://t.co/iuzozSVIKq'
599799965792145409,2015-05-17 04:53:50+00:00,"b""Ed's rocking. http://t.co/H51TSkCw3Z"""
599797096057679872,2015-05-17 04:42:26+00:00,"b""Because of people like Ed Sheeran we can change the course of people's lives. http://t.co/1i4l3ONzIw"""
599769246319546369,2015-05-17 02:51:46+00:00,b'Proud of my fellow Western HS alum and TWF Scholar Kevin. Good luck at Microsoft. https://t.co/7bWzR8G2wu'
599468932198576129,2015-05-16 06:58:25+00:00,"b'We have a champ, well done Travis. Great first night! #TigerJam http://t.co/OF1VHSpVH1'"
599248775962447872,2015-05-15 16:23:36+00:00,b'From @TWFoundation board meeting last night - check out the numbers report. Looking good you guys! http://t.co/SvRFhBimCJ'
599023017054863360,2015-05-15 01:26:31+00:00,b'Just posted a photo https://t.co/coXg6oZnsc'
599022931910492162,2015-05-15 01:26:10+00:00,b'Just posted a photo https://t.co/cC0lElTCsS'
599022850914287617,2015-05-15 01:25:51+00:00,b'Just posted a photo https://t.co/TyLYSNMKY8'
599022734035853312,2015-05-15 01:25:23+00:00,b'Just 10 short months of construction. I couldn\xe2\x80\x99t be happier with how the course at @bluejacknation is\xe2\x80\xa6 https://t.co/UnM9uMhK4N'
599018515085983744,2015-05-15 01:08:37+00:00,b'Board Meeting http://t.co/kDJyahlhTX'
598933526906437633,2015-05-14 19:30:55+00:00,"b'Poker Night Fri., Ed Sheeran Sat. and all benefitting my Foundation. Important fundraising weekend for our kids. #TigerJam'"
598875750469476352,2015-05-14 15:41:20+00:00,"b'With @BluejackNation team, now on way to #TigerJam.  Front 9 sodded, back 9 not far behind.  Course looks great. http://t.co/FP1pfTXc4A'"
593417881615904768,2015-04-29 14:13:42+00:00,"b'See you at the US Open, Open Champ, Memorial, Greenbrier and my Foundation\xe2\x80\x99s event, the Quicken Loans National. Going to be a busy summer.'"
591627358269997056,2015-04-24 15:38:48+00:00,"b'Hello Yao, awesome day at Nike campus in Shanghai. http://t.co/ufn4147z1s'"
591595638707593216,2015-04-24 13:32:46+00:00,"b'Looking forward to going back to THE PLAYERS this year, hoping for a repeat of 2013.'"
585909022353686528,2015-04-08 20:56:11+00:00,"b""I'll always have memories of my pop at Augusta and now Sam &amp; Charlie. An amazing day."""
584072902359658496,2015-04-03 19:20:06+00:00,"b""I'm playing in the Masters. Thanks for all the support.  http://t.co/SYih4eSxUa"""
576453576702050304,2015-03-13 18:43:37+00:00,"b'Missing AP, but making strides and working hard towards hopeful Masters return. http://t.co/KlNFDIeZYi'"
565648305179590656,2015-02-11 23:07:19+00:00,"b'Back is good, game will be too.             http://t.co/U5anYWsQeK'"
562972267068792835,2015-02-04 13:53:42+00:00,"b""Terrible loss for golf and me personally. My grandfather is gone and we all lost a brave, decent and honorable man. I'll miss u Charlie."""
561272536483106817,2015-01-30 21:19:35+00:00,"b'Disappointed, but really appreciate the incredible support this week.'"
560070688459857922,2015-01-27 13:43:52+00:00,b'My footwork has never been better. Excited to put them in play this week. #TW15 http://t.co/ABcQVOjLPv'
557959547604983808,2015-01-21 17:54:57+00:00,"b""Excited to be part of @fullswinggolf. Can't wait to see how this new technology will help my game."""
557957763754905600,2015-01-21 17:47:51+00:00,b'Happy 75th birthday to the Golden Bear @jacknicklaus'
553560375967645696,2015-01-09 14:34:12+00:00,b'Starting my year off at Phoenix &amp; Torrey back-to-back weeks. I\xe2\x80\x99m ready to go. Should be a lot of fun. http://t.co/sRnFLf6NvM'
551776592222232576,2015-01-04 16:26:05+00:00,"b""Stuart wasn't covering heroes &amp; champions, it was the other way around. Thinking of my friend &amp; his daughters."""
544901171702685696,2014-12-16 17:05:37+00:00,"b""RG: Just finished nine holes around El Cardonal to officially open the course. Now it's time for others to play it. http://t.co/n9nrWcmyXd"""
544897386884399104,2014-12-16 16:50:35+00:00,b'RG: The approach into the par-4 eighth. http://t.co/tHFBxSrLFH'
544895614228893696,2014-12-16 16:43:32+00:00,b'RG: A nice backdrop to the seventh green at El Cardonal. http://t.co/6slbAagmuh'
544893703350145024,2014-12-16 16:35:57+00:00,b'RG: The tee shot on the par-4 seventh playing back toward the Pacific. http://t.co/wvLAHOlm4v'
544890803630645248,2014-12-16 16:24:25+00:00,b'RG: The tee shot at the par-5 sixth at El Cardonal @DiamanteCabo http://t.co/NUFh2mWqP7'
544888658189635584,2014-12-16 16:15:54+00:00,b'RG: Looking back from the fifth green. http://t.co/qlHogqlKak'
544886627060170752,2014-12-16 16:07:50+00:00,"b'RG: The fourth hole where Tiger says ""the meat of the course"" begins. http://t.co/g4ZUTmXyWg'"
544886273442607105,2014-12-16 16:06:25+00:00,b'RG: Looking back from the third green at El Cardonal. http://t.co/OSHhtaWNv8'
544884891004178432,2014-12-16 16:00:56+00:00,b'RG: Walking and talking to the gallery following Tiger around the El Cardonal opening. http://t.co/mDaWVPPPHe'
544883150267351040,2014-12-16 15:54:01+00:00,b'RG: The par-3 second at El Cardonal. http://t.co/T7NLteraC0'
544881816659050496,2014-12-16 15:48:43+00:00,b'RG: The first official birdie putt at El Cardonal. http://t.co/L2HGhsJevL'
544880255912411136,2014-12-16 15:42:31+00:00,b'RG: Nice day for a walk around El Cardonal @DiamanteCabo http://t.co/GGbgQ1ObTs'
544879845927555072,2014-12-16 15:40:53+00:00,b'RG: Tiger rips the first tee shot at El Cardonal. http://t.co/JNEROzH7ze'
544878537577336832,2014-12-16 15:35:41+00:00,b'RG: Quite an escort line to the first tee. http://t.co/pFEQBPclc9'
544876671829299201,2014-12-16 15:28:16+00:00,b'RG: Pretty nice spot to warm up. http://t.co/mClAdLo8wx'
544875274257858560,2014-12-16 15:22:43+00:00,"b'RG: Warming up on a nice morning. Says first three holes on course are almost ""warm-up"" holes then it gets serious. http://t.co/kU7VNcR8W7'"
544874743602876418,2014-12-16 15:20:36+00:00,b'RG: The ribbon cutting officially opens El Cardonal. http://t.co/qP6SJrOFXx'
544871257762979840,2014-12-16 15:06:45+00:00,b'RG: Tiger says El Cardonal @DiamanteCabo will focus on playability for players of all skill levels. http://t.co/CFCdNsJQr3'
544870227679649792,2014-12-16 15:02:40+00:00,b'RG: The grand opening of El Cardonal is underway and the place looks spectacular.'
544864263203205120,2014-12-16 14:38:58+00:00,"b""Busy at my first TW Design course opening @DiamanteCabo. I'm asking @RonGreenJr to tweet for me and share the day's activities."""
544586835708878848,2014-12-15 20:16:34+00:00,b'Back to work @BluejackNation http://t.co/CNNX73bmh2'
541753412950704129,2014-12-08 00:37:33+00:00,b'So happy for @lindseyvonn for taking home her 60th win on the World Cup this weekend. Hard work pays off.'
541747935558791168,2014-12-08 00:15:47+00:00,"b'Impressive performance by the kid, @JordanSpieth. Well done this week. Once the fever broke, it felt good to be back.'"
541745912977301504,2014-12-08 00:07:45+00:00,"b'So proud of you @Cheyenne_Woods!Talent &amp; persistence, you have them both.'"
541354307267088384,2014-12-06 22:11:39+00:00,b'RT @TWFSinger: Tiger always makes time for his @TWFoundation kids.  MT #TWLearningCenter students meet the man behind the vision: http://t.\xe2\x80\xa6'
541354203277709312,2014-12-06 22:11:14+00:00,b'I competed and Linds won.'
540349928779046912,2014-12-04 03:40:36+00:00,"b""Jonathan cried when he graduated from Tufts. He never thought he'd make it. Our scholars are amazing. http://t.co/sUbzQBGpGR"""
539964677649084418,2014-12-03 02:09:45+00:00,"b""So grateful and proud of my Foundation's staff for their service and what we've been able to accomplish helping youth. Big things ahead."""
539964172453568513,2014-12-03 02:07:45+00:00,"b""Great day at Isleworth. It's nice to be back. Thanks to Hero for coming out. Enjoyed our press conference and looking forward to the week."""
537268164157911040,2014-11-25 15:34:46+00:00,"b'History was made last night by my grandpa. Thanks Charlie for inspiring Pop, who then in turn inspired\xe2\x80\xa6 http://t.co/82i2OnmUea'"
536202302542340096,2014-11-22 16:59:25+00:00,b'Happy to have Chris Como consulting and working with me on my swing. I\xe2\x80\x99m excited to be back competing.'
534799105122652160,2014-11-18 20:03:37+00:00,"b'Most things in the media you let slide, but sometimes you can\xe2\x80\x99t and shouldn\xe2\x80\x99t. Read my @PlayersTribune piece http://t.co/u0511anhGJ'"
533273663693672448,2014-11-14 15:02:03+00:00,"b'This is the story of Bluejack National, scheduled to be my first US designed golf course. http://t.co/MdvzQfpGNX'"
532207297708445697,2014-11-11 16:24:42+00:00,"b'Happy Veterans Day Pop, and to all the men, women and families that sacrifice so much. I\xe2\x80\x99m forever grateful for your service.'"
531998933586038785,2014-11-11 02:36:44+00:00,"b""You're the grandpa I never had. Your past sacrifices allow me to play golf today. I'm so happy for you Charlie."""
524651346075856896,2014-10-21 20:00:03+00:00,"b'Resilience, hard work &amp; now excitement.  El Cardonal @DiamanteCabo will open Dec. 16th.  Grateful for the amazing effort. #unstoppable'"
521075735013126144,2014-10-11 23:11:51+00:00,"b""I couldn't be happier to be inducting my brother-for-life, Notah Begay, into the Stanford Hall of Fame."""
520672342004232192,2014-10-10 20:28:54+00:00,"b'Hanging with one of my favorite people, PK, @nikegolf hq today. http://t.co/vAR4PznCF5'"
518174253620162560,2014-10-03 23:02:23+00:00,b'Excited to be back @BluejackNation and see how great things are progressing along. http://t.co/QfZjzBNcuI'
516344464986865664,2014-09-28 21:51:28+00:00,"b'Amazing run and career for the captain, Derek Jeter. More time to work on your golf swing.'"
510868978181607424,2014-09-13 19:13:50+00:00,"b'Great time seeing a screening of #TheEqualizer w/ friends and @lindseyvonn. Not for the kids, rated R, out Sep 26! http://t.co/APOhDTELKG'"
510401308432797699,2014-09-12 12:15:29+00:00,"b""I couldn't be more proud of my foundation for winning 2014 Patterson Award. Well deserved. http://t.co/yS7ZOvZ5hY"""
509692009817182208,2014-09-10 13:16:59+00:00,b'Easy money he\xe2\x80\x99d shoot better than his age. Happy Birthday AP.'
508980368025083904,2014-09-08 14:09:10+00:00,b'Follow @MusclePharm for your chance to win my signed golf bag. Follow @MusclePharm and comment #MPTigerBag! http://t.co/GCYkY01iIY'
507163891391270912,2014-09-03 13:51:09+00:00,b'Great group of Ryder Cup Players. Go USA!'
504811588155502592,2014-08-28 02:03:56+00:00,b'My Sincere thanks to billclinton for coming to the #dbchampionship party. His support means so much to\xe2\x80\xa6 http://t.co/cTvmGgTvXN'
501743818186956800,2014-08-19 14:53:42+00:00,"b""#ALSIcebucketchallenge accepted. Phil Knight and @RafaelNadal you're up. Thanks @McIlroyRory  http://t.co/KJC2g8PXdK"""
501544838748459008,2014-08-19 01:43:02+00:00,"b""Don't quit your night job RT @jimmyfallon: Giving these guys a few tips. (@TigerWoods @mcilroyrory) #NikeGolf http://t.co/4ONVtUHUA9"""
499704250898067456,2014-08-13 23:49:12+00:00,b'Just posted a statement on Ryder Cup and a golf update. Always grateful for the support. http://t.co/qUTgrRy9Cr'
487945721060945920,2014-07-12 13:05:00+00:00,"b'Great day for LV &amp; me at Rolex Friday. Great partner, fantastic watches, amazing facility and talented people.'"
483386734638403584,2014-06-29 23:09:13+00:00,"b'Congrats to @JustinRose99 on the win @QLNational, course played like a US Open, fitting to see him win.'"
482259242754506752,2014-06-26 20:28:58+00:00,b'Thanks guys http://t.co/xKiZQ13Dt1'
479256305362669568,2014-06-18 13:36:22+00:00,b'Excited to join the @MusclePharm team and I love the new bag. http://t.co/Ofbre9VHEL http://t.co/bLiRc3heaI'
478604138406608896,2014-06-16 18:24:53+00:00,b'Big things ahead for us Rick! MT @TWFSinger: First day at the Foundation. So excited to be a part of an amazing team #TWFpride'
478146386014531584,2014-06-15 12:05:56+00:00,"b""Happy Father's Day to all the fathers out there."""
475734550136365056,2014-06-08 20:22:10+00:00,"b'Congrats to @RafaelNadal on his 9th French Open, guy is so impressive.'"
475734186889072640,2014-06-08 20:20:43+00:00,b'Good luck to my barber Sid @celebritystylz in his competition today.'
471396404053565442,2014-05-27 21:03:55+00:00,b'Happy 70 Mom RT @TWFoundation: Wishing Tida a very happy 70th birthday from the Tiger Woods Foundation! http://t.co/0yvioNJdIn'
471309431397838849,2014-05-27 15:18:19+00:00,"b""Excited to announce my Foundation's new President &amp; CEO. Big things ahead. http://t.co/EVtQMSJDZw"""
466946495703707648,2014-05-15 14:21:34+00:00,b'Thrilled with how things are turning out at El Cardonal diamantecabo http://t.co/vzVjCEfquy'
463322468938424320,2014-05-05 14:20:59+00:00,b'Wish I could defend this week at @THEPLAYERSChamp. Good luck guys. Just posted a new blog: http://t.co/5fMpjZ6o8E'
460829535202979840,2014-04-28 17:14:57+00:00,"b""Congrats to Conrad Ray and Anne Walker for leading @Stanford men's and women's golf teams to Pac-12 titles Sunday. Go CARD!"""
459073745597263872,2014-04-23 20:58:04+00:00,b'Want to join me &amp; @OneRepublic in Vegas for Tiger Jam? Head over to http://t.co/koPh9xsQlj to enter. Every dollar helps my foundation.'
454238261133991936,2014-04-10 12:43:35+00:00,b'It never gets old watching the honorary starters tee off. One of the oldest and best traditions in the game.'
451024221053796353,2014-04-01 15:52:08+00:00,b'Sad to say I\xe2\x80\x99m missing the Masters. Thanks to the fans for so many kind wishes. http://t.co/Ofbre9VHEL'
448158748805439489,2014-03-24 18:05:46+00:00,b'Thrilled to announce the @QLNational today with Finchem and billemerson. Big things ahead. http://t.co/c6BMXDhVhb'
446031937204137984,2014-03-18 21:14:35+00:00,b'Called Arnold today to tell him that sadly I won\xe2\x80\x99t be able to play. Back spasms and the pain haven\xe2\x80\x99t subsided. http://t.co/7F8LDAV2Ff'
438993129719726080,2014-02-27 11:04:52+00:00,"b""Wearing these TW14's today designed on nikeid. Have you\ndesigned yours\xe2\x80\xa6 http://t.co/FQnyVnaidR"""
438422578810863617,2014-02-25 21:17:42+00:00,b'Just posted some big @TWFoundation news here: http://t.co/q1titsjBdw'
435891670190538752,2014-02-18 21:40:47+00:00,"b""Check out my new wristband. It's for sale in Asia to help raise funds for twfoundation's planned\xe2\x80\xa6 http://t.co/n7esZ84cU4"""
432571399983886337,2014-02-09 17:47:13+00:00,"b""Way to go @Cheyenne_Woods ! A great win and accomplishment. I'm so proud of you."""
430701732327600128,2014-02-04 13:57:49+00:00,"b'Great day of golf. Hopefully this visit, in some small way, helps grow the game in this amazing place. http://t.co/2sxRITkmRp'"
430701220358279168,2014-02-04 13:55:47+00:00,b'Thanks to Mr. Munjal for the wonderful hospitality and for making my first visit to India so\xe2\x80\xa6 http://t.co/7NSO9m85zl'
430409763198083073,2014-02-03 18:37:38+00:00,b'Just met a cricket legend and his family. Sachin Tendulkar @sachin_rt was so cool and loved being welcomed to India.'
425049576207581185,2014-01-19 23:38:10+00:00,b'Nothing like watching the greatest of all time play. Congrats Peyton.'
420604438102179840,2014-01-07 17:14:47+00:00,"b'I asked for TW14 @NIKEiD designs, you delivered. My favorite is from @DaneJThompson. Spot em on Tour soon. @NikeGolf http://t.co/Jy9Xd8uaCo'"
409849548212031488,2013-12-09 00:58:41+00:00,b'And congrats to @ZachJohnsonPGA.'
