twitter_id,date,tweet
1069440658304364549,2018-12-03 03:58:16+00:00,"b'\xe2\x80\x9cIt\xe2\x80\x99s been quite an amazing year to go from where I came from and now I can finally say I\xe2\x80\x99m done playing for the year,\xe2\x80\x9d said Woods, after finishing round 4 of the Hero World Challenge. \xe2\x80\x9cWe can sit back and really enjoy it.\xe2\x80\x9d \xe2\x80\x93 TGR\nhttps://t.co/anF5cypo7I'"
1069358991128576001,2018-12-02 22:33:45+00:00,b'Congrats to @JonRahmpga\xc2\xa0on a great win at #HeroWorldChallenge! Thanks to my @TGRLiveEvents\xc2\xa0staff\xc2\xa0and @HeroMotoCorp for another\xc2\xa0successful\xc2\xa0tournament! https://t.co/YfpB6WDGoe'
1069069475255857152,2018-12-02 03:23:19+00:00,"b'\xe2\x80\x9cI know I can play now, and I know I can win. I just have not done a very good job this week of playing clean and keeping my rounds going like I should and could have,\xe2\x80\x9d said Woods. He will tee off tomorrow at 10:42 a.m. ET. \xe2\x80\x93 TGR\nhttps://t.co/HdQn5SVVGJ'"
1068996322101993472,2018-12-01 22:32:38+00:00,b'Golf and our country lost a true gentleman and a friend. I had the honor of playing golf with President Bush and he joined us at our inaugural event in DC in 2007. He was also an integral part of the Presidents Cup. Mr. Bush accomplished so much in his life and will be missed. https://t.co/XzrgZqtea3'
1068706249884295170,2018-12-01 03:20:00+00:00,"b'\xe2\x80\x9cIf I would have just putted the way I normally do, this round could easily have been 8, 9 under,\xe2\x80\x9d Woods said, who will tee off tomorrow at 11:49 a.m. ET. \xe2\x80\x93 TGR https://t.co/o7rECgB87x'"
1068357684527812610,2018-11-30 04:14:55+00:00,b'Woods will tee off in tomorrow\xe2\x80\x99s second round of the Hero World Challenge at 11:15 a.m. ET. \xe2\x80\x93 TGR\nhttps://t.co/6TOngLLyPy'
1068268453256196098,2018-11-29 22:20:21+00:00,"b'RT @TGRLiveEvents: From iconic moments to charitable giving, see how the #HeroWorldChallenge has made an impact on and off the course for t\xe2\x80\xa6'"
1067988199589519360,2018-11-29 03:46:43+00:00,b'Woods returns to Albany to play in and host the Hero World Challenge. He will tee off in tomorrow\xe2\x80\x99s first round at 12:05 p.m. ET with Justin Thomas. \xe2\x80\x93 TGR https://t.co/KK5Fs5g3gD'
1067846418772254720,2018-11-28 18:23:20+00:00,b'This was such a fun experience with my mentee Sammy. I am proud that @TGRLiveEvents allow @TGRFound to make a positive impact on our students. https://t.co/YMNbXVLVrD'
1067551663031025669,2018-11-27 22:52:05+00:00,b'I am excited to continue my global corporate partnership with my friend Pawan Munjal and @HeroMotoCorp including many more years of the #HeroWorldChallenge \nhttps://t.co/k9knUh0Dhm'
1067407229429694464,2018-11-27 13:18:09+00:00,"b""Today is #GivingTuesday, and I'm proud of the work my foundation is doing to impact students through education. Support the #80FOR80 Campaign to help 80 new scholars achieve their dreams. #UnrelentingChampions https://t.co/wCgfhIy9gG"""
1066731134204162049,2018-11-25 16:31:35+00:00,"b'From family, to golf, to @TGRFound, @tgrdesignbytw and The Woods Jupiter, this past year has been blessed with many accomplishments. Thanks to everyone who helped us all get there. I\xe2\x80\x99m looking forward to 2019. https://t.co/bkpjkZHvN6 https://t.co/9PtX428Fvm'"
1066017935708299265,2018-11-23 17:17:36+00:00,b'It\xe2\x80\x99s game time. Capital One\xe2\x80\x99s The Match: Tiger vs. Phil can be purchased through Bleacher Report Live. Buy now - https://t.co/116YGt2bat https://t.co/3R2FcyCpXU'
1063151354481401857,2018-11-15 19:26:49+00:00,"b""RT @tgrdesignbytw: The Jupiter Island Practice Facility, designed and created in @tigerwoods' backyard, replicates tournament-like conditio\xe2\x80\xa6"""
1062523304047796224,2018-11-14 01:51:11+00:00,b'The full episode of 24/7 The Match Tiger vs Phil is on tonight at 10pm on @HBO. Getting ready for next week. https://t.co/Vdoo1tBS5X'
1062491486246371328,2018-11-13 23:44:45+00:00,b'RT @BleacherReport: His golf swing is almost as pretty as his jumper \n\n@TigerWoods gives some advice to @StephenCurry30 \xf0\x9f\x8f\x8c #CapitalOnesTheMa\xe2\x80\xa6'
1061994349326680064,2018-11-12 14:49:18+00:00,"b""Today is a day of gratitude and respect. Thanks Pop and about 20 million veterans and their families for sacrificing so much and giving selflessly every day. I've seen our military's commitment firsthand, and I know how important it is to me and our country."""
1059993174242930688,2018-11-07 02:17:21+00:00,b'RT @BleacherReport: \xf0\x9f\x97\xa3 Elbows\n\nTiger and Phil go head-to-head in a game of...golf pong? https://t.co/gRHjb7A9V0'
1059830779583184896,2018-11-06 15:32:03+00:00,b'RT @BleacherReport: .@TigerWoods left no doubt in 2018: He\xe2\x80\x99s officially back \xf0\x9f\x90\x85\n\nCapital One\xe2\x80\x99s The Match is coming soon on @brlive and PPV h\xe2\x80\xa6'
1058423798473637893,2018-11-02 18:21:12+00:00,"b'RT @tgrdesignbytw: With the grassing completed on the front nine at Payne\xe2\x80\x99s Valley, we continue to move along nicely with our first public\xe2\x80\xa6'"
1057341257134022656,2018-10-30 18:39:34+00:00,"b'#TWInvitational not only helps us build awareness, but allows us to make an impact on the lives of youth through @TGRFound https://t.co/SZ63yV5BVU'"
1055895848473845764,2018-10-26 18:56:02+00:00,"b'Teeing off Friday, November 23rd at 3 p.m. ET. Available to watch on pay-per-view and through @BRLive https://t.co/Z0AvD0a4B1'"
1053346449294049280,2018-10-19 18:05:38+00:00,b'Thanks to USLI and all our guests who help @TGRFound empower youth through education. https://t.co/2lagiEhUcm'
1053022617207230474,2018-10-18 20:38:50+00:00,b'Look what just came in the mail today. Thank you to everyone for making number 80 so special. https://t.co/xBxx8nb3oB'
1052368004703498241,2018-10-17 01:17:39+00:00,b'Coding with my mentee. Combine coding and a little art of green reading and you get YES!!!!!!!!!!!! https://t.co/UTPRTuN79x'
1052065199832817664,2018-10-16 05:14:24+00:00,b'I am pleased to share the stage with two friends and @TGRFound board members to talk golf and philanthropy at the #TWInvitational dinner. https://t.co/n5Hz0DqKZp'
1046509252465119233,2018-09-30 21:17:03+00:00,"b'\xe2\x80\x9cAt the end of the day, we came here as a team and we win or lose, and unfortunately we lost this one,\xe2\x80\x9d said Woods. - TGR\nhttps://t.co/SGYcp5WGor'"
1046197532613910528,2018-09-30 00:38:23+00:00,"b'With Europe in the lead, Tiger hopes for a better day in tomorrow\xe2\x80\x99s singles match against Jon Rahm. They will tee off at 6:41 a.m. ET. \xe2\x80\x93 TGR\nhttps://t.co/0mXAr8M65s'"
1045765031953149952,2018-09-28 19:59:47+00:00,"b'\xe2\x80\x9cMy game is just fine. My putting feels solid,\xe2\x80\x9d said Woods. He and Reed will take on Molinari and Fleetwood again tomorrow morning in four-balls. They tee off at 2:40 a.m. ET, 8:40 a.m. local time. \xe2\x80\x93 TGR\n https://t.co/yMrxhdpKUw'"
1045409699296940032,2018-09-27 20:27:49+00:00,"b'\xe2\x80\x9cWe haven\xe2\x80\x99t won as a U.S. squad here in 25 years on foreign soil, so hopefully that will change this week,\xe2\x80\x9d said Woods. He plays with Patrick Reed in tomorrow\xe2\x80\x99s four-balls match against Francesco Molinari and Tommy Fleetwood. \xe2\x80\x93 TGR\nhttps://t.co/fHdiyReGal'"
1045012469981343744,2018-09-26 18:09:22+00:00,"b'Woods has a second practice round today at Le Golf National. The final practice sessions will be held tomorrow, followed by the opening ceremony and captain\xe2\x80\x99s pairings for Friday competition. - TGR\nhttps://t.co/emOYrixGap'"
1044661973215047680,2018-09-25 18:56:37+00:00,"b'Still soaking in Sunday\xe2\x80\x99s victory, Woods arrives in France for the Ryder Cup. \xe2\x80\x9cTo have earned my way onto to the team, to have not only the captain, vice captains but players want me on the team because I was picked, means a lot to me,\xe2\x80\x9d said Woods. \xe2\x80\x93 TGR https://t.co/UJcOXWL4cT'"
1044061113451720704,2018-09-24 03:09:01+00:00,"b'\xe2\x80\x9cI\xe2\x80\x99ve been sitting on 79 for about five years now, and to get 80 is a pretty damned good feeling,\xe2\x80\x9d said Woods. \xe2\x80\x93 TGR\nhttps://t.co/zeudcqeabH'"
1043992116416909312,2018-09-23 22:34:51+00:00,"b'Congratulations to our boss on winning the Tour Championship today, marking it his 80th PGA Tour victory and a comeback for the ages. - TGR #TW80 https://t.co/A0ZR8WceRc'"
1043685068831633408,2018-09-23 02:14:45+00:00,"b'\xe2\x80\x9cI would love to win this event. I\xe2\x80\x99ve got a bunch of guys behind me who are playing well. We\xe2\x80\x99ll see what happens,\xe2\x80\x9d said Woods, who will tee off tomorrow at 2:05 p.m. ET. - TGR\n https://t.co/dQ1CjbhnW6'"
1043336827397201920,2018-09-22 03:10:58+00:00,b'Tiger is tied for the lead heading into the weekend. He will tee off tomorrow at 2:30 p.m. ET. - TGR\nhttps://t.co/7Rzz3rES4m'
1042968990673461249,2018-09-21 02:49:19+00:00,"b'\xe2\x80\x9cTo be able to play golf again and earn my way back to this level is something that I was hoping I would do at the beginning of the year, but I didn\xe2\x80\x99t know. And I\xe2\x80\x99ve done it,"" said Woods. He will tee off tomorrow at 2:00 p.m. ET. \xe2\x80\x93 TGR\n https://t.co/91wNaIUBBT'"
1042553285192900608,2018-09-19 23:17:27+00:00,"b'\xe2\x80\x9cThe season itself has been amazing. To be able to play this well and to come back from where I\xe2\x80\x99ve come back and to get here has been a pretty tall order and something I\xe2\x80\x99m proud of,\xe2\x80\x9d said Woods. He will tee off tomorrow at 12:30 p.m. ET. - TGR\n https://t.co/ADh4o3ehzk'"
1041708925186392066,2018-09-17 15:22:16+00:00,"b'Looking forward to returning to East Lake this week. I\xe2\x80\x99ll be teeing it up with the @bridgestonegolf #TOURBXS, the ball that best fits my game. #1BallFitterInGolf https://t.co/cxN9W9jnEs'"
1039866561480339456,2018-09-12 13:21:22+00:00,b'The #HeroWorldChallenge has evolved into a global event. I\xe2\x80\x99d like to thank Pawan Munjal and Hero MotoCorp for their continued support of the tournament. We are very excited to continue growing the event at Albany.\nhttps://t.co/3kasy1S9i6'
1039345185581424640,2018-09-11 02:49:36+00:00,"b'\xe2\x80\x9cTo have a chance to win again this year, it\xe2\x80\x99s a very positive feeling,\xe2\x80\x9d Woods said. - TGR\nhttps://t.co/Gfj8z4tsy7'"
1038939687870783489,2018-09-09 23:58:18+00:00,b'Sunday\xe2\x80\x99s final round of the BMW Championship was suspended due to weather. Woods is set to tee off Monday morning at 8:40 a.m. ET. \xe2\x80\x93 TGR\nhttps://t.co/u5oWjqFSH1'
1038594558391668736,2018-09-09 01:06:53+00:00,"b'\xe2\x80\x9cThe golf course is soft. Everyone is making birdies. You can be aggressive. I got to take a run at it, whether it\xe2\x80\x99s tomorrow on Monday,\xe2\x80\x9d said Woods. He will tee off at 8:10 a.m. ET. - TGR\nhttps://t.co/neYzytUYPh'"
1038233719314763776,2018-09-08 01:13:02+00:00,"b'\xe2\x80\x9cI hit a lot of beautiful putts and didn\xe2\x80\x99t make any,\xe2\x80\x9d Woods said, who played better than he scored finishing the round tied for 12th. He will tee off tomorrow at 12:40 p.m. ET. \xe2\x80\x93 TGR\nhttps://t.co/6PAvqk2zZZ'"
1037906370752864256,2018-09-07 03:32:16+00:00,"b'Woods shoots 62, securing share of the first-round lead at the BMW Championship. He hopes to carry this momentum into tomorrow as he will tee off at 8:06 a.m. ET. - TGR\nhttps://t.co/wJnTBz2Jb3'"
1037403188792643591,2018-09-05 18:12:48+00:00,"b'\xe2\x80\x9cIt\xe2\x80\x99s beyond special,\xe2\x80\x9d said Woods of being chosen by Jim Furyk to join the U.S. Ryder Cup team. \xe2\x80\x9cDeep down, I wanted to make the team.\xe2\x80\x9d - TGR\nhttps://t.co/89lSlDZkry'"
1036802038296928256,2018-09-04 02:24:03+00:00,"b'Tiger closes out the weekend with an even par round, and quickly prepares for the BMW Championship. - TGR\nhttps://t.co/OKfeILEafI'"
1036404060805627904,2018-09-03 00:02:38+00:00,"b'\xe2\x80\x9cI have to play well in order to make East Lake,\xe2\x80\x9d said Woods, who heads into Monday\xe2\x80\x99s final round. He will tee off at 12:15 p.m. ET. - TGR\nhttps://t.co/RNFmXiolSS'"
1036062334698053633,2018-09-02 01:24:44+00:00,"b'\xe2\x80\x9cI played well. It was a good day,\xe2\x80\x9d said Woods, who shot a bogey-free second round. He will tee off tomorrow at 11:35 a.m. ET. - TGR\nhttps://t.co/Kbw9yRD4rn'"
1035720498133573633,2018-09-01 02:46:24+00:00,"b'\xe2\x80\x9cI hit a lot of good putts, and just have to give myself more looks at them,\xe2\x80\x9d said Woods. He will tee off in tomorrow\xe2\x80\x99s second round at 1:16 p.m. ET. - TGR\nhttps://t.co/vN8SyFeiRY'"
1035347830708285440,2018-08-31 02:05:33+00:00,"b'""I\xe2\x80\x99ve played really well on this golf course over the years. Hopefully it will be one of those weeks again,"" said Woods, as he arrives at the Dell Technologies Championship. He will tee off tomorrow morning at 8:51 a.m. ET. - TGR\nhttps://t.co/NgrstnEptM'"
1033875464849420288,2018-08-27 00:34:53+00:00,"b'\xe2\x80\x9cWhat you\xe2\x80\x99re seeing is that I\xe2\x80\x99m close and just one shot here, one shot there, per day, flips the momentum,\xe2\x80\x9d said Woods. He\xe2\x80\x99s already looking forward to next week\xe2\x80\x99s Dell Technologies Championship. - TGR \nhttps://t.co/2SRB2DH8Es'"
1033490540350898182,2018-08-25 23:05:20+00:00,"b'\xe2\x80\x9cI hit it good today,\xe2\x80\x9d Woods said, who had a bogey-free third round at The Northern Trust. He will tee off Sunday at 10 a.m. ET. - TGR \nhttps://t.co/y4JAVhrS2J'"
1033207013013168129,2018-08-25 04:18:42+00:00,"b""\xe2\x80\x9cThe name of the game is you\xe2\x80\x99ve got to make putts and you\xe2\x80\x99ve got to roll it,\xe2\x80\x9d said Woods, hopeful to do just that in tomorrow's round. He will tee off at 7:50 a.m. ET. \xe2\x80\x93 TGR\n https://t.co/GB6mmeINdV"""
1032821311322636288,2018-08-24 02:46:04+00:00,b'Woods ends Round 1 at The Northern Trust at even par. He will tee off tomorrow at 12:55 p.m. ET. - TGR  https://t.co/mnteBlWcco'
1032372054379528192,2018-08-22 21:00:52+00:00,b'@PhilMickelson Think you will earn some bragging rights? \xf0\x9f\x8f\x86'
1032368603339743233,2018-08-22 20:47:10+00:00,b'It\xe2\x80\x99s on @PhilMickelson #TigerVSPhil https://t.co/PZivYPOEf5'
1032327000692850689,2018-08-22 18:01:51+00:00,b'It\xe2\x80\x99s been an incredible year out here on the @PGATOUR. I can\xe2\x80\x99t thank everyone enough for all the support. I\xe2\x80\x99m excited to get the #FedExCup playoffs going this week @thentgolf. #LiveUnderPar https://t.co/8s3SbqxJLI'
1032095855078256640,2018-08-22 02:43:21+00:00,"b'\xe2\x80\x9cI have been close to winning tournaments this year. I think if I keep giving myself opportunities, I\xe2\x80\x99ll get the job done,\xe2\x80\x9d said Woods, as he enters into The Northern Trust. He will tee off on Thursday at 7:54 a.m. ET. - TGR\nhttps://t.co/8eYE0ekdMr'"
1029734360914771968,2018-08-15 14:19:37+00:00,b'Thank you for all of your support during the #MetLifeMatchUp. Today is the last day to vote for my shot and help @TGRFound earn a donation of $750k. The money will provide our scholars educational resources that will lead to a brighter future. Vote now - https://t.co/YUymsdod6G https://t.co/n8oO4fFE2p'
1029113249990672385,2018-08-13 21:11:33+00:00,b'Vote for my shot and help @TGRFound impact thousands of students by providing educational resources to help them succeed in school and beyond. Vote Now - https://t.co/YUymsdod6G https://t.co/6iW5JW3TsS'
1028858390972456960,2018-08-13 04:18:50+00:00,"b'\xe2\x80\x9cThese fans were so positive all week. I can\xe2\x80\x99t thank them enough for what they were saying out there and what it meant to me as a player, just coming back and trying to win a major championship again,"" said Woods. - TGR\nhttps://t.co/LNUsuBdNJo'"
1028807960653443078,2018-08-13 00:58:26+00:00,b'I can\xe2\x80\x99t thank the fans in St. Louis enough for packing the course all week and for their enthusiasm and support. It meant so much to me. https://t.co/jQSkSCSYdM'
1028680454747181057,2018-08-12 16:31:47+00:00,b'Help @tgrfound make a difference! Go vote now - https://t.co/YUymsdod6G https://t.co/fxrTIzGT2y'
1028477216349401088,2018-08-12 03:04:11+00:00,"b'\xe2\x80\x9cI\xe2\x80\x99ve got a shot tomorrow,\xe2\x80\x9d said Woods who tees off in tomorrow\xe2\x80\x99s final round at 2:35 p.m. ET. - TGR\nhttps://t.co/Blzm1KztPF'"
1028106007065649152,2018-08-11 02:29:08+00:00,"b'\xe2\x80\x9cTomorrow is going to be a long day for a lot of us,\xe2\x80\x9d Woods said, as play was suspended during Friday\xe2\x80\x99s second round due to inclement weather. Play will resume tomorrow at 8 a.m. ET. - TGR\nhttps://t.co/kvjXPZyYXa'"
1027927759362949120,2018-08-10 14:40:50+00:00,"b'I can\xe2\x80\x99t believe we opened #TheWoodsJupiter three years ago today. Thanks so much for making us a big success. Stop by today for some great food, fun and watch the @PGAChampionship. https://t.co/DZPkh1f9Zv'"
1027746605552820224,2018-08-10 02:41:00+00:00,"b'\xe2\x80\x9cI could have easily gone the other way, but I hung in there and turned it around,\xe2\x80\x9d said Woods, who completed the first round of the PGA Championship at even par. He tees off tomorrow at 2:48 p.m. ET. - TGR\n https://t.co/JCenTwr5uI'"
1027647444954349570,2018-08-09 20:06:58+00:00,"b""It's so sad to lose Jarrod after all he went through. I played with him once at Firestone and he had an amazing spirit. We're all family out here and support each other."""
1027030696173490176,2018-08-08 03:16:13+00:00,b'Tiger has made his arrival at Bellerive Country Club. He tees off on Thursday at 9:23 a.m. ET with defending champion Justin Thomas and Rory McIlroy. - TGR\nhttps://t.co/O1LGAWJrgT'
1026292892531339265,2018-08-06 02:24:27+00:00,"b'\xe2\x80\x9cI\xe2\x80\x99m going to miss playing here. I\xe2\x80\x99m going to miss the people,\xe2\x80\x9d said Woods after Sunday\xe2\x80\x99s final round at Firestone. \xe2\x80\x93 TGR\nhttps://t.co/tLMSum7Vd2'"
1026269209591009280,2018-08-06 00:50:21+00:00,b'Please vote for my shot and help @TGRFound support and educate our youth. You are able to vote up to 20 times per day up until August 15th. Vote Now: https://t.co/YUymsdod6G https://t.co/TVaXsSunRM'
1026232406674747394,2018-08-05 22:24:06+00:00,"b""Thanks Akron, Firestone and Bridgestone for all the memories we've shared. It's been an honor. I\xe2\x80\x99m going to miss birdieing that 18th hole. https://t.co/VeS0wlnEJs"""
1025908501623828481,2018-08-05 00:57:01+00:00,"b'\xe2\x80\x9cI felt like I couldn\xe2\x80\x99t quite turn it around today,\xe2\x80\x9d said Woods, with hopes of a more successful round tomorrow as he tees off at 11:20 a.m. ET. - TGR\nhttps://t.co/xSXd6F9bOs'"
1025557227703287813,2018-08-04 01:41:11+00:00,"b'Tiger is tied for 10th heading into Saturday at Firestone. \xe2\x80\x9cIt\xe2\x80\x99s imperative for me to get the ball in the fairway and go ahead and attack,\xe2\x80\x9d said Woods, who tees off tomorrow at 1:05 p.m. ET. - TGR\n https://t.co/2hMYFFIlam'"
1025555371325190146,2018-08-04 01:33:49+00:00,"b'RT @TGRSinger: .@TigerWoods proved today that not only is he back, but he perseveres against many challenges. He sets a great example for t\xe2\x80\xa6'"
1025555306971951104,2018-08-04 01:33:33+00:00,b'RT @TGRSinger: This is what a great partnership looks like.  @TGRFound teams up with Hexadyne and our good friend @RealRJSanchez to make a\xe2\x80\xa6'
1025210114905653248,2018-08-03 02:41:53+00:00,"b'\xe2\x80\x9cI\xe2\x80\x99ve had so many great memories here. Hopefully, I can have one more,\xe2\x80\x9d said Woods, who will tee off tomorrow at 2:10 p.m. ET. - TGR\nhttps://t.co/H0YzbOFXMx'"
1024824411331944448,2018-08-02 01:09:14+00:00,"b'Woods, eight-time past champion, has made his return to Firestone after securing one of the final spots. \xe2\x80\x9cI\xe2\x80\x99m excited to get back here,\xe2\x80\x9d Woods said, who will tee off at 10:20 a.m. ET tomorrow morning alongside Jason Day. \xe2\x80\x93 TGR \nhttps://t.co/SiT9lqA1k8'"
1024006742210957312,2018-07-30 19:00:07+00:00,b'RT @PGAChampionship: So many great #PGAChamp moments from @TigerWoods. Is this your favorite? \n\nVote for this moment &amp; more: https://t.co/N\xe2\x80\xa6'
1021202891204382721,2018-07-23 01:18:36+00:00,"b'\xe2\x80\x9cAt the beginning of the year, if they\xe2\x80\x99d said you\xe2\x80\x99re playing The Open Championship, I would have said I\xe2\x80\x99d be very lucky to do that,\xe2\x80\x9d said Woods, who not only played but contended and finished tied for 6th. - TGR\nhttps://t.co/4XDAGegFLz'"
1021166746919718913,2018-07-22 22:54:59+00:00,b'Statistics on Tiger Woods\xe2\x80\x99 fourth round at The Open Championship courtesy of @EliasSports. \xe2\x80\x93 TGR https://t.co/8fEzabWWV6'
1021143407941636097,2018-07-22 21:22:15+00:00,"b'The fans\xe2\x80\x99 support today, and all week, was amazing. Thanks for making my return to links golf something I\xe2\x80\x99ll never forget. https://t.co/Om5evUtWFS'"
1021019253330391040,2018-07-22 13:08:54+00:00,b'Statistics on Tiger Woods\xe2\x80\x99 third round at The Open Championship courtesy of @EliasSports. \xe2\x80\x93 TGR https://t.co/i58Vb72p9u'
1020835650243788800,2018-07-22 00:59:19+00:00,"b'\xe2\x80\x9cI\xe2\x80\x99ve had a chance to win. Given what happened the last two years, I didn\xe2\x80\x99t know if that would ever happen again. But here I am with a chance Sunday in a major championship,\xe2\x80\x9d said Woods. He tees off tomorrow at 2:25 p.m. local time, 9:25 a.m. ET. - TGR https://t.co/6P8DeyaVa4'"
1020437572860948480,2018-07-20 22:37:30+00:00,"b'\xe2\x80\x9cI\xe2\x80\x99m certainly right in it,\xe2\x80\x9d said Woods, who tees off tomorrow at 1:15 p.m. local time, 8:15 a.m. ET. \xe2\x80\x93 TGR\nhttps://t.co/0B2rhm3fWO'"
1020382686937001986,2018-07-20 18:59:25+00:00,b'Statistics on Tiger Woods\xe2\x80\x99 second round at The Open Championship courtesy of @EliasSports. \xe2\x80\x93 TGR https://t.co/pi2BuHvm01'
1020112721424117761,2018-07-20 01:06:40+00:00,b'Statistics on Tiger Woods\xe2\x80\x99 first round at The Open Championship courtesy of @EliasSports. \xe2\x80\x93 TGR https://t.co/T3kHgG8ycR'
1020092454865965058,2018-07-19 23:46:08+00:00,"b'\xe2\x80\x9cI thought I played a very solid round,\xe2\x80\x9d said Woods, who will tee off tomorrow morning at 10:20 a.m. local time, 5:20 a.m. ET. - TGR \nhttps://t.co/YU2jyU4Bcp'"
1019945770303270916,2018-07-19 14:03:15+00:00,b'Statistics on Tiger Woods and The Open Championship courtesy of @EliasSports. \xe2\x80\x93 TGR https://t.co/Kg2G6TTWF8'
1019314340414017536,2018-07-17 20:14:11+00:00,"b'Tiger has arrived at Carnoustie. \xe2\x80\x9cIt\xe2\x80\x99s going to be a real interesting test in how we\xe2\x80\x99re going to manage our way around this golf course,\xe2\x80\x9d said Woods, who will tee off Thursday at 3:21 p.m. local time, 10:21 a.m. ET. \xe2\x80\x93 TGR\nhttps://t.co/lSG2aDX490'"
1018258215417667584,2018-07-14 22:17:31+00:00,b'Thanks @Alex_OxChambo and crew! Great day hanging with you. @NikeUK @nikegolf https://t.co/UieG8hz05x'
1017997398604484608,2018-07-14 05:01:07+00:00,b'Here in London before The Open. Any nice greens to practice on?'
1013607250974400512,2018-07-02 02:16:15+00:00,"b'Tiger finishes tied for 4th @QLNational, making this his second-best showing of the season. - TGR \nhttps://t.co/PKxCmT14iZ'"
1013575710814998530,2018-07-02 00:10:55+00:00,"b'Congrats @F_Molinari on a great win @QLNational! Thanks to the fans, volunteers, @TPCPotomac and my @TGRLiveEvents staff for a successful week! https://t.co/fyp1EyOxnu'"
1013256696414834688,2018-07-01 03:03:16+00:00,b'Tiger tees off tomorrow at 1:20 p.m. ET with hopes that the course plays firm and tough. \xe2\x80\x93 TGR https://t.co/VvVK5ansgZ'
1013195516216250368,2018-06-30 23:00:09+00:00,"b'The camo bag used in today\xe2\x80\x99s round will be signed and entered into an auction where the proceeds will benefit @TGRFound. The auction is open for bidding and will close on July 10th. To place your bid, please visit https://t.co/BH02XxZTnl - TGR https://t.co/4BSX3U23gB'"
1012889708064624641,2018-06-30 02:44:59+00:00,"b'\xe2\x80\x9cI was thinking something in the mid-to-high 60\xe2\x80\x99s would have been a good score, and I was able to do that,\xe2\x80\x9d said Woods, who will tee off tomorrow at 12:25 p.m. ET. - TGR\nhttps://t.co/ypW2WfWF73'"
1012526444369637380,2018-06-29 02:41:30+00:00,b'Woods tees off tomorrow morning at 8:20 a.m. ET - TGR\nhttps://t.co/7mi2QlFeA4'
1012355759726907392,2018-06-28 15:23:16+00:00,b'Go check out @TGRFound\xe2\x80\x99s Activity Zone at @QLNational this weekend! - TGR https://t.co/SgXmdzVPTB'
1012151788227743745,2018-06-28 01:52:45+00:00,b'\xe2\x80\x9cFun Pro-Am round today. Excited to be back in DC playing at the @QLNational supporting @TGRFound.\xe2\x80\x9d #MomentsMadeHere\nhttps://t.co/NsgbMifWBq'
1012070771882160128,2018-06-27 20:30:50+00:00,b'I am proud to continue the tradition of honoring and supporting our nation\xe2\x80\x99s military at the @QLNational. #MomentsMadeHere https://t.co/OqpHtrOrrF'
1011716623416348672,2018-06-26 21:03:34+00:00,b'RT @TGRFound: Check out this great article via @usatoday: @TigerWoods wants to level the playing field in education one child at a time htt\xe2\x80\xa6'
1008441418950627330,2018-06-17 20:09:04+00:00,"b""Happy Father's Day everyone. \nI'm blessed and proud to be Sam's and Charlie's dad."""
1007812801577078789,2018-06-16 02:31:10+00:00,"b'Tiger heads home after missed cut at U.S. Open but looks forward to upcoming events, including the @QLNational. - TGR\nhttps://t.co/Et1grQFWGh'"
1007468859153149952,2018-06-15 03:44:28+00:00,b'Tiger tees off at tomorrow morning at 8:02 a.m. ET on the 10th hole with Johnson and Thomas. - TGR\nhttps://t.co/eW5ZKmwaBx'
